query,expected_answer,answer,context,retrieved_ids,relevant_ids,sources,difficulty,type,faithfulness,answer_relevance
What document contains the schematic of Dual Buckle Test?,AIS-005/2000 Annex-VI,"The schematic of the Dual Buckle Test can be found in Annex-VI of the document ""AISC Automotive Vehicles - Safety Belt Assemblies - Specifications"".","['perpendicular to the button’s initial direction of motion. For non-recessed devices, the area should not be less than 2.5 cm2 and a width not less than 10 mm. The buckle release area shall be colored red. No other externally visible parts of the buckle shall be of this colour. Direction/mode of operation “PRESS/PUSH/LIFT” shall be indicated on the buckle. 4.2.2.3 The buckle shall be capable of withstanding repeated operation and shall undergo 5000 opening and closing cycles under normal conditions of use prior to dynamic test as per para 5.6.2. In the case of harness belt buckles, the test may be carried out without all the tongues being introduced. 4.2.2.4 The buckle, when tested in accordance with 5.3.3, shall operate normally. 4.2.2.5 The buckle shall be tested for strength as prescribed in para 5.3.1 and 5.3.5, as appropriate. It must not break, be seriously distorted or become detached when subjected to the prescribed load. 4.2.2.6 In the case of buckles which incorporate a component common to the two assemblies, if the buckle of one assembly can be assembled in use with the mating part of that assembly with that of other assembly, the strength and release test as per para 5.6.2 and 5.6.3 shall also be carried out for both possible means of assembly. 4.2.3 Belt Adjustment Device 4.2.3.1 Two samples of each belt adjustment device shall be tested in accordance with the requirement of para 5.3.8. The strap slip shall not exceed 25 mm for each sample of adjusting device and the sum of shifts for all the adjusting devices shall not exceed 40 mm. 4.2.3.2 All the adjustment devices shall be tested for strength as prescribed in para 5.3.1 and 5.3.5 as appropriate. They must not break or become detached under the tension set up by the prescribed load. 4.2.3.3 When tested in accordance with para 5.3.6, the force required to operate any manually adjusting device shall not exceed 50 N. AIS-005/2000 4.2.4 Attachments and Belt Adjustment Devices for Height The attachments shall be tested for strength as prescribed in para 5.3.1. and 5.3.2 as appropriate. Belt adjustment devices for height shall be tested for strength as prescribed in para 5.3.2 unless they have been tested as part of the vehicle anchorage systems as per Draft AIS/015. These parts must not break or become detached under the tension set up by the prescribed load. 4.2.5 Retractors 4.2.5.1 Retractors, other than non-loading ones, shall be subjected to tests and fulfil the requirements specified below, including the tests for strength prescribed in para 5.3.1 and 5.3.2. 4.2.5.2 Manually Unlocking Retractors 4.2.5.2.1 The strap of a safety belt assembly equipped with a manually unlocking retractor shall not move more than 25 mm between the locking positions of the retractor. 4.2.5.2.2 The strap of a safety belt assembly shall extract from a manually unlocking retractor within 6 mm of its maximum length when a tension between 14 N and 22 N is applied to the strap in the normal direction of pull.', 'from its edge and a small loop of soft wire may be used on the connecting link between the buckle tab or lever and the force measuring device. The buckle opening force shall be measured and any failure of the buckle noted. AIS-005/2000 5.6.4 Additional Test for Pre-loading Device The pre-loading force shall be measured in less than four seconds after the impact as close as possible to the contact point with the manikin on the free length of webbing between the manikin and the pre-loading device or sash guide, if any, the manikin having been replaced in its originally seated position if necessary. 5.7 Test Report The test report shall record the results of all the tests in paragraph 5 above and in particular the trolley speed, the maximum forward displacement of the manikin, the position of the buckle, the buckle opening force, and any failure or breakage. If by virtue of para 5.6.2.1, the anchorage prescribed in para 3 and Fig.1 of Annexure-15 have not been respected, the test report shall describe how the belt assembly or the restraint system was installed and shall specify important angles and dimensions. The report shall also mention any distortion or breakage of the buckle that has occurred during the test. In the case of a restraint system, the test report shall also specify the manner of attaching the vehicle structure to the trolley, the position of the seats and the inclination of the seat backs. If the forward displacement of the manikin has exceeded the values prescribed in para 4.4.2.9.2, the report shall state whether the requirements in paragraph 4.4.2.10.1 are met. 6. SEAT BELT MARKING 6.1 Each seat belt assembly shall be marked at least with the information listed below to ensure correct usage and compliance to this regulation. 6.1.1 Manufacturer’s name or trade mark. 6.1.2 Part No. of identification. 6.1.3 Batch number, month and year of manufacture. 7. CONFORMITY OF PRODUCTION Any safety belt or restraint system approved under this standard shall be so manufactured as to conform to the approved by meeting the requirements set forth in para 4 and 5 above. In order to verify that the requirements of this standard are met, suitable controls of the production and its verification by carrying out the tests on randomly selected samples shall be carried out. The minimum frequency requirements are set out in Annexure-4. In order to reduce the number of types for COP, the locking mechanism is considered to be of two types with respect to mounting angle with reference to the vehicle axis system viz. less than 10° and more than 10°. 8. NOTE This standard is based on ECE Regulation-16 “Safety Belts and Restraint Systems”, 2000/3/EC “Motor Vehicle Safety Belts” and JIS:D-4604-1988 “Seat Belts for Automobiles”. *********** AIS-005/2000 Annex-I : Types of Seat Belt Assemblies Fig.1 : Two-Point Type (Ref. Para. 3.1) Fig.2 : Three-Point Type (Ref. Para. 3.1.2) AIS-005/2000 Annex-I : Types of Seat Belt Assemblies Fig.3 : Harness Type (Ref. Para. 3.1.3) AIS-005/2000', 'out with the longest possible length. A tension load from 200 N to 22.7 kN should be applied at the specified rate. The component and its parts should be examined for any abnormalities and the vertical displacement of the rollers during the loading i.e. between 200 N and 22.7 kN should be noted. 5.6.1.5 Three-Point Type The test is carried out in the same way as the two point belt except the layout is as per Fig.2 of Annexure-14. 5.6.1.6 The buckle opening test shall be continued with a load of 665 N ± 50 N on the assembly according to para 5.6.3. 5.6.2 Dynamic Test of Belt Assembly 5.6.2.1 The belt assembly shall be mounted on a trolley equipped with the seat and the anchorages defined in para 1, 2 and 3 and Fig.1 in Annexure-15. However, if the belt assembly is intended for a specific vehicle or for specific types of vehicle, the distances between the manikin and the anchorages shall be determined by the test agency either in conformity with the fitting instructions supplied with the belt or in conformity with the data supplied by the manufacturer of the vehicle. In that case, when the dynamic test has been carried out for a type of vehicle, it need not be repeated for other types of vehicles where each anchorage point is less than 50 mm distant from the corresponding anchorage point of the tested belt. Alternatively, manufacturers may determine hypothetical anchorage positions for testing in order to enclose the maximum number of real anchorages points. If the belt is equipped with a belt adjustment device for height, the position of the device and its means of securing it shall be the same as those of the vehicle design. 5.6.2.2 In the case of a safety belt or restraint system forming part of an assembly for which approval is requested as a restraint system, the safety belt shall be mounted on the part of the vehicle structure to which the restraint system is normally fitted and this part shall be rigidly attached to the trolley as given in para 5.6.2.3. 5.6.2.3 The method used to secure the vehicle during the test shall not be such as to strengthen the anchorage of the seats or safety belts or to lessen the normal deformation of the structure. No forward movement of the vehicle shall be present which by limiting the forward movement of the manikin except the foot, would reduce the load imposed on the restraint system during the test. The discarded part of the structure can be replaced by parts of equivalent strength provided they do not hinder the forward movement of the manikin. AIS-005/2000 5.6.2.4 A securing device can be considered satisfactory if it produces no effect on the area extending over the whole width of the structure and if the vehicle or the structure is blocked or fixed at a distance of not less than 500 mm from the anchorage of the restraint system. At the rear,', 'the members of AISC. ********** AIS-005/2000 INDEX OF ANNEXURES Annex. No. Particulars Page No. Annex-I Types of Seat Belt Assemblies Fig.1 Two Point Belt Fig.2 Three Point Belt Fig.3 Harness Belt Annex-II Information to be Provided by Safety Belt/Vehicle Manufacturer for Approval of Safety Belt/Restraint Systems Annex-III Minimum Requirements for Safety Belts and Retractors for Different Categories of Vehicles Annex-IV Samples for the Tests and COP Frequency Annex-V Test Chamber for Corrosion Test Annex-VI Schematic of Dual Buckle Test Annex-VII Abrasion and Micro Slip Test (Fig.1 to Fig.3) Annex-VIII Typical Apparatus to Test Durability of Retractor Mechanism Annex-IX Typical Apparatus to Test Locking of Emergency Locking Retractors Annex-X Typical Apparatus to Test the Dust Resistance of Retractors Annex-XI Retraction Force Measurement – Schematic Annex-XII Typical Setup for Gripping the Strap in Tensile Testing Machine Annex-XIII Energy Absorptivity Plot Annex-XIV Static Strength/Displacement of Seat Belt Assembly/Restraint System Fig.1 Setup for Two Point Type Fig.2 Setup for Three Point Type Annex-XV Description of Trolley, Seat, Anchorages, Stopping Device and Manikin for Dynamic Test Fig.1 Trolley, Seat, Anchorage Fig.2 Stopping Device Fig.3 Stopping Device (polyurethane tube) Fig.4 Stopping Device (olive-shaped knob) Fig.5 Description of the Curve of Trolley Deceleration According to the Time Fig.6 Manikin – Side View of Head, Neck and Torso Fig.7 Manikin – Front View of Head, Neck and Torso Fig.8 Manikin – Side View of Hip, Thighs and Lower Leg Fig.9 Manikin – Front View of Hip, Thighs and Lower Leg Fig.10 Manikin – Principle Dimensions Fig.11 Manikin in Seated Position Annex-XVI List of Members of Panel on Safety Belts Annex-XVII AISC Members AIS-005/2000 Automotive Vehicles - Safety Belt Assemblies - Specifications 1. SCOPE This Automotive Industry Safety Standard specifies the requirements of safety belt assemblies and restraint systems which are designed for installation in motor vehicles of category M and N and intended for separate use i.e. as indirect fittings by persons of adult built occupying forward and rearward facing seats. 2. REFERENCES 2.1 IS:14272 (Part 1):1995 – Automotive Vehicles – Types – Terminologies. 2.2 Draft AIS/015 – Automotive Industry Standard on Automotive Vehicles : Safety Belt Anchorages – Specifications. 2.3 IS:11939-1998 – Automotive Vehicles – Steering Control Systems – Impact Protection Requirements and Methods of Measurements 2.4 ISO:4582-1980 – Plastics – Determination of Change in Colour and Variations in Properties After Exposure to Day Light Under Glass, Natural Weathering or Artificial Light 2.5 ISO:6487-1987 - Road Vehicles - Measurement Techniques in Impact Test - Instrumentation. 2.6 ASTM D-573 “Test Method for Rubber – Deterioration in Air” 2.7 ASTM D-735 (replaced by D2000) “Classification System for Rubber Products in Auto Applications”. 2.8 ASTM D-736 (Discontinued) “Method of Test for Low Temperature Brittleness of Rubber and Rubber-like Materials”. 3. DEFINITIONS For the purpose of this Standard: 3.1 Safety Belt (Seat Belt, Belt) means an arrangement of straps with a securing buckle, adjusting devices and attachments which are capable of being anchored to the interior of a motor vehicle and designed to diminish the risk of injury to the wearer', 'the belt assembly or restraint system and its rigid parts shall be inspected visually, without opening the buckle, to determine whether there has been any failure or breakage. In the case of restraint systems, it shall also be ascertained, after the test, whether the parts of the vehicle structure which are attached to the trolley have undergone any visible permanent deformation. If there is any such deformation found, this shall be taken into account in any calculation made para 4.4.2..10.1. 5.6.2.13 The belt assembly shall be removed from the test trolley without the buckle being opened. The buckle opening test should be conducted according to para 5.6.3. 5.6.2.14 After the buckle opening test, the components of the belt assembly or of the restraint device shall be inspected and the extent of the damage sustained by the belt assembly or restraint device during the dynamic test shall be recorded in the test report. 5.6.3 Buckle Opening Test 5.6.3.1 For this test, belt assemblies or restraint devices which has already undergone the static strength/displacement test according to para 5.6.1 or dynamic test in conformity with para 5.6.2 shall be used. 5.6.3.2 In the case of samples subjected to static strength/displacement test, this test is continued as mentioned in 5.6.1.6. 5.6.3.3 In the case of samples subjected to dynamic test, a load shall be applied to the buckle by direct traction via the straps fixed to it so that all the straps are subjected to the force of 600/n N, where ‘n’ is the number of straps linked to the buckle when it is in a locked position and its minimum is deemed to be 2. In the case where the buckle is connected to a rigid part, the load shall be applied at the same angle as the one formed by the buckle and the rigid end during the dynamic test. 5.6.3.4 The buckle opening force shall be applied to the geometric centre of the buckle release button along a fixed axis running parallel to the initial direction of motion of the button. During the application of the force needed to open the buckle, the buckle shall be held by a rigid support. The point of contact of the test equipment shall be spherical in form with a radius of 2.5 mm ± 0.1 mm. It shall have a polished metal surface. For lift cover buckles, the buckle opening force shall be applied by a spring balance or other measuring device in a manner and direction which are normal for opening the buckle. For lever type buckles a hole of 2.5 mm dia may be drilled through the buckle tab or lever on a centre line between 3.0 mm and 3.3 mm from its edge and a small loop of soft wire may be used on the connecting link between the buckle tab or lever and the force measuring device. The buckle opening force shall be measured and any failure of the buckle noted. AIS-005/2000 5.6.4 Additional Test for Pre-loading Device The']","['7', '23', '20', '1', '22']",['27'],"['document16.pdf', 'document16.pdf', 'document16.pdf', 'document16.pdf', 'document16.pdf']",easy,factual,1.0,1.0
What figure illustrates a suitable apparatus to test the durability of the retractor mechanism?,AIS-005/2000 Annex-VIII,"The figure that illustrates a suitable apparatus to test the durability of the retractor mechanism is not explicitly mentioned in the provided text. However, it can be inferred from the document that such an apparatus might be similar to the one described in Annex-VIII (Typical Apparatus to Test Durability of Retractor Mechanism). This information is found on page 10 of the document titled ""AIS-005/2000 Automotive Vehicles - Safety Belt Assemblies - Specifications.""","['these axes shall be in the direction chosen by the test agency to give the most adverse conditions with respect to actuation of the locking mechanism. 5.4.2.4 A suitable apparatus for the tests is described in Annexure-9. The design of any such test apparatus shall ensure that the required acceleration is given before the webbing is withdrawn out of the retractor by more than 5 mm and that the withdrawal takes place at an average rate of increase of acceleration is between 25 g/s and 150 g/s. 5.4.2.5 To check conformity with the requirements of paragraph 4.2.5.4.1.4 and 4.2.5.4.1.5, the retractor shall be mounted on a horizontal table and the table titled with a speed not exceeding 2 degrees per second until locking has occurred. The test shall be repeated with tilting in other directions to ensure that the requirements are fulfilled. AIS-005/2000 5.4.3 Dust Resistance 5.4.3.1. The retractor shall be positioned in a test chamber as described in Annexure-10. It shall be mounted with the same relative position as in the vehicle. The test chamber shall contain dust as specified in para 5.4.3.2. A length of 500 mm of the strap shall be extracted from the retractor and kept extracted, except that it shall be subjected ten complete cycles of retraction and withdrawal within one or two minutes after each agitation of the dust. For a period of five hours, the dust shall be agitated every twenty minutes for five seconds by compressed air free of oil and moisture at a gauge pressure of 550 kPa entering through an orifice 1.5 ± 0.1 mm in diameter. 5.4.3.2 The dust used in the test prescribed in para 5.4.3.1 shall consist of about 1 kg of dry quartz. The particle size distribution is as follows : 5.4.3.2.1 Passing 150 microns aperture, 10 microns wire diameter : 99-100%. 5.4.3.2.2 Passing 105 microns aperture 64 microns wire diameter : 76-86%. 5.4.3.2.3 Passing 75 microns aperture, 52 microns wire diameter : 60-70% 5.4.4 Retracting Force The retracting force shall be measured with the safety belt assembly fitted to a manikin as per the dynamic test prescribed in para 5.6.2 as shown in Annexure-11. The strap tension shall be measured at the point of contact with (but just clear of) the manikin while the strap is being retracted at an approximate rate of 0.6 m/min. 5.5 Tests on Straps 5.5.1 Test of Breaking Strength of Strap (Static Test) 5.5.1.1 The test shall be carried out each time on two new samples of strap of sufficient length, conditioned in conformity with the appropriate provisions of para 5.5.2. 5.5.1.2 Each strap shall be gripped between the clamps of a tensile testing machine. The clamps shall be so designed as to avoid breakage of the strap at or near the point of contact with the clamps. The speed of traverse shall be about 100 mm/min. The free length of the specimen between the clamps of the machine at the start of the test shall be 200 mm ±', 'mm between the locking positions of the retractor. 4.2.5.2.2 The strap of a safety belt assembly shall extract from a manually unlocking retractor within 6 mm of its maximum length when a tension between 14 N and 22 N is applied to the strap in the normal direction of pull. 4.2.5.2.3 The strap shall be withdrawn from the retractor and allowed to retract repeatedly by the method described in para 5.4.1 until 5000 cycles have been completed. The retractor shall then be subjected to the corrosion test given in para 5.2 and the dust resistance test given in para 5.4.3. It shall then satisfactorily complete a further 5000 cycles of withdrawal and retraction. After the above tests, the retractor shall operate correctly and still meet the requirement of para 4.2.5.2.1 and 4.2.5.2.2. 4.2.5.3 Automatically Locking Retractors 4.2.5.3.1 The strap of a safety belt assembly equipped with an automatically locking retractor shall not move more than 30 mm between the locking positions of the retractor. After a rearward movement by the wearer, the belt must either remain at its initial position or return to that position automatically on subsequent forward movements of the wearer. 4.2.5.3.2 If the retractor is part of a lap belt, the retracting force of the strap shall not be less than 7 N when measured in the free length between the manikin and the retractor in accordance with para 5.4.4. If the retractor is part of an upper torso restraint, the retracting force of the strap shall be between 2 N and 7 N when similarly measured. If the strap passes through a guide or pulley, the retracting force shall be measured in the free length between the manikin and guide or pulley. If the assembly incorporates a device which upon manual or automatic operation prevents the strap from being completely retracted, such a device shall not be operated when the retracting force is measured. AIS-005/2000 4.2.5.3.3 The strap shall be withdrawn from the retractor and allowed to retract repeatedly by the method described in para 5.4.1 until 5000 cycles of withdrawal and retraction have been completed. The retractor shall then be subjected to the corrosion test given in para 5.2 followed by dust resistance test prescribed in para 5.4.3. It shall then satisfactorily complete a further 5000 cycles. After the above tests, the retractor shall operate correctly and still meet the requirements of paragraphs 4.2.5.3.1 and 4.2.5.3.2. 4.2.5.4 Emergency Locking Retractor 4.2.5.4.1 An emergency locking retractor, when tested in accordance with para 5.4.2. shall satisfy the conditions below. 4.2.5.4.1.1 In the case of single sensitivity according to para 3.7.4.1, only the specifications regarding the deceleration of vehicle are valid. 4.2.5.4.1.2 The locking must have occurred when the deceleration of the vehicle reached 0.45 g in the case of Type 4 retractor or 0.85 g in the case of Type 4 N retractor. 4.2.5.4.1.3 It must not lock at at values of accelerations of the strap, measured in the direction of the unreeling less than 0.8 g', 'the retractor is not less than 540 mm or, in all other cases, on the arc of a circle with center K and radius 350 mm. 3.4 In the case of a belt equipped with a belt adjustment device for height, this shall be secured either to a rigid frame, or to a part of the vehicle on which it is normally mounted which shall be securely fixed on the test trolley. 4. STOPPING DEVICE 4.1 This device consists of two identical absorbers mounted in parallel, except in the case of restraint systems when four absorbers shall be used for a nominal mass of 800 kg. If necessary, an additional absorber shall be used for each 200 kg increases of nominal mass. 4.2 Each absorber comprises: an outer casing formed from a steel tube, a polyurethane energy-absorber tube, a polished-steel olive-shaped knob penetrating into the absorber, a shaft and an impact plate. 4.3 The dimensions of the various parts of this energy absorber are shown in Figures 2, 3 and 4. The characteristic values of the energy-absorbing material are given below. Immediately before each test, the tubes must be conditioned at a temperature of between 15 oC and 25oC for at least 12 hours without being used. The temperature of the stopping device during the dynamic testing of safety belts and restraint systems must be the same as during the calibration test to within ± 2oC. 4.4 Characteristic Values Of The Energy-Absorbing Material (ASTM method D 735 unless otherwise stated) 4.4.1 Shore hardness A: 95 ± 2 at 20 ± 5oC 4.4.2 Breaking strength: Ro ≥ 343 daN/cm2 4.4.3 Minimum elongation: Ao ≥ 400% 4.4.4 Modulus: at 100% elongation: ≥ 108 daN/ cm2 at 300% elongation: ≥ 235 daN/ cm2 4.4.5 Low-temperature brittleness five hours at –55oC (ASTM method D 736): 4.4.6 Compression set (method B): 22 hours at 70 oC ≤ 45% AIS-005/2000 4.4.7 Density at 25 o C : 1, 05 to 1, 10 4.4.8 Ageing in air (ASTM method D 573): 4.4.9 70 hours at 100 o C- shore hardness A: maximum variation ± 3 - breaking strength: decrease < 10% of Ro - elongation: decrease < 10% of Ao - mass: decrease < 1% 4.4.10 Immersion in fluids 4.4.10.1 Immersion in oil (ASTM method No. 1 Oil): 70 hours at 100 o C- shore hardness A: maximum variation ± 4 - breaking strength: decrease < 15% of Ro - elongation: decrease < 10% of Ao - volume: swelling < 5% 4.4.10.2 Immersion in oil (ASTM method No.3 Oil): 70 hours at 100 o C - breaking strength: decrease < 15% of Ro - elongation: decrease < 10% of Ao - volume: swelling < 5% 4.4.10.3 Immersion in distilled water: one week at 70oC - breaking strength: decrease < 35% of Ro - elongation: decrease < 20% of Ao 4.5 The requirements relating to the stopping device are given para 4.6 below. Any other device giving equivalent results is acceptable. 4.6 Trolley deceleration requirements: 4.6.1 The deceleration', 'the members of AISC. ********** AIS-005/2000 INDEX OF ANNEXURES Annex. No. Particulars Page No. Annex-I Types of Seat Belt Assemblies Fig.1 Two Point Belt Fig.2 Three Point Belt Fig.3 Harness Belt Annex-II Information to be Provided by Safety Belt/Vehicle Manufacturer for Approval of Safety Belt/Restraint Systems Annex-III Minimum Requirements for Safety Belts and Retractors for Different Categories of Vehicles Annex-IV Samples for the Tests and COP Frequency Annex-V Test Chamber for Corrosion Test Annex-VI Schematic of Dual Buckle Test Annex-VII Abrasion and Micro Slip Test (Fig.1 to Fig.3) Annex-VIII Typical Apparatus to Test Durability of Retractor Mechanism Annex-IX Typical Apparatus to Test Locking of Emergency Locking Retractors Annex-X Typical Apparatus to Test the Dust Resistance of Retractors Annex-XI Retraction Force Measurement – Schematic Annex-XII Typical Setup for Gripping the Strap in Tensile Testing Machine Annex-XIII Energy Absorptivity Plot Annex-XIV Static Strength/Displacement of Seat Belt Assembly/Restraint System Fig.1 Setup for Two Point Type Fig.2 Setup for Three Point Type Annex-XV Description of Trolley, Seat, Anchorages, Stopping Device and Manikin for Dynamic Test Fig.1 Trolley, Seat, Anchorage Fig.2 Stopping Device Fig.3 Stopping Device (polyurethane tube) Fig.4 Stopping Device (olive-shaped knob) Fig.5 Description of the Curve of Trolley Deceleration According to the Time Fig.6 Manikin – Side View of Head, Neck and Torso Fig.7 Manikin – Front View of Head, Neck and Torso Fig.8 Manikin – Side View of Hip, Thighs and Lower Leg Fig.9 Manikin – Front View of Hip, Thighs and Lower Leg Fig.10 Manikin – Principle Dimensions Fig.11 Manikin in Seated Position Annex-XVI List of Members of Panel on Safety Belts Annex-XVII AISC Members AIS-005/2000 Automotive Vehicles - Safety Belt Assemblies - Specifications 1. SCOPE This Automotive Industry Safety Standard specifies the requirements of safety belt assemblies and restraint systems which are designed for installation in motor vehicles of category M and N and intended for separate use i.e. as indirect fittings by persons of adult built occupying forward and rearward facing seats. 2. REFERENCES 2.1 IS:14272 (Part 1):1995 – Automotive Vehicles – Types – Terminologies. 2.2 Draft AIS/015 – Automotive Industry Standard on Automotive Vehicles : Safety Belt Anchorages – Specifications. 2.3 IS:11939-1998 – Automotive Vehicles – Steering Control Systems – Impact Protection Requirements and Methods of Measurements 2.4 ISO:4582-1980 – Plastics – Determination of Change in Colour and Variations in Properties After Exposure to Day Light Under Glass, Natural Weathering or Artificial Light 2.5 ISO:6487-1987 - Road Vehicles - Measurement Techniques in Impact Test - Instrumentation. 2.6 ASTM D-573 “Test Method for Rubber – Deterioration in Air” 2.7 ASTM D-735 (replaced by D2000) “Classification System for Rubber Products in Auto Applications”. 2.8 ASTM D-736 (Discontinued) “Method of Test for Low Temperature Brittleness of Rubber and Rubber-like Materials”. 3. DEFINITIONS For the purpose of this Standard: 3.1 Safety Belt (Seat Belt, Belt) means an arrangement of straps with a securing buckle, adjusting devices and attachments which are capable of being anchored to the interior of a motor vehicle and designed to diminish the risk of injury to the wearer', 'of the belt assembly including the necessary securing components, which enable it to be attached to the belt anchorages. 3.6 Energy Absorber means a device designed to disperse energy independently of or jointly with the strap and forming part of a belt assembly. AIS-005/2000 3.7 Retractor means a device to accommodate part or the whole of the strap of a safety belt. 3.7.1 Non Locking Retractor (Type 1) means a retractor from which the strap is extracted to its full length by a small external force and which provides no adjustment for the length of the extracted strap. 3.7.2 Manually Unlocking Retractor (Type 2) means a retractor requiring manual operation of a device by the user to unlock the retractor in order to obtain the desired strap extraction which locks automatically when the said operation ceases. 3.7.3 Automatically Locking Retractor (Type 3) means a retractor allowing the extraction of the strap to the desired length and which when the buckle is fastened, automatically adjusts the strap to the wearer. Further extraction of the strap is prevented without deliberate action by the wearer. 3.7.4 Emergency/Locking Retractor (ELR) (Type 4) means a retractor which during normal driving conditions does not restrict the freedom of movement by the wearer of the safety belt. It has a length adjusting capability which automatically adjust the strap to the wearer and a locking mechanism actuated in an emergency by: 3.7.4.1 deceleration of the vehicle (single sensitivity) 3.7.4.2 a combination of deceleration of the vehicle, movement of the webbing or any other automatic means (multiple sensitivity) 3.7.4.3 ELRs may be of simple locking or webbing clamp type. 3.7.5 Emergency Locking Retractor with Higher Response Threshold (Type 4 N) means a retractor of the type defined in para 2.7.4 but having special properties for use in vehicles of category M2, M3, N1, N2 and N3 as defined in IS:14272 (Part-1):1995. 3.7.6 Belt Adjustment Device For Height means a device enabling the position in height of the upper pillar loop of a belt to be adjusted according to the requirements of the individual wearer and the position of the seat. This may be considered as a part of the belt or the anchorage of the belt. 3.8 Belt Anchorages means parts of the vehicle or seat structure or any other part of the vehicle to which the safety belt assemblies are to be secured. 3.9 Vehicle Type As Regards Safety Belts And Restraint Systems means category of motor vehicles which do not differ in such essential respects as the dimensions, geometry and materials of the components of the vehicle or seat structure or any other part of the vehicle to which safety belts and restraint systems are attached. AIS-005/2000 3.10 Restraint System means a system consisting of seat affixed to the structure of the vehicle by appropriate means and a safety belt for which at least one anchorage is located on the seat structure. 3.11 Seat means a structure which may or may not be integral with the vehicle']","['16', '8', '29', '1', '3']",['27'],"['document16.pdf', 'document16.pdf', 'document16.pdf', 'document16.pdf', 'document16.pdf']",easy,factual,0.6,0.95
What document describes the Type 1 Procedure Test in the Abrasion and Micro Slip Test?,AIS-005/2000 Annex-VII,"The Type 1 Procedure Test in the Abrasion and Micro Slip Test is described in ""AIS-005/2000 Annexure-V Test Chamber for Corrosion Test (Para 5.2)"" document. Specifically, it can be found in section 3.2 of this document.","['be kept fully immersed for three hours in distilled water, at a temperature of 20 ± 5°C, to which a trace of wetting agent has been added. Any wetting agent suitable for the fibre under the test may be used. The breaking load shall be determined within ten minutes after removal of the strap from the water. 5.5.2.7 Abrasion Conditioning 5.5.2.7.1 The abrasion conditions will be performed on each and every device in which the strap is in contact with a rigid part of the belt. However, Type 1 abrasion test need not be carried out on the belt adjusting device where the micro slip test as per para 5.3.8 shows the strap slip less than half the specified amount. The setting on the test apparatus will approximately maintain the relative position of the strap and contact area. The samples shall be conditioned as per para 5.5.2.2. The ambient temperature during the abrasion procedure shall be between 15°C and 30°C. 5.5.2.7.2 The requirements for each abrasion procedure are listed in the table below. The shift given in the last column of this table represents the amplitude of a back and forth motion applied to the strap. PROCEDURE LOAD, N FREQUENCY, Hz No. of Cycles Shift, Mm Type 1 0.5 300 ± 20 Type 2 0.5 45,000 300 ± 20 Type 3 0.5 45,000 5.5.2.7.3 Details of Procedures 5.5.2.7.3.1 Type 1 This procedure is for cases where the strap slides through an adjusting device. A vertical steady load of 25 N shall be maintained on one end of the strap, the other end of the strap shall be attached to a device giving the strap a horizontal back and forth motion. The adjusting device shall be placed on the horizontal strap so that the strap remains under load as shown in Fig.2 of Annexure-7. In the cases where the strap will not slide back and forth with 25 N load, the load may be increased upto 50 N to allow a back and forth motion. 5.5.2.7.3.2 Type 2 This is for cases where the strap changes direction once in passing through a rigid part. During this test, the angles which both strap ends make with each other shall be maintained as shown in Fig.3 of Annexure-7. A steady load of 5 N shall be maintained during the test. If the strap changes direction more than once in passing through a rigid part, a load of 5 N may be increased so as to achieve the prescribed strap movement of 300 mm through that rigid part. AIS-005/2000 5.5.2.7.3.3 Type 3 This is for cases where the strap is fixed to a rigid part of sewing or similar means. The total back and forth motion i.e. shift shall be 300 ± 20 mm and the 50 N load shall only be applied during the time corresponding to a shift of 100 ± 20 mm for each half period as shown in Fig.1 of Annexure-7. 5.5.3 Elongation Test A test piece should be fixed', 'any other source from accumulating. The collectors shall be placed near the test samples, one as near as possible to the nozzles and the other as far away as possible from the nozzles. The mist shall be such that, for each 80 cm2 of horizontal collecting area, an average of between 1.0 ml and 2.0 ml of solution per hour is collected in each collector when measured over at least 16 hours. 5.2 The nozzle or nozzles shall be directed or baffled in such a manner that the spray does not strike directly onto the test samples. *********** AIS-005/2000 Annex-VI : Schematic of Dual Buckle Test (Ref. Para. 5.3.5) AIS-005/2000 Annex-VII : Abrasion and Micro Slip Test (Ref. Para. 5.5.2.7.3.3 and 5.3.8.3) Fig.1 AIS-005/2000 Annex-VII : Schematic of Abrasion and Micro Slip Test (Ref. Para. 5.3.8 and 5.5.2.7.3) Fig.2 Type 1 Procedure Test (Ref. Para. 5.5.2.7.3.1) AIS-005/2000 Annex-VII : Abrasion and Micro Slip Test Fig.3 Type 2 Procedure Test (Ref. Para. 5.5.2.7.3.2) AIS-005/2000 Annex-VIII : Typical Apparatus to Test Durability of Retractor Mechanism (Ref. Para. 5.4.1) AIS-005/2000 ANNEXURE-IX TYPICAL APPARATUS TO TEST LOCKING OF EMERGENCY LOCKING RETRACTORS (Para 5.4.2.4) 1.0 A suitable apparatus is illustrated in the figure given below. This consists of a motor-driven cam, the follower of which is attached by wires to a small trolley mounted on a track. The cam follower incorporates a ‘lost-motion’ device which absorbs any movement should the reel lock before the full stroke of the follower is completed. The cam design and motor speed combination is such as to give the required acceleration at a rate of increase of acceleration as specified in 5.4.2.4 and the stroke is arranged to be in excess of the maximum permitted strap movement before locking. 2.0 On the trolley a carrier is mounted which can be swiveled to enable the retractor to be mounted in varying positions relative to the direction of movement of the trolley. 3.0 When testing retractors for sensitivity to strap movement, the retractor is mounted on a suitable fixed bracket and the strap is attached to the trolley. 4.0 When carrying out the above tests, any brackets, etc., supplied by the manufacturer or by his representative shall be incorporated in the test installation to simulate as closely as possible the intended installation in a vehicle. 5.0 Any additional brackets, etc., that may be required to simulate the installation as intended in a vehicle shall be provided by the manufacturer or by his representative. AIS-005/2000 Annex-X : Typical Apparatus to Test the Dust Resistance to Retractors (Ref. Para. 5.4.3.1) AIS-005/2000 Annex-XI : Retraction Force Measurement - Schematic (Ref. Para. 5.4.4) AIS-005/2000 Annex-XII : Typical Setup for Gripping the Strap in Tensile Testing Machine (Ref. Para. 5.5.1.2) AIS-005/2000 Annex-XIII : Energy Absorptivity Pot (Ref. Para. 5.5.4) Work Load Ratio = ABC ABD X 100 % AIS-005/2000 AIS-005/2000 Annex-XIV : Static Strength/Displacement of Seat Belt Assembly/Restraint System Fig.2 : Setup for Three Point Type AIS-005/2000 ANNEXURE-XV DESCRIPTION OF TROLLEY, SEAT, ANCHORAGES, STOPPING DEVICE AND MANIKIN', 'of specimens, duration of tests and the permissible losses in mass per unit are shall be agreed accordingly. 7.1 Specimens Specimens shall be complete mirror assembly with its mounting support. Five specimens are required. 7.2 Preparation of Specimens Prior to functional check, the specimens as specified in sub-clause 7.1 shall be degreased with white spirit or another suitable solvent using soft, non-fibrous cloth or a brush and subsequently weighed to the nearest ± 0.1 mg. If they cannot be weighted immediately after degreasing, The specimen shall be kept in a disiccator until weighing. After weighing the specimens shall be coated on one side with a strippable protection (e.g. self adhesive films or strippable varnishes). 7.3 Exposure The specimens shall be set up on edge, inclined at an angle of 600 to 750 to the horizontal, in the test apparatus with the test surface upwards and exposed for 240 hours under the specified test conditions. 7.4 Removal of corrosion products Before the corrosion products are removed, the coatings applied before exposure shall be stripped off. The corrosion products shall be removed from the specimens by pickling at a temperature of 18 0C to 28 0C. A hydrochloric acid inhibited with 3.5 g of hexomethylene- tetramine per liter, with ρ = 1.10 g/ml, may be used for this purpose, e.g. 500 ml of HCL with ρ = 1.19 g/ml, chemically pure, made up to 1 liter with de ionised water. AIS 001 / 2001 After the removal of corrosion products, the specimens shall be thoroughly rinsed in water, dried and subsequently kept until weighing in a disicccator at temperature of 18 0 to 28 0C. 7.5 Weighing of Specimen The specimen to be weighed to the nearest ± 1 mg. 7.6 Evaluation of functional check results The loss in mass shall be related to the surface area exposed to corrosion and expressed in g/m2. The average loss shall be 140 ± 20 g/m3. AIS 001 / 2001 ANNEX 5 WEATHER RESISTANCE TEST The test site shall be generally be placed under temperature condition of 20 +150C. Test Method 2.1 The test shall be conducted in accordance with the following procedure. 2.1.1 Mount the test parts on the test apparatus and carry out the test in accordance with the conditions given in the Table of clause 2.1.3. for 300 hours. 2.1.2 Carbons, glass filters and safety devices for electric discharge shall fit the test apparatus and be capable of correctly maintaining the performances of the test apparatus. 2.1.3 Type of test Test conditions Type of test apparatus Sunshine carbon arc system Weather- ability tester / UV lamp / Xenon lamp Item of test condition Construction of test apparatus See reference Figure 3 of JIS B 7753 Shape of the lamps Open system Number of lamps Carbon Upper electrode mm Copper coated sunshine carbon Approx. ∅36 x 350 Approx. ∅13 x 305 Electrodes Lower electrode mm Copper coated sunshine carbon Approx. ∅23 x 350 Approx. ∅13 x 305 Continuous light table hours h 60', 'to 30,000 --do 30,001 to 90,000 --do-- 90,001 to 3,00,000 Once per two weeks 3,00,001 to 15,00,000 One per day 15,00,001 to 30,00,000 --do-- Above 30,00,000 --do-- ******* AIS-005/2000 ANNEXURE-V TEST CHAMBER FOR CORROSION TEST (Para 5.2) 1.0 TEST APPARATUS : 1.1 The apparatus shall consist of a mist chamber, a salt solution reservoir, supply of suitably conditioned compressed air, one or more atomizing nozzles, sample supports, provision of heating the chamber, and the necessary means of control. The size and detailed construction of the apparatus shall be optional provided that the test conditions are met. 1.2 It is important to ensure that drops of solution accumulated on the ceiling or cover of the chamber do not fall on test samples. 1.3 Drops of solution which fall from test samples shall not return to the reservoir for re-spraying. 1.4 The apparatus shall not be constructed of materials that will affect the corrosiveness of the mist. 2.0 LOCATION OF TEST SAMPLES IN THE MIST CABINET: 2.1 Samples except retractors, shall be supported or suspended between 15 degrees and 30 degrees from the vertical and preferably parallel to the principal direction of horizontal flow of mist through the chamber, based upon the dominant surface being tested 2.2 Retractors shall be supported or suspended so that the axes of the reel for storing the strap shall be normal to the principle direction of horizontal flow of mist through the chamber. The strap opening in the retractor shall also be facing in this principal direction. 2.3 Each sample shall be placed so as to permit free setting of mist on all samples. 2.4 Each sample shall be so placed to prevent salt solution from one sample dripping on to any other samples. 3.0 SALT SOLUTION: 3.1 The salt solution shall be prepared by dissolving 5 ± 1 parts by mass of sodium chloride in 95 parts of distilled water. The salt shall be sodium chloride substantially free of nickel and copper and containing on the dry basis not more than 0.1% of sodium iodide and not more than 0.3% of the total impurities. AIS-005/2000 3.2 The solution shall be such that when atomized at 35°C, the collected solution is in the pH range of 6.5 to 7.2. 4.0 AIR SUPPLY: The compressed air supply to the nozzle for atomizing the salt solution shall be free of oil and dirt, and maintained at a pressure between 70 kPa and 180 kPa. 5.0 CONDITIONS IN THE MIST CHAMBER: 5.1 The exposure zone of the mist chamber shall be maintained at 35°C ± 5°C. At least two clean mist collectors shall be placed within the exposure zone to prevent drops of solution from the test samples or any other source from accumulating. The collectors shall be placed near the test samples, one as near as possible to the nozzles and the other as far away as possible from the nozzles. The mist shall be such that, for each 80 cm2 of horizontal collecting area, an average of', 'ground. Appendix 1: Description of the ESA chosen to represent the type (electronic block diagram and list of main component constituting the ESA (e.g. make and type of microprocessor, crystal, etc.). Appendix 2: Relevant test report(s) supplied by the manufacturer from a test laboratory accredited to ISO 17025 and recognized by the Test Agency for the purpose of drawing up the type approval certificate."" 27/60 AIS-004 (Part 3) ANNEX 2 (See 5.2.1) METHOD OF MEASUREMENT OF RADIATED BROADBAND ELECTROMAGNETIC EMISSIONS FROM VEHICLES 1. GENERAL 1.1. The test method described in this Annex shall only be applied to vehicles. 1.2 Test Method This test is intended to measure the broadband emissions generated by electrical or electronic systems fitted to the vehicle (e.g. ignition system or electric motors). If not otherwise stated in this annex the test shall be performed according to CISPR 12 (Amendment 1 fifth edition 2005). 2. VEHICLE STATE DURING TESTS 2.1. For vehicles equipped with an internal combustion engine, the engine shall be in operation according to CISPR 12 (amendment 1, fifth edition 2005) clause 5.3.2. Typically for single cylinder engines, the engine speed shall be 2500 + 10% rpm and for multi-cylinder (>1 cylinder) engines, the engine speed shall be 1500 + 10% rpm. For vehicles equipped with an electric propulsion motor, the vehicle shall be driven on a dynamometer without a load, or on non-conductive axle stands, with a constant speed of 40 km/h, or the maximum speed, if this is less than 40 km/h. 2.2. Other vehicle systems All equipment capable of generating broadband emissions which can be switched on permanently by the driver or passenger should be in operation in maximum load, e.g. wiper motors or fans. The horn and electric window motors are excluded because they are not used continuously. 3. MEASURING LOCATION 3.1 As an alternative to the requirements of CISPR 12 (amendment 1, fifth edition 2005) for vehicles of category L the test surface may be any location that fulfils the conditions shown in the figure 1 in the appendix to this annex. In this case the measuring equipment must lie outside the part shown in the figures 1 and 2 of Appendix 1 to this annex. 3.2 Enclosed test facilities may be used if correlation can be shown between the results obtained in the enclosed test facility and those obtained at an outdoor site. Enclosed test facilities do not need to meet the dimensional requirements of the outdoor site other than the distance from the antenna to the vehicle and the height of the antenna. 28/60 AIS-004 (Part 3) 4. TEST REQUIREMENTS 4.1. The limits apply throughout the frequency range 30 to 1,000 MHz for measurements performed in a semi anechoic chamber or an outdoor test site. 4.2. Measurements can be performed with either quasi-peak or peak detectors. The limits given in paragraphs 5.2 and 5.5 of this standard are for quasi-peak detectors. If peak detectors are used a correction factor of 20 dB as defined in CISPR 12 (amendment']","['18', '27', '20', '26', '17']",['27'],"['document16.pdf', 'document16.pdf', 'document3.pdf', 'document16.pdf', 'document14.pdf']",easy,factual,0.4,1.0
What is the direction of longitudinal oscillation of the pendulum according to AIS-001 (Part 2) (Rev.1)?,parallel to the longitudinal plane of the vehicle,"According to AIS-001 (Part 2), the longitudinal direction of oscillation of the pendulum should be parallel to the longitudinal median plane of the vehicle. This information can be found in multiple sections across Chunks 1, 3, and 5, specifically in clauses 8.2.2.3, 6.1.3.2.2.3, and 6.1.3.2.2.4.","['position where the distance between the holder and the base is shortest. 8.2.2.2.4. When the reflecting surface is mobile in the holder, it shall be adjusted so that the upper corner which is furthest from the vehicle, is in the position of greatest projection relative to the holder. AIS-001 (Part 2) (Rev.1): 2011 5/14 8.2.2.3. When the pendulum is in a vertical position, the horizontal and longitudinal vertical planes passing through the centre of the hammer, shall pass through the centre of the mirror as defined in 2.7 above. The longitudinal direction of oscillation of the pendulum shall be parallel to the longitudinal plane of the vehicle. 8.2.2.4. When, under the conditions governing adjustment prescribed in 8.2.2.2.1 and 8.2.2.2.2 above, parts of the rear-view mirror limit the return of the hammer, the point of impact shall be shifted in a direction perpendicular to the axis of rotation or pivot in question. This displacement shall be that which is strictly necessary for the implementation of the test. It shall be limited in such a way that the point of contact of the hammer is located at least 10 mm from the periphery of the reflecting surface. 8.2.2.5. The test consists in allowing the hammer to fall from a height corresponding to a pendulum angle of 60º from the vertical so that the hammer strikes the rear-view mirror at the moment when the pendulum reaches the vertical position. 8.2.2.6. The rear-view mirrors are subjected to impact in the following different conditions: 8.2.2.6.1. Test 1: The point of impact shall be as defined in 8.2.2.3 or 8.2.2.4 above. The impact shall be such that the hammer strikes the rear-view mirror on the reflecting surface side. 8.2.2.6.2. Test 2: The point of impact shall be as defined in 8.2.2.3 or 8.2.2.4 above. The impact shall be such that the hammer strikes the rear-view mirror on the opposite side to the reflecting surface. 8.3. Bending test on the holder fixed to the stem 8.3.1. Description of the test 8.3.1.1. The holder shall be placed horizontally in a device in such a way that the adjustment parts of the mounting are clamped securely. In the direction of the greatest dimension of the holder, the end nearest to the point of fixing on the adjustment part shall be immobilized by means of a fixed step 15 mm wide, covering the entire width of the holder. 8.3.1.2. At the other end, a step identical with the one described above shall be placed on the holder so that the specified test load is applied to it (see Figure 2 below). 8.3.1.3. The end of the holder opposite that at which the force is applied may be clamped instead of kept in position as shown in Figure 2. 8.3.2. The test load shall be 25 kg applied for one minute. AIS-001 (Part 2) (Rev.1): 2011 6/14 Figure 2 Example of bending test apparatus for rear view mirror holder 8.4. Results of the tests 8.4.1. Results of the test prescribed in', ""the pendulum. The end of the pendulum comprises a hammer formed by a rigid sphere with a diameter of 165 ± 1 mm having a 5 mm thick rubber covering of Shore A hardness 50. A device is provided which permits determination of the maximum angle assumed by the arm in the plane of release. AIS-001 (Part 1) (Rev.1) : 2011 10/35 A support firmly fixed to the structure of the pendulum serves to hold the specimens in compliance with the impact requirements specified in 6.1.3.2.2.6. Figure 1 below gives the dimensions (in mm) of the test rig and the special design specifications: Figure 1 (See 6.1.3.2.1.1.) 6.1.3.2.1.2. The centre of percussion of the pendulum coincides with the centre of the sphere, which forms the hammer. It is at a distance l from the axis of oscillation in the release plane, which is equal to 1 m ± 5 mm. The reduced mass of the pendulum is mo = 6.8 ± 0.05 kilograms. The relationship of mo to the total mass m of the pendulum and to the distance d between the centre of gravity of the pendulum and its axis of rotation is expressed in the equation: l d m mo × = 6.1.3.2.2 Description of the test 6.1.3.2.2.1 The procedure used to clamp the mirror to the support shall be that recommended by the manufacturer of the device or, where appropriate, by the vehicle manufacturer. 6.1.3.2.2.2 Positioning of the mirror for the test: 6.1.3.2.2.2.1 Mirrors shall be positioned on the pendulum impact rig in such a way that the axes which are horizontal and vertical when the mirror is installed on a vehicle in accordance with the applicant's mounting instructions are in a similar position; AIS-001 (Part 1) (Rev.1) : 2011 11/35 6.1.3.2.2.2.2 When a mirror is adjustable with respect to the base, the test position shall be that in which any pivoting device is least likely to operate, within the limits of adjustment provided by the applicant; 6.1.3.2.2.2.3 When the mirror has a device for adjusting its distance from the base, the device shall be set in the position in which the distance between the housing and the base is shortest 6.1.3.2.2.2.4 When the reflecting surface is mobile in the housing, it shall be so adjusted that the upper corner, which is furthest from the vehicle, is in the position of greatest projection relative to the housing. 6.1.3.2.2.3 Except in the case of test 2 for interior mirrors (see 6.1.3.2.2.6.1.), when the pendulum is in a vertical position the horizontal and longitudinal vertical planes passing through the centre of the hammer shall pass through the centre of the reflecting surface as defined in 2.1.1.11. The longitudinal direction of oscillation of the pendulum shall be parallel to the longitudinal median plane of the vehicle. 6.1.3.2.2.4 When, under the conditions governing adjustment laid down in 6.1.3.2.2.1. and 6.1.3.2.2.2. parts of the mirror limit the return of the hammer, the point of impact shall be displaced in a direction perpendicular"", 'm0 = 6.8 ± 0.05 kg . (The relation of reduced mass of pendulum ‘m0’ to the total mass ‘m’ of the pendulum and to the distance ‘d’ between the center of gravity of the pendulum and its axis of rotation is expressed in the equation : m0 = m . d ) L 8.2.2 Description of the test. 8.2.2.1 The procedure used to clamp the rear-view mirror to the support shall be that recommended by the manufacturer of the device or, where appropriate, by the vehicle manufacturer. 8.2.2.2 Positioning of the rear-view mirror for the test. 8.2.2.2.1 Rear-view mirrors shall be so positioned on the pendulum impact rig such that the axes which are horizontal and vertical, when the rear- view mirror is installed on a vehicle in accordance with the applicant’s mounting instruction, are in similar position. 8.2.2.2.2 When a rear-view mirror is adjustable with respect to the base, the test position shall be that in which any pivoting device is least likely to operate, within the limits of adjustment provided by the applicants. 8.2.2.2.3 When the rear-view mirror has a device for adjusting its distance from the base, the device shall be set in the position in which the distance between the housing and the base is shortest. 8.2.2.2.4 When the reflecting surface is mobile in the housing, it shall be so adjusted that the upper corner which is farthest from the vehicle, is in the position of greatest projection relative to the housing. 8.2.2.3 Except in the case of test 2 for interior rear-view mirrors (see item 8.2.2.6.1), when the pendulum is in a vertical position the horizontal and longitudinal vertical planes passing through the center of the hammer shall pass through the center of the reflecting surface as defined in 4.9. The longitudinal direction of oscillation of the pendulum shall be parallel to the longitudinal plane of the vehicle. 8.2.2.4 When, under the conditions governing adjustment laid down in items 8.2.2.1 and 8.2.2.2, parts of the rear-view mirror limit the return of the hammer, the point of impact shall be displaced in a direction perpendicular to the axis of rotation or pivoting in question. This displacement shall be as minimum as possible for the conduct of the test; it shall be limited in such a way that: AIS 001 / 2001 - either the sphere delimiting the hammer remains at least tangential to the cylinder as defined in 5.4 - or the point of contact with the hammer is located at least 10 mm from the periphery of the reflecting surface. 8.2.2.5 The test consists in allowing the hammer to fall from a height corresponding to a pendulum angle of 60° from the vertical so that the hammer strikes the rear-view mirror at the moment when the pendulum reaches the vertical position. 8.2.2.6 The rear-view mirrors are subjected to impact under the following different conditions: 8.2.2.6.1 Interior rear-view mirrors (Class I) Test 1: The point of impact shall as defined in item 8.2.2.3. The impact', 'device for indirect vision has a device for adjusting its distance from the base, the device shall be set in the position in which the distance between the housing and the base is shortest. 6.3.2.2.2.4 In the case of mirrors, when the reflecting surface is mobile in the housing, it shall be so adjusted that the upper corner, which is furthest from the vehicle, is in the position of greatest projection relative to the housing. 6.3.2.2.3 In the case of mirrors, except in the case of test 2 for Class I mirrors (see clause 6.3.2.2.7.1. below), when the pendulum is in a vertical position the horizontal and longitudinal vertical planes passing through the centre of the hammer shall pass through the centre of the reflecting surface as defined in clause 2.1.1.10. The longitudinal direction of oscillation of the pendulum shall be parallel to the longitudinal median plane of the vehicle. 6.3.2.2.4. In the case of camera-monitor systems, when the pendulum is in a vertical position the horizontal and longitudinal vertical planes passing through the centre of the hammer shall pass through the centre of the lens or of the transparent protection part protecting the lens. The longitudinal direction of oscillation of the pendulum shall be parallel to the longitudinal median plane of the vehicle. If the test is performed with a shutter camera system, the shutter has to be open during the pendulum impact. 6.3.2.2.5 When, under the conditions governing adjustment laid down in clause 6.3.2.2.1. and 6.3.2.2.2. above parts of the device for indirect vision limit the return of the hammer, the point of impact shall be displaced in a direction perpendicular to the axis of rotation or pivoting in question. The displacement shall be no greater than is strictly necessary for the execution of the test; it shall be limited in such a way that: AIS-001 (Part 1) (Rev.2):2023 24/46 a) either the sphere delimiting the hammer remains at least tangential to the cylinder as defined in 6.1.1.6; b) or in the case of mirrors the point of contact with the hammer is located at least 10 mm from the periphery of the reflecting surface. 6.3.2.2.6. The test consists in allowing the hammer to fall from a height corresponding to a pendulum angle of 60° from the vertical so that the hammer strikes the device for indirect vision at the moment when the pendulum reaches the vertical position. 6.3.2.2.7. The device for indirect vision are subjected to impact under the following different conditions 6.3.2.2.7.1. Class I rear-view mirrors a) Test 1: The points of impact shall be as defined in clause 6.3.2.2.3. above. The impact shall be such that the hammer strikes the mirror on the reflecting surface side. b) Test 2: Point of impact on the edge of the protective housing, such that the impact produced makes an angle of 45° with the plane of the reflecting surface and is situated in the horizontal plane passing through the centre of that surface. The impact shall occur on', 'of oscillation of the pendulum shall be parallel to the longitudinal median plane of the vehicle. 6.1.3.2.2.4 When, under the conditions governing adjustment laid down in 6.1.3.2.2.1. and 6.1.3.2.2.2. parts of the mirror limit the return of the hammer, the point of impact shall be displaced in a direction perpendicular to the axis of rotation or pivoting in question. The displacement shall be no greater than is strictly necessary for the execution of the test; it shall be limited in such a way that: a) either the sphere delimiting the hammer remains at least tangential to the cylinder as defined in 6.1.1.5.; b) or the point of contact with the hammer is located at least 10 mm from the periphery of the reflecting surface. 6.1.3.2.2.5. The test consists in allowing the hammer to fall from a height corresponding to a pendulum angle of 60° from the vertical so that the hammer strikes the mirror at the moment when the pendulum reaches the vertical position. 6.1.3.2.2.6. The mirrors are subjected to impact under the following different conditions: 6.1.3.2.2.6.1. Interior mirrors a) Test 1: The points of impact shall be as defined in 6.1.3.2.2.3. The impact shall be such that the hammer strikes the mirror on the reflecting surface side. b) Test 2: Point of impact on the edge of the protective housing, such that the impact produced makes an angle of 45° with the plane of the reflecting surface and is situated in the horizontal plane passing through the centre of that surface. The impact shall occur on the reflecting surface side. AIS-001 (Part 1) (Rev.1) : 2011 12/35 6.1.3.2.2.6.2. Exterior mirrors a) Test 1: The point of impact shall be as defined in 6.1.3.2.2.3. or 6.1.3.2.2.4. The impact shall be such that the hammer strikes the mirror on the reflecting surface side. b) Test 2: The point of impact shall be as defined in 6.1.3.2.2.3. or 6.1.3.2.2.4. The impact shall be such that the hammer strikes the mirror on the side opposite to the reflecting surface. 6.1.3.2.2.6.2.1. Where Class II or III rear-view mirrors are fixed to the same mounting as Class IV rear-view mirrors, the above-mentioned tests shall be executed on the lower mirror. Nevertheless, the testing agency may repeat one or both of these tests on the upper mirror if this is less than 2 m from the ground. 6.1.3.2.3 Bending test on the protective housing attached to the stem (Class VII) 6.1.3.2.3.1 Description of test The test shall be carried out as per 8.3 of Part 2 of this standard 6.1.3.3 Results of the tests 6.1.3.3.1 In the tests described in 6.1.3.2., the pendulum shall continue to swing after impact in such a way that the projection of the position assumed by the arm on the plane of release makes an angle of at least 20° with the vertical. The accuracy of measurement of the angle shall be within ± 1°. 6.1.3.3.1.1 This requirement is not applicable to mirrors stuck to the windscreen, in respect of which']","['4', '9', '7', '17', '10']",['4'],"['document6.pdf', 'document4.pdf', 'document3.pdf', 'document5.pdf', 'document4.pdf']",easy,factual,1.0,1.0
What is the minimum distance from the periphery of the reflecting surface that the point of contact of the hammer should be located?,10 mm,"The minimum distance from the periphery of the reflecting surface that the point of contact of the hammer should be located is not explicitly stated in all documents provided. However, it can be inferred from document 3 (page 10) where it mentions that if the reflecting surface projects beyond the protective housing, the radius of curvature 'c' on the edge of the projecting part shall be not less than 2.5 mm and the reflecting surface shall return into the protective housing under a force of 50 N applied to the point of greatest projection, relative to the protective housing, in a horizontal direction approximately parallel to the longitudinal median plane of the vehicle. This implies that the point of contact of the hammer should be located within the protective housing or at least 2.5 mm from the periphery of the reflecting surface.

In document 4 (page 10), it also mentions that when the rear-view mirror is mounted on a plain surface, all parts... which are in potential, static contact with a sphere either 165 mm in diameter in the case of an interior rear-view mirror or 100 mm in diameter in the case of an exterior rear-view mirror, shall have a radius of curvature ‘c’ of not less than 2.5 mm. This again implies that the point of contact of the hammer should be located within the radius of curvature of these parts.

In document 5 (page 29), it mentions that for Class II or III rear-view mirrors, if the reflecting surface projects beyond the protective housing, the radius of curvature ‘c’ on the edge of the projecting part shall be not less than 2.5 mm. This also implies that the point of contact of the hammer should be located within the protective housing or at least 2.5 mm from the periphery of the reflecting surface.

So, based on the provided documents, it can be inferred that the minimum distance from the periphery of the reflecting surface that the point of contact of the hammer should be located is at least 2.5 mm.","['of oscillation of the pendulum shall be parallel to the longitudinal median plane of the vehicle. 6.1.3.2.2.4 When, under the conditions governing adjustment laid down in 6.1.3.2.2.1. and 6.1.3.2.2.2. parts of the mirror limit the return of the hammer, the point of impact shall be displaced in a direction perpendicular to the axis of rotation or pivoting in question. The displacement shall be no greater than is strictly necessary for the execution of the test; it shall be limited in such a way that: a) either the sphere delimiting the hammer remains at least tangential to the cylinder as defined in 6.1.1.5.; b) or the point of contact with the hammer is located at least 10 mm from the periphery of the reflecting surface. 6.1.3.2.2.5. The test consists in allowing the hammer to fall from a height corresponding to a pendulum angle of 60° from the vertical so that the hammer strikes the mirror at the moment when the pendulum reaches the vertical position. 6.1.3.2.2.6. The mirrors are subjected to impact under the following different conditions: 6.1.3.2.2.6.1. Interior mirrors a) Test 1: The points of impact shall be as defined in 6.1.3.2.2.3. The impact shall be such that the hammer strikes the mirror on the reflecting surface side. b) Test 2: Point of impact on the edge of the protective housing, such that the impact produced makes an angle of 45° with the plane of the reflecting surface and is situated in the horizontal plane passing through the centre of that surface. The impact shall occur on the reflecting surface side. AIS-001 (Part 1) (Rev.1) : 2011 12/35 6.1.3.2.2.6.2. Exterior mirrors a) Test 1: The point of impact shall be as defined in 6.1.3.2.2.3. or 6.1.3.2.2.4. The impact shall be such that the hammer strikes the mirror on the reflecting surface side. b) Test 2: The point of impact shall be as defined in 6.1.3.2.2.3. or 6.1.3.2.2.4. The impact shall be such that the hammer strikes the mirror on the side opposite to the reflecting surface. 6.1.3.2.2.6.2.1. Where Class II or III rear-view mirrors are fixed to the same mounting as Class IV rear-view mirrors, the above-mentioned tests shall be executed on the lower mirror. Nevertheless, the testing agency may repeat one or both of these tests on the upper mirror if this is less than 2 m from the ground. 6.1.3.2.3 Bending test on the protective housing attached to the stem (Class VII) 6.1.3.2.3.1 Description of test The test shall be carried out as per 8.3 of Part 2 of this standard 6.1.3.3 Results of the tests 6.1.3.3.1 In the tests described in 6.1.3.2., the pendulum shall continue to swing after impact in such a way that the projection of the position assumed by the arm on the plane of release makes an angle of at least 20° with the vertical. The accuracy of measurement of the angle shall be within ± 1°. 6.1.3.3.1.1 This requirement is not applicable to mirrors stuck to the windscreen, in respect of which', 'position where the distance between the holder and the base is shortest. 8.2.2.2.4. When the reflecting surface is mobile in the holder, it shall be adjusted so that the upper corner which is furthest from the vehicle, is in the position of greatest projection relative to the holder. AIS-001 (Part 2) (Rev.1): 2011 5/14 8.2.2.3. When the pendulum is in a vertical position, the horizontal and longitudinal vertical planes passing through the centre of the hammer, shall pass through the centre of the mirror as defined in 2.7 above. The longitudinal direction of oscillation of the pendulum shall be parallel to the longitudinal plane of the vehicle. 8.2.2.4. When, under the conditions governing adjustment prescribed in 8.2.2.2.1 and 8.2.2.2.2 above, parts of the rear-view mirror limit the return of the hammer, the point of impact shall be shifted in a direction perpendicular to the axis of rotation or pivot in question. This displacement shall be that which is strictly necessary for the implementation of the test. It shall be limited in such a way that the point of contact of the hammer is located at least 10 mm from the periphery of the reflecting surface. 8.2.2.5. The test consists in allowing the hammer to fall from a height corresponding to a pendulum angle of 60º from the vertical so that the hammer strikes the rear-view mirror at the moment when the pendulum reaches the vertical position. 8.2.2.6. The rear-view mirrors are subjected to impact in the following different conditions: 8.2.2.6.1. Test 1: The point of impact shall be as defined in 8.2.2.3 or 8.2.2.4 above. The impact shall be such that the hammer strikes the rear-view mirror on the reflecting surface side. 8.2.2.6.2. Test 2: The point of impact shall be as defined in 8.2.2.3 or 8.2.2.4 above. The impact shall be such that the hammer strikes the rear-view mirror on the opposite side to the reflecting surface. 8.3. Bending test on the holder fixed to the stem 8.3.1. Description of the test 8.3.1.1. The holder shall be placed horizontally in a device in such a way that the adjustment parts of the mounting are clamped securely. In the direction of the greatest dimension of the holder, the end nearest to the point of fixing on the adjustment part shall be immobilized by means of a fixed step 15 mm wide, covering the entire width of the holder. 8.3.1.2. At the other end, a step identical with the one described above shall be placed on the holder so that the specified test load is applied to it (see Figure 2 below). 8.3.1.3. The end of the holder opposite that at which the force is applied may be clamped instead of kept in position as shown in Figure 2. 8.3.2. The test load shall be 25 kg applied for one minute. AIS-001 (Part 2) (Rev.1): 2011 6/14 Figure 2 Example of bending test apparatus for rear view mirror holder 8.4. Results of the tests 8.4.1. Results of the test prescribed in', 'that the hammer strikes the rear-view mirror at the moment when the pendulum reaches the vertical position. 8.2.2.6 The rear-view mirrors are subjected to impact under the following different conditions: 8.2.2.6.1 Interior rear-view mirrors (Class I) Test 1: The point of impact shall as defined in item 8.2.2.3. The impact shall be such that hammer strikes the rear-view mirror on the reflecting surface side. Test 2: Point of impact on the edge of the housing, so that the impact produced makes an angle of 45° with the plane of the reflecting surface and is situated in the horizontal plane passing through the center of the surface. The impact shall occur on the reflecting surface side. 8.2.2.6.2 Exterior rear-view mirrors of all types. Test 1: The point of impact shall as defined in item 8.2.2.3 or 8.2.2.4. The impact shall be such that hammer strikes the rear-view mirror on the reflecting surface side. Test 2: The point of impact shall be as defined in item 8.2.2.3 or 8.2.2.4. The impact is such that the hammer strikes the rear- view mirror on the side opposite to the reflecting surface. Where Class II or III rear-view mirrors are fixed to the same mounting as Class IV rear-view mirrors, the above mentioned tests shall be on the lower mirror. Nevertheless, the Testing Agency may repeat one or both of these tests on the upper mirror if this is less than 2 m from the ground. 8.3 Bending test on the protective housing fixed to the stem 8.3.1 This test shall be performed on all rear-view mirrors with stem. AIS 001 / 2001 8.3.2 Description of the test. The protective housing is placed horizontally in a device in such a way that the adjustment parts of the mounting can be clamped securely. In the direction of the greatest dimension of the housing, the end nearest to the point of fixing on the adjustment part is immobilized by means of a fixed stop 15 mm wide covering the entire width of the housing. At the other end, a stop identical to the one described above is placed on the housing so that the specified test load can be applied to it. The end of the housing opposite that at which the force is applied may be clamped instead of simply blocked, as shown in Figure 2. Figure 2 Example of bending-test apparatus for rear-view mirror holders 8.3.3 The test load is 25 kgs. applied for one minute. REQUIREMENTS 9.1 In the tests described in 8.2, the pendulum shall continue to swing after impact in such a way the projection of the position assumed by the arm on the plane of release makes an angle of at least 20° with the vertical. The accuracy of measurement of the angle shall be within ± 1°. 9.1.1 This requirement is not applicable to rear-view mirror stuck to the windscreen, in respect of which the requirement stipulated in item 9.2 shall apply after the test. 9.1.2 The required pendulum angle', 'on its perimeter, shall have a radius ‘c’ greater or equal to 2.5 mm at all points in all directions. If the reflecting surface projects beyond the protective housing, the radius of curvature ‘c’ on the edge of the projecting part shall be not less than 2.5 mm and the reflecting surface shall return into the protective housing under a force of 50 N applied to the point of greatest projection, relative to the protective housing, in a horizontal direction approximately parallel to the longitudinal median plane of the vehicle. 5.3 When the rear-view mirror is mounted on a plain surface, all parts, irrespective of the adjustment position of the device, including those parts remaining attached to the support after the test provided for in 8.2, which are in potential, static contact with a sphere either 165 mm in diameter in the case of an interior rear-view mirror or 100 mm in diameter in the case of an exterior rear-view mirror, shall have a radius of curvature ‘c’ of not less than 2.5 mm. 5.3.1 Edges of fixing holes or recesses of which the diameter or longer diagonal is less than 12 mm are exempt from the radius requirements of item 5.3 provided that they are blunted. 5.4 The device for the attachment of rear-view mirrors to the vehicle shall be so designed that a cylinder with a 50 mm radius, having as its axis the axis, or one of the axes, of pivot or rotation which ensure deflection of the rear-view mirror in the direction of impact concerned, passes through at least part of the surface to which the device is attached. 5.5 In the case of those parts of interior rear-view mirrors which are made of a material with a Shore A hardness of less than 50 and which are mounted on a rigid support and also the part of exterior rear-view mirrors which are made of a material with a Shore A hardness not exceeding 60, the requirements of 5.2 and 5.3 shall only apply to the support. 5.6 All rear-view mirrors shall be examined visually for harmful defects. 6. DIMENSIONS 6.1 Interior rear-view mirrors (Class I). The dimensions of the reflecting surface shall be such that it is possible to inscribe thereon a rectangle, one side of which is 4 cm and the other side ‘a’ cm in length, where a = 15 cm x 1 1 + 1000 r (r as defined in clause 4.6) 6.2 Main exterior rear-view mirrors (Classes II and III). AIS 001 / 2001 6.2.1 The dimensions of the reflecting surface shall be such that it is possible to inscribe therein: - a rectangle 4 cm high, the base length of which, measured in centimeters, has the value ‘a’, - a segment which is parallel to the height of the rectangle, and the length of which, expressed in centimeters, has the value ‘b’. 6.2.2 The minimum values of ‘a’ and ‘b’ are given in the table below: Class of Rear-view mirrors', 'side. b) Test 2: Point of impact on the edge of the protective housing, such that the impact produced makes an angle of 45° with the plane of the reflecting surface and is situated in the horizontal plane passing through the centre of that surface. The impact shall occur on the reflecting surface side. 6.3.2.2.7.2. Classes II to VII mirrors a) Test 1: The point of impact shall be as defined in clause 6.3.2.2.3. or 6.3.2.2.5. above. The impact shall be such that the hammer strikes the mirror on the reflecting surface side. b) Test 2: The point of impact shall be as defined in clause 6.3.2.2.3. or 6.3.2.2.5. above. The impact shall be such that the hammer strikes the mirror on the side opposite to the reflecting surface. Where Class II or III rear-view mirrors are fixed to the same mounting as Class IV rear-view mirrors, the above-mentioned tests shall be executed on the lower mirror. Nevertheless, the testing agency may repeat one or both of these tests on the upper mirror if this is less than 2 m from the ground. 6.3.2.2.7.3. Camera-Monitor Systems a) Test 1: The point of impact shall be as defined in clause 6.3.2.2.4. or 6.3.2.2.5. The impact shall be such that the hammer strikes the camera on the lens side. AIS-001 (Part 1) (Rev.2):2023 25/46 b) Test 2: The point of impact shall be as defined in clause 6.3.2.2.4. or 6.3.2.2.5. The impact shall be such that the hammer strikes the camera on the side opposite to the lens. Where more than one camera is fixed to the same mounting, the above-mentioned tests shall be executed on the lower camera. Nevertheless, the test agency responsible for testing may repeat one or both of these tests on the upper camera if this is less than 2 m from the ground. 6.3.2.3 Bending test on the protective housing attached to the stem (Class VII) 6.3.2.3.1 Description of test The test shall be carried out as per claque 8.3 of Part 2 of this standard. 6.3.3 Results of the tests 6.3.3.1 In the tests described in 6.3.2. above, the pendulum shall continue to swing after impact in such a way that the projection of the position assumed by the arm on the plane of release makes an angle of at least 20° with the vertical. The accuracy of measurement of the angle shall be within ± 1°. 6.3.3.1.1 In the case of mirrors this requirement is not applicable to mirrors stuck to the windscreen, in respect of which the requirement stipulated in clause 6.3.3.2. shall apply after the test. 6.3.3.1.2 The required angle to the vertical is reduced from 20° to 10° for all Class II and Class IV devices for indirect vision and for Class III devices for indirect vision which are attached to the same mounting as Class IV devices for indirect vision. 6.3.3.2 In the case of mirrors, should the mounting of the mirror break during the tests described in clause 6.3.2. above']","['10', '4', '8', '4', '18']",['4'],"['document4.pdf', 'document6.pdf', 'document3.pdf', 'document3.pdf', 'document5.pdf']",easy,factual,1.0,0.98
"In Test 2, where is the point of impact defined according to AIS-001 (Part 2) (Rev.1)?",as defined in 8.2.2.3 or 8.2.2.4 above,"According to AIS-001 (Part 2) (Rev.1), in Test 2, the point of impact is not explicitly defined for rear view mirrors intended for use on L category vehicles without bodywork partly or wholly encloses the driver. However, it is mentioned that the tests are described in Annexure-9, but no specific details about the point of impact in Test 2 are provided within the given context.","['side. b) Test 2: Point of impact on the edge of the protective housing, such that the impact produced makes an angle of 45° with the plane of the reflecting surface and is situated in the horizontal plane passing through the centre of that surface. The impact shall occur on the reflecting surface side. 6.3.2.2.7.2. Classes II to VII mirrors a) Test 1: The point of impact shall be as defined in clause 6.3.2.2.3. or 6.3.2.2.5. above. The impact shall be such that the hammer strikes the mirror on the reflecting surface side. b) Test 2: The point of impact shall be as defined in clause 6.3.2.2.3. or 6.3.2.2.5. above. The impact shall be such that the hammer strikes the mirror on the side opposite to the reflecting surface. Where Class II or III rear-view mirrors are fixed to the same mounting as Class IV rear-view mirrors, the above-mentioned tests shall be executed on the lower mirror. Nevertheless, the testing agency may repeat one or both of these tests on the upper mirror if this is less than 2 m from the ground. 6.3.2.2.7.3. Camera-Monitor Systems a) Test 1: The point of impact shall be as defined in clause 6.3.2.2.4. or 6.3.2.2.5. The impact shall be such that the hammer strikes the camera on the lens side. AIS-001 (Part 1) (Rev.2):2023 25/46 b) Test 2: The point of impact shall be as defined in clause 6.3.2.2.4. or 6.3.2.2.5. The impact shall be such that the hammer strikes the camera on the side opposite to the lens. Where more than one camera is fixed to the same mounting, the above-mentioned tests shall be executed on the lower camera. Nevertheless, the test agency responsible for testing may repeat one or both of these tests on the upper camera if this is less than 2 m from the ground. 6.3.2.3 Bending test on the protective housing attached to the stem (Class VII) 6.3.2.3.1 Description of test The test shall be carried out as per claque 8.3 of Part 2 of this standard. 6.3.3 Results of the tests 6.3.3.1 In the tests described in 6.3.2. above, the pendulum shall continue to swing after impact in such a way that the projection of the position assumed by the arm on the plane of release makes an angle of at least 20° with the vertical. The accuracy of measurement of the angle shall be within ± 1°. 6.3.3.1.1 In the case of mirrors this requirement is not applicable to mirrors stuck to the windscreen, in respect of which the requirement stipulated in clause 6.3.3.2. shall apply after the test. 6.3.3.1.2 The required angle to the vertical is reduced from 20° to 10° for all Class II and Class IV devices for indirect vision and for Class III devices for indirect vision which are attached to the same mounting as Class IV devices for indirect vision. 6.3.3.2 In the case of mirrors, should the mounting of the mirror break during the tests described in clause 6.3.2. above', 'position where the distance between the holder and the base is shortest. 8.2.2.2.4. When the reflecting surface is mobile in the holder, it shall be adjusted so that the upper corner which is furthest from the vehicle, is in the position of greatest projection relative to the holder. AIS-001 (Part 2) (Rev.1): 2011 5/14 8.2.2.3. When the pendulum is in a vertical position, the horizontal and longitudinal vertical planes passing through the centre of the hammer, shall pass through the centre of the mirror as defined in 2.7 above. The longitudinal direction of oscillation of the pendulum shall be parallel to the longitudinal plane of the vehicle. 8.2.2.4. When, under the conditions governing adjustment prescribed in 8.2.2.2.1 and 8.2.2.2.2 above, parts of the rear-view mirror limit the return of the hammer, the point of impact shall be shifted in a direction perpendicular to the axis of rotation or pivot in question. This displacement shall be that which is strictly necessary for the implementation of the test. It shall be limited in such a way that the point of contact of the hammer is located at least 10 mm from the periphery of the reflecting surface. 8.2.2.5. The test consists in allowing the hammer to fall from a height corresponding to a pendulum angle of 60º from the vertical so that the hammer strikes the rear-view mirror at the moment when the pendulum reaches the vertical position. 8.2.2.6. The rear-view mirrors are subjected to impact in the following different conditions: 8.2.2.6.1. Test 1: The point of impact shall be as defined in 8.2.2.3 or 8.2.2.4 above. The impact shall be such that the hammer strikes the rear-view mirror on the reflecting surface side. 8.2.2.6.2. Test 2: The point of impact shall be as defined in 8.2.2.3 or 8.2.2.4 above. The impact shall be such that the hammer strikes the rear-view mirror on the opposite side to the reflecting surface. 8.3. Bending test on the holder fixed to the stem 8.3.1. Description of the test 8.3.1.1. The holder shall be placed horizontally in a device in such a way that the adjustment parts of the mounting are clamped securely. In the direction of the greatest dimension of the holder, the end nearest to the point of fixing on the adjustment part shall be immobilized by means of a fixed step 15 mm wide, covering the entire width of the holder. 8.3.1.2. At the other end, a step identical with the one described above shall be placed on the holder so that the specified test load is applied to it (see Figure 2 below). 8.3.1.3. The end of the holder opposite that at which the force is applied may be clamped instead of kept in position as shown in Figure 2. 8.3.2. The test load shall be 25 kg applied for one minute. AIS-001 (Part 2) (Rev.1): 2011 6/14 Figure 2 Example of bending test apparatus for rear view mirror holder 8.4. Results of the tests 8.4.1. Results of the test prescribed in', 'that the hammer strikes the rear-view mirror at the moment when the pendulum reaches the vertical position. 8.2.2.6 The rear-view mirrors are subjected to impact under the following different conditions: 8.2.2.6.1 Interior rear-view mirrors (Class I) Test 1: The point of impact shall as defined in item 8.2.2.3. The impact shall be such that hammer strikes the rear-view mirror on the reflecting surface side. Test 2: Point of impact on the edge of the housing, so that the impact produced makes an angle of 45° with the plane of the reflecting surface and is situated in the horizontal plane passing through the center of the surface. The impact shall occur on the reflecting surface side. 8.2.2.6.2 Exterior rear-view mirrors of all types. Test 1: The point of impact shall as defined in item 8.2.2.3 or 8.2.2.4. The impact shall be such that hammer strikes the rear-view mirror on the reflecting surface side. Test 2: The point of impact shall be as defined in item 8.2.2.3 or 8.2.2.4. The impact is such that the hammer strikes the rear- view mirror on the side opposite to the reflecting surface. Where Class II or III rear-view mirrors are fixed to the same mounting as Class IV rear-view mirrors, the above mentioned tests shall be on the lower mirror. Nevertheless, the Testing Agency may repeat one or both of these tests on the upper mirror if this is less than 2 m from the ground. 8.3 Bending test on the protective housing fixed to the stem 8.3.1 This test shall be performed on all rear-view mirrors with stem. AIS 001 / 2001 8.3.2 Description of the test. The protective housing is placed horizontally in a device in such a way that the adjustment parts of the mounting can be clamped securely. In the direction of the greatest dimension of the housing, the end nearest to the point of fixing on the adjustment part is immobilized by means of a fixed stop 15 mm wide covering the entire width of the housing. At the other end, a stop identical to the one described above is placed on the housing so that the specified test load can be applied to it. The end of the housing opposite that at which the force is applied may be clamped instead of simply blocked, as shown in Figure 2. Figure 2 Example of bending-test apparatus for rear-view mirror holders 8.3.3 The test load is 25 kgs. applied for one minute. REQUIREMENTS 9.1 In the tests described in 8.2, the pendulum shall continue to swing after impact in such a way the projection of the position assumed by the arm on the plane of release makes an angle of at least 20° with the vertical. The accuracy of measurement of the angle shall be within ± 1°. 9.1.1 This requirement is not applicable to rear-view mirror stuck to the windscreen, in respect of which the requirement stipulated in item 9.2 shall apply after the test. 9.1.2 The required pendulum angle', 'these axes shall be in the direction chosen by the test agency to give the most adverse conditions with respect to actuation of the locking mechanism. 5.4.2.4 A suitable apparatus for the tests is described in Annexure-9. The design of any such test apparatus shall ensure that the required acceleration is given before the webbing is withdrawn out of the retractor by more than 5 mm and that the withdrawal takes place at an average rate of increase of acceleration is between 25 g/s and 150 g/s. 5.4.2.5 To check conformity with the requirements of paragraph 4.2.5.4.1.4 and 4.2.5.4.1.5, the retractor shall be mounted on a horizontal table and the table titled with a speed not exceeding 2 degrees per second until locking has occurred. The test shall be repeated with tilting in other directions to ensure that the requirements are fulfilled. AIS-005/2000 5.4.3 Dust Resistance 5.4.3.1. The retractor shall be positioned in a test chamber as described in Annexure-10. It shall be mounted with the same relative position as in the vehicle. The test chamber shall contain dust as specified in para 5.4.3.2. A length of 500 mm of the strap shall be extracted from the retractor and kept extracted, except that it shall be subjected ten complete cycles of retraction and withdrawal within one or two minutes after each agitation of the dust. For a period of five hours, the dust shall be agitated every twenty minutes for five seconds by compressed air free of oil and moisture at a gauge pressure of 550 kPa entering through an orifice 1.5 ± 0.1 mm in diameter. 5.4.3.2 The dust used in the test prescribed in para 5.4.3.1 shall consist of about 1 kg of dry quartz. The particle size distribution is as follows : 5.4.3.2.1 Passing 150 microns aperture, 10 microns wire diameter : 99-100%. 5.4.3.2.2 Passing 105 microns aperture 64 microns wire diameter : 76-86%. 5.4.3.2.3 Passing 75 microns aperture, 52 microns wire diameter : 60-70% 5.4.4 Retracting Force The retracting force shall be measured with the safety belt assembly fitted to a manikin as per the dynamic test prescribed in para 5.6.2 as shown in Annexure-11. The strap tension shall be measured at the point of contact with (but just clear of) the manikin while the strap is being retracted at an approximate rate of 0.6 m/min. 5.5 Tests on Straps 5.5.1 Test of Breaking Strength of Strap (Static Test) 5.5.1.1 The test shall be carried out each time on two new samples of strap of sufficient length, conditioned in conformity with the appropriate provisions of para 5.5.2. 5.5.1.2 Each strap shall be gripped between the clamps of a tensile testing machine. The clamps shall be so designed as to avoid breakage of the strap at or near the point of contact with the clamps. The speed of traverse shall be about 100 mm/min. The free length of the specimen between the clamps of the machine at the start of the test shall be 200 mm ±', 'AIS-001 (Part 2) (Rev.1): 2011 I AUTOMOTIVE INDUSTRY STANDARD Automotive Vehicles – Approval of Rear View Mirrors Intended for use on L Category Vehicles without Bodywork Partly or Wholly Encloses the Driver - Specification (Revision 1) PRINTED BY THE AUTOMOTIVE RESEARCH ASSOCIATION OF INDIA P.B. NO. 832, PUNE 411 004 ON BEHALF OF AUTOMOTIVE INDUSTRY STANDARDS COMMITTEE UNDER CENTRAL MOTOR VEHICLE RULES – TECHNICAL STANDING COMMITTEE SET-UP BY MINISTRY OF ROAD TRANSPORT & HIGHWAYS (DEPARTMENT OF ROAD TRANSPORT & HIGHWAYS) GOVERNMENT OF INDIA May 2011 AIS-001 (Part 2) (Rev.1): 2011 II INTRODUCTION 0. The Government of India felt the need for a permanent agency to expedite the publication of standards and development of test facilities in parallel when the work on the preparation of the standards is going on, as the development of improved safety critical parts can be undertaken only after the publication of the standard and commissioning of test facilities. To this end, the erstwhile Ministry of Surface Transport (MOST) has constituted a permanent Automotive Industry Standards Committee (AISC) vide order No.RT-11028/11/97-MVL dated September 15, 1997. The standards prepared by AISC will be approved by the permanent CMVR Technical Standing Committee (CTSC). After approval, the Automotive Research Association of India, (ARAI), Pune, being the Secretariat of the AIS Committee, has published this standard. For better dissemination of this information ARAI may publish this document on their Web site. 0.1 Accordingly AIS-001 covering mandatory requirements regarding performance requirements of rear view mirrors has been published in 2001 and implemented thereafter in 2003. 0.2 With technological developments in rear view mirrors, AIS-001 was taken up for revision and now is prepared in two parts. This part covers the requirements of rear view mirrors intended for use on L category vehicles without body work partly or wholly encloses the driver. 0.3 This part is based on the following ECE Regulation: ECE R amendment (Supplement 2 to the 00 series of amendments - date of entry into force: 18 June 2007) Uniform Provisions Concerning the Approval of Seats of Rear-view Mirrors of two-wheeled Power-driven Vehicles with or without Side Car, with regard to the Mounting of Rear-view Mirrors on Handlebars 0.4 While preparing this standard attempts have been made to align with the above ECE regulation. However, certain changes were necessary in the Indian context. 0.5 The following standard contain provisions, which through reference in this text constitute provision of the standard. AIS-001 (Part 1) (Rev.1):2011 Automotive Vehicles - Approval of devices for indirect vision intended for use on M, N category and L category with bodywork vehicles – specification AIS-002 (Part 2) (Rev.1): 2011 Automotive Vehicles – Approval of Rear View Mirrors intended for use on L category vehicles without bodywork partly or wholly encloses the driver – Installation requirements AIS-001 (Part 2) (Rev.1): 2011 III AIS-037 Procedure for Type Approval and Establishing Conformity of Production for Safety Critical Components. AIS-053 Automotive Vehicles – Types – Terminology 0.6 The composition of AIS panel and AIS Committee responsible for preparation of this']","['18', '4', '8', '16', '0']",['4'],"['document5.pdf', 'document6.pdf', 'document3.pdf', 'document16.pdf', 'document6.pdf']",easy,factual,0.5,0.85
What does 'Class I' refer to in this ARAI Automotive Industry Standard document?,Interior rear-view mirrors,"Based on the provided context, there is no mention of a 'Class I' in any of the documents. Therefore, it cannot be determined what 'Class I' refers to in the given ARAI Automotive Industry Standard documents.","['AIS-001 (Part 1) (Rev.1) : 2011 I AUTOMOTIVE INDUSTRY STANDARD Automotive Vehicles – Approval of Devices for Indirect Vision Intended for use on M, N Category and L Category with Bodywork Vehicles – Specification (Revision 1) PRINTED BY THE AUTOMOTIVE RESEARCH ASSOCIATION OF INDIA P.B. NO. 832, PUNE 411 004 ON BEHALF OF AUTOMOTIVE INDUSTRY STANDARDS COMMITTEE UNDER CENTRAL MOTOR VEHICLE RULES – TECHNICAL STANDING COMMITTEE SET-UP BY MINISTRY OF ROAD TRANSPORT & HIGHWAYS (DEPARTMENT OF ROAD TRANSPORT & HIGHWAYS) GOVERNMENT OF INDIA May 2011 AIS-001 (Part 1) (Rev.1) : 2011 II Status chart of the standard to be used by the purchaser for updating the record Sr. No. Corrigenda. Amendment Revision Date Remark Misc. General remarks : AIS-001 (Part 1) (Rev.1) : 2011 III INTRODUCTION 0.0 The Government of India felt the need for a permanent agency to expedite the publication of standards and development of test facilities in parallel when the work on the preparation of the standards is going on, as the development of improved safety critical parts can be undertaken only after the publication of the standard and commissioning of test facilities. To this end, the erstwhile Ministry of Surface Transport (MOST) has constituted a permanent Automotive Industry Standards Committee (AISC) vide order No. RT-11028/11/97-MVL dated September 15, 1997. The standards prepared by AISC will be approved by the permanent CMVR Technical Standing Committee (CTSC). After approval, the Automotive Research Association of India, (ARAI), Pune, being the Secretariat of the AIS Committee, has published this standard. For better dissemination of this information ARAI may publish this document on their web site. 0.1 Accordingly AIS-001 covering mandatory requirements regarding performance of rear view mirrors devices has been published in 2001 and has been implemented thereafter in 2003. 0.2 With technological developments in automotive vehicles rear view mirrors, AIS-001 was taken up for revision and now is prepared in two parts. This part covers the requirements for approval of devices for indirect vision for use on M, N, category and L category vehicles with bodywork vehicles- specification. 0.3 This part is based on the following ECE Regulation ECE R 46, Rev. 3, Supplement 4 to the 02 series of amendment (Date of entry into force 22 July 2009). Uniform Provisions Concerning the Approval of Devices for Indirect Vision and of Motor Vehicles with regard to the Installation of these Devices 0.4 While preparing this standard attempts have been made to align with the above ECE regulation. However, certain changes were necessary in the Indian context. 0.5 The following standards contain provisions, which through reference in this text constitute provisions of the standard. AIS-002 (Part 1) (Rev.1):2011 Automotive Vehicles – Devices for indirect Vision intended for use on L category with bodywork vehicles, M and N category -Installation requirements AIS-037 Procedure for Type Approval and Establishing Conformity of Production for Safety Critical Components. AIS-053 Automotive Vehicles – Types – Terminology AIS-001 (Part 1) (Rev.1) : 2011 IV IS 13942:1994 Automotive vehicles - External projections - Performance requirements ISO 15008:2003', ""Manufacturers Association Representative from Automotive Components Manufacturers Association of India Representative from Indian Construction Equipment Manufactures' Association (ICEMA) Member Secretary Shri Vikram Tandon The Automotive Research Association of India * At the time of approval of this Automotive Industry Standard (AIS)"", 'AIS-001 (Part 2) (Rev.1): 2011 I AUTOMOTIVE INDUSTRY STANDARD Automotive Vehicles – Approval of Rear View Mirrors Intended for use on L Category Vehicles without Bodywork Partly or Wholly Encloses the Driver - Specification (Revision 1) PRINTED BY THE AUTOMOTIVE RESEARCH ASSOCIATION OF INDIA P.B. NO. 832, PUNE 411 004 ON BEHALF OF AUTOMOTIVE INDUSTRY STANDARDS COMMITTEE UNDER CENTRAL MOTOR VEHICLE RULES – TECHNICAL STANDING COMMITTEE SET-UP BY MINISTRY OF ROAD TRANSPORT & HIGHWAYS (DEPARTMENT OF ROAD TRANSPORT & HIGHWAYS) GOVERNMENT OF INDIA May 2011 AIS-001 (Part 2) (Rev.1): 2011 II INTRODUCTION 0. The Government of India felt the need for a permanent agency to expedite the publication of standards and development of test facilities in parallel when the work on the preparation of the standards is going on, as the development of improved safety critical parts can be undertaken only after the publication of the standard and commissioning of test facilities. To this end, the erstwhile Ministry of Surface Transport (MOST) has constituted a permanent Automotive Industry Standards Committee (AISC) vide order No.RT-11028/11/97-MVL dated September 15, 1997. The standards prepared by AISC will be approved by the permanent CMVR Technical Standing Committee (CTSC). After approval, the Automotive Research Association of India, (ARAI), Pune, being the Secretariat of the AIS Committee, has published this standard. For better dissemination of this information ARAI may publish this document on their Web site. 0.1 Accordingly AIS-001 covering mandatory requirements regarding performance requirements of rear view mirrors has been published in 2001 and implemented thereafter in 2003. 0.2 With technological developments in rear view mirrors, AIS-001 was taken up for revision and now is prepared in two parts. This part covers the requirements of rear view mirrors intended for use on L category vehicles without body work partly or wholly encloses the driver. 0.3 This part is based on the following ECE Regulation: ECE R amendment (Supplement 2 to the 00 series of amendments - date of entry into force: 18 June 2007) Uniform Provisions Concerning the Approval of Seats of Rear-view Mirrors of two-wheeled Power-driven Vehicles with or without Side Car, with regard to the Mounting of Rear-view Mirrors on Handlebars 0.4 While preparing this standard attempts have been made to align with the above ECE regulation. However, certain changes were necessary in the Indian context. 0.5 The following standard contain provisions, which through reference in this text constitute provision of the standard. AIS-001 (Part 1) (Rev.1):2011 Automotive Vehicles - Approval of devices for indirect vision intended for use on M, N category and L category with bodywork vehicles – specification AIS-002 (Part 2) (Rev.1): 2011 Automotive Vehicles – Approval of Rear View Mirrors intended for use on L category vehicles without bodywork partly or wholly encloses the driver – Installation requirements AIS-001 (Part 2) (Rev.1): 2011 III AIS-037 Procedure for Type Approval and Establishing Conformity of Production for Safety Critical Components. AIS-053 Automotive Vehicles – Types – Terminology 0.6 The composition of AIS panel and AIS Committee responsible for preparation of this', 'AIS-006 AUTOMOTIVE INDUSTRY STANDARD Automotive Vehicles – Bumper fitment on M1 Category of Vehicles – Test Methods PRINTED BY THE AUTOMOTIVE RESEARCH ASSOCIATION OF INDIA P. B. NO. 832. PUNE 411 004 ON BEHALF OF AUTOMOTIVE INDUSTRY STANDARDS COMMITTEE UNDER CENTRAL MOTOR VEHICLE RULES - TECHNICAL STANDING COMMITTEE SET-UP BY MINISTRY OF SHIPPING, ROAD TRANSPORT & HIGHWAYS (DEPARTMENT OF ROAD TRANSPORT & HIGHWAYS) GOVERNMENT OF INDIA December 2005 I AIS-006 Status chart of the Standard to be used by the purchaser for updating the record Sr. No. Corr- igenda. Amend- ment Revision Date Remark Misc. General Remarks: II AIS-006 INTRODUCTION The Government of India felt the need for a permanent agency to expedite the publication of standards and development of test facilities in parallel when the work on the preparation of the standards is going on, as the development of improved safety critical parts can be undertaken only after the publication of the standard and commissioning of test facilities. To this end, the erstwhile Ministry of Surface Transport (MOST) has constituted a permanent Automotive Industry Standard Committee (AISC) vide order No. RT-11028/11/97-MVL dated September 15, 1997. The standards prepared by AISC will be approved by the permanent CMVR Technical Standing Committee (CTSC). After approval, the Automotive Research Association of India, (ARAI), Pune, being the secretariat of the AIS Committee, has published this standard. For better dissemination of this information ARAI may publish this document on their Web site. The purpose of this standard is to assure exterior protection of elements located at front and rear ends of the vehicle against small shocks and low energy impacts. The elements include lighting & signaling, engine cooling, fuel lines, bonnet / boot lids, doors, engine/vehicle exhausts, propulsion, steering, braking, suspension including tyres. With this objective to ensure suitable anchorages of bumpers, this standard has been formulated by offering three equivalent optional methods. These methods have been arrived at after suitable debate in the expert forums and also after relevant test work by member agencies. These methods are also founded on ECE R 42 “Uniform Provisions Concerning the Approval of Vehicles with regard to their Front and Rear Protective Devices (Bumpers etc.) and JIS D1601-1995 “Vibration Testing Methods for Automotive Parts”. The Automotive Industry Standards Committee responsible for preparation of this standard is given in Annexure IV. III AIS-006 Automotive Vehicles – Bumper fitment on M1 Category of Vehicles – Test methods 1.0 SCOPE This standard establishes requirements for approval of vehicles of category M1 with regard to integrity of anchorages of front and rear bumpers to the vehicle. 2.0 DEFINITIONS For the purpose of this standard: 2.1 “Approval of vehicle” means the approval of a vehicle type with regard to the anchoring of front and rear bumpers. 2.2 “Vehicle type” means M1 category of vehicles which do not differ in such essential respects as: 2.2.1 The size, material and mass of the bumpers, 2.2.2 The type of mounting and mounting fasteners for the bumpers. 3.0 APPLICATION FOR APPROVAL 3.1 The vehicle manufacturer shall', 'AIS-002 (Part 1)(Rev. 1):2011 I. AUTOMOTIVE INDUSTRY STANDARD Automotive Vehicles – Approval of Devices for Indirect Vision intended for use on L category with bodywork vehicles, M and N category - Installation requirements (Revision 1) PRINTED BY THE AUTOMOTIVE RESEARCH ASSOCIATION OF INDIA P.B. NO. 832, PUNE 411 004 ON BEHALF OF AUTOMOTIVE INDUSTRY STANDARDS COMMITTEE UNDER CENTRAL MOTOR VEHICLE RULES – TECHNICAL STANDING COMMITTEE SET-UP BY MINISTRY OF ROAD TRANSPORT & HIGHWAYS (DEPARTMENT OF ROAD TRANSPORT & HIGHWAYS) GOVERNMENT OF INDIA October 2011 AIS-002 (Part 1)(Rev. 1):2011 II Status chart of the standard to be used by the purchaser for updating the record Sr. No. Corrigenda. Amendment Revision Date Remark Misc. General remarks : AIS-002 (Part 1)(Rev. 1):2011 III INTRODUCTION 0.0 The Government of India felt the need for a permanent agency to expedite the publication of standards and development of test facilities in parallel when the work on the preparation of the standards is going on, as the development of improved safety critical parts can be undertaken only after the publication of the standard and commissioning of test facilities. To this end, the erstwhile Ministry of Surface Transport (MOST) has constituted a permanent Automotive Industry Standards Committee (AISC) vide order No.RT- 11028/11/97-MVL dated September 15, 1997. The standards prepared by AISC will be approved by the permanent CMVR Technical Standing Committee (CTSC). After approval, the Automotive Research Association of India, (ARAI), Pune, being the Secretariat of the AIS Committee, has published this standard. For better dissemination of this information ARAI may publish this document on their Web site. 0.1 0.2 Accordingly AIS-002 covering mandatory requirements regarding installation of rear view mirrors been published in 2001 and has been implemented thereafter in 2003. With technological developments in the rear view mirrors and devices for Indirect Vision, AIS-002 was taken up for revision and now is prepared in two parts. This part covers the requirements for installation of rear view mirrors and devices for indirect vision for L category vehicles with bodywork, M and N category of vehicles. 0.3 This part is based on the following ECE regulation: ECE R 46, (Supplement 4 to the 02 series of amendment of R46.) Date of entry into force 22 July 2009. Uniform provisions concerning the approval of devices for indirect vision and of motor vehicles with regard to the installation of these devices 0.4 While preparing this standard attempts have been made to align with the above ECE regulation. However, certain changes were necessary in the Indian context. 0.5 The following standards contain provisions, which through reference in this text constitute provisions of the standard AIS-001 (Part 1 ) (Rev. 1) Automotive Vehicles - Approval of Devices for Indirect Vision intended for use on M, N category and L category with bodywork vehicles - specification AIS-007 Information on Technical Specifications to be Submitted by the Vehicle Manufacturer AIS-053 Automotive Vehicles – Types - Terminology AIS-002 (Part 1)(Rev. 1):2011 IV IS 2553 (Part 2) :1992. Safety glass - Specification - Part 2 for']","['0', '41', '0', '0', '0']",['3'],"['document4.pdf', 'document9.pdf', 'document6.pdf', 'document17.pdf', 'document8.pdf']",easy,factual,0.0,0.0
What does 'r' represent in the context of this document?,"The average of the radii of curvature measured in mm, on a reflecting surface","In the provided documents, 'r' represents the co-ordinates of a point referred to as the ""R"" point in various contexts. For example, it is used to define the three-dimensional reference system (HB-1 Three-dimensional reference system), and also to determine the critical viewing distance (Annex K). However, without specific context, it's hard to provide a definitive answer as 'r' could have different meanings in different sections of the documents.","['field of vision. 6.1.2.2.2 Differences between the radii of curvature of mirrors 6.1.2.2.2.1 The difference between ri or r\'i, and rp at each reference point shall not exceed 0.15 r 6.1.2.2.2.2 The difference between any of the radii of curvature (rp1, rp2, and rp3) and r shall not exceed 0.15 r. 6.1.2.2.2.3 When r is not less than 3,000 mm, the value of 0.15 r quoted in clause 6.1.2.2.2.1. and 6.1.2.2.2.2. is replaced by 0.25 r. AIS-001 (Part 1) (Rev.2):2023 10/46 6.1.2.2.3 Requirements for aspherical parts of mirrors 6.1.2.2.3.1 Aspherical mirrors shall be of sufficient size and shape to provide useful information to the driver. This normally means a minimum width of 30 mm at some point. 6.1.2.2.3.2 The radius of curvature ri of the aspherical part shall not be less than 150 mm. 6.1.2.2.4 Value of \'r\' for spherical mirrors shall not be less than: 6.1.2.2.4.1 1200 mm for rear-view mirrors (Class I); 6.1.2.2.4.2 1200 mm for Class II and III main rear-view mirrors; 6.1.2.2.4.3 300 mm for ""wide-angle"" mirrors (Class IV) and ""close-proximity"" mirrors (Class V); 6.1.2.2.4.4 200 mm for front mirrors (Class VI). 6.1.2.2.4.5 1000 mm or more than 1500 mm in the case of Class VII main rear-view mirrors 6.1.2.2.5 The value of the normal coefficient of reflection, as determined according to the method described in Annex F, shall be not less than 40 per cent. In the case of reflecting surfaces with a changeable degree of reflection, the ""day"" position shall allow the colours of the signals used for road traffic to be recognized. The value of the normal coefficient of reflection in the ""night"" position shall be not less than 4 per cent. 6.1.2.2.6 The reflecting surface shall retain the characteristics laid down in 6.1.2.2.5. in spite of prolonged exposure to adverse weather conditions in normal use. Note : 6.1.2.2.6 is general clause and no specific tests are required for verifying compliance to this clause. 6.2 Devices for Indirect Vision other than Mirrors 6.2.1. General requirements 6.2.1.1. If adjustment by the user is needed, the device for indirect vision shall be adjustable without the use of tools. 6.2.1.2. If a device for indirect vision can only render the total prescribed field of vision by scanning the field of vision, the total process of scanning, rendering and reset to its initial position together shall not take more than 200 milliseconds at room temperature of 22 °C ± 5 °C AIS-001 (Part 1) (Rev.2):2023 11/46 6.2.1.3. The effectiveness of the CMS of Classes I to IV shall not be adversely affected by magnetic or electrical fields. This shall be demonstrated by compliance with the technical requirements and transitional provisions of AIS-004 (Part 3), as amended from time to time. 6.2.2. Camera-monitor systems The requirements of paragraph 6.2.2.1. shall be considered to be satisfied in the case of monitors of a vehicle that fulfills the provisions of IS 15223: 2002. 6.2.2.1. General requirements 6.2.2.1.1. When the devices of the camera-monitor system are mounted in the position recommended', 'fiducial marks correspond to the values indicated by the manufacturer. HB-3. The co-ordinates of the ""R"" point and the ""H"" point are established in relation to the fiducial marks defined by the vehicle manufacturer. Figure HB-1 Three-dimensional reference system */ The reference system corresponds to ISO standard 4130, 1978 AIS-002 (Part 1) (Rev.2):2023 41/65 ANNEX HC (See H-3.1) REFERENCE DATA CONCERNING SEATING POSITIONS HC-1. Coding of reference data Reference data are listed consecutively for each seating position. Seating positions are identified by a two-digit code. The first digit is an Arabic numeral and designates the row of seats, counting from the front to the rear of the vehicle. The second digit is a capital letter which designates the location of the seating position in a row, as viewed in the direction of forward motion of the vehicle; the following letters shall be used: L = left C = centre R = right HC-2. Description of vehicle measuring attitude HC-2.1. Co-ordinates of fiducial marks X ............................ Y ............................ Z ............................. HC-3. List of reference data HC-3.1. Seating position: .................................. HC-3.1.1. Co-ordinates of ""R"" point X ............................ Y ............................ Z............................ HC-3.1.2. Design torso angle .............................. HC-3.1.3. Specifications for seat adjustment (Strike out what does not apply.) horizontal: .................... vertical: ....................… angular: ........................ torso angle: ................... Note : List reference data for further seating positions under HC-3.2, HC-3.3, etc. AIS-002 (Part 1) (Rev.2):2023 42/65 ANNEX J (Reserved) AIS-002 (Part 1) (Rev.2):2023 43/65 ANNEX K (See 15.3.3.) CALCULATION OF THE DETECTION DISTANCE FOR CMS OF CLASSES V AND VI K-1. CAMERA MONITOR DEVICE FOR INDIRECT VISION K-1.1. Determination of the smallest discernable detail The smallest discernable detail of the naked eye shall be defined according to standard ophthalmologic tests like the Landolt C test or the Triangle Orientation Discrimination (TOD) test. The smallest discernable detail at the centre of the viewing system can be determined using the Landolt C test or the TOD test. In the rest of the viewing area the smallest discernable detail may be estimated from the centrally determined smallest discernable detail and the local image deformation. For instance, in the case of a digital camera the smallest discernable detail at a given pixel location (in the monitor) scales inversely with the solid angle of the pixel. K-1.1.1. Landolt-C test In the Landolt-C test, test symbols are judged by the subject under test. In accordance with this test the smallest discernable detail is defined as the visual angle of the gap size of the Landolt C symbol at threshold size and is expressed in arcmin. The threshold size corresponds to the size at which the subject judges the orientation correctly in 75 per cent of the trials. The smallest discernable detail is determined in a test involving a human observer. A test chart containing test symbols is placed in front of the camera and the observer judges the orientation of test symbols from the monitor. From the threshold gap size of the Landolt C test symbol d [m] and the distance', 'not restrict their use at other locations. Class I: Interior rear-view mirrors, (Clause 4.2) Class II, III & VI : “Main” exterior rear-view mirrors, (Clause 4.3) Class IV: “Wide-angle” exterior rear-view mirrors, Class V: “Close proximity” exterior rear-view mirrors. 4.6 “r” means the average of the radii of curvature measured in mm, on a reflecting surface in accordance with one of the methods described in Annex 3. 4.7 “Main radius of curvature at a point on the reflecting surface” means the values obtained using the apparatus defined in Annex 3 measured on the major arc of the reflecting surface passing through the center of that surface and lying within a vertical plane (ri) passing through the center of that surface, and lying within a horizontal plane, (r’ i) and on the major arc which is perpendicular to that segment. 4.8 “Radius of curvature at a point on the reflecting surface (rp)” means the arithmetical mean of the main radii of curvature ri and r’i or in other words; rp = ri+ r’i 4.9 “Center of reflecting surface” means the centroid of the visible zone of the reflecting surface. 4.10 “Radius of curvature of the constituent part of the rear-view mirror” means the radius `c’ of the arc of the circle which most closely approximates the rounded form of the part under consideration. AIS 001 / 2001 4.11 “Driver’s ocular points” means two points 65 mm apart located 635 mm vertically above the R point relating to the driving position defined in IS:13749 1993. The straight line joining these is at right angles to the vertical longitudinal median plane of the vehicle. The center of the segment having its extremities, the two ocular points, is located within a vertical longitudinal median plane which shall pass through the center of the driver’s seating position as specified by the manufacturer. In the absence of similar procedure for 3 wheeled vehicles, R point shall be as specified by vehicle manufacturer. 4.12 “Ambinocular vision” means the entire field of vision obtained by superimposing the monocular fields for the right and left eyes. (see figure a). Figure a E = interior rear-view mirror. OD } driver’s eye OE } ID } monocular virtual image IE } I = Ambinocular virtual image. A = angle of view from the right eye. B = angle of view from the left eye. C = angle of binocular view. D = angle of Ambinocular view. AIS 001 / 2001 5. GENERAL SPECIFICATIONS 5.1 Assembly of reflective surfaces with housing or mirror plate holder of all rear-view mirrors or the mirrors shall be adjustable 5.2 The edge of the reflecting surface shall be enclosed in a protective housing (holder, etc.) which, on its perimeter, shall have a radius ‘c’ greater or equal to 2.5 mm at all points in all directions. If the reflecting surface projects beyond the protective housing, the radius of curvature ‘c’ on the edge of the projecting part shall be not less than 2.5 mm and the', 'supporting surface such that the co-ordinates of the fiducial marks correspond to the values indicated by the manufacturer. HB-3. The co-ordinates of the ""R"" point and the ""H"" point are established in relation to the fiducial marks defined by the vehicle manufacturer. Figure HB-1 Three-dimensional reference system ‐‐‐‐‐‐‐‐‐‐‐‐‐‐‐‐‐‐‐‐‐‐‐‐‐‐‐‐‐‐‐‐‐‐ */ The reference system corresponds to ISO standard 4130, 1978 AIS-002 (Part 1)(Rev.1):2011 34/42 ANNEX HC (See H-3.1) REFERENCE DATA CONCERNING SEATING POSITIONS HC-1. Coding of reference data Reference data are listed consecutively for each seating position. Seating positions are identified by a two-digit code. The first digit is an Arabic numeral and designates the row of seats, counting from the front to the rear of the vehicle. The second digit is a capital letter which designates the location of the seating position in a row, as viewed in the direction of forward motion of the vehicle; the following letters shall be used: L = left C = centre R = right HC-2. Description of vehicle measuring attitude HC-2.1. Co-ordinates of fiducial marks X ............................ Y ............................ Z ............................. HC-3. List of reference data HC-3.1. Seating position: .................................. HC-3.1.1. Co-ordinates of ""R"" point X ............................ Y ............................ Z............................ HC-3.1.2. Design torso angle .............................. HC-3.1.3. Specifications for seat adjustment (Strike out what does not apply.) horizontal: .................... vertical: ....................… angular: ........................ torso angle: ................... Note : List reference data for further seating positions under HC-3.2, HC-3.3, etc. AIS-002 (Part 1)(Rev.1):2011 35/42 ANNEX J (Reserved) AIS-002 (Part 1)(Rev.1):2011 36/42 ANNEX K (See 15.3.3.) CALCULATION OF THE DETECTION DISTANCE K-1. CAMERA MONITOR DEVICE FOR INDIRECT VISION K-1.1. Resolution threshold of a camera The resolution threshold of a camera is defined by the formula: c c c N 60 β ω = where: ωc - resolution threshold of the camera (arc-min) βc - angle of vision of the camera (°) Nc - number of video lines of the camera (#) The manufacturer shall supply the values for βc and Nc K-1.2. Determination of the critical viewing distance of the monitor For a monitor having certain dimensions and properties, a distance to the monitor shall be calculated within which the detection distance is dependent only on the performances of the camera. This critical viewing distance rm,c is defined by: ⎟⎟ ⎠ ⎞ ⎜⎜ ⎝ ⎛ = .2 tan .2. , eye m m c m N H r ω where: rm,c - critical viewing distance (m) Hm - height of the monitor image (m) Nm - number of video lines of the monitor (-) ωeye - resolution threshold of the observer (minutes of arch) The number 60 is for conversion from minutes of arches to degrees. The manufacturer shall supply the values for Hm and Nm. ωeye = 1 K-1.3 Determination of the detection distance K-1.3.1. Maximum detection distance within the critical viewing distance where, due to the installation, the distance eye-monitor is less than the critical viewing distance, the maximum attainable detection distance shall be defined by AIS-002 (Part 1)(Rev.1):2011 37/42 ⎟⎟ ⎠ ⎞ ⎜⎜ ⎝', 'REQUIREMENTS H-3.1. Data presentation For each seating position where reference data are required in order to demonstrate compliance with the provisions of the present standard, all or an appropriate selection of the following data shall be presented in the form indicated in Annex HC. H-3.1.1. the co-ordinates of the ""R"" point relative to the three-dimensional reference system; H-3.1.2. the design torso angle; H-3.1.3. all indications necessary to adjust the seat (if it is adjustable) to the measuring position set out in H-4.3. H-3.2. Relationship between measured data and design specifications H-3.2.1. The co-ordinates of the ""H"" point and the value of the actual torso angle obtained by the procedure set out in H-4 shall be compared, respectively, with the co-ordinates of the ""R"" point and the value of the design torso angle indicated by the vehicle manufacturer. H-3.2.2. The relative positions of the ""R"" point and the ""H"" point and the relationship between the design torso angle and the actual torso angle shall be considered satisfactory for the seating position in question if the ""H"" point, as defined by its co-ordinates, lies within a square of 50 mm side length with horizontal and vertical sides whose diagonals intersect at the ""R"" point, and if the actual torso angle is within 5 degree of the design of the torso angle. AIS-002 (Part 1)(Rev.1):2011 26/42 H-3.2.3. If these conditions are met, the ""R"" point and the design torso angle, shall be used to demonstrate compliance with the provisions of this standard. H-3.2.4. If the ""H"" point or the actual torso angle does not satisfy the requirements of H-3.2.2, the ""H"" point and the actual torso angle shall be determined twice more (three times in all). If the results of two of these three operations satisfy the requirements, the conditions of H-3.2.3 shall apply. H-3.2.5. If the results of at least two of the three operations described H-3.2.4 do not satisfy the requirements of H-3.2.2, or if the verification is not to carry out because the vehicle manufacturer has failed to supply information regarding the position of the ""R"" point or regarding the design torso angle, the centroid of the three measured points or the average of the three measured angles shall be used and be regarded as applicable in all cases where the ""R"" point or the design torso angle is referred to in this standard. H-4. PROCEDURE FOR ""H"" POINT AND ACTUAL TORSO ANGLE DETERMINATION H-4.1. The vehicle shall be preconditioned at the manufacturer\'s discretion, at a temperature of 20 + 10°C to ensure that the seat material reaches the room temperature. If the seat to be checked has never been sat upon, a 70 to 80 kg person or device shall sit on the seat twice for one minute to flex the cushion and back. At the manufacturer\'s request, all seat assemblies shall remain unloaded for a minimum period of 30 min prior to installation of the 3-D H machine. H-4.2. The vehicle shall be at the measuring attitude defined']","['9', '28', '3', '21', '16']",['3'],"['document5.pdf', 'document9.pdf', 'document3.pdf', 'document8.pdf', 'document8.pdf']",easy,factual,0.95,0.95
What is the definition of 'Driver’s ocular points' according to this document?,Two points 65 mm apart located 635 mm vertically above the R point relating to the driving position defined in IS:13749 1993,"According to the provided documents, the term 'Driver’s ocular points' refers to the imaginary points where a driver's eyes are located when looking straight ahead while seated in the vehicle. This concept is used as a reference point for defining the fields of vision required for various mirrors and devices installed on vehicles.

In AIS-002 (Part 1) (Rev.2):2023, the driver's ocular points are mentioned in clauses 15.2.4.5.1, 15.2.4.5.6, and 15.2.4.6.

In AIS-002 (Part 1)(Rev.1):2011, the driver's ocular points are mentioned in clauses 15.2.4.2.1, 15.2.4.3.1, and 15.2.4.3.2.","['the driver’s ocular points. In addition, the road shall be visible to the driver over a width of 4.5 m, which is bounded by a plane parallel to the median longitudinal vertical plane and passing through the outermost point of the vehicle starting from a point 1.5 m behind the vertical plane passing through the driver’s ocular points (see Figure 7). Figure 7 Class IV Field of vision 15.2.4.5. "" Class V close-proximity view device The field of vision shall be such that the driver is able to see a flat horizontal portion of the road along the side of the vehicle, bounded by the following vertical planes (see Figures 8a and 8b): 15.2.4.5.1 The plane parallel to the median longitudinal vertical plane of the vehicle which passes through the outermost point of the vehicle cab on the passenger’s side; 15.2.4.5.2. in the transverse direction, the parallel plane passing at a distance of 2 m in front of the plane mentioned in clause 15.2.4.5.1. above 15.2.4.5.3. to the rear, the plane parallel to the vertical plane passing through the driver’s ocular points and situated at a distance of 1.75 m behind that plane; 15.2.4.5.4. to the front, the plane parallel to the vertical plane passing through the driver’s ocular points and situated at a distance of 1 m in front of that plane. If the vertical transverse plane passing through the leading edge AIS-002 (Part 1) (Rev.2):2023 15/65 of the vehicle bumper is less than 1 m in front of the vertical plane passing through the driver’s ocular points, the field of vision shall be limited to that plane. 15.2.4.5.5. In case the field of vision described in Figures 8a and 8b is able to be perceived through the combination of the field of vision from a Class IV wide-angle view device and that of a Class VI front view device, the installation of a Class V close proximity view device is not compulsory. Figures 8a and 8b Class V Field of vision 15.2.4.5.6 On the passenger side only, the field of vision shall also be such that the driver can see a flat horizontal portion of the road along the side of the vehicle which is outside the field defined in clauses 15.2.4.5.1. to 15.2.4.5.4. above but within the field bounded by the following vertical planes; the front of this field of vision may be rounded off with a radius of 2,000 mm (see Figures 8c and 8d): 15.2.4.5.7 In the transverse direction, the parallel plane passing at a distance of 4.5 m in front of the plane mentioned in clause 15.2.4.5.1. above. 15.2.4.5.8 To the rear, the plane parallel to the vertical plane passing through the driver\'s ocular points and situated at a distance of 1.75 m behind that plane. 15.2.4.5.9. To the front, the plane parallel to the vertical plane passing through the driver\'s ocular points and situated at a distance of 3 m in front of that plane. This field of vision may be partially provided', 'points runs perpendicular to the vertical longitudinal median plane of the vehicle. The centre of the segment joining the two ocular points is in a vertical longitudinal plane which shall pass through the centre of the driver\'s designated seating position, as specified by the vehicle manufacturer. Note: The R point declared by the manufacturer may be used for measurement of field of visions 12.2. ""Ambinocular vision"" means the total field of vision obtained by the superimposition of the monocular fields of the right eye and the left eye (see Figure 3 below). Note : Figures 1 and 2 reserved. Figure 3 (See 12.2) Ambinocular vision AIS-002 (Part 1) (Rev.2):2023 2/65 E= interior rear-view mirror OD = driver’s eyes OE = driver’s eyes ID = virtual monocular images IE = virtual monocular images I = virtual ambinocular images A = angle of vision of right eye. B = angle of vision of left eye. C = binocular angle of vision. D = angle of Ambinocular vision. 12.3. ""Type of vehicle as regards indirect vision"" means motor vehicles which are identical in respect of the following basic features: 12.3.1. Type of device for indirect vision; 12.3.2. The bodywork features which reduce the field of vision 12.3.3. The coordinates of point R (where applicable); 12.3.4 The prescribed positions, and type-approval markings of compulsory and (if fitted) optional devices for indirect vision. 12.4 Reserved 12.5 ""Forward control"" means a configuration in which more than half of the engine length is rearward of the foremost point of the windshield base and the steering wheel hub in the forward quarter of the vehicle length. 12.6 ""Ocular reference point"" means the middle point between the driver\'s ocular points. 12.7 “Unladen (kerb) mass"" (kg) means the mass of the vehicle in running order, unoccupied and unladen but with the addition of 75 kg for the mass of the driver, the mass of fuel, in the case of liquid fuels, corresponding to 90 per cent of the capacity of the fuel tank specified by the manufacturer, and in the case of gaseous fuels such as CNG, LPG etc. the legally permitted maximum, and the masses of coolant, lubricant, tools and spare wheel, if any. 13. APPLICATION FOR APPROVAL 13.1. Information to be submitted at the time of applying for type approval of the devices for indirect vision shall be as given in Annex B 13.2. Reserved. 13.3. A vehicle representative of the vehicle type to be approved shall be submitted to the testing agency responsible for conducting the approval tests. 13.4. Reserved AIS-002 (Part 1) (Rev.2):2023 3/65 13.5. The CMS shall be provided by the applicant with the following documents: (a) Technical specification of the CMS; (b) Operator\'s manual (c) Documentation referred to in Annex M, clause 2.3. (d) Documentation referred to in clause 16.1.1.1.1., if applicable 14. APPROVAL 14.1. If the vehicle type submitted for approval in accordance with clause 13 above, meets the requirements of clause 15 of this standard, approval shall be granted. 14.2. Reserved 14.3.', 'position, as specified by the vehicle manufacturer. Note: The R point declared by the manufacturer may be used for measurement of field of visions. 12.2. ""Ambinocular vision"" means the total field of vision obtained by the superimposition of the monocular fields of the right eye and the left eye (see Figure 3 below). Note : Figures 1 and 2 reserved Figure 3 (See 12.2) Ambinocular vision E= interior rear-view mirror OD = driver’s eyes OE = driver’s eyes ID = virtual monocular images IE = virtual monocular images I = virtual ambinocular images A = angle of vision of right eye. B = angle of vision of left eye. C = binocular angle of vision. D = angle of Ambinocular vision. IE ID I C A B D OE OD E AIS-002 (Part 1)(Rev. 1):2011 2/42 12.3. ""Type of vehicle as regards indirect vision"" means motor vehicles which are identical in respect of the following basic features: 12.3.1. Type of device for indirect vision; 12.3.2. The bodywork features which reduce the field of vision; 12.3.3. The coordinates of point R (where applicable); 12.3.4 The prescribed positions, and type-approval markings of compulsory and (if fitted) optional devices for indirect vision. 12.4 Reserved 12.5. ""Forward control"" means a configuration in which more than half of the engine length is rearward of the foremost point of the windshield base and the steering wheel hub in the forward quarter of the vehicle length. 12.6 “Unladen (kerb) mass"" (kg) means the mass of the vehicle in running order, unoccupied and unladen but with the addition of 75 kg for the mass of the driver, the mass of fuel, in the case of liquid fuels, corresponding to 90 per cent of the capacity of the fuel tank specified by the manufacturer, and in the case of gaseous fuels such as CNG, LPG etc. the legally permitted maximum, and the masses of coolant, lubricant, tools and spare wheel, if any. 13. APPLICATION FOR APPROVAL 13.1. Information to be submitted at the time of applying for type approval of the devices for indirect vision shall be as given in Annex B 13.2. Reserved. 13.3. A vehicle representative of the vehicle type to be approved shall be submitted to the testing agency responsible for conducting the approval tests. 13.4. Reserved 14. APPROVAL 14.1. If the vehicle type submitted for approval in accordance with 13 above meets the requirements of 15 of this standard, approval shall be granted. 14.2. Reserved 14.3. Reserved AIS-002 (Part 1)(Rev. 1):2011 3/42 15. REQUIREMENTS 15.1 General 15.1.1 The compulsory and optional devices for indirect vision, set out in the table under 15.2.1.1.1, installed on the vehicle shall be classes described in AIS-001 (Part 1) (Rev. 1). 15.1.2. Mirrors and other devices for indirect vision shall be fitted in such a way that the mirror or other device does not move so as significantly to change the field of vision as measured or vibrate to an extent which would cause the driver to misinterpret the nature', ""points and situated at a distance of 1.75 m behind that plane. 15.2.4.5.9. To the front, the plane parallel to the vertical plane passing through the driver's ocular points and situated at a distance of 3 m in front of that plane. This field of vision may be partially provided by a front- view device (Class VI). AIS-002 (Part 1) (Rev.2):2023 16/65 15.2.4.5.10 The field of vision prescribed in clause 15.2.4.5.6. to 15.2.4.5.9. above may be partially provided by a wide-angle view device (Class IV) or a combination of a close-proximity view device (Class V) and a front-view device Class VI). 15.2.4.5.11 The area prescribed in clause 15.2.4.5.6. to 15.2.4.5.9. above may be viewed using a combination of direct view and indirect vision devices (of Class IV, V, VI). 15.2.4.5.11.1 If an indirect vision device of Class IV is used to provide a part of the field of vision prescribed in clause 15.2.4.5.6. to 15.2.4.5.9., its hall be adjusted in a way that it simultaneously provides the field of vision prescribed in clause 15.2.4.4.2. 15.2.4.5.11.2 If an indirect vision device of Class V is used to provide a part of the field of vision prescribed in clause 15.2.4.5.6. to 15.2.4.5.9., it shall be adjusted in a way that it simultaneously provides the field of vision prescribed in clauses 15.2.4.5.1. to 15.2.4.5.4 15.2.4.5.11.3 If an indirect vision device of Class VI is used to provide a part of the field of vision prescribed in clause 15.2.4.5.6. to 15.2.4.5.9., it shall be adjusted in a way that it simultaneously provides the field of vision prescribed in clause 15.2.4.6.1. 15.2.4.5.12 The field of vision prescribed in clauses15.2.4.5.1. to 15.2.4.5.4. may be viewed using a combination of a close-proximity view device (Class V) and a wide-angle view device (Class IV). In such cases the close-proximity view mirror (Class V) shall provide at least 90 per cent of the field of vision prescribed in clause 15.2.4.5.1 to 15.2.4.5.4. and the Class IV mirror shall be adjusted in a way that it simultaneously provides the field of vision prescribed in clause 15.2.4.4.2. 15.2.4.5.13 Clause 15.2.4.5.6. to 15.2.4.5.12. above shall not apply to a vehicle where any part of a Class V mirror, if fitted, or its holder, is less than 2.4 m above the ground, regardless of its position after adjustment. 15.2.4.5.14. Clause 15.2.4.5.6. to 15.2.4.5.12. above shall not apply to a vehicle of category M2 or M3. AIS-002 (Part 1) (Rev.2):2023 17/65 Figures 8c and 8d – Larger field of vision on the passenger side 15.2.4.6. Class VI front-view device (a) a transverse vertical plane through the outermost point of the front of the vehicle, (b) a transverse vertical plane 2000 mm in front of the plane defined in (a), (c) a longitudinal vertical plane parallel to the longitudinal vertical median plane going through the outermost side of the vehicle at the driver's side and, (d) a longitudinal vertical plane parallel to the longitudinal vertical median plane 2000 mm outside the outermost side of the"", ""m behind the driver's ocular points to the horizon. In addition, the road shall be visible to the driver over a width of 1 m, which is bounded by a plane parallel to the median longitudinal vertical plane and passing through the outermost point of the vehicle starting from a point 4 m behind the vertical plane passing through the driver's ocular points (see Figure 5). 15.2.4.2.2. Exterior rear-view mirror on the passenger's side The field of vision shall be such that the driver is able to see at least a 5 m wide, flat, horizontal portion of the road, which is bounded on the passenger's side by a plane parallel to the median longitudinal vertical plane of the vehicle and passing through the outermost point of the vehicle on the passenger's side and which extends from 30 m behind the driver’s ocular points to the horizon. In addition, the road shall be visible to the driver over a width of 1 m, which is bounded by a plane parallel to the median longitudinal vertical plane and passing through the outermost point of the vehicle starting from a point 4 m behind the vertical plane passing through the driver's ocular points (see Figure 5). AIS-002 (Part 1)(Rev.1):2011 11/42 Figure 5 Field of vision of Class II mirrors 15.2.4.3 Main exterior rear-view mirrors Class III 15.2.4.3.1. Exterior rear-view mirror on the driver’s side The field of vision shall be such that the driver is able to see at least a 4 m wide, flat, horizontal portion of the road, which is bounded by a plane parallel to the median longitudinal vertical plane and passing through the outermost point of the vehicle on the driver’s side of the vehicle and extends from 20 m behind the driver’s ocular points to the horizon (see Figure 6). In addition, the road shall be visible to the driver over a width of 1 m, which is bounded by a plane parallel to the median longitudinal vertical plane and passing through the outermost point of the vehicle starting from a point 4 m behind the vertical plane passing through the driver’s ocular points. 15.2.4.3.2 Exterior rear-view mirror on the passenger’s side The field of vision shall be such that the driver is able to see at least a 4 m wide flat, horizontal portion of the road which is bounded by a plane parallel to the median longitudinal vertical plane passing through the outermost point of the vehicle on the passenger’s side and which extends from 20 m behind the driver’s ocular points to the horizon (see Figure 6). In addition, the road shall be visible to the driver over a width of 1 m, which is bounded by a plane parallel to the median longitudinal vertical plane and passing through the outermost point of the vehicle starting from a point 4 m behind the vertical plane passing through the driver’s ocular points. AIS-002 (Part 1)(Rev.1):2011 12/42 Figure 6 Field of vision of Class III mirrors""]","['12', '3', '2', '13', '8']",['3'],"['document9.pdf', 'document9.pdf', 'document8.pdf', 'document9.pdf', 'document8.pdf']",easy,factual,1.0,1.0
Which document defines the condition for the transient/burst generator?,IEC 61000-4-4,"The document that defines the condition for the transient/burst generator is not explicitly mentioned in the provided text. However, it can be inferred that the standard for this might be found in IEC 61000-4-4 ""Electromagnetic Compatibility (EMC) - Part 4-4 - Testing and measurement techniques - Electrical fast transient’s/burst immunity test"", edition 2.0 - 2004, as it is one of the standards listed in Appendix 1 of the document.","['per cent of its nominal value. Vehicle sets in motion AIS-004 (Part 3) (Rev.1) 117/149 2.1.3 All other equipment which can be switched on permanently by the driver or passenger should be OFF. 2.2 Only non-perturbing equipment shall be used while monitoring the vehicle. The vehicle exterior and the passenger compartment shall be monitored to determine whether the requirements of this annex are met (e.g. by using (a) video camera(s), a microphone, etc.). 3.0 TEST EQUIPMENT 3.1 The test equipment is composed of a reference ground plane (a shielded room is not required), a transient/burst generator, Coupling/Decoupling Network (CDN) and capacitive coupling clamp 3.2 The transient/burst generator shall meet the condition defined in paragraph 6.1. of IEC 61000-4-4. 3.3 The Coupling/Decoupling Network shall meet the condition defined in paragraph 6.2. of IEC 61000-4-4. When the Coupling/Decoupling Network cannot be used on AC or DC power lines, the capacitive coupling clamp defined in paragraph 6.3. of IEC 61000-4-4 can be used. 4.0 TEST SETUP 4.1 The vehicle test setup is based on the laboratory type setup as described in paragraph 7.2. of IEC 61000-4-4. 4.2 The vehicle shall be placed directly on the ground plane. 4.3 The Test Agency shall perform the test as specified in paragraph 6.8.2.1. of this Standard. Alternatively, if the manufacturer provides measurement from a test laboratory accredited to the applicable parts of ISO 17025 and recognized by the Type Approval Authority, the Test Agency may choose not to perform the test to confirm that the vehicle meets the requirements of this annex. 5.0 GENERATION OF REQUIRED TEST LEVEL 5.1 Test methodology 5.1.1 The test method according to IEC 61000-4-4 shall be used to establish the test level requirements. 5.1.2 Test phase The vehicle shall be positioned on the ground plane. The electrical fast transient/burst (EFT/B) shall be applied on the vehicle on the AC/DC power lines in common modes by using CDN as described in Figure 1 of Appendix 1 to this annex. The test set-up shall be noted in the test report. AIS-004 (Part 3) (Rev.1) 118/149 ANNEX 13 - APPENDIX 1 Figure 1 Vehicle in configuration ""REESS charging mode"" coupled to the power grid coupling AIS-004 (Part 3) (Rev.1) 119/149 ANNEX 14 METHOD OF TESTING FOR IMMUNITY OF VEHICLES TO SURGES CONDUCTED ALONG AC AND DC POWER LINES (See 6.9) 1.0 GENERAL 1.1 The test method described in this annex shall only be applied to vehicles. This method concerns only the configuration of the vehicle with ""REESS charging mode coupled to the power grid"". 1.2 Test method This test is intended to demonstrate the immunity of the vehicle electronic systems. The vehicle shall be subject to surges conducted along AC and DC power lines of the vehicle as described in this annex. The vehicle shall be monitored during the tests. If not otherwise stated in this annex the test shall be performed according to I EC 61000-4-5. 2.0 VEHICLE STATE DURING TESTS IN CONFIGURATION ""REESS IN CHARGING MODE COUPLED TO THE POWER GRID"" 2.1', 'A per phase and not subjected to conditional connection shall be performed according to paragraph 4. of IEC 61000-3-3. AIS-004 (Part 3) (Rev.1) 103/149 3.2 The tests for vehicle in configuration ""REESS charging mode coupled to the power grid"" with rated current > 16 A and ≤ 75 A per phase and subjected to conditional connection shall be performed according to paragraph 6. of IEC 61000-3-11. 3.3 The test set-up for vehicle in configuration ""REESS charging mode coupled to the power grid"" is shown in Figures 1a and 1b of Appendix 1 to this annex. 4.0 TEST REQUIREMENTS 4.1 The parameters to be determined in the time-domain are ""short duration flicker value"", ""long duration flicker value"" and ""voltage relative variation"". 4.2 The limits for vehicle in configuration ""REESS charging mode coupled to the power grid"" with input current ≤ 16 A per phase and not subjected to conditional connection are given in paragraph 6.4.2.1. of this Standard. 4.3 The limits for vehicle in configuration ""REESS charging mode coupled to the power grid"" with input current > 16 A and ≤ 75 A per phase and subjected to conditional connection are given in paragraph 6.4.2.2. of this Standard. AIS-004 (Part 3) (Rev.1) 104/149 ANNEX 10 - APPENDIX 1 Figure 1a Vehicle in configuration ""REESS charging mode coupled to the power grid"" – Single phase test set-up Figure 1b Vehicle in configuration ""REESS charging mode coupled to the power grid"" – Three phase test set-up AIS-004 (Part 3) (Rev.1) 105/149 ANNEX 11 METHOD(S) OF TESTING FOR EMISSION OF RADIO FREQUENCY CONDUCTED DISTURBANCES ON AC OR DC POWER LINES FROM VEHICLES (See 6.5) 1.0 GENERAL 1.1 The test method described in this annex shall be applied to vehicles in configuration ""REESS charging mode coupled to the power grid"". 1.2 Test method This test is intended to measure the level of radio frequency conducted disturbances generated by vehicle in configuration ""REESS charging mode coupled to the power grid"" through its AC or DC power lines in order to ensure it is compatible with residential, commercial and light industrial environments. If not otherwise stated in this annex the test shall be performed according to CISPR 16-2-1. 2.0 VEHICLE STATE DURING TESTS 2.1 The vehicle shall be in configuration ""REESS charging mode coupled to the power grid"". The state of charge (SOC) of the traction battery shall be kept between 20 per cent and 80 per cent of the maximum SOC during the whole frequency range measurement (this may lead to split the measurement in different sub-bands with the need to discharge the vehicle\'s traction battery before starting the next sub-bands). If the current consumption can be adjusted, then the current shall be set to at least 80 per cent of its nominal value. The vehicle shall be immobilized, engine OFF. And all other equipment which can be switched on permanently by the driver or passenger should be OFF. 3.0 Test arrangements 3.1 The test shall be performed according to paragraph 6.4.1. of CISPR 16-2-1 as', 'the Immunity to Transient Disturbances Conducted along Supply Lines. 5.8.1 Method of testing The immunity of ESA representative of its type shall be tested by the method(s) according to ISO 7637-2, second edition 2004 as described in Annex 8 with the test levels given in table 1. AIS-004 (Part 3) (Rev.1) 12/149 Table 1 Immunity of ESA Test pulse number Immunity test level Functional status for systems: Related to immunity related functions Not related to immunity related functions III C D 2a III B D 2b III C D 3a/3b III A D III B (For ESA which must be operational during engine start phases) C (For other ESA) D 5.9 Specifications Concerning the Emission of Transient Conducted Disturbances 5.9.1 Method of testing The emission of ESA representative of its type shall be tested by the method(s) according to ISO 7637-2, second edition 2004 as described in Annex 8 for the levels given in table 2. AIS-004 (Part 3) (Rev.1) 13/149 Table 2 Maximum allowed pulse amplitude Maximum allowed pulse amplitude for Polarity of pulse amplitude Vehicles with 12 V systems Vehicles with 24 V systems Positive +75 +150 Negative - 450 5.10 Exceptions 5.10.1 Where a vehicle or electrical / electronic system or ESA does not include an electronic oscillator with an operating frequency greater than 9 kHz, it shall be deemed to comply with paragraphs 5.3.2 or 5.6.2 above and to Annexes 3 and 6. 5.10.2 Vehicles which do not have electrical / electronic systems with ""immunity related functions"" need not be tested for immunity to radiated disturbances and shall be deemed to comply with paragraph 5.4 and with Annex 4 to this standard. 5.10.3 ESAs with no immunity related functions need not be tested for immunity to radiated disturbances and shall be deemed to comply with paragraph 5.7 and with Annex 7 to this standard. 5.10.4 Electrostatic Discharge For vehicles fitted with tyres, the vehicle body / chassis can be considered to be an electrically isolated structure. Significant electrostatic forces in relation to the vehicle\'s external environment occur only at the moment of occupant entry into or exit from the vehicle. As the vehicle is stationary at these moments, no type approval test for electrostatic discharge is deemed necessary. 5.10.5 Conducted Emission ESAs that are not switched, contain no switches or do not include inductive loads need not be tested for conducted emission and shall be deemed to comply with paragraph 5.9. 5.10.6 The loss of function of receivers during the immunity test, when the test signal is within the receiver bandwidth (RF exclusion band) as specified for the specific radio service / product in the harmonized international EMC standard, does not necessarily lead to fail criteria. AIS-004 (Part 3) (Rev.1) 14/149 5.10.7 RF transmitters shall be tested in the transmit mode. Wanted emissions (e.g. from RF transmitting systems) within the necessary bandwidth and out of band emissions are disregarded for the purpose of this standard. Spurious emissions are subject to this standard. 5.10.7.1 ""Necessary Bandwidth"": for', 'Fast Transient / Burst disturbances conducted along AC and DC power lines. 136/149 Annex 20 Method of testing for immunity of ESAs to surges conducted along AC and DC power lines. 139/149 Annex 21A Guidelines for deciding applicability, worst case criteria (WCC) and criteria for extension of approval (CEA) for radiated immunity test. 143/149 AIS-004 (Part 3) (Rev.1) V Annex 21B Guidelines for deciding applicability, worst case criteria (WCC) and criteria for extension of approval (CEA) for radiated emission test. 146/149 Annex 22 Composition of AISC Panel 148/149 Annex 23 Composition of AISC 149/149 AIS-004 (Part 3) (Rev.1) 1/149 Automotive Vehicles –Requirements for Electromagnetic Compatibility 1.0 SCOPE This standard applies to: 1.1 Vehicles of categories L, M, N and T (Refer IS 14272 for vehicle category definitions) with regard to electromagnetic compatibility; 1.2 Components and separate technical units intended to be fitted in these vehicles with the limitation given in paragraph 3.2.1 with regard to electromagnetic compatibility. 1.3 It covers: (a) Requirements regarding the immunity to radiated and conducted disturbances for functions related to direct control of the vehicle, related to driver, passenger and other road users\' protection and related to disturbances, which would cause confusion to the driver or other road users, related to vehicle data bus functionality, related to disturbances, which would affect vehicle statutory data; (b) Requirements regarding the control of unwanted radiated and conducted emissions to protect the intended use of electrical or electronic equipment at own or adjacent vehicles or nearby, and the control of disturbances from accessories that may be retrofitted to the vehicle. (c) Additional requirements for vehicles and ESAs providing coupling systems for charging the REESS regarding the control of emissions and immunity from this connection between vehicle and power grid. 2.0 DEFINITIONS For the purposes of this standard: 2.1 ""Electromagnetic compatibility"" means the ability of a vehicle or component(s) or separate technical unit(s) to function satisfactorily in its electromagnetic environment without introducing intolerable electromagnetic disturbances to anything in that environment. 2.2 ""Electromagnetic disturbance"" means any electromagnetic phenomenon which may degrade the performance of a vehicle or component(s) or separate technical unit(s), or of any other device, unit of equipment or system operated in vicinity of a vehicle. An electromagnetic disturbance may be electromagnetic noise, an unwanted signal or a change in the propagation medium itself. 2.3 ""Electromagnetic immunity"" means the ability of a vehicle or component(s) or separate technical unit(s) to operate without degradation of performance in the presence of (specified) electromagnetic disturbances which includes wanted radio frequency signals from radio transmitters or AIS-004 (Part 3) (Rev.1) 2/149 radiated in-band emissions of industrial-scientific-medical (ISM) apparatus, internal or external to the vehicle. 2.4 ""Electromagnetic environment"" means the totality of electromagnetic phenomena existing at a given location. 2.5 ""Broadband emission"" means an emission, which has a bandwidth greater than that of a particular measuring apparatus or receiver (International Special Committee on Radio Interference (CISPR) 25, second edition). 2.6 ""Narrowband emission"" means an emission which has a bandwidth less than that of a particular', '""Electromagnetic Compatibility (EMC) - Part 3-12 – Limits for harmonic current emissions produced by equipment connected to public low-voltage systems with input current > 16 A and ≤ 75 A per phase"", edition 1.0 - 2004. IEC 61000-4-4 ""Electromagnetic Compatibility (EMC) - Part 4-4 - Testing and measurement techniques - Electrical fast transient’s/burst immunity test"", edition 2.0 - 2004. IEC 61000-4-5 ""Electromagnetic Compatibility (EMC) - Part 4-5 - Testing and measurement techniques - Surge immunity test"", edition 2.0 – 2005. IEC 61000-6-2 ""Electromagnetic Compatibility (EMC) - Part 6-2 - Generic Standards Immunity for industrial environments"", edition 2.0 - 2005. IEC 61000-6-3 ""Electromagnetic Compatibility (EMC) - Part 6-3 - Generic Standards Emission standard for residential, commercial and light-industrial environments"", edition 2.0 - 2006. CISPR 16–2–1 ""Specification for radio disturbances and immunity measuring apparatus and methods - Part 2-1 - Methods of measurement of disturbances and immunity - Conducted disturbances measurement"", edition 2.0 - 2008. CISPR 32 ""Information Technology Equipment - Radio disturbances characteristics - Limits and methods of measurement"", edition 2.0 - 2015. CISPR 16-1-2 ""Specification for radio disturbance and immunity measuring apparatus and methods - Part 1-2: Radio disturbance and immunity measuring apparatus - Ancillary equipment - Conducted disturbances"", edition 1.2: 2006. 35/149 APPENDIX 2 AIS-004 (Part 3) (Rev.1) VEHICLE BROADBAND REFERENCE LIMITS Antenna-Vehicle Separation: 10 m Limit E (dBµV/m) at frequency F (MHz) 30 - 75 MHz 75 - 400 MHz 400 – 1,000 MHz E = 32 E = 32 + 15.13 log (F/75) E = 43 Frequency – megahertz – logarithmic (See paragraph 5.2.2.1 of this standard) 1,000 F (MHz) E (dBµV/m) Vehicle radiated emission limit Broadband type approval limit - 10 m Quasi-peak detector - 120 kHz bandwidth 36/149 APPENDIX 3 VEHICLE BROADBAND REFERENCE LIMITS AIS-004 (Part 3) (Rev.1) Antenna-Vehicle Separation: 3 m Limit E (dBµV/m) at frequency F (MHz) 30 - 75 MHz 75 - 400 MHz 400 – 1,000 MHz E = 42 E = 42 + 15.13 log (F/75) E = 53 Frequency – megahertz - logarithmic (See paragraph 5.2.2.2 of this standard) 1,000 F (MHz) E (dBµV/m) Vehicle radiated emission limit Broadband type approval limit - 3 m Quasi-peak detector - 120 kHz bandwidth 37/149 APPENDIX 4 AIS-004 (Part 3) (Rev.1) VEHICLE NARROWBAND REFERENCE LIMITS Antenna-Vehicle Separation: 10 m Limit E (dBµV/m) at frequency F (MHz) 30 - 75 MHz 75 - 400 MHz 400 – 1,000 MHz E = 22 E = 22 + 15.13 log (F/75) E = 33 Frequency – megahertz - logarithmic (See paragraph 5.3.2.1 of this standard) F (MHz) E (dBµV/m) Vehicle radiated emission limit Narrowband type approval limit - 10 m Average detector - 120 kHz bandwidth 38/149 APPENDIX 5 VEHICLE NARROWBAND REFERENCE LIMITS AIS-004 (Part 3) (Rev.1) Antenna-Vehicle Separation: 3 m Limit E (dBµV/m) at frequency F (MHz) 30 - 75 MHz 75 - 400 MHz 400 – 1,000 MHz E = 32 E = 32 + 15.13 log (F/75) E = 43 Frequency – megahertz - logarithmic (See paragraph 5.3.2.2 of this standard) F']","['57', '52', '11', '3', '25']",['57'],"['document15.pdf', 'document15.pdf', 'document15.pdf', 'document15.pdf', 'document15.pdf']",easy,factual,0.95,0.85
What is the composition of the test equipment according to AIS-004 (Part 3) (Rev.1)?,"reference ground plane, transient/burst generator, Coupling/Decoupling Network (CDN), and capacitive coupling clamp","The composition of the test equipment according to AIS-004 (Part 3) (Rev.1) includes:

1. A semi-anechoic chamber or an outdoor test site for measuring radiated broadband electromagnetic emissions from Electrical/Electronic Sub-Assemblies (ESAs).
2. An absorber lined shielded enclosure (ALSE) or an open area test site (OATS), which complies with the requirements of CISPR 16-1 (second edition 2002), as an alternative to an ALSE.
3. A quasi-peak or peak detector for measuring the emissions throughout the frequency range 30 to 1,000 MHz.
4. A test load of 25 kg for bending tests on rear view mirror holders.
5. Apparatus for keeping the ESA under test in normal operation mode, preferably in maximum load.
6. Equipment for applying the test load and measuring the results of the bending tests.
7. Testing agencies accredited to the applicable parts of ISO 17025 (first edition 1999) and recognized by the Test Agency, if measurement data for the whole frequency band from a test laboratory is provided by the manufacturer.
8. Figure 1, Figure 2, and Figure 3, which are diagrams illustrating the setup of the test equipment for various tests.

Sources: AIS-004 (Part 3) ANNEX 4 – APPENDIX 1, Figures 1 to 3; AIS-001 (Part 2) (Rev.1): 2011, sections 6, 7, and 8.","['these axes shall be in the direction chosen by the test agency to give the most adverse conditions with respect to actuation of the locking mechanism. 5.4.2.4 A suitable apparatus for the tests is described in Annexure-9. The design of any such test apparatus shall ensure that the required acceleration is given before the webbing is withdrawn out of the retractor by more than 5 mm and that the withdrawal takes place at an average rate of increase of acceleration is between 25 g/s and 150 g/s. 5.4.2.5 To check conformity with the requirements of paragraph 4.2.5.4.1.4 and 4.2.5.4.1.5, the retractor shall be mounted on a horizontal table and the table titled with a speed not exceeding 2 degrees per second until locking has occurred. The test shall be repeated with tilting in other directions to ensure that the requirements are fulfilled. AIS-005/2000 5.4.3 Dust Resistance 5.4.3.1. The retractor shall be positioned in a test chamber as described in Annexure-10. It shall be mounted with the same relative position as in the vehicle. The test chamber shall contain dust as specified in para 5.4.3.2. A length of 500 mm of the strap shall be extracted from the retractor and kept extracted, except that it shall be subjected ten complete cycles of retraction and withdrawal within one or two minutes after each agitation of the dust. For a period of five hours, the dust shall be agitated every twenty minutes for five seconds by compressed air free of oil and moisture at a gauge pressure of 550 kPa entering through an orifice 1.5 ± 0.1 mm in diameter. 5.4.3.2 The dust used in the test prescribed in para 5.4.3.1 shall consist of about 1 kg of dry quartz. The particle size distribution is as follows : 5.4.3.2.1 Passing 150 microns aperture, 10 microns wire diameter : 99-100%. 5.4.3.2.2 Passing 105 microns aperture 64 microns wire diameter : 76-86%. 5.4.3.2.3 Passing 75 microns aperture, 52 microns wire diameter : 60-70% 5.4.4 Retracting Force The retracting force shall be measured with the safety belt assembly fitted to a manikin as per the dynamic test prescribed in para 5.6.2 as shown in Annexure-11. The strap tension shall be measured at the point of contact with (but just clear of) the manikin while the strap is being retracted at an approximate rate of 0.6 m/min. 5.5 Tests on Straps 5.5.1 Test of Breaking Strength of Strap (Static Test) 5.5.1.1 The test shall be carried out each time on two new samples of strap of sufficient length, conditioned in conformity with the appropriate provisions of para 5.5.2. 5.5.1.2 Each strap shall be gripped between the clamps of a tensile testing machine. The clamps shall be so designed as to avoid breakage of the strap at or near the point of contact with the clamps. The speed of traverse shall be about 100 mm/min. The free length of the specimen between the clamps of the machine at the start of the test shall be 200 mm ±', 'AIS-001 (Part 1) (Rev.1) : 2011 I AUTOMOTIVE INDUSTRY STANDARD Automotive Vehicles – Approval of Devices for Indirect Vision Intended for use on M, N Category and L Category with Bodywork Vehicles – Specification (Revision 1) PRINTED BY THE AUTOMOTIVE RESEARCH ASSOCIATION OF INDIA P.B. NO. 832, PUNE 411 004 ON BEHALF OF AUTOMOTIVE INDUSTRY STANDARDS COMMITTEE UNDER CENTRAL MOTOR VEHICLE RULES – TECHNICAL STANDING COMMITTEE SET-UP BY MINISTRY OF ROAD TRANSPORT & HIGHWAYS (DEPARTMENT OF ROAD TRANSPORT & HIGHWAYS) GOVERNMENT OF INDIA May 2011 AIS-001 (Part 1) (Rev.1) : 2011 II Status chart of the standard to be used by the purchaser for updating the record Sr. No. Corrigenda. Amendment Revision Date Remark Misc. General remarks : AIS-001 (Part 1) (Rev.1) : 2011 III INTRODUCTION 0.0 The Government of India felt the need for a permanent agency to expedite the publication of standards and development of test facilities in parallel when the work on the preparation of the standards is going on, as the development of improved safety critical parts can be undertaken only after the publication of the standard and commissioning of test facilities. To this end, the erstwhile Ministry of Surface Transport (MOST) has constituted a permanent Automotive Industry Standards Committee (AISC) vide order No. RT-11028/11/97-MVL dated September 15, 1997. The standards prepared by AISC will be approved by the permanent CMVR Technical Standing Committee (CTSC). After approval, the Automotive Research Association of India, (ARAI), Pune, being the Secretariat of the AIS Committee, has published this standard. For better dissemination of this information ARAI may publish this document on their web site. 0.1 Accordingly AIS-001 covering mandatory requirements regarding performance of rear view mirrors devices has been published in 2001 and has been implemented thereafter in 2003. 0.2 With technological developments in automotive vehicles rear view mirrors, AIS-001 was taken up for revision and now is prepared in two parts. This part covers the requirements for approval of devices for indirect vision for use on M, N, category and L category vehicles with bodywork vehicles- specification. 0.3 This part is based on the following ECE Regulation ECE R 46, Rev. 3, Supplement 4 to the 02 series of amendment (Date of entry into force 22 July 2009). Uniform Provisions Concerning the Approval of Devices for Indirect Vision and of Motor Vehicles with regard to the Installation of these Devices 0.4 While preparing this standard attempts have been made to align with the above ECE regulation. However, certain changes were necessary in the Indian context. 0.5 The following standards contain provisions, which through reference in this text constitute provisions of the standard. AIS-002 (Part 1) (Rev.1):2011 Automotive Vehicles – Devices for indirect Vision intended for use on L category with bodywork vehicles, M and N category -Installation requirements AIS-037 Procedure for Type Approval and Establishing Conformity of Production for Safety Critical Components. AIS-053 Automotive Vehicles – Types – Terminology AIS-001 (Part 1) (Rev.1) : 2011 IV IS 13942:1994 Automotive vehicles - External projections - Performance requirements ISO 15008:2003', 'partly or wholly encloses the driver – Installation requirements AIS-001 (Part 2) (Rev.1): 2011 III AIS-037 Procedure for Type Approval and Establishing Conformity of Production for Safety Critical Components. AIS-053 Automotive Vehicles – Types – Terminology 0.6 The composition of AIS panel and AIS Committee responsible for preparation of this standard is given in Annex H and Annex J respectively. AIS-001 (Part 2) (Rev.1): 2011 IV Automotive Vehicles – Approval of Rear View Mirrors Intended for use on L Category Vehicles without Bodywork Partly or Wholly Encloses the Driver - Specification Para. No. Contents Page No. 1. Scope 1/14 2. Definitions 1/14 3. Application for approval 2/14 4. Marking 2/14 5. Approval 2/14 6. General requirements 2/14 7. Special specifications 3/14 8. Tests 3/14 9. Conformity of production 6/14 10. Penalties for non Conformity of Production 7/14 11. Extension of type approval 7/14 12. to 21. Reserved 7/14 22. Transitional provision 7/14 23. Establishing compliance of “E”/“e” approved rear view mirrors to this standard 8/14 24. Amendments to ECE regulations after the level described in 0.3 of introduction 8/14 List of Annexes Annex A Reserved 9/14 Annex B Reserved 9/14 Annex C Reserved 9/14 Annex D Reserved 9/14 Annex E Reserved 9/14 Annex F Reserved 9/14 Annex G Control of the conformity of production for rear view mirrors. 10/14 AIS-001 (Part 2) (Rev.1): 2011 1/14 Automotive Vehicles – Approval of Rear View Mirrors Intended for use on L Category Vehicles without Bodywork Partly or Wholly Encloses the Driver – Specification 1.0 SCOPE This standard applies, 1.1 to rear-view mirrors intended to be installed on vehicles of categories L, as defined in AIS-053, without bodywork partly or wholly encloses the driver. Note : The permission to use rear view mirrors covered by this standard are governed by requirements specified by the standard for installation of requirements of that category of vehicles. 1.2 Reserved 2. DEFINITIONS For the purposes of this standard: 2.1. ""Rear-view mirror"" means any device intended to give a clear view to the rear; 2.2. ""Rear-view mirror type"" means devices which do not differ in respect of the following main characteristics: 2.2.1 The dimensions and radius of curvature of the rear-view mirror reflecting surface, 2.2.2. The design, shape or materials of the rear-view mirrors, including the connection with the vehicle; 2.3. ""Class of rear-view mirrors"" means all devices having one or several features or functions in common. The rear-view mirrors mentioned in this standard are grouped in Class ""L"". 2.4. ""r"" is as defined in 2.1.1.5 of Part 1 of this standard. 2.5 ""Principal radii of curvature at one point obtained on the reflecting surface (ri) and (r\'i)"" means the values obtained using the apparatus defined in Annex G of Part 1 of this standard, measured on the arc of the reflecting surface contained in a plane parallel to the greatest dimension of the mirror and passing through its centre and on the arc perpendicular to it; 2.6 ""Radius of curvature at one point on the reflecting surface (rp)""', ""units and associated wiring harness predominantly towards the middle of the vehicle, a reference point may be established based on either the right side surface or the left side surface of the vehicle. This reference point shall be at the midpoint of the vehicle's length or at one point along the side of the vehicle chosen by the manufacturer in conjunction with the Test Agency after considering the distribution of electronic systems and the layout of any wiring harness. Such testing may only take place if the physical construction of the chamber permits. The antenna location must be noted in the test report. 38/60 AIS-004 (Part 3) ANNEX 4 – APPENDIX 1 Figure 1 39/60 AIS-004 (Part 3) Figure 2 40/60 AIS-004 (Part 3) Figure 3 41/60 AIS-004 (Part 3) ANNEX 5 (See 5.5.1) METHOD OF MEASUREMENT OF RADIATED BROADBAND ELECTROMAGNETIC EMISSIONS FROM ELECTRICAL/ELECTRONIC SUB-ASSEMBLIES 1. GENERAL 1.1. The test method described in this annex may be applied to ESAs which may be subsequently fitted to vehicles, which comply with Annex 2. 1.2. Test method This test is intended to measure broadband electromagnetic emissions from ESAs (e.g. ignition systems, electric motor, etc.). If not otherwise stated in this annex the test shall be performed according CISPR 25 (second edition 2002). 2. ESA STATE DURING TESTS 2.1. The ESA under test shall be in normal operation mode, preferably in maximum load. 3. TEST ARRANGEMENTS 3.1. The test shall be performed according to CISPR 25 (second edition 2002) clause 6.4. - ALSE method. 3.2. Alternative measuring location As an alternative to an absorber lined shielded enclosure (ALSE) an open area test site (OATS), which complies with the requirements of CISPR 16-1 (second edition 2002) may be used (see Appendix 1 of this annex). 3.3. Ambient To ensure that there is no extraneous noise or signal of a magnitude sufficient to affect materially the measurement, measurements shall be taken before or after the main test. In this measurement, the extraneous noise or signal shall be at least 6 dB below the limits of interference given in paragraph 5.5.2.1 of this standard, except for intentional narrowband ambient transmissions. 4. TEST REQUIREMENTS 4.1. The limits apply throughout the frequency range 30 to 1,000 MHz for measurements performed in a semi anechoic chamber or an outdoor test site. 42/60 AIS-004 (Part 3) 4.2. Measurements can be performed with either quasi-peak or peak detectors. The limits given in paragraphs 5.2 and 5.5 of this standard are for quasi-peak detectors. If peak detectors are used a correction factor of 20 dB as defined in CISPR 12 (fifth edition 2001) shall be applied. 4.3. Measurements The Test Agency shall perform the test at the intervals specified in the CISPR 25 (second edition 2002) standard throughout the frequency range 30 to 1,000 MHz. Alternatively, if the manufacturer provides measurement data for the whole frequency band from a test laboratory accredited to the applicable parts of ISO 17025 (first edition 1999) and recognized by the Test Agency, the Test Agency may"", 'kept in position as shown in Figure 2. 8.3.2. The test load shall be 25 kg applied for one minute. AIS-001 (Part 2) (Rev.1): 2011 6/14 Figure 2 Example of bending test apparatus for rear view mirror holder 8.4. Results of the tests 8.4.1. Results of the test prescribed in 8.2 shall be as specified in 6.1.3.3.1, 6.1.3.3.3, 6.1.3.3.3.1 and 6.1.3.3.3.2 of Part 1 of this standard. 8.4.2 Results of the test prescribed in 8.3 shall be as specified in 6.1.3.3.3, 6.1.3.3.3.1 and 6.1.3.3.3.2 of Part 1 of this standard. 9. CONFORMITY OF PRODUCTION 9.1 Any rear-view mirror approved pursuant to this standard shall be so manufactured as to conform to the type approved by meeting the requirements set out in 6, 7 and 8 this standard. 9.2 The manufacturer shall ensure that for each type of rear-view mirror at least the tests prescribed in Annex G to this standard are carried out. 9.3 Verification of the Conformity of Production procedure by the testing agencies shall be as per AIS-037. 9.4 The normal frequency of these verifications shall be once every two years. 9.5 During the verification of Conformity of productions, the following tests may be conducted by the testing Agency 9.5.1 Reflecting surface requirements as per 7.2.2 9.5.2 Impact test pursuant to the requirements of 8.2. AIS-001 (Part 2) (Rev.1): 2011 7/14 10. PENALTIES FOR NON-CONFORMITY OF PRODUCTION Shall be as prescribed in AIS-037. EXTENSION OF TYPE APPROVAL. Procedure shall be as described in 7.0 of Part 1 of this standard. 12. to 21 Reserved 22. 22.1 TRANSITIONAL PROVISION At the request of the applicant, type approval for rear view mirror for compliance to AIS-001 (Part 2) (Rev.1):2011, shall be granted by testing agencies from 22nd February 2011 (date of adoption in CMVR-TSC). Such type approvals shall be deemed to be compliance to Class VI rear view mirrors of AIS-001:2001. 22.2 At the request of applicant, type approval of Class VI rear view mirrors compliance to AIS-001:2001 shall be granted up to the notified date of implementation of AIS-001 (Part 2) (Rev.1):2011. 22.3 Type approvals issued for compliance to Class VI rear view mirrors other than flat mirrors of AIS-001 : 2001 shall be extended to approval of AIS-001 (Part 2) (Rev.1):2011 subject to satisfactory compliance of the following: 22.3.1 Marking as per 4.0 22.3.2 In case of “E/e” approved devices, requirements specified in 23. Note: Additional verification for the above need not be carried out, if compliance to the above requirements has already been established during the type approval as per of AIS-001:2001 22.4 Extension of Approvals for engineering and administrative changes: 22.4.1 In the case of 22.1, extensions shall be granted subject to the conditions of AIS-001 (Part 2) (Rev.1):2011. Such extensions shall be deemed to be compliance to AIS-001:2001. 22.4.2 In the case of 22.2, extensions shall be granted subject to conditions of AIS-001:2001 till the notified date of implementation of AIS-001 (Part 2) (Rev.1):2011. 22.5 Type approvals for compliance to AIS-037, already been granted, shall']","['16', '0', '1', '23', '5']",['57'],"['document16.pdf', 'document4.pdf', 'document6.pdf', 'document14.pdf', 'document6.pdf']",easy,factual,1.0,1.0
Under what conditions can the capacitive coupling clamp be used instead of the Coupling/Decoupling Network in the test setup?,When the Coupling/Decoupling Network cannot be used on AC or DC power lines,"According to the provided documents, the capacitive coupling clamp can be used instead of the Coupling/Decoupling Network in the test setup when the conditions are not specified explicitly in the text. However, it is mentioned that the use of the capacitive coupling clamp is part of the immunity tests performed according to ISO 11452-4 (third edition 2005), and it can be used as an alternative method for testing the ESA while installed in the vehicle.

Source: document14.pdf, pages 59-60 (Bulk current injection testing)","['in paragraph 6.2. of IEC 61000-4-4. When the Coupling/Decoupling Network cannot be used on AC or DC power lines, the capacitive coupling clamp defined in paragraph 6.3. of IEC 61000-4-4 can be used. 4.0 TEST SET-UP 4.1 The ESA test setup is based on the laboratory type set-up as described in paragraph 7.2. of IEC 61000-4-4. 4.2 The ESA shall be placed directly on the ground plane. 4.3 The Test Agency shall perform the test as specified in paragraph 6.15.2.1. of this Standard. Alternatively, if the manufacturer provides measurement from a test laboratory accredited to the applicable parts of ISO 17025 and recognized by the Type Approval Authority, the Test Agency may choose not to perform the test to confirm that the ESA meets the requirements of this annex. 5.0 GENERATION OF REQUIRED TEST LEVEL 5.1 Test methodology 5.1.1 The test method according to IEC 61000-4-4 shall be used to establish the test level requirements. 5.1.2 Test phase The ESA shall be positioned on the ground plane. The Electrical Fast Transient/Burst (EFT/B) shall be applied on the ESA on the AC/DC power lines in common modes by using CDN as described in Figure 1 of Appendix 1 to this annex. The test setup shall be noted in the test report. AIS-004 (Part 3) (Rev.1) 138/149 ANNEX 19 – APPENDIX 1 Figure 1 ESA in configuration ""REESS charging mode coupled to the power grid"" AIS-004 (Part 3) (Rev.1) 139/149 ANNEX 20 METHOD OF TESTING FOR IMMUNITY OF ESAs TO SURGES CONDUCTED ALONG AC AND DC POWER LINES (See 6.16) 1.0 GENERAL 1.1 The test method described in this annex shall only be applied to ESAs. This method applies only to ESAs in configuration ""REESS charging mode coupled to the power grid"". 1.2 Test method This test is intended to demonstrate the immunity of the ESA. The ESA shall be subject to surges conducted along AC and DC power lines of the ESA as described in this annex. The ESA shall be monitored during the tests. If not otherwise stated in this annex the test shall be performed according to IEC 61000-4-5. 2.0 ESA state during tests in configuration ""REESS in charging mode coupled to the power grid"" 2.1 The ESA shall be in charging mode 2.1.2 Basic ESA conditions The paragraph defines minimum test conditions (as far as applicable) and failures criteria for ESA immunity tests. REESS charging mode"" ESA test conditions Failure criteria ESA shall be in configuration ""REESS charging mode coupled to the Power grid"". The state of charge (SOC) of the traction battery shall be kept between 20 per cent and 80 per cent of the maximum SOC during the whole time duration of the measurement (this may lead to the measurement being split into different sub-bands with the need to discharge the vehicle’s traction battery before starting the next sub-bands). If the current consumption can be adjusted, then the current shall be set to at least 20 per cent of its nominal value. Incorrect charging condition (e.g.', 'per cent of its nominal value. Vehicle sets in motion AIS-004 (Part 3) (Rev.1) 117/149 2.1.3 All other equipment which can be switched on permanently by the driver or passenger should be OFF. 2.2 Only non-perturbing equipment shall be used while monitoring the vehicle. The vehicle exterior and the passenger compartment shall be monitored to determine whether the requirements of this annex are met (e.g. by using (a) video camera(s), a microphone, etc.). 3.0 TEST EQUIPMENT 3.1 The test equipment is composed of a reference ground plane (a shielded room is not required), a transient/burst generator, Coupling/Decoupling Network (CDN) and capacitive coupling clamp 3.2 The transient/burst generator shall meet the condition defined in paragraph 6.1. of IEC 61000-4-4. 3.3 The Coupling/Decoupling Network shall meet the condition defined in paragraph 6.2. of IEC 61000-4-4. When the Coupling/Decoupling Network cannot be used on AC or DC power lines, the capacitive coupling clamp defined in paragraph 6.3. of IEC 61000-4-4 can be used. 4.0 TEST SETUP 4.1 The vehicle test setup is based on the laboratory type setup as described in paragraph 7.2. of IEC 61000-4-4. 4.2 The vehicle shall be placed directly on the ground plane. 4.3 The Test Agency shall perform the test as specified in paragraph 6.8.2.1. of this Standard. Alternatively, if the manufacturer provides measurement from a test laboratory accredited to the applicable parts of ISO 17025 and recognized by the Type Approval Authority, the Test Agency may choose not to perform the test to confirm that the vehicle meets the requirements of this annex. 5.0 GENERATION OF REQUIRED TEST LEVEL 5.1 Test methodology 5.1.1 The test method according to IEC 61000-4-4 shall be used to establish the test level requirements. 5.1.2 Test phase The vehicle shall be positioned on the ground plane. The electrical fast transient/burst (EFT/B) shall be applied on the vehicle on the AC/DC power lines in common modes by using CDN as described in Figure 1 of Appendix 1 to this annex. The test set-up shall be noted in the test report. AIS-004 (Part 3) (Rev.1) 118/149 ANNEX 13 - APPENDIX 1 Figure 1 Vehicle in configuration ""REESS charging mode"" coupled to the power grid coupling AIS-004 (Part 3) (Rev.1) 119/149 ANNEX 14 METHOD OF TESTING FOR IMMUNITY OF VEHICLES TO SURGES CONDUCTED ALONG AC AND DC POWER LINES (See 6.9) 1.0 GENERAL 1.1 The test method described in this annex shall only be applied to vehicles. This method concerns only the configuration of the vehicle with ""REESS charging mode coupled to the power grid"". 1.2 Test method This test is intended to demonstrate the immunity of the vehicle electronic systems. The vehicle shall be subject to surges conducted along AC and DC power lines of the vehicle as described in this annex. The vehicle shall be monitored during the tests. If not otherwise stated in this annex the test shall be performed according to I EC 61000-4-5. 2.0 VEHICLE STATE DURING TESTS IN CONFIGURATION ""REESS IN CHARGING MODE COUPLED TO THE POWER GRID"" 2.1', 'ESA fails the tests defined in this annex, it must be verified as having failed under the relevant test conditions and not as a result of the generation of uncontrolled fields. 4.0 SPECIFIC TEST REQUIREMENTS 4.1 Absorber chamber test 4.1.1 Test method This test method allows the testing of vehicle electrical/electronic systems by exposing an ESA to electromagnetic radiation generated by an antenna. 4.1.2 Test methodology The ""substitution method"" shall be used to establish the test field conditions according to ISO 11452-2, second edition 2004. The test shall be performed with vertical polarization 4.1.2.1 For ESAs in configuration ""REESS charging mode coupled to the power grid"" the test arrangement shall be according to Appendix 3 to this annex. 4.1.2.1.1 The shielding configuration shall be according to the vehicle series configuration. Generally, all shielded HV parts shall be properly connected with low impedance to ground (e. g. AN, cables, connectors etc.). ESAs and loads shall be connected to ground. The external HV power supply shall be connected via feed-through-filtering. 4.1.2.1.2 Unless otherwise specified the length of the LV harness and the HV harness parallel to the front edge of the ground plane shall be 1,500 mm (±75 mm). The total length of the test harness including the connector shall be 1,700 mm (+300/-0 mm). The distance between the LV harness and the HV harness shall be 100 mm (+100/-0 mm). 4.1.2.1.3 All of the harnesses shall be placed on a non-conductive, low relative permittivity material (εr ≤ 1,4), at 50 mm (±5 mm) above the ground plane. 4.1.2.1.4 Shielded supply lines for HV+ and HV- line and three phase lines may be coaxial cables or in a common shield depending on the used plug system. AIS-004 (Part 3) (Rev.1) 90/149 The original HV-harness from the vehicle may be used optionally. 4.1.2.1.5 Unless otherwise specified, the ESA case shall be connected to the ground plane either directly or via defined impedance. 4.1.2.1.6 For onboard chargers, the AC/DC power lines shall be placed the furthest from the antenna (behind LV and HV harness). The distance between the AC/DC power lines and the closest harness (LV or HV) shall be 100 mm (+100/-0 mm). 4.1.2.1.7 Unless otherwise specified, the configuration with the LV harness closer to the antenna shall be tested. 4.2 TEM cell testing (see Appendix 2 to this annex) 4.2.1 Test method The TEM (transverse electromagnetic mode) cell generates homogeneous fields between the internal conductor (septum) and housing (ground plane). 4.2.2 Test methodology The test shall be performed according to ISO 11452-3, third edition 2001. Depending on the ESA to be tested the Test Agency shall choose the method of maximum field coupling to the ESA or to the wiring harness inside the TEM-cell. 4.3 Bulk current injection testing 4.3.1 Test method This is a method of carrying out immunity tests by inducing currents directly into a wiring harness using a current injection probe. 4.3.2 Test methodology The test shall be performed according to ISO 11452-4, third edition 2005 on a test', 'Agency shall chose the method of maximum field coupling to the ESA or to the wiring harness inside the TEM-cell. 4.3. Bulk current injection testing 4.3.1. Test method This is a method of carrying out immunity tests by inducing currents directly into a wiring harness using a current injection probe. 4.3.2. Test methodology The test shall be performed according to ISO 11452-4, third edition 2005 on a test bench. As an alternative the ESA may be tested while installed in the vehicle according to ISO 11451-4 (first edition 1995) with the following characteristics: (a) the injection probe shall be positioned in 150 mm distance to the ESA to be tested; (b) the reference method shall be used to calculate injected currents from forward power; (c) the frequency range of the method is limited by the injection probe specification. 4.4. Stripline testing 4.4.1. Test method This test method consists of subjecting the wiring harness connecting the components in an ESA to specified field strengths. 4.4.2. Test methodology The test shall be performed according ISO 11452-5, second edition 2002. 49/60 AIS-004 (Part 3) 4.5. 800 mm stripline testing 4.5.1. Test method The stripline consists of two parallel metallic plates separated by 800 mm. Equipment under test is positioned centrally between the plates and subjected to an electromagnetic field (see Appendix 1 to this annex). This method can test complete electronic systems including sensors and actuators as well as the controller and wiring loom. It is suitable for apparatus whose largest dimension is less than one –third of the plate separation. 4.5.2. Test methodology 4.5.2.1. Positioning of stripline The stripline shall be housed in a screened room (to prevent external emissions) and positioned 2 m away from walls and any metallic enclosure to prevent electromagnetic reflections. RF absorber material may be used to damp these reflections. The stripline shall be placed on non-conducting supports at least 0.4 m above the floor. 4.5.2.2. Calibration of the stripline A field-measuring probe shall be positioned within the central one-third of the longitudinal, vertical and transverse dimensions of the space between the parallel plates with the system under test absent. The associated measuring equipment shall be sited outside the screen room. At each desired test frequency, a level of power shall be fed into the stripline to produce the required field strength at the antenna. This level of forward power, or another parameter directly related to the forward power required to define the field, shall be used for type approval tests unless changes occur in the facilities or equipment, which necessitate this procedure being repeated. 4.5.2.3. Installation of the ESA under test The main control unit shall be positioned within the central one third of the longitudinal, vertical and transverse dimensions of the space between the parallel plates. It shall be supported on a stand made from non-conducting material. 4.5.2.4. Main wiring loom and sensor/actuator cables The main wiring loom and any sensor/actuator cables shall rise vertically from the control unit to the top ground plate (this', 'STRENGTH 5.1 Test methodology 5.1.1 The substitution method according to ISO 11451-1, third edition 2005 shall be used to establish the test field conditions. 5.1.2 Calibration For TLS one field probe at the facility reference point shall be used. For antennas four field probes at the facility reference line shall be used. 5.1.3 Test phase The vehicle shall be positioned with the centre line of the vehicle on the facility reference point or line. The vehicle shall normally face a fixed antenna. However, where the electronic control units and the associated wiring harness are predominantly in the rear of the vehicle, the test should normally be carried out with the vehicle facing away from the antenna. In the case of long vehicles (i.e. excluding vehicles of categories L, M1 and N1), which have electronic control units and associated wiring harness predominantly towards the middle of the vehicle, a reference point may be established based on either the right side surface or the left side surface of the vehicle. This reference point shall be at the midpoint of the vehicle\'s length or at one point along the side of the vehicle chosen by the manufacturer in conjunction with the Test Agency after considering the distribution of electronic systems and the layout of any wiring harness. Such testing may only take place if the physical construction of the chamber permits. The antenna location must be noted in the test report. AIS-004 (Part 3) (Rev.1) 72/149 ANNEX 4 – APPENDIX 1 Figure 1 Figure 2 AIS-004 (Part 3) (Rev.1) 73/149 Figure 3 AIS-004 (Part 3) (Rev.1) 74/149 Figure 4 Vehicle in configuration ""REESS charging mode coupled to the power grid"" Example of test set-up for vehicle with plug located on the vehicle side (AC power charging without communication) Figure 4a – Front View Figure 4b – Top View AIS-004 (Part 3) (Rev.1) 75/149 Example of test set-up for vehicle with plug located front / rear of vehicle (AC power charging without communication) Figure 4c – Front View Figure 4d – Top View AIS-004 (Part 3) (Rev.1) 76/149 Example of test set-up for vehicle with plug located on vehicle side (AC or DC power charging with communication) Figure 4e – Front View Figure 4f – Top View AIS-004 (Part 3) (Rev.1) 77/149 Example of test set-up for vehicle with plug located front / rear of the vehicle (AC or DC power charging with communication) Figure 4g – Front View Figure 4h – Top View AIS-004 (Part 3) (Rev.1) 78/149 ANNEX 5 (See 5.5.1 and 6.10) METHOD OF MEASUREMENT OF RADIATED BROADBAND ELECTROMAGNETIC EMISSIONS FROM ELECTRICAL/ELECTRONIC SUB-ASSEMBLIES 1.0 GENERAL 1.1 The test method described in this annex may be applied to ESAs which may be subsequently fitted to vehicles, which comply with Annex 2. 1.2 This method concerns both kinds of ESA: (a) Other ESAs than involved in ""REESS charging mode coupled to the power grid"". (b) ESAs involved in ""REESS charging mode coupled to the power grid"". Test method This test is intended to']","['66', '57', '46', '27', '39']",['57'],"['document15.pdf', 'document15.pdf', 'document15.pdf', 'document14.pdf', 'document15.pdf']",easy,factual,0.8,0.85
"What is the minimum period for which all seat assemblies should remain unloaded before installation of the 3-D H machine, according to the ARAI Automotive Industry Standard?",30 min,"The minimum period for which all seat assemblies should remain unloaded before installation of the 3-D H machine is 30 minutes, according to the ARAI Automotive Industry Standard (AIS) Part 1 (Rev.2):2023. This information can be found in the provided excerpts from the standard on pages 31 and 34 of document8.pdf.","['its fully rearward position. H-4.15. If a re-run of the installation of the 3-D H machine is desired, the seat assembly should remain unloaded for a minimum period of 30 min prior to the re-run. The 3-D H machine should not be left loaded on the seat assembly longer than the time required to perform the test. H-4.16. If the seats in the same row are regarded as similar (bench seat, identical seats, etc.) only one ""H"" point and one ""actual torso angle"" shall be determined for each row of seats, the 3-D H machine described in Annex HA being seated in a place regarded as representative for the row. This place shall be: H-4.16.1. in the case of the front row, the driver\'s seat; H-4.16.2 in the case of the rear row or rows, an outer seat. AIS-002 (Part 1) (Rev.2):2023 37/65 ANNEX HA (See H-2.2) DESCRIPTION OF THE THREE DIMENSIONAL ""H"" POINT MACHINE */ (3-D H machine) HA-1. Back and seat pans The back and seat pans are constructed of reinforced plastic and metal; they simulate the human torso and thigh and are mechanically hinged at the ""H"" point. A quadrant is fastened to the probe hinged at the ""H"" point to measure the actual torso angle. An adjustable thigh bar, attached to the seat pan, establishes the thigh centreline and serves as a baseline for the hip angle quadrant. HA-2. Body and leg elements Lower leg segments are connected to the seat pan assembly at the T-bar joining the knees, which is a lateral extension of the adjustable thigh bar. Quadrants are incorporated in the lower leg segments to measure knee angles. Shoe and foot assemblies are calibrated to measure the foot angle. Two spirit levels orient the device in space. Body element weights are placed at the corresponding centres of gravity to provide seat penetration equivalent to a 76 kg male. All joints of the 3-D H machine should be checked for free movement without encountering noticeable friction. (*/For details of the construction of the 3-D H machine refer to Society of Automotive Engineers (SAE), 400 Commonwealth Drive, Warrendale, Pennsylvania/15096, United States of America. The machine corresponds to that described in ISO Standard 6549-1980.) AIS-002 (Part 1) (Rev.2):2023 38/65 Figure HA-1 3-D H machine elements designation AIS-002 (Part 1) (Rev.2):2023 39/65 Figure HA-2 Dimensions of the 3-D H machine elements and load distribution AIS-002 (Part 1) (Rev.2):2023 40/65 ANNEX HB (See H-2.9) THREE-DIMENSIONAL REFERENCE SYSTEM HB-1. The three-dimensional reference system is defined by three orthogonal planes established by the vehicle manufacturer (see Figure HB-1 */) HB-2. The vehicle measuring attitude is established by positioning the vehicle on the supporting surface such that the co-ordinates of the fiducial marks correspond to the values indicated by the manufacturer. HB-3. The co-ordinates of the ""R"" point and the ""H"" point are established in relation to the fiducial marks defined by the vehicle manufacturer. Figure HB-1 Three-dimensional reference system */ The reference system corresponds to ISO standard 4130, 1978 AIS-002', 'back angle quadrant of the 3-D H machine with the probe in its fully rearward position. H-4.15. If a re-run of the installation of the 3-D H machine is desired, the seat assembly should remain unloaded for a minimum period of 30 min prior to the re-run. The 3-D H machine should not be left loaded on the seat assembly longer than the time required to perform the test. H-4.16. If the seats in the same row are regarded as similar (bench seat, identical seats, etc.) only one ""H"" point and one ""actual torso angle"" shall be determined for each row of seats, the 3-D H machine described in Annex HA being seated in a place regarded as representative for the row. This place shall be: H-4.16.1. in the case of the front row, the driver\'s seat; H-4.16.2 in the case of the rear row or rows, an outer seat. AIS-002 (Part 1)(Rev.1):2011 30/42 ANNEX HA (See H-2.2) DESCRIPTION OF THE THREE DIMENSIONAL ""H"" POINT MACHINE */ (3-D H machine) HA-1. Back and seat pans The back and seat pans are constructed of reinforced plastic and metal; they simulate the human torso and thigh and are mechanically hinged at the ""H"" point. A quadrant is fastened to the probe hinged at the ""H"" point to measure the actual torso angle. An adjustable thigh bar, attached to the seat pan, establishes the thigh centreline and serves as a baseline for the hip angle quadrant. HA-2. Body and leg elements Lower leg segments are connected to the seat pan assembly at the T-bar joining the knees, which is a lateral extension of the adjustable thigh bar. Quadrants are incorporated in the lower leg segments to measure knee angles. Shoe and foot assemblies are calibrated to measure the foot angle. Two spirit levels orient the device in space. Body element weights are placed at the corresponding centres of gravity to provide seat penetration equivalent to a 76 kg male. All joints of the 3-D H machine should be checked for free movement without encountering noticeable friction. (*/For details of the construction of the 3-D H machine refer to Society of Automotive Engineers (SAE), 400 Commonwealth Drive, Warrendale, Pennsylvania/15096, United States of America. The machine corresponds to that described in ISO Standard 6549-1980.) AIS-002 (Part 1)(Rev.1):2011 31/42 Figure HA-1 3-D H machine elements designation AIS-002 (Part 1)(Rev.1):2011 32/42 Figure HA-2 Dimensions of the 3-D H machine elements and load distribution AIS-002 (Part 1)(Rev.1):2011 33/42 ANNEX HB (See H-2.9) THREE-DIMENSIONAL REFERENCE SYSTEM HB-1. The three-dimensional reference system is defined by three orthogonal planes established by the vehicle manufacturer (see Figure HB-1 */) HB-2. The vehicle measuring attitude is established by positioning the vehicle on the supporting surface such that the co-ordinates of the fiducial marks correspond to the values indicated by the manufacturer. HB-3. The co-ordinates of the ""R"" point and the ""H"" point are established in relation to the fiducial marks defined by the vehicle manufacturer. Figure HB-1 Three-dimensional reference system ‐‐‐‐‐‐‐‐‐‐‐‐‐‐‐‐‐‐‐‐‐‐‐‐‐‐‐‐‐‐‐‐‐‐ */ The', 'back. At the manufacturer\'s request, all seat assemblies shall remain unloaded for a minimum period of 30 min prior to installation of the 3-D H machine. H-4.2. The vehicle shall be at the measuring attitude defined in H-2.11. H-4.3. The seat, if it is adjustable, shall be adjusted first to the rearmost normal driving or riding position, as indicated by the vehicle manufacturer, taking into consideration only the longitudinal adjustment of the seat, excluding seat travel used for purposes other than normal driving or riding positions. Where other modes of seat adjustment exist (vertical, angular, seat-back, etc.) these will be then adjusted to the position specified by the vehicle manufacturer. For suspension seats, the vertical position shall be rigidly fixed corresponding to a normal driving position as specified by the manufacturer. H-4.4. The area of the seating position contacted by the 3-D H machine shall be covered by a muslin cotton, of sufficient size and appropriate texture, described as a plain cotton fabric having 18.9 threads per/cm2 and weighing 0.228 kg/m2 or knitted or non-woven fabric having equivalent characteristics. If test is run on a seat outside the vehicle, the floor on which the seat is placed shall have the same essential characteristics e.g. tilt angle, height difference with a seat mounting, surface texture, etc, as the floor of the vehicle in which the seat is intended to be used. AIS-002 (Part 1) (Rev.2):2023 34/65 H-4.5. Place the seat and back assembly of the 3-D H machine so that the centreplane of the occupant (C/LO) coincides with the centreplane of the 3-D H machine. At the manufacturer\'s request, the 3-D H machine may be moved inboard with respect to the C/LO if the 3-D H machine is located so far outboard that the seat edge will not permit levelling of the 3-D H machine. H-4.6. Attach the foot and lower leg assemblies to the seat pan assembly, either individually or by using the T-bar and lower leg assembly. A line through the ""H"" point sight buttons shall be parallel to the ground and perpendicular to the longitudinal centre-plane of the seat. H-4.7. Adjust the feet and leg positions of the 3-D H machine as follows: H-4.7.1. Designated seating position: driver and outside front passenger H-4.7.1.1. Both feet and leg assemblies shall be moved forward in such a way that the feet take up natural positions on the floor, between the operating pedals if necessary. Where possible the left foot shall be located approximately the same distance to the left of the centreplane of the 3-D H machine as the right foot is to the right. The spirit level verifying the transverse orientation of the 3-D H machine is brought to the horizontal by readjustment of the seat pan if necessary, or by adjusting the leg and foot assemblies towards the rear. The line passing through the ""H"" point sight buttons shall be maintained perpendicular to the longitudinal centreplane of the seat. H-4.7.1.2. If it is not possible for the left', 'shall sit on the seat twice for one minute to flex the cushion and back. At the manufacturer\'s request, all seat assemblies shall remain unloaded for a minimum period of 30 min prior to installation of the 3-D H machine. H-4.2. The vehicle shall be at the measuring attitude defined in H-2.11. H-4.3. The seat, if it is adjustable, shall be adjusted first to the rearmost normal driving or riding position, as indicated by the vehicle manufacturer, taking into consideration only the longitudinal adjustment of the seat, excluding seat travel used for purposes other than normal driving or riding positions. Where other modes of seat adjustment exist (vertical, angular, seat-back, etc.) these will be then adjusted to the position specified by the vehicle manufacturer. For suspension seats, the vertical position shall be rigidly fixed corresponding to a normal driving position as specified by the manufacturer. H-4.4. The area of the seating position contacted by the 3-D H machine shall be covered by a muslin cotton, of sufficient size and appropriate texture, described as a plain cotton fabric having 18.9 threads per/cm2 and weighing 0.228 kg/m2 or knitted or non-woven fabric having equivalent characteristics. If test is run on a seat outside the vehicle, the floor on which the seat is placed shall have the same essential characteristics e.g. tilt angle, height difference with a seat mounting, surface texture, etc, as the floor of the vehicle in which the seat is intended to be used. AIS-002 (Part 1)(Rev.1):2011 27/42 H-4.5. Place the seat and back assembly of the 3-D H machine so that the centreplane of the occupant (C/LO) coincides with the centreplane of the 3-D H machine. At the manufacturer\'s request, the 3-D H machine may be moved inboard with respect to the C/LO if the 3-D H machine is located so far outboard that the seat edge will not permit levelling of the 3-D H machine. H-4.6. Attach the foot and lower leg assemblies to the seat pan assembly, either individually or by using the T-bar and lower leg assembly. A line through the ""H"" point sight buttons shall be parallel to the ground and perpendicular to the longitudinal centre-plane of the seat. H-4.7. Adjust the feet and leg positions of the 3-D H machine as follows: H-4.7.1. Designated seating position: driver and outside front passenger H-4.7.1.1. Both feet and leg assemblies shall be moved forward in such a way that the feet take up natural positions on the floor, between the operating pedals if necessary. Where possible the left foot shall be located approximately the same distance to the left of the centreplane of the 3-D H machine as the right foot is to the right. The spirit level verifying the transverse orientation of the 3-D H machine is brought to the horizontal by readjustment of the seat pan if necessary, or by adjusting the leg and foot assemblies towards the rear. The line passing through the ""H"" point sight buttons shall be maintained perpendicular to the longitudinal', 'and then, alternately, the eight torso weights. Maintain the 3-D H machine level. H-4.12. Tilt the back pan forward to release the tension on the seat-back. Rock the 3-D H machine from side to side through 10° arc (5° to each side of the vertical centreplane) for three complete cycles to release any accumulated friction between the 3-D H machine and the seat. During the rocking action, the T-bar of the 3-D H machine may tend to diverge from the specified horizontal and vertical alignment. The T-bar shall therefore be restrained by applying an appropriate lateral load during the rocking motions. Care shall be exercised in holding the T-bar and rocking the 3-D H machine to ensure that no inadvertent exterior loads are applied in a vertical or fore-and-aft direction. The feet of the 3-D H machine are not to be restrained or held during this step. If the feet change position, they should be allowed to remain in that attitude for the moment. Carefully return the back pan to the seat-back and check the two spirit levels for zero position. If any movement of the feet has occurred during the rocking operation of the 3-D H machine, they shall be repositioned as follows: Alternately, lift each foot off the floor the minimum necessary amount until no additional foot movement is obtained. During this lifting, the feet are to be free to rotate; and no forward or lateral loads are to be applied. When each foot is placed back in the down position, the heel is to be in contact with the structure designed for this; Check the lateral spirit level for zero position; if necessary, apply a lateral load to the top of the back pan sufficient to level the 3-D H machine\'s seat pan on the seat. AIS-002 (Part 1)(Rev.1):2011 29/42 H-4.13. Holding the T-bar to prevent the 3-D H machine from sliding forward on the seat cushion, proceed as follows: (a) return the back pan to the seat back; (b) alternately apply and release a horizontal rearward load, not to exceed 25 N, to the back angle bar at a height approximately at the centre of the torso weights until the hip angle quadrant indicates that a stable position has been reached after load release. Care shall be exercised to ensure that no exterior downward or lateral loads are applied to the 3-D H machine. If another level adjustment of the 3-D H machine is necessary, rotate the back pan forward, re-level, and repeat the procedure from H-4.12. H-4.14. Take all measurements: H-4.14.1. The co-ordinates of the ""H"" point are measured with respect to the three-dimensional reference system; H-4.14.2. The actual torso angle is read at the back angle quadrant of the 3-D H machine with the probe in its fully rearward position. H-4.15. If a re-run of the installation of the 3-D H machine is desired, the seat assembly should remain unloaded for a minimum period of 30 min prior to the re-run. The 3-D H']","['27', '20', '24', '17', '19']",['17'],"['document9.pdf', 'document8.pdf', 'document9.pdf', 'document8.pdf', 'document8.pdf']",easy,factual,1.0,1.0
"What should be the position of the seat, if adjustable, before measuring the area contacted by the 3-D H machine according to the ARAI Automotive Industry Standard?",Rearmost normal driving or riding position (excluding seat travel used for purposes other than normal driving or riding positions),"According to the provided documents (ARAI Automotive Industry Standard), the position of the seat, if adjustable, should be set to its fully rearward position before measuring the area contacted by the 3-D H machine. This is stated in section H-4.12 of document ""document9.pdf"" on page 45. The 3-D H machine is then installed on the seat and adjusted accordingly.","['shall sit on the seat twice for one minute to flex the cushion and back. At the manufacturer\'s request, all seat assemblies shall remain unloaded for a minimum period of 30 min prior to installation of the 3-D H machine. H-4.2. The vehicle shall be at the measuring attitude defined in H-2.11. H-4.3. The seat, if it is adjustable, shall be adjusted first to the rearmost normal driving or riding position, as indicated by the vehicle manufacturer, taking into consideration only the longitudinal adjustment of the seat, excluding seat travel used for purposes other than normal driving or riding positions. Where other modes of seat adjustment exist (vertical, angular, seat-back, etc.) these will be then adjusted to the position specified by the vehicle manufacturer. For suspension seats, the vertical position shall be rigidly fixed corresponding to a normal driving position as specified by the manufacturer. H-4.4. The area of the seating position contacted by the 3-D H machine shall be covered by a muslin cotton, of sufficient size and appropriate texture, described as a plain cotton fabric having 18.9 threads per/cm2 and weighing 0.228 kg/m2 or knitted or non-woven fabric having equivalent characteristics. If test is run on a seat outside the vehicle, the floor on which the seat is placed shall have the same essential characteristics e.g. tilt angle, height difference with a seat mounting, surface texture, etc, as the floor of the vehicle in which the seat is intended to be used. AIS-002 (Part 1)(Rev.1):2011 27/42 H-4.5. Place the seat and back assembly of the 3-D H machine so that the centreplane of the occupant (C/LO) coincides with the centreplane of the 3-D H machine. At the manufacturer\'s request, the 3-D H machine may be moved inboard with respect to the C/LO if the 3-D H machine is located so far outboard that the seat edge will not permit levelling of the 3-D H machine. H-4.6. Attach the foot and lower leg assemblies to the seat pan assembly, either individually or by using the T-bar and lower leg assembly. A line through the ""H"" point sight buttons shall be parallel to the ground and perpendicular to the longitudinal centre-plane of the seat. H-4.7. Adjust the feet and leg positions of the 3-D H machine as follows: H-4.7.1. Designated seating position: driver and outside front passenger H-4.7.1.1. Both feet and leg assemblies shall be moved forward in such a way that the feet take up natural positions on the floor, between the operating pedals if necessary. Where possible the left foot shall be located approximately the same distance to the left of the centreplane of the 3-D H machine as the right foot is to the right. The spirit level verifying the transverse orientation of the 3-D H machine is brought to the horizontal by readjustment of the seat pan if necessary, or by adjusting the leg and foot assemblies towards the rear. The line passing through the ""H"" point sight buttons shall be maintained perpendicular to the longitudinal', 'back. At the manufacturer\'s request, all seat assemblies shall remain unloaded for a minimum period of 30 min prior to installation of the 3-D H machine. H-4.2. The vehicle shall be at the measuring attitude defined in H-2.11. H-4.3. The seat, if it is adjustable, shall be adjusted first to the rearmost normal driving or riding position, as indicated by the vehicle manufacturer, taking into consideration only the longitudinal adjustment of the seat, excluding seat travel used for purposes other than normal driving or riding positions. Where other modes of seat adjustment exist (vertical, angular, seat-back, etc.) these will be then adjusted to the position specified by the vehicle manufacturer. For suspension seats, the vertical position shall be rigidly fixed corresponding to a normal driving position as specified by the manufacturer. H-4.4. The area of the seating position contacted by the 3-D H machine shall be covered by a muslin cotton, of sufficient size and appropriate texture, described as a plain cotton fabric having 18.9 threads per/cm2 and weighing 0.228 kg/m2 or knitted or non-woven fabric having equivalent characteristics. If test is run on a seat outside the vehicle, the floor on which the seat is placed shall have the same essential characteristics e.g. tilt angle, height difference with a seat mounting, surface texture, etc, as the floor of the vehicle in which the seat is intended to be used. AIS-002 (Part 1) (Rev.2):2023 34/65 H-4.5. Place the seat and back assembly of the 3-D H machine so that the centreplane of the occupant (C/LO) coincides with the centreplane of the 3-D H machine. At the manufacturer\'s request, the 3-D H machine may be moved inboard with respect to the C/LO if the 3-D H machine is located so far outboard that the seat edge will not permit levelling of the 3-D H machine. H-4.6. Attach the foot and lower leg assemblies to the seat pan assembly, either individually or by using the T-bar and lower leg assembly. A line through the ""H"" point sight buttons shall be parallel to the ground and perpendicular to the longitudinal centre-plane of the seat. H-4.7. Adjust the feet and leg positions of the 3-D H machine as follows: H-4.7.1. Designated seating position: driver and outside front passenger H-4.7.1.1. Both feet and leg assemblies shall be moved forward in such a way that the feet take up natural positions on the floor, between the operating pedals if necessary. Where possible the left foot shall be located approximately the same distance to the left of the centreplane of the 3-D H machine as the right foot is to the right. The spirit level verifying the transverse orientation of the 3-D H machine is brought to the horizontal by readjustment of the seat pan if necessary, or by adjusting the leg and foot assemblies towards the rear. The line passing through the ""H"" point sight buttons shall be maintained perpendicular to the longitudinal centreplane of the seat. H-4.7.1.2. If it is not possible for the left', 'level verifying the transverse orientation of the 3-D H machine is brought to the horizontal by readjustment of the seat pan if necessary, or by adjusting the leg and foot assemblies towards the rear. The line passing through the ""H"" point sight buttons shall be maintained perpendicular to the longitudinal centreplane of the seat. H-4.7.1.2. If it is not possible for the left leg be kept parallel to the right leg and is not possible for the left foot to be supported by the structure, move the left foot until it is supported. The alignment of the sight buttons shall be maintained. H-4.7.2. Designated seating position: outboard rear For rear seats or auxiliary seats, the legs are located as specified by the manufacturer. If the feet then rest on parts of the floor which are at different levels, the foot which first comes into contact with the front seat shall serve as a reference and the other foot shall be so arranged that the spirit level giving the transverse orientation of the seat of the device indicates the horizontal. H-4.7.3. Other designated seating positions: The general procedure indicated in H-4.7.1 shall be followed except that the feet shall be placed as specified by the vehicle manufacturer. H-4.8. Apply lower leg and thigh weights and level the 3-D H machine. H-4.9. Tilt the back pan forward against the forward stop and draw the 3-D H machine away from the seat-back using the T-bar. Reposition the 3-D H machine on the seat by one of the following methods: AIS-002 (Part 1)(Rev.1):2011 28/42 H-4.9.1. If the 3-D H machine tends to slide rearward, use the following procedure. Allow the 3-D H machine to slide rearward until a forward horizontal restraining load on the T-bar is no longer required, i.e. until the seat pan contacts the seat-back. If necessary, reposition the lower leg; H-4.9.2. If the 3-D H machine does not tend to slide rearward, use the following procedure. Slide the 3-D H machine rearwards by applying a horizontal rearward load to the T-bar until the seat pan contacts the seat-back (see Figure 2 of Annex HA). H-4.10 Apply a 100 + 10 N load to the back and pan assembly of the 3-D H machine at the intersection of the hip angle quadrant and the T-bar housing. The direction of load application shall be maintained along a line passing by the above intersection to a point just above the thigh bar housing (see Figure 2 of Annex HA).Then carefully return the back pan to the seat-back. Care shall be exercised throughout the remainder of the procedure to prevent the 3-D H machine from sliding forward. H-4.11. Install the right and left buttock weights and then, alternately, the eight torso weights. Maintain the 3-D H machine level. H-4.12. Tilt the back pan forward to release the tension on the seat-back. Rock the 3-D H machine from side to side through 10° arc (5° to each side of the vertical centreplane) for three complete cycles', 'back angle quadrant of the 3-D H machine with the probe in its fully rearward position. H-4.15. If a re-run of the installation of the 3-D H machine is desired, the seat assembly should remain unloaded for a minimum period of 30 min prior to the re-run. The 3-D H machine should not be left loaded on the seat assembly longer than the time required to perform the test. H-4.16. If the seats in the same row are regarded as similar (bench seat, identical seats, etc.) only one ""H"" point and one ""actual torso angle"" shall be determined for each row of seats, the 3-D H machine described in Annex HA being seated in a place regarded as representative for the row. This place shall be: H-4.16.1. in the case of the front row, the driver\'s seat; H-4.16.2 in the case of the rear row or rows, an outer seat. AIS-002 (Part 1)(Rev.1):2011 30/42 ANNEX HA (See H-2.2) DESCRIPTION OF THE THREE DIMENSIONAL ""H"" POINT MACHINE */ (3-D H machine) HA-1. Back and seat pans The back and seat pans are constructed of reinforced plastic and metal; they simulate the human torso and thigh and are mechanically hinged at the ""H"" point. A quadrant is fastened to the probe hinged at the ""H"" point to measure the actual torso angle. An adjustable thigh bar, attached to the seat pan, establishes the thigh centreline and serves as a baseline for the hip angle quadrant. HA-2. Body and leg elements Lower leg segments are connected to the seat pan assembly at the T-bar joining the knees, which is a lateral extension of the adjustable thigh bar. Quadrants are incorporated in the lower leg segments to measure knee angles. Shoe and foot assemblies are calibrated to measure the foot angle. Two spirit levels orient the device in space. Body element weights are placed at the corresponding centres of gravity to provide seat penetration equivalent to a 76 kg male. All joints of the 3-D H machine should be checked for free movement without encountering noticeable friction. (*/For details of the construction of the 3-D H machine refer to Society of Automotive Engineers (SAE), 400 Commonwealth Drive, Warrendale, Pennsylvania/15096, United States of America. The machine corresponds to that described in ISO Standard 6549-1980.) AIS-002 (Part 1)(Rev.1):2011 31/42 Figure HA-1 3-D H machine elements designation AIS-002 (Part 1)(Rev.1):2011 32/42 Figure HA-2 Dimensions of the 3-D H machine elements and load distribution AIS-002 (Part 1)(Rev.1):2011 33/42 ANNEX HB (See H-2.9) THREE-DIMENSIONAL REFERENCE SYSTEM HB-1. The three-dimensional reference system is defined by three orthogonal planes established by the vehicle manufacturer (see Figure HB-1 */) HB-2. The vehicle measuring attitude is established by positioning the vehicle on the supporting surface such that the co-ordinates of the fiducial marks correspond to the values indicated by the manufacturer. HB-3. The co-ordinates of the ""R"" point and the ""H"" point are established in relation to the fiducial marks defined by the vehicle manufacturer. Figure HB-1 Three-dimensional reference system ‐‐‐‐‐‐‐‐‐‐‐‐‐‐‐‐‐‐‐‐‐‐‐‐‐‐‐‐‐‐‐‐‐‐ */ The', 'its fully rearward position. H-4.15. If a re-run of the installation of the 3-D H machine is desired, the seat assembly should remain unloaded for a minimum period of 30 min prior to the re-run. The 3-D H machine should not be left loaded on the seat assembly longer than the time required to perform the test. H-4.16. If the seats in the same row are regarded as similar (bench seat, identical seats, etc.) only one ""H"" point and one ""actual torso angle"" shall be determined for each row of seats, the 3-D H machine described in Annex HA being seated in a place regarded as representative for the row. This place shall be: H-4.16.1. in the case of the front row, the driver\'s seat; H-4.16.2 in the case of the rear row or rows, an outer seat. AIS-002 (Part 1) (Rev.2):2023 37/65 ANNEX HA (See H-2.2) DESCRIPTION OF THE THREE DIMENSIONAL ""H"" POINT MACHINE */ (3-D H machine) HA-1. Back and seat pans The back and seat pans are constructed of reinforced plastic and metal; they simulate the human torso and thigh and are mechanically hinged at the ""H"" point. A quadrant is fastened to the probe hinged at the ""H"" point to measure the actual torso angle. An adjustable thigh bar, attached to the seat pan, establishes the thigh centreline and serves as a baseline for the hip angle quadrant. HA-2. Body and leg elements Lower leg segments are connected to the seat pan assembly at the T-bar joining the knees, which is a lateral extension of the adjustable thigh bar. Quadrants are incorporated in the lower leg segments to measure knee angles. Shoe and foot assemblies are calibrated to measure the foot angle. Two spirit levels orient the device in space. Body element weights are placed at the corresponding centres of gravity to provide seat penetration equivalent to a 76 kg male. All joints of the 3-D H machine should be checked for free movement without encountering noticeable friction. (*/For details of the construction of the 3-D H machine refer to Society of Automotive Engineers (SAE), 400 Commonwealth Drive, Warrendale, Pennsylvania/15096, United States of America. The machine corresponds to that described in ISO Standard 6549-1980.) AIS-002 (Part 1) (Rev.2):2023 38/65 Figure HA-1 3-D H machine elements designation AIS-002 (Part 1) (Rev.2):2023 39/65 Figure HA-2 Dimensions of the 3-D H machine elements and load distribution AIS-002 (Part 1) (Rev.2):2023 40/65 ANNEX HB (See H-2.9) THREE-DIMENSIONAL REFERENCE SYSTEM HB-1. The three-dimensional reference system is defined by three orthogonal planes established by the vehicle manufacturer (see Figure HB-1 */) HB-2. The vehicle measuring attitude is established by positioning the vehicle on the supporting surface such that the co-ordinates of the fiducial marks correspond to the values indicated by the manufacturer. HB-3. The co-ordinates of the ""R"" point and the ""H"" point are established in relation to the fiducial marks defined by the vehicle manufacturer. Figure HB-1 Three-dimensional reference system */ The reference system corresponds to ISO standard 4130, 1978 AIS-002']","['17', '24', '18', '20', '27']",['17'],"['document8.pdf', 'document9.pdf', 'document8.pdf', 'document8.pdf', 'document9.pdf']",easy,factual,1.0,1.0
"What should be the fabric covering the area of the seating position contacted by the 3-D H machine, according to the ARAI Automotive Industry Standard?","Muslin cotton, plain cotton fabric having 18.9 threads per cm² and weighing 0.228 kg/m² or knitted or non-woven fabric having equivalent characteristics","According to the ARAI Automotive Industry Standard (AIS-002), the area of the seating position contacted by the 3-D H machine should be covered by a muslin cotton, or an equivalent fabric. The specifications for this fabric are described as a plain cotton fabric having 18.9 threads per square centimeter (threads/cm²) and weighing 0.228 kilograms per square meter (kg/m²). Alternatively, knitted or non-woven fabrics with equivalent characteristics can also be used. This information is found in H-4.4 of AIS-002 (Part 1)(Rev.1):2011.","['back. At the manufacturer\'s request, all seat assemblies shall remain unloaded for a minimum period of 30 min prior to installation of the 3-D H machine. H-4.2. The vehicle shall be at the measuring attitude defined in H-2.11. H-4.3. The seat, if it is adjustable, shall be adjusted first to the rearmost normal driving or riding position, as indicated by the vehicle manufacturer, taking into consideration only the longitudinal adjustment of the seat, excluding seat travel used for purposes other than normal driving or riding positions. Where other modes of seat adjustment exist (vertical, angular, seat-back, etc.) these will be then adjusted to the position specified by the vehicle manufacturer. For suspension seats, the vertical position shall be rigidly fixed corresponding to a normal driving position as specified by the manufacturer. H-4.4. The area of the seating position contacted by the 3-D H machine shall be covered by a muslin cotton, of sufficient size and appropriate texture, described as a plain cotton fabric having 18.9 threads per/cm2 and weighing 0.228 kg/m2 or knitted or non-woven fabric having equivalent characteristics. If test is run on a seat outside the vehicle, the floor on which the seat is placed shall have the same essential characteristics e.g. tilt angle, height difference with a seat mounting, surface texture, etc, as the floor of the vehicle in which the seat is intended to be used. AIS-002 (Part 1) (Rev.2):2023 34/65 H-4.5. Place the seat and back assembly of the 3-D H machine so that the centreplane of the occupant (C/LO) coincides with the centreplane of the 3-D H machine. At the manufacturer\'s request, the 3-D H machine may be moved inboard with respect to the C/LO if the 3-D H machine is located so far outboard that the seat edge will not permit levelling of the 3-D H machine. H-4.6. Attach the foot and lower leg assemblies to the seat pan assembly, either individually or by using the T-bar and lower leg assembly. A line through the ""H"" point sight buttons shall be parallel to the ground and perpendicular to the longitudinal centre-plane of the seat. H-4.7. Adjust the feet and leg positions of the 3-D H machine as follows: H-4.7.1. Designated seating position: driver and outside front passenger H-4.7.1.1. Both feet and leg assemblies shall be moved forward in such a way that the feet take up natural positions on the floor, between the operating pedals if necessary. Where possible the left foot shall be located approximately the same distance to the left of the centreplane of the 3-D H machine as the right foot is to the right. The spirit level verifying the transverse orientation of the 3-D H machine is brought to the horizontal by readjustment of the seat pan if necessary, or by adjusting the leg and foot assemblies towards the rear. The line passing through the ""H"" point sight buttons shall be maintained perpendicular to the longitudinal centreplane of the seat. H-4.7.1.2. If it is not possible for the left', 'back angle quadrant of the 3-D H machine with the probe in its fully rearward position. H-4.15. If a re-run of the installation of the 3-D H machine is desired, the seat assembly should remain unloaded for a minimum period of 30 min prior to the re-run. The 3-D H machine should not be left loaded on the seat assembly longer than the time required to perform the test. H-4.16. If the seats in the same row are regarded as similar (bench seat, identical seats, etc.) only one ""H"" point and one ""actual torso angle"" shall be determined for each row of seats, the 3-D H machine described in Annex HA being seated in a place regarded as representative for the row. This place shall be: H-4.16.1. in the case of the front row, the driver\'s seat; H-4.16.2 in the case of the rear row or rows, an outer seat. AIS-002 (Part 1)(Rev.1):2011 30/42 ANNEX HA (See H-2.2) DESCRIPTION OF THE THREE DIMENSIONAL ""H"" POINT MACHINE */ (3-D H machine) HA-1. Back and seat pans The back and seat pans are constructed of reinforced plastic and metal; they simulate the human torso and thigh and are mechanically hinged at the ""H"" point. A quadrant is fastened to the probe hinged at the ""H"" point to measure the actual torso angle. An adjustable thigh bar, attached to the seat pan, establishes the thigh centreline and serves as a baseline for the hip angle quadrant. HA-2. Body and leg elements Lower leg segments are connected to the seat pan assembly at the T-bar joining the knees, which is a lateral extension of the adjustable thigh bar. Quadrants are incorporated in the lower leg segments to measure knee angles. Shoe and foot assemblies are calibrated to measure the foot angle. Two spirit levels orient the device in space. Body element weights are placed at the corresponding centres of gravity to provide seat penetration equivalent to a 76 kg male. All joints of the 3-D H machine should be checked for free movement without encountering noticeable friction. (*/For details of the construction of the 3-D H machine refer to Society of Automotive Engineers (SAE), 400 Commonwealth Drive, Warrendale, Pennsylvania/15096, United States of America. The machine corresponds to that described in ISO Standard 6549-1980.) AIS-002 (Part 1)(Rev.1):2011 31/42 Figure HA-1 3-D H machine elements designation AIS-002 (Part 1)(Rev.1):2011 32/42 Figure HA-2 Dimensions of the 3-D H machine elements and load distribution AIS-002 (Part 1)(Rev.1):2011 33/42 ANNEX HB (See H-2.9) THREE-DIMENSIONAL REFERENCE SYSTEM HB-1. The three-dimensional reference system is defined by three orthogonal planes established by the vehicle manufacturer (see Figure HB-1 */) HB-2. The vehicle measuring attitude is established by positioning the vehicle on the supporting surface such that the co-ordinates of the fiducial marks correspond to the values indicated by the manufacturer. HB-3. The co-ordinates of the ""R"" point and the ""H"" point are established in relation to the fiducial marks defined by the vehicle manufacturer. Figure HB-1 Three-dimensional reference system ‐‐‐‐‐‐‐‐‐‐‐‐‐‐‐‐‐‐‐‐‐‐‐‐‐‐‐‐‐‐‐‐‐‐ */ The', 'its fully rearward position. H-4.15. If a re-run of the installation of the 3-D H machine is desired, the seat assembly should remain unloaded for a minimum period of 30 min prior to the re-run. The 3-D H machine should not be left loaded on the seat assembly longer than the time required to perform the test. H-4.16. If the seats in the same row are regarded as similar (bench seat, identical seats, etc.) only one ""H"" point and one ""actual torso angle"" shall be determined for each row of seats, the 3-D H machine described in Annex HA being seated in a place regarded as representative for the row. This place shall be: H-4.16.1. in the case of the front row, the driver\'s seat; H-4.16.2 in the case of the rear row or rows, an outer seat. AIS-002 (Part 1) (Rev.2):2023 37/65 ANNEX HA (See H-2.2) DESCRIPTION OF THE THREE DIMENSIONAL ""H"" POINT MACHINE */ (3-D H machine) HA-1. Back and seat pans The back and seat pans are constructed of reinforced plastic and metal; they simulate the human torso and thigh and are mechanically hinged at the ""H"" point. A quadrant is fastened to the probe hinged at the ""H"" point to measure the actual torso angle. An adjustable thigh bar, attached to the seat pan, establishes the thigh centreline and serves as a baseline for the hip angle quadrant. HA-2. Body and leg elements Lower leg segments are connected to the seat pan assembly at the T-bar joining the knees, which is a lateral extension of the adjustable thigh bar. Quadrants are incorporated in the lower leg segments to measure knee angles. Shoe and foot assemblies are calibrated to measure the foot angle. Two spirit levels orient the device in space. Body element weights are placed at the corresponding centres of gravity to provide seat penetration equivalent to a 76 kg male. All joints of the 3-D H machine should be checked for free movement without encountering noticeable friction. (*/For details of the construction of the 3-D H machine refer to Society of Automotive Engineers (SAE), 400 Commonwealth Drive, Warrendale, Pennsylvania/15096, United States of America. The machine corresponds to that described in ISO Standard 6549-1980.) AIS-002 (Part 1) (Rev.2):2023 38/65 Figure HA-1 3-D H machine elements designation AIS-002 (Part 1) (Rev.2):2023 39/65 Figure HA-2 Dimensions of the 3-D H machine elements and load distribution AIS-002 (Part 1) (Rev.2):2023 40/65 ANNEX HB (See H-2.9) THREE-DIMENSIONAL REFERENCE SYSTEM HB-1. The three-dimensional reference system is defined by three orthogonal planes established by the vehicle manufacturer (see Figure HB-1 */) HB-2. The vehicle measuring attitude is established by positioning the vehicle on the supporting surface such that the co-ordinates of the fiducial marks correspond to the values indicated by the manufacturer. HB-3. The co-ordinates of the ""R"" point and the ""H"" point are established in relation to the fiducial marks defined by the vehicle manufacturer. Figure HB-1 Three-dimensional reference system */ The reference system corresponds to ISO standard 4130, 1978 AIS-002', 'shall sit on the seat twice for one minute to flex the cushion and back. At the manufacturer\'s request, all seat assemblies shall remain unloaded for a minimum period of 30 min prior to installation of the 3-D H machine. H-4.2. The vehicle shall be at the measuring attitude defined in H-2.11. H-4.3. The seat, if it is adjustable, shall be adjusted first to the rearmost normal driving or riding position, as indicated by the vehicle manufacturer, taking into consideration only the longitudinal adjustment of the seat, excluding seat travel used for purposes other than normal driving or riding positions. Where other modes of seat adjustment exist (vertical, angular, seat-back, etc.) these will be then adjusted to the position specified by the vehicle manufacturer. For suspension seats, the vertical position shall be rigidly fixed corresponding to a normal driving position as specified by the manufacturer. H-4.4. The area of the seating position contacted by the 3-D H machine shall be covered by a muslin cotton, of sufficient size and appropriate texture, described as a plain cotton fabric having 18.9 threads per/cm2 and weighing 0.228 kg/m2 or knitted or non-woven fabric having equivalent characteristics. If test is run on a seat outside the vehicle, the floor on which the seat is placed shall have the same essential characteristics e.g. tilt angle, height difference with a seat mounting, surface texture, etc, as the floor of the vehicle in which the seat is intended to be used. AIS-002 (Part 1)(Rev.1):2011 27/42 H-4.5. Place the seat and back assembly of the 3-D H machine so that the centreplane of the occupant (C/LO) coincides with the centreplane of the 3-D H machine. At the manufacturer\'s request, the 3-D H machine may be moved inboard with respect to the C/LO if the 3-D H machine is located so far outboard that the seat edge will not permit levelling of the 3-D H machine. H-4.6. Attach the foot and lower leg assemblies to the seat pan assembly, either individually or by using the T-bar and lower leg assembly. A line through the ""H"" point sight buttons shall be parallel to the ground and perpendicular to the longitudinal centre-plane of the seat. H-4.7. Adjust the feet and leg positions of the 3-D H machine as follows: H-4.7.1. Designated seating position: driver and outside front passenger H-4.7.1.1. Both feet and leg assemblies shall be moved forward in such a way that the feet take up natural positions on the floor, between the operating pedals if necessary. Where possible the left foot shall be located approximately the same distance to the left of the centreplane of the 3-D H machine as the right foot is to the right. The spirit level verifying the transverse orientation of the 3-D H machine is brought to the horizontal by readjustment of the seat pan if necessary, or by adjusting the leg and foot assemblies towards the rear. The line passing through the ""H"" point sight buttons shall be maintained perpendicular to the longitudinal', 'point indicated by the manufacturer may be taken as a reference at the discretion of the testing agency. H-2. DEFINITIONS For the purposes of this Annex: H-2.1. ""Reference data"" means one or several of the following characteristics of a seating position: H-2.1.1. the ""H"" point and the ""R"" point and their relationship; H-2.1.2. the actual torso angle and the design torso angle and their relationship. H-2.2. ""Three-dimensional \'H\' point machine"" (3-D H machine) means the device used for the determination of ""H"" points and actual torso angles. This device is described in Annex HA H-2.3. ""\'H\' point"" means the pivot centre of the torso and thigh of the 3-D H machine installed in the vehicle seat in accordance with H-4 below. The ""H"" point is located in the centre of the centreline of the device which is between the ""H"" point sight buttons on either side of the 3-D H machine. The ""H"" point corresponds theoretically to the ""R"" point (for tolerances see H-3.2.2). Once determined in accordance with the procedure described in H-4, the ""H"" point is considered fixed in relation to the seat-cushion structure and to move with it when the seat is adjusted. H-2.4 ""\'R\' point"" or ""seating reference point"" means a design point defined by a vehicle manufacturer for each seating position and established with respect to the three-dimensional reference system; H-2.5. ""Torso-line"" means the centreline of the probe of the 3-D H machine with the probe in the fully rearward position. H-2.6. ""Actual torso angle"" means the angle measured between a vertical line through the ""H"" point and the torso line using the back angle quadrant on the 3-D H machine. The actual torso angle corresponds theoretically to the design torso angle (for tolerances see H-3.2.2.). AIS-002 (Part 1)(Rev.1):2011 25/42 H-2.7. ""Design torso angle"" means the angle measures between a vertical line through the ""R"" point and the torso line in a position which corresponds to the design position of the seat-back established by the vehicle manufacturer. H-2.8. ""Centreplane of occupant"" (C/LO) means the median plane of the 3-D H machine positioned in each designated seating position; it is represented by the co-ordinate of the ""H"" point on the ""Y"" axis. For individual seats, the centreplane of the seat coincides with the centreplane of the occupant. For other seats, the centreplane of the occupant is specified by the manufacturer; H-2.9. ""Three-dimensional reference system"" means a system as described in Annex HB. H-2.10. ""Fiducial marks"" are physical points (holes, surfaces, marks or indentations) on the vehicle body as defined by the manufacturer; H-2.11. ""Vehicle measuring attitude"" means the position of the vehicle as defined by the co-ordinates of fiducial marks in the three-dimensional reference system H-3. REQUIREMENTS H-3.1. Data presentation For each seating position where reference data are required in order to demonstrate compliance with the provisions of the present standard, all or an appropriate selection of the following data shall be presented in the form indicated in Annex HC. H-3.1.1. the co-ordinates of the ""R""']","['24', '20', '27', '17', '15']",['17'],"['document9.pdf', 'document8.pdf', 'document9.pdf', 'document8.pdf', 'document8.pdf']",easy,factual,1.0,1.0
What should not be present in the buckle according to AIS-005/2000?,Partial latch position,"According to AIS-005/2000, there is no specific mention of what should not be present in the buckle. However, it is stated that the buckle and strap adjusting device must be connected to a tensile-testing machine by their normal attachments (AIS-005/2000 5.3.1). This implies that any non-standard or abnormal attachments should not be present in the buckle for testing purposes.

Reference(s):
- AIS-005/2000 document from pages 18, 19","['perpendicular to the button’s initial direction of motion. For non-recessed devices, the area should not be less than 2.5 cm2 and a width not less than 10 mm. The buckle release area shall be colored red. No other externally visible parts of the buckle shall be of this colour. Direction/mode of operation “PRESS/PUSH/LIFT” shall be indicated on the buckle. 4.2.2.3 The buckle shall be capable of withstanding repeated operation and shall undergo 5000 opening and closing cycles under normal conditions of use prior to dynamic test as per para 5.6.2. In the case of harness belt buckles, the test may be carried out without all the tongues being introduced. 4.2.2.4 The buckle, when tested in accordance with 5.3.3, shall operate normally. 4.2.2.5 The buckle shall be tested for strength as prescribed in para 5.3.1 and 5.3.5, as appropriate. It must not break, be seriously distorted or become detached when subjected to the prescribed load. 4.2.2.6 In the case of buckles which incorporate a component common to the two assemblies, if the buckle of one assembly can be assembled in use with the mating part of that assembly with that of other assembly, the strength and release test as per para 5.6.2 and 5.6.3 shall also be carried out for both possible means of assembly. 4.2.3 Belt Adjustment Device 4.2.3.1 Two samples of each belt adjustment device shall be tested in accordance with the requirement of para 5.3.8. The strap slip shall not exceed 25 mm for each sample of adjusting device and the sum of shifts for all the adjusting devices shall not exceed 40 mm. 4.2.3.2 All the adjustment devices shall be tested for strength as prescribed in para 5.3.1 and 5.3.5 as appropriate. They must not break or become detached under the tension set up by the prescribed load. 4.2.3.3 When tested in accordance with para 5.3.6, the force required to operate any manually adjusting device shall not exceed 50 N. AIS-005/2000 4.2.4 Attachments and Belt Adjustment Devices for Height The attachments shall be tested for strength as prescribed in para 5.3.1. and 5.3.2 as appropriate. Belt adjustment devices for height shall be tested for strength as prescribed in para 5.3.2 unless they have been tested as part of the vehicle anchorage systems as per Draft AIS/015. These parts must not break or become detached under the tension set up by the prescribed load. 4.2.5 Retractors 4.2.5.1 Retractors, other than non-loading ones, shall be subjected to tests and fulfil the requirements specified below, including the tests for strength prescribed in para 5.3.1 and 5.3.2. 4.2.5.2 Manually Unlocking Retractors 4.2.5.2.1 The strap of a safety belt assembly equipped with a manually unlocking retractor shall not move more than 25 mm between the locking positions of the retractor. 4.2.5.2.2 The strap of a safety belt assembly shall extract from a manually unlocking retractor within 6 mm of its maximum length when a tension between 14 N and 22 N is applied to the strap in the normal direction of pull.', 'AMENDMENT NO. 1 / MAY 2002 TO AIS-005 / 2000 Automotive Vehicles - Safety Belt Assemblies - Specifications. 1. ANNEXURE - III Replace existing ANNEXURE - III by following ANNEXURE - III : ANNEXURE-III MINIMUM REQUIREMENT FOR SAFETY BELTS AND RETRACTORS FOR DIFFERENT CATEGORIES OF VEHICLES (Para 4.1.2) Vehicle Category as per IS:14272 Part I-1995 Front Row Outboard All Other Seating Positions M1, N1 and M2 < 3.5 ton GVW 3 Point belt with emergency locking retractor with single/ multiple sensitivity 2 Point or 3 Point belt with or without retractors All Other Vehicles of M and N Category 2 Point or 3 Point belt with or without retractors PRINTED BY: THE AUTOMOTIVE RESEARCH ASSOCIATION OF INDIA P. B. NO. 832. PUNE 411 004 ON BEHALF OF : AUTOMOTIVE INDUSTRY STANDARDS COMMITTEE UNDER CENTRAL MOTOR VEHICLE RULES - TECHNICAL STANDING COMMITTEE SET-UP BY MINISTRY OF ROAD TRANSPORT & HIGHWAYS GOVERNMENT OF INDIA May 2002 AIS-005/2000 AUTOMOTIVE INDUSTRY STANDARD Automotive Vehicles - Safety Belt Assemblies - Specifications PRINTED BY : THE AUTOMOTIVE RESEARCH ASSOCIATION OF INDIA P.B. NO.832, PUNE 411 004 ON BEHALF OF : AUTOMOTIVE INDUSTRY STANDARDS COMMITTEE UNDER CENTRAL MOTOR VEHICLE RULES - TECHNICAL STANDING COMMITTEE SET-UP BY MINISTRY OF ROAD TRANSPORT & HIGHWAYS GOVERNMENT OF INDIA September 2000 AIS - 005 / 2000 Status chart of the Standard to be used by the purchaser for updating the record Sr. No. Corr- igenda. Amend- ment Revision Date Remark Misc. General Remarks : AIS-005/2000 INTRODUCTION The Automotive Industry Standards Committee (AISC) functions under the guidance of CMVR Technical Standing Committee. AISC is setup to assist the Automotive Industry as well as Government of India in the preparation of new standards and review of the existing standards. ARAI acts as the Secretariat for AISC. Seats, seat belts, seat belt anchorages, etc., are safety critical items for the passenger in case of sudden acceleration/deceleration and accidents. Further, seats and their design, mounting, etc., constitute substantially to the ride comfort of the vehicle users. Presently there are no Indian standards or CMVR covering the seats and related items. AISC identified these as one of the priority items and a series of standards are being drafted by a Panel. This standard is one of them. Seat belts have become mandatory fitment on front seats of M and N categories of vehicles from April 1994 in India. Even though there is a safety standard covering some of the requirements of safety belts, this is not in line with international requirements. Hence, it is necessary to have a comprehensive standard for safety belt. This standard fulfils the above requirement. The Panel responsible for preparation of the standard is given in Annexure-XVI. Annexure-XVII gives the list of the members of AISC. ********** AIS-005/2000 INDEX OF ANNEXURES Annex. No. Particulars Page No. Annex-I Types of Seat Belt Assemblies Fig.1 Two Point Belt Fig.2 Three Point Belt Fig.3 Harness Belt Annex-II Information to be Provided by Safety Belt/Vehicle Manufacturer for Approval of Safety Belt/Restraint Systems Annex-III Minimum Requirements for', 'from its edge and a small loop of soft wire may be used on the connecting link between the buckle tab or lever and the force measuring device. The buckle opening force shall be measured and any failure of the buckle noted. AIS-005/2000 5.6.4 Additional Test for Pre-loading Device The pre-loading force shall be measured in less than four seconds after the impact as close as possible to the contact point with the manikin on the free length of webbing between the manikin and the pre-loading device or sash guide, if any, the manikin having been replaced in its originally seated position if necessary. 5.7 Test Report The test report shall record the results of all the tests in paragraph 5 above and in particular the trolley speed, the maximum forward displacement of the manikin, the position of the buckle, the buckle opening force, and any failure or breakage. If by virtue of para 5.6.2.1, the anchorage prescribed in para 3 and Fig.1 of Annexure-15 have not been respected, the test report shall describe how the belt assembly or the restraint system was installed and shall specify important angles and dimensions. The report shall also mention any distortion or breakage of the buckle that has occurred during the test. In the case of a restraint system, the test report shall also specify the manner of attaching the vehicle structure to the trolley, the position of the seats and the inclination of the seat backs. If the forward displacement of the manikin has exceeded the values prescribed in para 4.4.2.9.2, the report shall state whether the requirements in paragraph 4.4.2.10.1 are met. 6. SEAT BELT MARKING 6.1 Each seat belt assembly shall be marked at least with the information listed below to ensure correct usage and compliance to this regulation. 6.1.1 Manufacturer’s name or trade mark. 6.1.2 Part No. of identification. 6.1.3 Batch number, month and year of manufacture. 7. CONFORMITY OF PRODUCTION Any safety belt or restraint system approved under this standard shall be so manufactured as to conform to the approved by meeting the requirements set forth in para 4 and 5 above. In order to verify that the requirements of this standard are met, suitable controls of the production and its verification by carrying out the tests on randomly selected samples shall be carried out. The minimum frequency requirements are set out in Annexure-4. In order to reduce the number of types for COP, the locking mechanism is considered to be of two types with respect to mounting angle with reference to the vehicle axis system viz. less than 10° and more than 10°. 8. NOTE This standard is based on ECE Regulation-16 “Safety Belts and Restraint Systems”, 2000/3/EC “Motor Vehicle Safety Belts” and JIS:D-4604-1988 “Seat Belts for Automobiles”. *********** AIS-005/2000 Annex-I : Types of Seat Belt Assemblies Fig.1 : Two-Point Type (Ref. Para. 3.1) Fig.2 : Three-Point Type (Ref. Para. 3.1.2) AIS-005/2000 Annex-I : Types of Seat Belt Assemblies Fig.3 : Harness Type (Ref. Para. 3.1.3) AIS-005/2000', '2000/3/EC “Motor Vehicle Safety Belts” and JIS:D-4604-1988 “Seat Belts for Automobiles”. *********** AIS-005/2000 Annex-I : Types of Seat Belt Assemblies Fig.1 : Two-Point Type (Ref. Para. 3.1) Fig.2 : Three-Point Type (Ref. Para. 3.1.2) AIS-005/2000 Annex-I : Types of Seat Belt Assemblies Fig.3 : Harness Type (Ref. Para. 3.1.3) AIS-005/2000 ANNEXURE-II INFORMATION TO BE PROVIDED BY THE SAFETY BELT / VEHICLE MANUFACTURER FOR APPROVAL FOR SAFETY BELT/RESTRAINT SYSTEMS (Para 4.1.1) 1.0 GENERAL 1.1 Make (trade name of manufacturer): 1.2 Type and general commercial description (s): 1.3 Name and address of manufacturer: 1.4 Address (s) of assembly plant (s): 2.0 LIST OF VEHICLE(S) TO WHICH THE DEVICE IS INTENDED TO BE FITTED (If applicable) 3.0 DESCRIPTION OF THE DEVICE 3.1 Safety belt 3.1.1 Configuration of safety belt (two-point belt, three-point belt, static, automatic): 3.1.2 Details of webbing (material, weave, dimensions and colour): 3.1.3 Type of retractor and classify further in the case of emergency locking retractor – simple locking type, or webbing clamp type (Ref. Para 3.7). 3.1.4 Information on additional functions, if applicable: 3.1.5 Drawings of the rigid parts: 3.1.6 Type of buckle (Ref.3.3) 3.1.7 Diagram of the safety belt assembly enabling identification and location of the rigid parts: 3.1.8 Mounting instructions showing, inter-alia, the installation of the retractor and its sensing device: 3.1.9 If a belt adjustment device for height is present, state whether it is considered to be part of the belt: 3.1.10 In the case of a pre-loading device or system, a full technical description of the construction and function including any sensing device, describing the method of activation and any necessary method to avoid inadvertent activation: 3.2 Restraint system 3.2.1 Drawings of the relevant parts of the vehicle structure and any seat anchorage reinforcements: 3.2.2 Drawings of the seat, showing its structure, adjustment system and fixing components, with an indication of the materials used: 3.2.3 Drawing or photograph of the restraint system as installed: AIS-005/2000 4.0 DESCRIPTION OF THE VEHICLE Photographs and/or drawings of a representative vehicle: 5.0 BODYWORK 5.1 Seats 5.1.1 Number: 5.1.2 Position and arrangement: 5.1.3 Characteristics: For seats non type-approved as components, description and drawings of: 5.1.3.1 the seats and their anchorages: 5.1.3.2 the adjustment system: 5.1.3.3 the displacement and locking systems: 5.1.3.4 the seat belt anchorages if incorporated in the seat structure: 5.2 Safety belts and/or other restraint systems Number and position of safety belts and restraint systems and seats on which they can be used: Row of Seat Location * Type of seat belt Variant (if applicable) Belt adjustment device for height (indicate yes/no/optional) First row of seats L C R Second row of seats (1) F M B (1) The table may be extended as necessary for vehicles with more than two rows of seats or if there are more than three seats across the width of the vehicle. * (L = left-hand side, R = right-hand side, C = center) ****************** AIS-005/2000 ANNEXURE-III MINIMUM REQUIREMENT FOR SAFETY BELTS AND RETRACTORS FOR DIFFERENT CATEGORIES OF VEHICLES (Para 4.1.2) Front Row', 'carried out for approval of a type of belt or restraint system is given in Annexure - 4. AIS-005/2000 5.2 Corrosion Test 5.2.1 The complete safety belt assembly shall be subjected to salt spray (fog) testing in a test chamber as prescribed in Annexure-5. In the case of an assembly incorporating a retractor, the strap shall be unwound to full length less 300 mm ± 3 mm. Except for short interruptions that may be necessary, e.g., to check and replenish the salt solution, the exposure test shall proceed continuously for a period of fifty hours. 5.2.2 On completion of the test, the assembly shall be gently washed, in a clean running water in a temperature not higher than 38°C, to remove any salt deposit that may have formed and then allowed to dry at room temperature for 24 hours before inspection in accordance with para 4.2.1.2. 5.3 Static Test of Belt Components Incorporating Rigid Parts 5.3.1 The buckle and strap adjusting device must be connected to a tensile-testing machine by their normal attachments and a load of 10 kN must be applied. In the case of harness belts, the buckle shall be connected to the testing apparatus by the straps which are attached to the buckle and the tongue or two tongues located in an approximately symmetrical way to the geometric centre of the buckle. If the buckle or adjusting device is part of the attachment or of the common component of a three-point strap, the buckle or adjusting device must be tested together with the attachment in accordance with para 5.3.2 except in the case of retractors with a return pulley at the upper strap anchorage. In this case the test load must be 10 kN and the length of strap remaining on the reel at the moment of locking must be as close as possible to 450 mm. 5.3.2 The attachments and any belt adjustment devices for height shall be tested in the manner described in para 5.3.1 but load of 15 kN shall be applied in the least favourable conditions likely to occur in a vehicle in which the belt is correctly installed as per para 5.6.2.1. In the case of retractors, the test shall be performed with the strap completely unwound from the reel. 5.3.3 Two samples of the complete belt assembly shall be placed in a low- temperature chamber at –10 ± 1°C for two hours. Immediately after being removed from the chamber, the mating parts of the buckle shall then be locked together manually. 5.3.4 Two samples of the complete belt assembly shall be placed in a low- temperature chamber at a temperature of –10°C ± 1°C for two hours. All rigid items and parts made of plastic under test shall then be laid in turn on a flat rigid steel surface (which has been kept with the samples in the low temperature chamber), placed on the horizontal surface of a compact rigid block with a mass of at least 100 kg, within 30']","['7', '0', '23', '24', '13']",['6'],"['document16.pdf', 'document16.pdf', 'document16.pdf', 'document16.pdf', 'document16.pdf']",easy,factual,0.75,0.75
Which standards contain provisions that are referenced in AIS-002 (Part 1) (Rev.2):2023?,"[AIS-037, AIS-001 (Part 1) (Rev.2):2023 III IS 14272:2011, IS 13942:1994, ISO 15008:2003, CIE publication 50 (45), EN 12368]","The standards that are referenced in AIS-002 (Part 1) (Rev.2):2023 include:

1. AIS-007 (Revision 5) - Referenced in document2.pdf, page 28/65. Specifically, Table 1A to 1.9, 1.2 and 9 of detailed specifications for L category vehicles, and Table 2 A1.1, A1.7.1, A.2.1, A.2.1.1, A.2.1.2, A2.2, A2.1.5 for M and N category vehicles.

2. UN Regulations - Acceptance of changes in the UN/ GTR regulation, the base standard for AIS/ TAP 115/116 is referenced in document2.pdf, page 17/21.","['case of 5.4.1 5.4.3.1 In case, in the revised standard one or more tests or verification are dropped, extension of previous approval shall be accorded disregarding such tests or verifications. 5.4.3.2 The provisions of Criteria of Extension of Approval prescribed in revised standard, shall be followed for provisions covered in the previous standard, unless otherwise so specified in the revised standard. 5.4.4 In the case of 5.4.2, procedure prescribed in 5.3 shall be followed. Note 1: The technical details for the revised AIS shall be worked out as per the guidelines given in 5.3 and 5.4 and shall be included in the transitional provisions of the revised AIS/ TAP. Note 2: The corresponding guidelines for other Standards or Rules covered in this document for which Transitional Provisions are applicable, may be derived from the equivalence of terms table given in Annexure I. 6.0 PROVISIONS REGARDING IS The responsibility of issue and control of modifications in IS rests with Bureau of Indian Standards. This section specifically covers the requirement with respect to transitional provisions related to implementation of IS, which is replacing existing notified AIS and amendments in already notified IS under CMVR. 6.1 IS replacing existing notified AIS Before notifying the IS standard in place of AIS, it shall be necessary to establish the equivalence or otherwise of the two standards. The procedure for establishing equivalence of the IS and its corresponding AIS shall be as under 6.1.1 Proposal for notifying IS in place of existing AIS shall be normally initiated by BIS through CMVR-TSC. CMVR-TSC or AISC may also identify such need and initiate action 6.1.2 CMVR- TSC will direct AISC to examine equivalence. Note: If AISC has identified such need and indicated the action, AISC need not wait for the direction. 6.1.3 AISC or its designated panel shall examine whether the two standards are equivalent. In case of standards which come under the purview of AIS-037, the study of equivalency, the details which are specified for tests for COP, in the original AIS or Annex B of AIS-037, as applicable shall also be considered. AIS-000 12/21 6.1.3.1 In case equivalence is established, AISC or its designated panel shall work out transitional provisions similar to Para 5 above. In case the designated AISC panel works out such details, it shall be as approved by AISC. Thereafter Secretariat shall place the IS with the details and draft notification for Implementation for approval to CMVR-TSC. 6.1.3.1.1 In such cases the type approvals and COP already issued as per AIS shall continue to remain valid and no further approval is required. 6.1.3.2 In case there are some changes: 6.1.3.2.1 AISC shall ascertain and endorse whether the changes are acceptable from the statutory point of view. If the changes are acceptable action prescribed in 6.1.3.1.shall be followed. In addition, the transitional provisions shall include, whether the type approvals and COP already issued shall continue to remain valid or if not, the provisions for extension for such approvals shall be included similar to those', 'established during the type approval as per AIS-001:2001. 21.4 Extension of Approvals for engineering and administrative changes: 21.4.1 In the case of 21.1, extensions shall be granted subject to the conditions of AIS-001 (Part 1) (Rev.1):2011. Such extensions shall be deemed to be compliance to AIS-001:2001. 21.4.2 In the case of 21.2, extensions shall be granted subject to conditions of AIS-001:2001 till the notified date of implementation AIS-001 (Part 1) (Rev.1):2011. 21.5 Type approvals for compliance to AIS-037, already been granted, shall continue to be valid for AIS-001 (Rev.1) (Part 1):2011. Note: Necessary corrections to the reference of verification reports as per this standard shall be incorporated while issuing the next COP certificate. In the meantime for issuing of vehicle certificate, test/verification report as per this standard shall deemed to be the proof of compliance of AIS-037. ESTABLISHING COMPLIANCE OF “E”/“e” APPROVED DEVICES TO THIS STANDARDS 22.1 As an exception to 7.4 of AIS-037, (or related administrative decisions) for certifying compliance of “E”/”e” approved rear-view mirrors devices to this standard, the test for the following shall be carried out by testing agency 22.1.1 Requirements of dimension as per 6.1.2.1 22.1.2 Requirements of reflecting surfaces as per 6.1.2.2 AIS-001 (Part 1) (Rev.1) : 2011 17/35 AMENDMENTS TO ECE REGULATIONS AFTER THE LEVEL DESCRIBED IN 0.3 OF INTRODUCTION 23.1 Supplements In case of changes in ECE regulation, which are issued as supplements (Supplements do not affect the earlier type approvals) at the request of applicant, approval of compliance to this standard shall be issued taking into account the changes arising out of such supplement(s) to ECE regulation with approval from Chairman AISC. This shall be incorporated in the test report. Note: Such changes will be considered for inclusion in this standard at the time of its next amendment /revision. 23.2 Series of amendments Changes in ECE regulation, which are issued as series of amendments (series of amendments may affect the earlier type approvals) will not be considered for issuing approval to this standard. However, Chairman, AISC may, on a case to case basis, permit to accept latest series of amendments. This shall be incorporated in the test report. Note: Such changes will be considered for inclusion in this standard at the time of its next revision. AIS-001 (Part 1) (Rev.1) : 2011 18/35 ANNEX A (See 3.1) INFORMATION TO BE SUBMITTED AT THE TIME OF APPLYING FOR TYPE APPROVAL A1 The information given in Table A1, if applicable, shall be supplied and shall include a list of contents. A2 Any sketches shall be supplied in appropriate scale and in sufficient detail. A3 Photographs, if any, shall show sufficient detail. Table A1 (See A1) 1. Make (trade name of manufacturer): 2. Type and general commercial description(s): 3. Means of identification of the type, if indicated on the device: 4. Category of vehicle for which the device is intended: 5. Name and address of manufacturer: 6. Location and method of affixing of the approval mark: 7. Address(es) of assembly plant(s): 8. Mirrors (state for', 'Road Transport & Highways. These standards are available as priced documents through Knowledge Centre, ARAI (Contact: Dr. A Madhav. Rao, Knowledge Centre, ARAI. Email: madhavrao.lib@araiindia.com) AIS standards are currently available in following Volumes: 1. CMVR-Type Approval Certification 2. EMI/ Lighting/ Light-signalling Devices 3. Tyres/ Brakes/ Stability 4. General Safety 5. Passive Safety 6. Bus Body/ Truck Body Approval 7. Miscellaneous Testing 8. CNG vehicles 9. LPG vehicles 10. Battery operated vehicles 11. Automotive Rubber Components 12. Automotive Industry Standards (AISs) Agricultural Tractors', 'be deemed to be compliance to AIS-002 (Part 1) (Rev.1):2011. 22.2 At the request of applicant, type approval to the compliance to AIS-002 (Part 1) (Rev.1):2011 shall be granted up to the notified date of implementation of AIS-002 (Part 1) (Rev. 2): 2023. 22.3 Type approvals issued for compliance to AIS-002 (Part 1) (Rev.1):2011 shall: 22.3.1 be extended for L category vehicles without any further verification, for compliance to AIS-002 (Part 1) (Rev. 2): 2023. 22.3.2 not be extended for M and N category vehicles for compliance to AIS-002 (Part 1) (Rev. 2): 2023. Note: Additional verification for the above need not be carried out, if compliance to the above requirements has already been established during the type approval as per AIS-002 (Part 1) (Rev.1):2011. 22.4 Extension of Approvals for engineering and administrative changes: 22.4.2 In the case of 21.1, extensions shall be granted subject to the conditions of AIS-002 (Part 1) (Rev. 2): 2023. Such extensions shall be deemed to be compliance to AIS-002 (Part 1) (Rev.1):2011. 22.4.2 In the case of 21.2, extensions shall be granted subject to conditions of AIS-002 (Part 1) (Rev.1):2011 till the notified date of implementation of AIS-002 (Part 1) (Rev.2): 2023. AIS-002 (Part 1) (Rev.2):2023 26/65 AMENDMENTS TO UN REGULATIONS AFTER THE LEVEL DESCRIBED IN 0.3 OF INTRODUCTION 23.1 Supplements In case of changes in UN regulation, which are issued as supplements (Supplements do not affect the earlier type approvals) at the request of applicant, approval of compliance to this standard shall be issued taking into account the changes arising out of such supplement(s) to UN regulation with approval from Chairman AISC. This shall be incorporated in the test report. Note: Such changes will be considered for inclusion in this standard at the time of its next amendment /revision. 23.2 Series of amendments Changes in UN regulation, which are issued as series of amendments (series of amendments may affect the earlier type approvals) will not be considered for issuing approval to this standard. However, Chairman, AISC may, on a case to case basis, permit to accept latest series of amendments. This shall be incorporated in the test report. Note: Such changes will be considered for inclusion in this standard at the time of its next revision. AIS-002 (Part 1) (Rev.2):2023 27/65 ANNEX A (Reserved) AIS-002 (Part 1) (Rev.2):2023 28/65 ANNEX B (See 13.1) INFORMATION TO BE SUBMITTED AT THE TIME OF TYPE APPROVAL B-1 The specification submitted by manufacturer (applicant) at the time of applying for the type approval of the vehicle to this standard shall contain at least the information set out in the following entries of AIS-007 (Revision 5): Table 1A 0.1 to 0.9, 1.2 and 9 of detailed specifications (For L category vehicles only) Table 2 A1.1, A1.7.1, A.2.1, A.2.1.1, A.2.1.2, A2.2, A2.1.5 (For M and N category vehicles) Table 3 B1.2, B27.1 to B27.8 (For M and N category vehicles) Following additional information shall also be provided along with the type approval application. 1. In case of L-category vehicles', 'AIS-000 I AUTOMOTIVE INDUSTRY STANDARD Administrative Procedure to deal with Corrigendum, Amendments or Revisions to AIS, TAP 115/116, CMVR Notifications, IS and ISO standards, which are notified under CMVR PRINTED BY THE AUTOMOTIVE RESEARCH ASSOCIATION OF INDIA P.B. NO. 832, PUNE 411 004 ON BEHALF OF AUTOMOTIVE INDUSTRY STANDARDS COMMITTEE UNDER CENTRAL MOTOR VEHICLE RULES – TECHNICAL STANDING COMMITTEE SET-UP BY MINISTRY OF ROAD TRANSPORT & HIGHWAYS (DEPARTMENT OF ROAD TRANSPORT & HIGHWAYS) GOVERNMENT OF INDIA October 2013 AIS-000 II Status chart of the standard to be used by the purchaser for updating the record Sr. No. Corrigenda. Amendment Revision Date Remark Misc. General remarks : AIS-000 III Administrative Procedure to deal with Corrigendum, Amendments or Revisions to AIS, TAP 115 / 116, CMVR Notifications, IS and ISO standards, which are notified under CMVR Para. No. Contents Page No. 1. Introduction 1/21 Scope 2/21 Definitions 2/21 General guidelines for approval of changes in published AIS 7/21 General guidelines for transitional provisions in AIS / TAP 115/116 9/21 Provisions regarding IS 11/21 General guidelines for approval of changes in published TAP 115/116 14/21 General guidelines for approval of changes in published CMVR Notifications including CMV Rule 115 16/21 Provisions regarding changes in ISO standards related to vehicle/ component approval notified under CMVR 16/21 Acceptance of changes in the UN/ GTR regulation, the base standard for AIS/ TAP 115/116 17/21 Annexures Annexure I Mapping of terms for equivalence 18/21 Annexure II Abbreviations used 19/21 Annexure III Composition of AISC panel on Administrative Procedure to deal with Corrigendum, Amendments or Revisions to AIS, TAP 115 / 116, CMVR Notifications, IS and ISO standards, which are notified under CMVR 20/21 Annexure IV Committee composition of AISC 21/21 AIS-000 1/21 Administrative Procedure to deal with Corrigendum, Amendments or Revisions to AIS, TAP 115 / 116, CMVR Notifications, IS and ISO standards, which are notified under CMVR 1.0 INTRODUCTION 1.1 Automotive Industry Standards Committee (AISC) is constituted by Ministry of Road Transport & Highways to formulate safety standards for automotive components, systems and vehicle level testing and type approval. Automotive Industry Standard (AIS), which are published on behalf of AISC, are technically based on equivalent UN Regulations/ EC Directives/ Global Technical Regulations (GTRs). AIS are notified as mandatory requirements under Central Motor Vehicles Rules (CMVR). On account of technological advancements and revisions in corresponding base regulations or any other technical/administrative reasons, AIS will be undergoing modifications from time to time. Transitional provisions related to implementation of such modified standards, granting approvals as per modified standards and extending the previous type approvals are therefore necessary. 1.2 Apart from these AIS, several Indian Standards (IS) are also notified under CMVR. As per the directive from government, existing AIS will be subsequently converted to IS by Bureau of Indian Standards (BIS). While modifications of IS is the primary responsibility of BIS, however transitional provisions related to implementation of such modified IS through CMVR are not addressed by BIS. Hence this document also addresses this aspect. 1.3 On the similar']","['7', '14', '13', '20', '0']",['1'],"['document2.pdf', 'document4.pdf', 'document1.pdf', 'document9.pdf', 'document2.pdf']",medium,factual,1.0,0.95
What are the typical dimensions for constructing a cell with specified upper frequency limits as per AIS-004 (Part 3) ANNEX 8?,"[1.69 cm, 1.00, 0.66 cm] for a cell form factor W : b and L/W = 1.00","The provided text does not contain specific information about the typical dimensions for constructing a cell with specified upper frequency limits as per AIS-004 (Part 3) ANNEX 8. However, it is mentioned in Annex 5 - Appendix 1 that a test sample on a ground plane with a minimum radius of 15 meters and an antenna of 1 meter could be used for certain tests related to electromagnetic emissions from electrical/electronic sub-assemblies (see Figure 1).

For the specifications concerning a cell, you may want to refer to ANNEX 8 in AIS-004 (Part 3), but it seems that the text provided does not contain this information. It is recommended to consult the original document for more detailed information.","['(Rev.1) 95/149 ANNEX 7 - APPENDIX 2 TYPICAL TEM CELL DIMENSIONS The following table shows the dimensions for constructing a cell with specified upper frequency limits: Upper frequency (MHz) Cell form factor W : b Cell form factor L/W Plate separation b (cm) Septum S (cm) 1.69 0.66 1.00 AIS-004 (Part 3) (Rev.1) 96/149 ANNEX 7 - APPENDIX 3 ABSORBER CHAMBER TEST Test configuration for ESA\'s involved in ""REESS charging mode coupled to the power grid"". The test shall be performed according to ISO 11452-2. Legend: ESA (grounded locally if required in test plan) Stimulation and monitoring system LV Test harness HV harness LV Load simulator (placement and ground connection according to CISPR 25 paragraph 6.4.2.5) HV load simulator Power supply (location optional) HV AN LV Artificial network (AN) HV power supply Ground plane (bonded to shielded enclosure) HV feed-through Low relative permittivity support (εr ≤ 1.4) AC/DC charger harness Biconical antenna AC/DC load simulator (e.g. Programmable Logic Controller (PLC)) 10 High-quality coaxial cable e.g. double-shielded (50 Ω) 50μH Line Impedance Stabilization Network (LISN) (AC) or HVAN (DC) 11 Bulkhead connector AC/DC power supply 12 Measuring instrument AC/DC feed-through 13 RF absorber material AIS-004 (Part 3) (Rev.1) 97/149 ANNEX 7 - APPENDIX 4 BCI TEST Test configuration for ESAs involved in ""REESS charging mode coupled to the power grid"". The test shall be performed according to ISO 11452-4. Legend: ESA (grounded locally if required in test plan) HV DC harness LV Test harness HV AN LV supply HV DC load LV LISN HV DC feed-through LV load simulator HV DC load simulator Stimulation and monitoring system HV AC/DC charger harness Low relative permittivity support 17 50 μH LISN (AC) or HV AN (DC) Ground plane 18 HV AC/DC power supply Injection probe 19 HV AC/DC feed-through 10 RF signal amplifier and generator 20 2HV AC/DC load simulator (e.g. PLC) AIS-004 (Part 3) (Rev.1) 98/149 ANNEX 8 METHOD(S) OF TESTING FOR IMMUNITY TO AND EMISSION OF TRANSIENTS OF ELECTRICAL/ELECTRONIC SUB-ASSEMBLIES (See 5.8.1 and 6.19) 1.0 GENERAL This test method shall ensure the immunity of ESAs to conducted transients on the vehicle power supply and limit conducted transients from ESAs to the vehicle power supply. 2.0 IMMUNITY AGAINST DISTURBANCES CONDUCTED ALONG SUPPLY LINES Apply the test pulses 1, 2a, 2b, 3a 3b and 4 according to the International Standard ISO 7637-2: 2004 to the supply lines as well as to other connections of ESAs which may be operationally connected to supply lines. 3.0 EMISSION OF CONDUCTED DISTURBANCES ALONG SUPPLY LINES Measurement according to the International Standard ISO 7637-2: 2004 on supply lines as well as to other connections of ESAs which may be operationally connected to supply lines. AIS-004 (Part 3) (Rev.1) 99/149 ANNEX 9 METHOD(S) OF TESTING FOR EMISSION OF HARMONICS GENERATED ON AC POWER LINES FROM VEHICLE (See 6.3) 1.0 GENERAL 1.1 The test method described in this annex shall be applied to vehicles in configuration ""REESS charging mode coupled to the power grid"" 1.2 Test method This test is', '25 (second edition 2002) standard throughout the frequency range 30 to 1,000 MHz. Alternatively, if the manufacturer provides measurement data for the whole frequency band from a test laboratory accredited to the applicable parts of ISO 17025 (first edition 1999) and recognized by the Test Agency, the Test Agency may divide the frequency range in 13 frequency bands 30–50, 50-75, 75-100, 100-130, 130-165, 165-200, 200-250, 250-320, 320-400, 400-520, 520-660, 660-820, 820-1,000 MHz and perform tests at the 13 frequencies giving the highest emission levels within each band to confirm that the ESA meets the requirements of this annex. In the event that the limit is exceeded during the test, investigations shall be made to ensure that this is due to the ESA and not to background radiation. 4.4. Readings The maximum of the readings relative to the limit (horizontal/vertical polarization) in each of the 13 frequency bands shall be taken as the characteristic reading at the frequency at which the measurements were made. 43/60 AIS-004 (Part 3) ANNEX 5 - APPENDIX 1 15 m minimum radius Test sample on ground plane Antenna 1 m Figure 1 Open Area Test Site: Electrical/electronic Sub-assembly Test Area Boundary Level Clear Area Free from Electromagnetic Reflecting Surfaces 44/60 AIS-004 (Part 3) ANNEX 6 (See 5.6.1) METHOD OF MEASUREMENT OF RADIATED NARROWBAND ELECTROMAGNETIC EMISSIONS FROM ELECTRICAL/ELECTRONIC SUB-ASSEMBLIES 1. GENERAL 1.1. The test method described in this annex shall apply to ESAs, which may be subsequently fitted to vehicles, which comply, with Annex 3. 1.2 Test Method This test is intended to measure the narrowband electromagnetic emissions such as might emanate from a microprocessor-based system. If not otherwise stated in this annex the test shall be performed according to CISPR 25 (second edition 2002). 2. ESA STATE DURING TESTS The ESA under test shall be in normal operation mode. 3. TEST ARRANGEMENTS 3.1. The test shall be performed according CISPR 25 (second edition 2002) clause 6.4. - ALSE method. 3.2. Alternative measuring location As an alternative to an absorber lined shielded enclosure (ALSE) an open area test site (OATS) which complies with the requirements of CISPR 16-1 ( second edition 2002) may be used (see Appendix 1 to Annex 5). 3.3. Ambient To ensure that there is no extraneous noise or signal of a magnitude sufficient to affect materially the measurement, measurements shall be taken before or after the main test. In this measurement, the extraneous noise or signal shall be at least 6 dB below the limits of interference given in paragraph 5.6.2.1 of this standard, except for intentional narrowband ambient transmissions. 4. TEST REQUIREMENTS 4.1. The limits apply throughout the frequency range 30 to 1,000 MHz for measurements performed in semi anechoic chambers or outdoor test sites. 4.2. Measurements shall be performed with an average detector. 45/60 AIS-004 (Part 3) 4.3. Measurements The Test Agency shall perform the test at the intervals specified in the CISPR 25 (second edition 2002) standard throughout the frequency range 30 to 1,000 MHz. Alternatively, if the manufacturer provides', 'made using the method described in Annex 3 using a vehicle-to-antenna spacing of 10.0 ± 0.2 m, the limits shall be 22 dB microvolts/m in the 30 to 75 MHz frequency band and 22 to 33 dB microvolts/m in the 75 to 400 MHz frequency band, this limit increasing logarithmically with frequencies above 75 MHz as shown in Appendix 4. In the 400 to 1,000 MHz frequency band the limit remains constant at 33 dB microvolts/m. 5.3.2.2 If measurements are made using the method described in Annex 3 using a vehicle-to-antenna spacing of 3.0 ± 0.05 m, the limit shall be 32 dB microvolts/m in the 30 to 75 MHz frequency band and 32 to 43 dB microvolts/m in the 75 to 400 MHz frequency band, this limit increasing logarithmically with frequencies above 75 MHz as shown in Appendix 5. In the 400 to 1,000 MHz frequency band the limit remains constant at 43 dB microvolts/m 5.3.2.3 On the vehicle representative of its type, the measured values, expressed in dB microvolts/m, shall be below the type approval limit. 5.3.2.4 Notwithstanding the limits defined in paragraphs 5.3.2.1, 5.3.2.2 and 5.3.2.3 of this standard, if, during the initial step described in paragraph 1.3. of Annex 3 , the signal strength measured at the vehicle broadcast radio antenna is less than 20 dB microvolts over the frequency range 76 to 108 MHz measured with an average detector, then the vehicle shall be deemed to comply with the limits for narrowband emissions and no further testing will be required. AIS-004 (Part 3) (Rev.1) 10/149 5.4 Specifications Concerning Immunity of Vehicles to Electromagnetic Radiation. 5.4.1 Method of Testing The immunity to electromagnetic radiation of the vehicle representative of its type shall be tested by the method described in Annex 4. 5.4.2 Vehicle Immunity Type Approval Limits. 5.4.2.1 If tests are made using the method described in Annex 4, the field strength shall be 30 volts/m rms (root mean squared) in over 90 percent of the 20 to 2,000 MHz frequency band and a minimum of 25 volts/m rms over the whole 20 to 2,000 MHz frequency band. 5.4.2.2 The vehicle representative of its type shall be considered as complying with immunity requirements if, during the tests performed in accordance with Annex 4, there shall be no degradation of performance of ""immunity related functions 5.5 Specifications Concerning Broadband Electromagnetic Interference Generated by ESAs. 5.5.1 Method of Measurement The electromagnetic radiation generated by the ESA representative of its type shall be measured by the method described in Annex 5. 5.5.2 ESA Broadband Type Approval limits 5.5.2.1 If measurements are made using the method described in Annex 5, the limits shall be 62 to 52 dB microvolts/m in the 30 to 75 MHz frequency band, this limit decreasing logarithmically with frequencies above 30 MHz, and 52 to 63 dB microvolts/m in the 75 to 400 MHz band, this limit increasing logarithmically with frequencies above 75 MHz as shown in Appendix 6. In the 400 to 1,000 MHz frequency', '2 using a vehicle-to-antenna spacing of 3.0 ± 0.05 m, the limits shall be 42 dB microvolts/m in the 30 to 75 MHz frequency band and 42 to 53 dB microvolts/m in the 75 to 400 MHz frequency band, this limit increasing logarithmically with frequencies above 75 MHz as shown in Appendix 3. In the 400 to 1,000 MHz frequency band the limit remains constant at 53 dB microvolts/m. 5.2.2.3 On the vehicle representative of its type, the measured values, expressed in dB microvolts/m shall be below the type approval limits 7/60 AIS-004 (Part 3) 5.3 Specifications Concerning Narrowband Electromagnetic Radiation from Vehicles 5.3.1 Method of Measurement The electromagnetic radiation generated by the vehicle representative of its type shall be measured using the method described in Annex 3. These shall be defined by the vehicle manufacturer in accordance with the Test Agency. 5.3.2 Vehicle narrowband type approval limits 5.3.2.1 If measurements are made using the method described in Annex 3 using a vehicle-to-antenna spacing of 10.0 ± 0.2 m, the limits shall be 22 dB microvolts/m in the 30 to 75 MHz frequency band and 22 to 33 dB microvolts/m in the 75 to 400 MHz frequency band, this limit increasing logarithmically with frequencies above 75 MHz as shown in Appendix 4. In the 400 to 1,000 MHz frequency band the limit remains constant at 33 dB microvolts/m. 5.3.2.2 If measurements are made using the method described in Annex 3 using a vehicle-to-antenna spacing of 3.0 ± 0.05 m, the limit shall be 32 dB microvolts/m in the 30 to 75 MHz frequency band and 32 to 43 dB microvolts/m in the 75 to 400 MHz frequency band, this limit increasing logarithmically with frequencies above 75 MHz as shown in Appendix 5. In the 400 to 1,000 MHz frequency band the limit remains constant at 43 dB microvolts/m 5.3.2.3 On the vehicle representative of its type, the measured values, expressed in dB microvolts/m, shall be below the type approval limit. 5.3.2.4 Notwithstanding the limits defined in paragraphs 5.3.2.1, 5.3.2.2 and 5.3.2.3 of this standard, if, during the initial step described in paragraph 1.3. of Annex 3 , the signal strength measured at the vehicle broadcast radio antenna is less than 20 dB microvolts over the frequency range 76 to 108 MHz measured with an average detector, then the vehicle shall be deemed to comply with the limits for narrowband emissions and no further testing will be required. 5.4 Specifications Concerning Immunity of Vehicles to Electromagnetic Radiation. 5.4.1 Method of Testing The immunity to electromagnetic radiation of the vehicle representative of its type shall be tested by the method described in Annex 4. 5.4.2 Vehicle Immunity Type Approval Limits. 5.4.2.1 If tests are made using the method described in Annex 4, the field strength shall be 30 volts/m rms (root mean squared) in over 90 per cent of the 20 to 2,000 MHz frequency band and a minimum of 25 volts/m rms over the whole 20 to 2,000 MHz frequency band.', 'up to five times the bandwidth. AIS-004 (Part 3) (Rev.1) 81/149 4.4 Measurements The Test Agency shall perform the test at the intervals specified in the CISPR 25 (second edition 2002) standard throughout the frequency range 30 to 1,000 MHz. Alternatively, if the manufacturer provides measurement data for the whole frequency band from a test laboratory accredited to the applicable parts of ISO 17025 and recognized by the Test Agency, the Test Agency may divide the frequency range in 13 frequency bands 30–50, 50-75, 75-100, 100-130, 130-165, 165-200, 200-250, 250-320, 320-400, 400-520, 520-660, 660-820, 820-1,000 MHz and perform tests at the 13 frequencies giving the highest emission levels within each band to confirm that the ESA meets the requirements of this annex. In the event that the limit is exceeded during the test, investigations shall be made to ensure that this is due to the ESA and not to background radiation. 4.5 Readings The maximum of the readings relative to the limit (horizontal / vertical polarization) in each of the 13 frequency bands shall be taken as the characteristic reading at the frequency at which the measurements were made. AIS-004 (Part 3) (Rev.1) 82/149 ANNEX 5 - APPENDIX 1 15 m minimum radius Test sample on ground plane Antenna 1 m Figure 1 Open Area Test Site: Electrical/electronic Sub-Assembly test area boundary level clear area free from electromagnetic reflecting surfaces AIS-004 (Part 3) (Rev.1) 83/149 Figure 2 Test configuration for ESAs involved in ""REESS charging mode coupled to the power grid"" (example for Bi-conical antenna) Legend: ESA (grounded locally if required in test plan) Stimulation and monitoring system LV Test harness HV harness LV Load simulator (placement and ground connection according to CISPR 25 paragraph 6.4.2.5) HV load simulator Power supply (location optional) HV AN LV Artificial network (AN) HV power supply Ground plane (bonded to shielded enclosure) HV feed-through Low relative permittivity support (εr ≤ 1.4) AC/DC charger harness Biconical antenna AC/DC load simulator (e.g. Programmable Logic Controller (PLC)) High-quality coaxial cable e.g. double-shielded (50 Ω) 50μH Line Impedance Stabilization Network (LISN) (AC) or HVAN (DC) Bulkhead connector AC/DC power supply Measuring instrument AC/DC feed-through RF absorber material AIS-004 (Part 3) (Rev.1) 84/149 ANNEX 6 METHOD OF MEASUREMENT OF RADIATED NARROWBAND ELECTROMAGNETIC EMISSIONS FROM ELECTRICAL/ELECTRONIC SUB-ASSEMBLIES (See 5.6.1) 1.0 GENERAL 1.1 The test method described in this annex shall apply to ESAs, which may be subsequently fitted to vehicles, which comply, with Annex 3. This method concerns only ESA other than those involved in ""REESS charging mode coupled to the power grid"". 1.2 Test Method This test is intended to measure the narrowband electromagnetic emissions such as might emanate from a microprocessor-based system. If not otherwise stated in this annex the test shall be performed according to CISPR 25 (second edition 2002). 2.0 ESA STATE DURING TESTS The ESA under test shall be in normal operation mode. 3.0 TEST ARRANGEMENTS 3.1 The test shall be performed according to CISPR 25 (second edition 2002) clause 6.4. - ALSE method. 3.2']","['49', '24', '9', '8', '42']",['28'],"['document15.pdf', 'document14.pdf', 'document15.pdf', 'document14.pdf', 'document15.pdf']",medium,multi-hop,0.25,0.35
What is the minimum width requirement for parts of the buckle that come into contact with the body of the wearer?,At least 46 mm in width,"The minimum width requirement for parts of the buckle that come into contact with the body of the wearer is not explicitly stated in the provided context. However, it can be inferred from the mention of the provision of recommendations of ISO/4582-1980 for light conditioning (Chunk 3, page 19), which might include such specifications. Without directly stating a minimum width requirement, the document does not provide enough information to determine this value.","['out with the longest possible length. A tension load from 200 N to 22.7 kN should be applied at the specified rate. The component and its parts should be examined for any abnormalities and the vertical displacement of the rollers during the loading i.e. between 200 N and 22.7 kN should be noted. 5.6.1.5 Three-Point Type The test is carried out in the same way as the two point belt except the layout is as per Fig.2 of Annexure-14. 5.6.1.6 The buckle opening test shall be continued with a load of 665 N ± 50 N on the assembly according to para 5.6.3. 5.6.2 Dynamic Test of Belt Assembly 5.6.2.1 The belt assembly shall be mounted on a trolley equipped with the seat and the anchorages defined in para 1, 2 and 3 and Fig.1 in Annexure-15. However, if the belt assembly is intended for a specific vehicle or for specific types of vehicle, the distances between the manikin and the anchorages shall be determined by the test agency either in conformity with the fitting instructions supplied with the belt or in conformity with the data supplied by the manufacturer of the vehicle. In that case, when the dynamic test has been carried out for a type of vehicle, it need not be repeated for other types of vehicles where each anchorage point is less than 50 mm distant from the corresponding anchorage point of the tested belt. Alternatively, manufacturers may determine hypothetical anchorage positions for testing in order to enclose the maximum number of real anchorages points. If the belt is equipped with a belt adjustment device for height, the position of the device and its means of securing it shall be the same as those of the vehicle design. 5.6.2.2 In the case of a safety belt or restraint system forming part of an assembly for which approval is requested as a restraint system, the safety belt shall be mounted on the part of the vehicle structure to which the restraint system is normally fitted and this part shall be rigidly attached to the trolley as given in para 5.6.2.3. 5.6.2.3 The method used to secure the vehicle during the test shall not be such as to strengthen the anchorage of the seats or safety belts or to lessen the normal deformation of the structure. No forward movement of the vehicle shall be present which by limiting the forward movement of the manikin except the foot, would reduce the load imposed on the restraint system during the test. The discarded part of the structure can be replaced by parts of equivalent strength provided they do not hinder the forward movement of the manikin. AIS-005/2000 5.6.2.4 A securing device can be considered satisfactory if it produces no effect on the area extending over the whole width of the structure and if the vehicle or the structure is blocked or fixed at a distance of not less than 500 mm from the anchorage of the restraint system. At the rear,', 'perpendicular to the button’s initial direction of motion. For non-recessed devices, the area should not be less than 2.5 cm2 and a width not less than 10 mm. The buckle release area shall be colored red. No other externally visible parts of the buckle shall be of this colour. Direction/mode of operation “PRESS/PUSH/LIFT” shall be indicated on the buckle. 4.2.2.3 The buckle shall be capable of withstanding repeated operation and shall undergo 5000 opening and closing cycles under normal conditions of use prior to dynamic test as per para 5.6.2. In the case of harness belt buckles, the test may be carried out without all the tongues being introduced. 4.2.2.4 The buckle, when tested in accordance with 5.3.3, shall operate normally. 4.2.2.5 The buckle shall be tested for strength as prescribed in para 5.3.1 and 5.3.5, as appropriate. It must not break, be seriously distorted or become detached when subjected to the prescribed load. 4.2.2.6 In the case of buckles which incorporate a component common to the two assemblies, if the buckle of one assembly can be assembled in use with the mating part of that assembly with that of other assembly, the strength and release test as per para 5.6.2 and 5.6.3 shall also be carried out for both possible means of assembly. 4.2.3 Belt Adjustment Device 4.2.3.1 Two samples of each belt adjustment device shall be tested in accordance with the requirement of para 5.3.8. The strap slip shall not exceed 25 mm for each sample of adjusting device and the sum of shifts for all the adjusting devices shall not exceed 40 mm. 4.2.3.2 All the adjustment devices shall be tested for strength as prescribed in para 5.3.1 and 5.3.5 as appropriate. They must not break or become detached under the tension set up by the prescribed load. 4.2.3.3 When tested in accordance with para 5.3.6, the force required to operate any manually adjusting device shall not exceed 50 N. AIS-005/2000 4.2.4 Attachments and Belt Adjustment Devices for Height The attachments shall be tested for strength as prescribed in para 5.3.1. and 5.3.2 as appropriate. Belt adjustment devices for height shall be tested for strength as prescribed in para 5.3.2 unless they have been tested as part of the vehicle anchorage systems as per Draft AIS/015. These parts must not break or become detached under the tension set up by the prescribed load. 4.2.5 Retractors 4.2.5.1 Retractors, other than non-loading ones, shall be subjected to tests and fulfil the requirements specified below, including the tests for strength prescribed in para 5.3.1 and 5.3.2. 4.2.5.2 Manually Unlocking Retractors 4.2.5.2.1 The strap of a safety belt assembly equipped with a manually unlocking retractor shall not move more than 25 mm between the locking positions of the retractor. 4.2.5.2.2 The strap of a safety belt assembly shall extract from a manually unlocking retractor within 6 mm of its maximum length when a tension between 14 N and 22 N is applied to the strap in the normal direction of pull.', 'designed as to avoid breakage of the strap at or near the point of contact with the clamps. The speed of traverse shall be about 100 mm/min. The free length of the specimen between the clamps of the machine at the start of the test shall be 200 mm ± 40 mm. A recommended procedure for gripping the strap in tensile testing machine is shown in Annexure-12. 5.5.1.3 When the load reaches 10 kN, the width of the strap shall be measured without stopping the machine. 5.5.1.4 The tension shall be increased until the strap breaks and the breaking load shall be noted. AIS-005/2000 5.5.1.5 If the strap slips or breaks at the point of contact or within 10 mm of either of the clamps, the test shall be invalid and a new test shall be carried out on another specimen. 5.5.2 Conditioning of Straps 5.5.2.1 Samples cut from the strap given for testing as required by the test agency shall be conditioned : at room conditions as per para 5.5.2.2 at special conditions as per para 5.5.2.3 to 5.5.2.7 5.5.2.2 Room Conditioning The strap shall be kept for at least 24 hours in an atmosphere having temperature of 20°C ± 5°C and a relative humidity of 65 ± 5%. If the test is not carried out immediately after conditioning, the specimen shall be replaced in a hermetically closed receptacle until the test begins. The breaking load shall be determined within five minutes after removal of the strap from the conditioning atmosphere or from the receptacle. 5.5.2.3 Light Conditioning The provision of recommendations of ISO/4582-1980 shall apply. The strap shall be exposed to light for the time necessary to produce a contrast equal to Grade 4 on the gray scale on Standard Blue Dye No.7. After exposure the strap shall be conditioned and tested for breaking load as per para 5.5.2.2. 5.5.2.4 Cold Conditioning The strap shall be conditioned according to para 5.5.2.2. Then the strap shall be kept for 1.5 hours on a plane surface in a low temperature chamber in which the air temperature is kept at –30°C ± 5°C and kept under load for 30 minutes in the same low temperature chamber. Then the mass shall be removed and the breaking load shall be measured within five minutes after removal of the strap from the low temperature chamber. 5.5.2.5 Heat Conditioning The strap shall be kept for 3 hours in a heating cabinet in an atmosphere having a temperature of 60°C ± 5°C at a relative humidity of 65 ± 5%. The breaking load shall be determined within five minutes after removal of the strap from the heating cabinet. AIS-005/2000 5.5.2.6 Exposure to Water The strap shall be kept fully immersed for three hours in distilled water, at a temperature of 20 ± 5°C, to which a trace of wetting agent has been added. Any wetting agent suitable for the fibre under the test may be used. The breaking load shall be determined within ten minutes after', 'parts made of plastic under test shall then be laid in turn on a flat rigid steel surface (which has been kept with the samples in the low temperature chamber), placed on the horizontal surface of a compact rigid block with a mass of at least 100 kg, within 30 seconds of their being removed from the low-temperature chamber. An 18 kg steel mass shall be allowed to fall under gravity from a height of 300 mm on to the test sample. The impact force of the 18 kg mass shall take the form of a convex surface with a hardness of at least 45 HRC having a transverse radius of 10 mm and a longitudinal radius of 150 mm placed along the centre line of the mass. One sample shall be tested with the axis of the curved bar in line with the strap, and the other sample shall be tested at 90° to the strap. AIS-005/2000 5.3.5 Buckles having parts common to two safety belts shall be loaded in such a way as to simulate the conditions of use in a vehicle with the seats in the mid-position of their adjustment. The direction of application of the load shall be established in accordance with para 5.6.2.1. A load of 15 kN shall be applied simultaneously to each of the straps. Suitable apparatus for the above test is shown in Annexure-6. 5.3.6 When testing any manual adjusting device, the strap shall be drawn steadily through that device, having regard to normal conditions of use, at a rate of approximately 100 mm/s, and the maximum force shall be measured to the nearest 1 N after the first 25 mm of strap movement. The test shall be carried out in both directions of strap travel through the adjusting device, the strap being cycled 10 times prior to measurement. 5.3.7 Additional Tests on Safety Belts with Pre-loading Devices – Conditioning The pre-loading device may be separated from the safety belt to be tested and kept for 24 hours at a temperature of 60 ± 5°C. The temperature shall then be raised to 100 ± 5°C for two hours. Subsequently it shall be kept for 24 hours at a temperature of -30 ± 5°C. After being removed from conditioning, the device shall warm up to ambient temperature. If it has been separated it shall be fitted again to the safety belt. 5.3.8 Micro Slip Test 5.3.8.1 The samples to be submitted to the micro slip test shall be conditioned as per para 5.5.2.2. The test shall be carried out immediately after conditioning at a temperature between 15°C to 30°C. 5.3.8.2 It shall be ensured that the free section of the adjusting device points either up or down on the test bench, as in the vehicle. 5.3.8.3 A 50 N load shall be attached to the lower end of the section of strap. The other end shall be subjected to a back ad forth motion, the total amplitude being 300 ± 20 mm. A', 'Strap X 4.3.5 Elongation The elongation of the webbing shall be 20% or less when the webbing is tested by the method specified in para 5.5.3. 4.3.6 Energy Absorptivity The work and work load ratio shall not be less than the values mentioned in table below when the webbing is tested by the method specified in para 5.5.4. Type of Webbing Work, Nm/m Length Work Load Ratio Lap Webbing Continuous Webbing AIS-005/2000 4.4 Belt Assembly or Restraint Systems 4.4.1 Static Strength/Displacement Test on Seat Belt Assembly/Restraint Systems (not applicable for ELR Belt) 4.4.1.1 When tested in accordance with the provisions of para 5.6.1, the seat belt must sustain the maximum test load for the type of assembly for a minimum continuous period of 30 s. The test load shall then be reduced to 665 N ± 50 N. The force required to open the buckle in the test as prescribed in para 5.6.3 shall not exceed 60 N for button type buckle and 140 N for the lever type buckle of a two point or 3 point seat belt assembly. 4.4.1.2 The displacement shall be measured after the test load has been applied for a minimum continuous period of 30 s according to para 5.6.1 and this should not be more than 180 mm for two point and 250 mm for three point safety belt assemblies. 4.4.1.3 This requirement may be waived if the dynamic test requirement as per para 4.4.2 is met. 4.4.2 Dynamic Test 4.4.2.1 The belt assembly or restraint system shall be subjected to a dynamic test in conformity with para 5.6.2. 4.4.2.2 The dynamic test shall be performed on two assemblies which has not previously been under load. 4.4.2.3 The buckles of the belt assemblies to be tested shall have met the requirements of para 4.2.2.3. In the case of safety belts with retractors, the retractor shall have been subjected to the dust resistance test laid down in para 5.4.3. 4.4.2.4 In addition, in case of safety belts/restraint system equipped with a pre- loading device comprising pyrotechnic means, the device shall have been subjected to the conditioning specified in para 5.3.7. 4.4.2.5 The belts shall have undergone the corrosion test described in para 5.2, after which the buckle shall be subjected to 500 additional opening and closing cycles under normal conditions of use. 4.4.2.6 Safety belts with retractors shall have been subjected to the tests described in para 4.2.5.2, 4.2.5.3 or 4.2.5.4. If however, a retractor has already been subjected to the corrosion test as mentioned above, this test need not be repeated. 4.4.2.7 In the case of a belt intended for use with a belt adjustment device for height, the test shall be carried out with the device adjusted in the most unfavourable position(s) chosen by the test agency. However, if the belt adjustment device for height consists of the belt anchorage itself, as approved in accordance with the provisions of draft standard AIS-015, the test agency responsible may, at its discretion, apply the provisions']","['20', '7', '17', '14', '11']",['6'],"['document16.pdf', 'document16.pdf', 'document16.pdf', 'document16.pdf', 'document16.pdf']",easy,factual,0.2,0.6
What happens if any visible cracks are present in any plastic cover or retainer of a rigid item according to the standard?,The complete plastic part shall then be removed and the remaining assembly shall then be assessed against its continued security.,"If any visible cracks are present in any plastic cover or retainer of a rigid item according to the standard (AIS-005/2000), the following actions should be taken:

1. The item is inspected visually without opening the buckle.
2. If visible cracks are found, this is recorded in the test report.
3. In the case of restraint systems, it is also ascertained whether the parts of the vehicle structure which are attached to the trolley have undergone any visible permanent deformation. If there is any such deformation found, this is taken into account in any calculation made para 4.4.2..10.1.
4. The item is removed from the test trolley without the buckle being opened.
5. After removal, the components of the belt assembly or of the restraint device are inspected and the extent of the damage sustained by the belt assembly or restraint device during the dynamic test is recorded in the test report.","['of the device nor any significant base metal corrosion shall be visible to the unaided eye of a qualified observer. 4.2.1.3 Rigid parts intended to absorb energy or to be subjected to or to transmit a load shall not be fragile. 4.2.1.4 The rigid items and parts made of plastics of a safety belt must be so located and installed that they are not liable during every day use of the vehicle, to become trapped under a moveable seat or in a door of that vehicle. If any of these items and parts do not comply with the above conditions, they shall be subjected to the test specified in paragraph 5.3.4. After the test, the part should have no disassociation nor fragmentation and should function normally. If any visible cracks are present in any plastic cover or retainer of rigid item, the complete plastic part shall then be removed and the remaining assembly shall then be assessed against its continued security. If the remaining assembly is still secure, or no visible cracks are present, it will then be further assessed against the test requirements specified in para 4.2.2, 4.2.3 and 4.4.2. 4.2.2 Buckle 4.2.2.1 The buckle shall be so designed as to be easy to use and grasp and preclude any possibility of incorrect use. The buckle should not have any partial latch position. The procedure for opening the buckle must be evident. The parts of the buckle likely to be in contact with the body of the wearer shall present a section of not less than 20 cm2 and at least 46 mm in width, measured in a plane situated at a maximum distance of 2.5 mm from the contact surface. In the case of harness belt buckles, the latter requirement shall be regarded as satisfied if the contact area of the buckle with the wearer’s body is between 20 cm2 and 40 cm2. AIS-005/2000 4.2.2.2 The buckle, even when not under load, shall remain closed whatever be its position. It shall not be possible to release the buckle inadvertently, accidentally or with a force of less than 10 N. When it is not under load and when under a maximum load of 300 N, it shall be capable of being released by the wearer with a single simple movement of one hand in one direction. The buckle shall be released by pressing a button or activating a similar device. For the buckles with the recessed release button, the surface to which the force is applied shall have an area of not less than 4.5 cm2 and a width of not less than 15 mm with the button in the actual release position and when projected into a plane perpendicular to the button’s initial direction of motion. For non-recessed devices, the area should not be less than 2.5 cm2 and a width not less than 10 mm. The buckle release area shall be colored red. No other externally visible parts of the buckle shall be of this colour. Direction/mode', 'and Class IV devices for indirect vision and for Class III devices for indirect vision which are attached to the same mounting as Class IV devices for indirect vision. 6.3.3.2 In the case of mirrors, should the mounting of the mirror break during the tests described in clause 6.3.2. above for mirrors stuck to the windscreen, the part remaining shall not project beyond the base by more than 10 mm and the configuration remaining after the test shall satisfy the conditions laid down in clause 6.1.1.3. 6.3.3.3 The reflecting surface shall not break during the tests described in 6.3.2. However, breakage of the reflecting surface will be allowed if one of the following conditions is fulfilled: 6.3.3.3.1. the fragments of glass still adhere to the back of the housing or to a surface firmly attached to the housing; partial separation of the glass from its backing is admissible provided that this does not exceed 2.5 mm on either side of the cracks. It is permissible for small splinters AIS-001 (Part 1) (Rev.2):2023 26/46 to become detached from the surface of the glass at the point of impact. 6.3.3.3.2 the reflecting surface is made of safety glass. 6.3.3.4. In the case of camera-monitor systems, the lens shall not break during the tests described in clause 6.3.2. above. 7. EXTENSION OF TYPE APPROVAL 7.1 Every modification pertaining to the information, even if the changes are not technical in nature declared in accordance with 3.2 shall be intimated by the manufacturer to the testing agency. If the changes are in parameters not related to the provisions, no further action need be taken. If the changes are in parameters related to the provisions, the Testing Agency, which has issued the certificate of compliance, shall then consider, whether, 7.1.1 the device with the changed specifications still complies with provisions, or 7.1.2 any further verification is required to establish compliance. 7.2 For considering whether testing is required or not, guidelines given in clause 7.5 (Criteria for Extension of Approval) shall be used. 7.3 In case of clause 7.1.2, tests for only those parameters which are affected by the modifications need be carried out. 7.4 In case of fulfilment of criterion of clause 7.1.1 or after results of further verification as per clause of 7.1.2 are satisfactory, the approval of compliance shall be extended for the changes carried out. 7.5 Criteria for extension of approval The criteria for extension of approval shall be as given in Annex N. 8. CONFORMITY OF PRODUCTION 8.1 Every device for indirect vision approved pursuant to this standard shall be so manufactured as to conform to the type approved by meeting the requirements set out in Clause 6 of this standard. 8.2 Verification of the Conformity of Production procedure by the testing agencies shall be as per AIS-037, as amended from time to time. 8.3. The normal frequency of these verifications shall be once every two years. AIS-001 (Part 1) (Rev.2):2023 27/46 8.4. During the verification of Conformity of productions, the following', 'of specimens, duration of tests and the permissible losses in mass per unit are shall be agreed accordingly. 7.1 Specimens Specimens shall be complete mirror assembly with its mounting support. Five specimens are required. 7.2 Preparation of Specimens Prior to functional check, the specimens as specified in sub-clause 7.1 shall be degreased with white spirit or another suitable solvent using soft, non-fibrous cloth or a brush and subsequently weighed to the nearest ± 0.1 mg. If they cannot be weighted immediately after degreasing, The specimen shall be kept in a disiccator until weighing. After weighing the specimens shall be coated on one side with a strippable protection (e.g. self adhesive films or strippable varnishes). 7.3 Exposure The specimens shall be set up on edge, inclined at an angle of 600 to 750 to the horizontal, in the test apparatus with the test surface upwards and exposed for 240 hours under the specified test conditions. 7.4 Removal of corrosion products Before the corrosion products are removed, the coatings applied before exposure shall be stripped off. The corrosion products shall be removed from the specimens by pickling at a temperature of 18 0C to 28 0C. A hydrochloric acid inhibited with 3.5 g of hexomethylene- tetramine per liter, with ρ = 1.10 g/ml, may be used for this purpose, e.g. 500 ml of HCL with ρ = 1.19 g/ml, chemically pure, made up to 1 liter with de ionised water. AIS 001 / 2001 After the removal of corrosion products, the specimens shall be thoroughly rinsed in water, dried and subsequently kept until weighing in a disicccator at temperature of 18 0 to 28 0C. 7.5 Weighing of Specimen The specimen to be weighed to the nearest ± 1 mg. 7.6 Evaluation of functional check results The loss in mass shall be related to the surface area exposed to corrosion and expressed in g/m2. The average loss shall be 140 ± 20 g/m3. AIS 001 / 2001 ANNEX 5 WEATHER RESISTANCE TEST The test site shall be generally be placed under temperature condition of 20 +150C. Test Method 2.1 The test shall be conducted in accordance with the following procedure. 2.1.1 Mount the test parts on the test apparatus and carry out the test in accordance with the conditions given in the Table of clause 2.1.3. for 300 hours. 2.1.2 Carbons, glass filters and safety devices for electric discharge shall fit the test apparatus and be capable of correctly maintaining the performances of the test apparatus. 2.1.3 Type of test Test conditions Type of test apparatus Sunshine carbon arc system Weather- ability tester / UV lamp / Xenon lamp Item of test condition Construction of test apparatus See reference Figure 3 of JIS B 7753 Shape of the lamps Open system Number of lamps Carbon Upper electrode mm Copper coated sunshine carbon Approx. ∅36 x 350 Approx. ∅13 x 305 Electrodes Lower electrode mm Copper coated sunshine carbon Approx. ∅23 x 350 Approx. ∅13 x 305 Continuous light table hours h 60', 'front and rear bumpers. 2.2 “Vehicle type” means M1 category of vehicles which do not differ in such essential respects as: 2.2.1 The size, material and mass of the bumpers, 2.2.2 The type of mounting and mounting fasteners for the bumpers. 3.0 APPLICATION FOR APPROVAL 3.1 The vehicle manufacturer shall apply for approval by providing all the information given in Annexure I. 4.0 REQUIREMENTS 4.1 The bumper of the vehicle under approval shall not show cracks/failures at or around the anchorages when subjected to vibration durability test as described in 4.1.1 or 4.1.2 below. 4.1.1 A test bench test as described in Annexure II or 4.1.2 A full vehicle test as described in Annexure III. 4.2 Specifications of paragraph 4.1 above are deemed to be met if the vehicle equipped with the same design of bumpers and their anchorages complies with the specifications of paragraph 6 of ECE regulation No. R 42, (Apr. / 2002). 4.3 Other equivalent test methods are permitted provided that the equivalence can be demonstrated with the test conditions referred in 4.1 and 4.2. 5.0 CRITERIA FOR EXTENSION OF APPROVAL 5.1 In case of the following changes, the verification for bumper fitment shall be carried out for establishing compliance of the changed parameters to the requirements specified in this standard. 1/8 AIS-006 5.1.1 Any increase in mass of the bumper by more than 10%, 5.1.2 Decrease in thickness by more than 10%, 5.1.3 Decrease in number of anchorage points, 5.1.4 Reduction in the size of fasteners, 5.1.5 Reduction in the number of fasteners, Note: Bumpers manufactured by different bumper vendors for the same vehicle manufacturer’s proprietary design need not be tested. 5.2 If the component is manufactured by different sources to the same type approved design, no retesting is required for granting extension to the approval. 6.0 CHANGES IN THE TECHNICAL SPECIFICATIONS ALREADY TYPE APPROVED 6.1 Every modification pertaining to the information declared in accordance with paragraph 2.0 of Annexure I related to bumper mounting shall be intimated by the manufacturer to the certifying agency. 6.2 If the changes are in parameters not related to the provisions, no further action need be taken. 6.3 If the changes are in parameters related to the provisions, the Testing Agency may then consider, whether, 6.3.1 The model with the changed specifications still complies with provisions; or, 6.3.2 Any further verification is required to establish compliance. 6.4 For considering whether any further verification is required or not, guidelines given in paragraph 5 (Criteria for Extension of Approval) may be used. 6.5 In case of 6.3.1, verification for only those parameters that are affected by the modifications needs to be carried out. 6.6 In case of fulfillment of criterion of para 6.3.1 or after results of further verification as per para of 6.3.2 are successful; the approval of compliance shall be extended for the changes carried out. 2/8 AIS-006 Annexure : I INFORMATION TO BE PROVIDED BY THE VEHICLE MANUFACTURER FOR APPROVAL OF THE BUMPERS 1.0 GENERAL 1.1 Name of model/variants', 'the belt assembly or restraint system and its rigid parts shall be inspected visually, without opening the buckle, to determine whether there has been any failure or breakage. In the case of restraint systems, it shall also be ascertained, after the test, whether the parts of the vehicle structure which are attached to the trolley have undergone any visible permanent deformation. If there is any such deformation found, this shall be taken into account in any calculation made para 4.4.2..10.1. 5.6.2.13 The belt assembly shall be removed from the test trolley without the buckle being opened. The buckle opening test should be conducted according to para 5.6.3. 5.6.2.14 After the buckle opening test, the components of the belt assembly or of the restraint device shall be inspected and the extent of the damage sustained by the belt assembly or restraint device during the dynamic test shall be recorded in the test report. 5.6.3 Buckle Opening Test 5.6.3.1 For this test, belt assemblies or restraint devices which has already undergone the static strength/displacement test according to para 5.6.1 or dynamic test in conformity with para 5.6.2 shall be used. 5.6.3.2 In the case of samples subjected to static strength/displacement test, this test is continued as mentioned in 5.6.1.6. 5.6.3.3 In the case of samples subjected to dynamic test, a load shall be applied to the buckle by direct traction via the straps fixed to it so that all the straps are subjected to the force of 600/n N, where ‘n’ is the number of straps linked to the buckle when it is in a locked position and its minimum is deemed to be 2. In the case where the buckle is connected to a rigid part, the load shall be applied at the same angle as the one formed by the buckle and the rigid end during the dynamic test. 5.6.3.4 The buckle opening force shall be applied to the geometric centre of the buckle release button along a fixed axis running parallel to the initial direction of motion of the button. During the application of the force needed to open the buckle, the buckle shall be held by a rigid support. The point of contact of the test equipment shall be spherical in form with a radius of 2.5 mm ± 0.1 mm. It shall have a polished metal surface. For lift cover buckles, the buckle opening force shall be applied by a spring balance or other measuring device in a manner and direction which are normal for opening the buckle. For lever type buckles a hole of 2.5 mm dia may be drilled through the buckle tab or lever on a centre line between 3.0 mm and 3.3 mm from its edge and a small loop of soft wire may be used on the connecting link between the buckle tab or lever and the force measuring device. The buckle opening force shall be measured and any failure of the buckle noted. AIS-005/2000 5.6.4 Additional Test for Pre-loading Device The']","['6', '19', '20', '1', '22']",['6'],"['document16.pdf', 'document5.pdf', 'document3.pdf', 'document17.pdf', 'document16.pdf']",easy,factual,1.0,0.95
What is the high temperature for an exterior mirrors cooling and heating repetition test as per IS 14210 : 1994?,70 °C,"The provided documents do not explicitly state the high temperature for an exterior mirrors cooling and heating repetition test as per IS 14210 : 1994. However, the standard does provide guidelines for various tests such as thermal shock resistance, humidity resistance, etc., but no specific mention of a cooling and heating repetition test with its associated temperature parameters can be found in the provided documents.","['14210 : 1994 (Clause 6.9) - For exterior mirrors only. 11.3 Temperature resistance test as per IS 14210 : 1994 (Clause 6.10) The high temperature for an outside mirrors for cooling and heating repetition test shall be 70 0C instead of 79 0C as specified in clause 6.10 of IS 14210 : 1994. 11.4 Vibration test as per IS 14210 : 1994 (Clause 6.8). 11.5 During testing mirrors for the above tests i.e. tests specified in clauses from 11.1 to 11.4, the state of a test room shall be at temperature of 20 ±15 0C and humidity of 65 ± 20 percent. 11.6 Salt spray test This test shall be conducted as per procedure given in Annex 4. After the test there shall be no visible discolouration, poor adhesion or cracking of the reflective surface. There shall be no loss of reflectivity less than 85%, as obtained when tested as per clause 10. 11.7 Weather resistance test The test procedure shall be as per Annex 5. Xenon lamp or UV lamp may be used instead of Carbon filament lamp due to cost consideration. 12. MARKINGS 12.1 All rear-view mirrors shall have following markings: 12.1.1 Rear-View Manufacturer’s name or trade mark and identification code for complete mirror assembly. 12.2 Marking provided on rear-view mirror shall be indelible and visible when the mirror is fitted on vehicle. 12.3 For convex mirrors, following marking shall be provided: OBJECT IN THE MIRROR ARE CLOSER THAN THEY APPEAR The height of these letters shall not be less than 5 mm and not more than 6.5 mm. CONFORMITY OF PRODUCTION (COP) TESTS 13.1 The following tests shall be carried out on Rear-View mirrors for verification of Conformity of Production 13.1.1 Dimensions of mirror. 13.1.2. Dimensions of mounting. 13.1.3 Marking on mirror 13.1.4 General requirements 13.1.4 Co-efficient of Reflection (as per clause 6.3 of IS 14210: 1994) 13.1.5 Distortion factor test (as per clause 6.6 of IS 14210: 1994) 13.1.6 Test of Radius of curvature of convex surface of mirrors. AIS 001 / 2001 ANNEX 1 Technical specifications to be submitted by Rear-View Mirror Manufacturer. 1. Name of the Manufacturer : 2. Address of the Manufacturer : 3. Address of plant(s) where Mirrors are manufactured : 4. Class of Mirror : 4.1 Manufacturer’s identification : No. for Mirror 5. Trade name or mark & location: 6. Sketch showing dimensions : of mirror and Radius of curvature of reflecting surface 7. Sketch showing mounting : details and dimensions of mirror. AIS 001 / 2001 ANNEX 2 PARAMETERS FOR DECIDING THE NECESSARY TESTS FOR EXTENSION OF TYPE APPROVAL PREAMBLE: This Annex gives factors to be considered while selecting a mirror to represent a range of variants for establishing compliance for Type Approval. This is also applicable to : • Extension of Type Approval for changes in Technical Specifications of an already Type Approved Mirror. • Establishing compliance of new mirrors /variants based on an already Type Approved mirror. In general, when changes in Technical Specifications of a mirror do', 'in Annex F, shall be not less than 40 per cent. In the case of reflecting surfaces with a changeable degree of reflection, the ""day"" position shall allow the colours of the signals used for road traffic to be recognized. The value of the normal coefficient of reflection in the ""night"" position shall be not less than 4 per cent. 6.1.2.2.6. The reflecting surface shall retain the characteristics laid down in 6.1.2.2.5. in spite of prolonged exposure to adverse weather conditions in normal use. Note : 6.1.2.2.6 is general clause and no specific tests are required for verifying compliance to this clause. AIS-001 (Part 1) (Rev.1) : 2011 9/35 6.1.3. Test 6.1.3.1. Mirrors in Classes I to VI and Class VII (having fitments identical to Class III) shall be subjected to the tests described in 6.1.3.2.1 and 6.1.3.2.2. Class VII mirrors with a stem, shall be subjected to the tests described in 6.1.3.2.3. 6.1.3.1.1. The test provided for in 6.1.3.2. shall not be required in the case of any exterior mirror of which no part is less than 2 m from the ground, regardless of the adjustment position, when the vehicle is under a load corresponding to its maximum technically permissible mass. This derogation also applies to the attachments of mirrors (attachment plates, arms, swivel joints, etc.) which are situated less than 2 m from the ground and which do not project beyond the overall width of the vehicle, measured in the transverse plane passing through the lowest mirror attachments or any other point forward of this plane if this configuration produces a greater overall width. In such cases, a description specifying that the mirror shall be mounted so as to conform to the above-mentioned conditions for the positioning of its attachments on the vehicle must be provided. Where advantage is taken of this derogation, the arm shall be indelibly marked with the symbol 2m ∆ and the type-approval report shall be endorsed to this effect. 6.1.3.2. Impact test The test according to this paragraph is not to be carried out for devices integrated in the bodywork of the vehicle and providing a frontal deflecting area of an angle not more than 45° measured in relation to the longitudinal median plane of the vehicle, or devices not protruding more than 100 mm measured beyond the circumscribing bodywork of the vehicle according to IS: 13942. Note: If this test is not carried out, it shall be mentioned in the test report. 6.1.3.2.1. Description of the test rig 6.1.3.2.1.1. The test rig consists of a pendulum capable of swinging about two horizontal axes at right angles to each other, one of which is perpendicular to the plane containing the ""release"" trajectory of the pendulum. The end of the pendulum comprises a hammer formed by a rigid sphere with a diameter of 165 ± 1 mm having a 5 mm thick rubber covering of Shore A hardness 50. A device is provided which permits determination of the maximum angle assumed by the arm', 'least 20° with the vertical. The accuracy of measurement of the angle shall be within ± 1°. 9.1.1 This requirement is not applicable to rear-view mirror stuck to the windscreen, in respect of which the requirement stipulated in item 9.2 shall apply after the test. 9.1.2 The required pendulum angle of return to the vertical is reduced from 20° to 10° for all Class II, Class III & Class VI rear-view mirrors which are fitted on the mounting normally used with Class IV rear- view mirrors. AIS 001 / 2001 9.2 Should the mounting of the rear-view mirror break during the tests described in item 8.2 for rear-view mirrors stuck to the windscreen, the part remaining shall not project beyond the base by more than 1 cm and the configuration after the test shall satisfy the conditions laid down in 5.3. 9.3 The reflecting surface shall not break during the tests described in 8.2 and 8.3. However, breakage of the reflecting surface will be allowed if one of the following conditions is fulfilled. 9.3.1 The fragments of glass still adhere to the back housing or to a surface firmly attached to the housing; partial separation of the glass from its backing is permitted provided this does not exceed 2.5 mm on either side of the cracks. It is permissible for small splinters to become detached from the surface of the glass at the point of impact. 9.3.2 The reflecting surface, if made of glass, shall be made of float glass. 10. TEST METHOD FOR DETERMINING REFLECTIVITY 10.1 DEFINITIONS 10.1.1 CIE standard illuminate A(1) - Colorimetric illuminant, representing the full radiator at T68 = 2855.8 K. 10.1.2 CIE standard source A(1) - Gas-filled tungsten filament lamp operating at a correlated colour temperature of T68 = 2855.8 K. 10.1.3 CIE 1931 standard calorimetric observer(1) - Receptor of radiation whose calorimetric characteristics correspond to the spectral tristimulus values. x(λ), y(λ), z(λ) (see table 1). 10.1.4 CIE spectral tristimulus values (1) - Tristimulus values of the spectral components of an equi-energy spectrum in the CIE (XYZ) system. 10.1.5 Photopic vision(1) - Vision by the normal eye when it is adapted to levels of luminance of at least several candela per square meter. 10.2 APPARATUS 10.2.1 General The apparatus shall consist of a light source, a holder for the test sample, a receiver unit with a photo-detector and an indicating meter (see Figure 3), and means of eliminating the effects of extraneous light. AIS 001 / 2001 The receiver may incorporate a light-integrating sphere to facilitate measuring the reflectance of non-flat (convex) mirrors (see Figure 4). 10.2.2 Spectral characteristics of light source and receiver The light source shall consist of a CIE standard source A(1) and associated optics to provide a near-collimated light beam. A voltage stabilizer is recommended in order to maintain a fixed lamp voltage during instrument operation. The receiver shall have a photo detector with a spectral response proportional to the photopic luminosity function of the CIE (1931) standard calorimetric observer(1) (see', 'which, measured in centimeters, has the value ‘a’, - a segment which is parallel to the height of the rectangle, and the length of which, expressed in centimeters, has the value ‘b’. 6.2.2 The minimum values of ‘a’ and ‘b’ are given in the table below: Class of Rear-view mirrors a b II 17 / [ 1+ 1000/r ] III 13 / [ 1+ 1000/r ] 6.3 Wide-angle exterior rear-view mirrors (Class IV) The contours of the reflecting surface shall be of simple geometric form and its dimensions such that it provides, if necessary in conjunction with a Class II exterior rear-view mirror, the required field of vision. 6.4 Close-proximity exterior rear-view mirrors (Class V) The contours of the reflecting surface shall be of simple geometric form and its dimensions such that the mirror provides the required field of vision. 6.5 ‘Main’ exterior mirrors (Class VI). 6.5.1 The minimum dimensions of the reflecting surface shall be such that: 6.5.1.1 Its area shall not be less than 6900 mm² ; 6.5.1.2 The diameter of circular mirrors shall not be less than 94 mm; 6.5.1.3 Where rear-view mirrors are not circular, their dimensions shall enable a circle of diameter 78 mm to be inscribed on their reflecting surface. 6.5.2 The maximum dimensions of the reflecting surfaces shall be such that: 6.5.2.1 The diameter of any circular rear-view mirror shall not be greater than 150 mm, 6.5.2.2 The reflecting surface of any non-circular rear-view mirror shall lie within a rectangle measuring 120 mm x 200 mm. AIS 001 / 2001 REFLECTING SURFACE AND COEFFICIENTS OF REFLECTION 7.1 The reflecting surface of a rear-view mirror shall be either flat or spherically convex. 7.1.1 There shall be no cracks, cloudiness, spots, etc, on the mirror surface. 7.1.2 Differences between the radii of curvature for spherically convex mirrors. 7.1.2.1 The difference between r or r’i and rp at each reference point shall not exceed 0,15 r. 7.1.2.2 The difference between any of the radii of curvature (rp1 , rp2 and rp3) and r shall not exceed 0,15 r. 7.1.2.3 When ‘r’ is not less than 3000 mm, the value of 0.15 r quoted in items 7.1.2.1 and 7.1.2.2 is replaced by 0.25 r. 7.1.3 The value of ‘r’ for spherically convex mirrors shall not be less than; 7.1.3.1 1200 mm for interior rear-view mirrors (Class I) and Class III main exterior rear-view mirrors; 7.1.3.2 1800 mm for Class II main exterior rear-view mirrors; 7.1.3.3 400 mm for wide-angle exterior rear-view mirrors (Class IV) and close-proximity exterior rear-view mirrors (Class V). 7.1.3.4 1000 mm in the case of Class VI rear-view mirrors. 7.1.4 The value of the normal coefficient of reflection, as determined according to the method described in 10, shall not be less than 40%. If the reflecting surface has two positions (`day’ and `night’) the day position shall allow the colours of the signals used for road traffic to be recognized. The value of the normal coefficient of reflection in the night position shall not', 'of the position assumed by the arm on the plane of release makes an angle of at least 20° with the vertical. The accuracy of measurement of the angle shall be within ± 1°. 6.1.3.3.1.1 This requirement is not applicable to mirrors stuck to the windscreen, in respect of which the requirement stipulated in 6.1.3.3.2. shall apply after the test. 6.1.3.3.1.2 The required angle to the vertical is reduced from 20° to 10° for all Class II and Class IV rear-view mirrors and for Class III rear-view mirrors which are attached to the same mounting as Class IV mirrors. 6.1.3.3.2 Should the mounting of the mirror break during the tests described in 6.1.3.2. for mirrors stuck to the windscreen, the part remaining shall not project beyond the base by more than 10 mm and the configuration remaining after the test shall satisfy the conditions laid down in 6.1.1.3. 6.1.3.3.3 The reflecting surface shall not break during the tests described in 6.1.3.2. However, breakage of the reflecting surface will be allowed if one of the following conditions is fulfilled: 6.1.3.3.3.1. the fragments of glass still adhere to the back of the housing or to a surface firmly attached to the housing; partial separation of the glass from its backing is admissible provided that this does not exceed 2.5 mm on either side of the cracks. It is permissible for small splinters to become detached from the surface of the glass at the point of impact. AIS-001 (Part 1) (Rev.1) : 2011 13/35 6.1.3.3.3.2 the reflecting surface is made of safety glass. 6.2. Devices for indirect vision other than mirrors 6.2.1 General requirements 6.2.1.1 If adjustment by the user is needed, the device for indirect vision shall be adjustable without the use of tools. 6.2.1.2 If a device for indirect vision is able to only render the total prescribed field of vision by scanning the field of vision, the total process of scanning, rendering and reset to its initial position together shall not take more than 2 seconds. 6.2.2 Camera-monitor devices for indirect vision 6.2.2.1 General requirements 6.2.2.1.1 When the camera-monitor device for indirect vision is mounted on a plane surface, all parts, irrespective of the adjustment position of the device which are in potential, static contact with a sphere either 165 mm in diameter in the case of a monitor or 100 mm in diameter in the case of a camera, shall have a radius of curvature ""c"" of not less than 2.5 mm. 6.2.2.1.2 Edges of fixing holes or recesses of which the diameter or longest diagonal is less than 12 mm are exempt from the radius requirements of 6.2.2.1.1. provided that they are blunted. 6.2.2.1.3 For parts of the camera and the monitor which are made of a material with a Shore A hardness of less than 60 and which are mounted on a rigid support, the requirements of 6.2.2.1.1. shall only apply to the support. 6.2.2.2 Functional requirements 6.2.2.2.1 The camera should function well under low sunlight conditions.']","['13', '8', '9', '5', '11']",['13'],"['document3.pdf', 'document4.pdf', 'document3.pdf', 'document3.pdf', 'document4.pdf']",easy,factual,0.65,0.5
What marking should be provided for convex mirrors as per the document?,'OBJECT IN THE MIRROR ARE CLOSER THAN THEY APPEAR',"Based on the documents provided, the marking requirements for convex mirrors are not explicitly stated in the context given. However, it is mentioned that the reflecting surface of a rear-view mirror should be either flat or spherically convex (document 3, clause 7.1). The normal coefficient of reflection for convex mirrors should not be less than 40% (document 3, clause 7.1.4). For interior and main exterior rear-view mirrors, the value of 'r' (radius of curvature) is specified in document 3, clauses 7.1.3.1, 7.1.3.2, and 7.1.3.3.

Therefore, while the specific marking for convex mirrors isn't directly mentioned, it can be inferred that they should meet the general requirements for reflecting surfaces, radius of curvature, and coefficient of reflection as stated in the documents.","['of Part 1 of this standard, measured on the arc of the reflecting surface contained in a plane parallel to the greatest dimension of the mirror and passing through its centre and on the arc perpendicular to it; 2.6 ""Radius of curvature at one point on the reflecting surface (rp)"" is as defined in 2.1.1.7 of Part 1 of this standard. 2.7 ""Centre of the mirror"" is “centre of reflecting surface” as defined in 2.1.1.11 of Part 1 of this standard. 2.8 Radius of curvature of the constituent parts of the rear-view mirror"" is as defined in 2.1.1.12 of Part 1 of this standard. AIS-001 (Part 2) (Rev.1): 2011 2/14 3. APPLICATION FOR APPROVAL 3.1 Reserved 3.2 Information to be submitted at the time of applying for type approval of the mirror shall be as given in Annex A of Part 1 of this standard. Note :Sl. No.9 and its sub-paragraphs of Annex A to Part 1 are not applicable for this standard. 3.3 For each type of rear-view mirror, the application shall be accompanied by, four samples of the type of rear view mirror. Additional samples may be called for at the request of the testing agency. 3.4 Reserved. 4. MARKING 4.1. The marking shall be as specified in 4. of Part 1 of this standard. 4.2. Every rear-view mirror shall possess on its holder a space large enough to accommodate the approval mark, which must be legible when the rear-view mirror has been mounted on the vehicle; this space shall be shown on the drawings referred to Annex A of Part 1 of this standard. 5. APPROVAL 5.1. If the samples submitted for approval meet the requirements of paragraph 6 to 8 of this standard, approval of the pertinent type of rear-view mirror, shall be granted. 5.2. Approval number shall be as per AIS-037 5.3 Reserved 5.4 Reserved 5.4.1 Reserved 5.4.2 Approval number granted as per AIS-037. 5.4.3 In addition to the approval mark (5.2), An an additional symbol in the form of the letter ""L"". The additional symbol shall be placed at any convenient position. 5.5 The approval mark and the additional symbol shall be clearly legible and be indelible. 5.6 Reserved 6. GENERAL REQUIREMENTS 6.1 Provisions of 6.1.1.1 of Part 1 of this standard shall apply. 6.2. Provisions of 6.1.1.2 of Part 1 of this standard shall apply. AIS-001 (Part 2) (Rev.1): 2011 3/14 6.3. When the rear-view mirror is mounted on a plane surface, all its parts, irrespective of the adjustment position of the device, including those parts remaining attached to the holder after the test set out in 8.2., which are in potential static contact with a sphere 100 mm in diameter shall have a radius of curvature ""c"" of not less than 2.5 mm. 6.3.1. Provisions of 6.1.1.4 of Part 1 of this standard shall apply. 6.4. Provisions of 6.1.1.6 of Part 1 of this standard shall apply. 7. SPECIAL SPECIFICATIONS 7.1. Dimensions 7.1.1. The minimum dimensions of the reflecting surface shall be', 'described in 10, shall not be less than 40%. If the reflecting surface has two positions (`day’ and `night’) the day position shall allow the colours of the signals used for road traffic to be recognized. The value of the normal coefficient of reflection in the night position shall not be less than 4%. TESTS 8.1 Rear-view mirror shall be subjected to the tests described in items 8.2, 8.3, 10 and 11 for Type Approval. 8.1.1 The test provided for in item 8.2 shall not be required in the case of any exterior rear-view mirror of which no part is less than 2 m from the ground, regardless of the adjustment position, when the vehicle is under a load corresponding to its maximum permissible weight (GVW). This provision also applies to the attachments of rear-view mirrors (attachment plates, arms, swivel joints etc.) which are situated less than 2 m from the ground and which do not project beyond the overall width of the vehicle, measured in the transverse plane passing through the lowest rear-view mirror attachments or any other point forward of this plane if this configuration produces a greater overall width. AIS 001 / 2001 In such cases, a description specifying that the rear-view mirror shall be mounted so as to conform with the above mentioned conditions for the positioning of its attachments on the vehicle shall be provided. Where advantage is taken of this provision, the arm shall be indelibly marked with the symbol 2 m and the type-approval certificate shall be endorsed to this effect. 8.2 IMPACT TEST 8.2.1 Description of the test rig. 8.2.1.1 The test rig consists of a pendulum capable of swinging about two horizontal axes at right angles to each other, one of which is perpendicular to the plane containing the “release” trajectory of the pendulum. The end of the pendulum comprises a hammer formed by a rigid sphere with a diameter of 165 ± 1 mm and having a 5 mm thick rubber covering of hardness shore A 50. A device is provided which permits determination of the maximum angle assumed by the arm in the plane of release. A support firmly fixed to the structure of the pendulum serves to hold the specimens in compliance with the impact requirements specified in item 8.2.2.6. Figure 1 below gives the dimensions of the test rig and the special design specifications AIS 001 / 2001 8.2.1.2 The center of percussion of the pendulum coincides with the center of the sphere which forms the hammer. It is at a distance L, (1000+ 5 mm) from the axis of oscillation in the release plane. The reduced mass of the pendulum to its center of percussion is m0 = 6.8 ± 0.05 kg . (The relation of reduced mass of pendulum ‘m0’ to the total mass ‘m’ of the pendulum and to the distance ‘d’ between the center of gravity of the pendulum and its axis of rotation is expressed in the equation : m0 = m', 'on its perimeter, shall have a radius ‘c’ greater or equal to 2.5 mm at all points in all directions. If the reflecting surface projects beyond the protective housing, the radius of curvature ‘c’ on the edge of the projecting part shall be not less than 2.5 mm and the reflecting surface shall return into the protective housing under a force of 50 N applied to the point of greatest projection, relative to the protective housing, in a horizontal direction approximately parallel to the longitudinal median plane of the vehicle. 5.3 When the rear-view mirror is mounted on a plain surface, all parts, irrespective of the adjustment position of the device, including those parts remaining attached to the support after the test provided for in 8.2, which are in potential, static contact with a sphere either 165 mm in diameter in the case of an interior rear-view mirror or 100 mm in diameter in the case of an exterior rear-view mirror, shall have a radius of curvature ‘c’ of not less than 2.5 mm. 5.3.1 Edges of fixing holes or recesses of which the diameter or longer diagonal is less than 12 mm are exempt from the radius requirements of item 5.3 provided that they are blunted. 5.4 The device for the attachment of rear-view mirrors to the vehicle shall be so designed that a cylinder with a 50 mm radius, having as its axis the axis, or one of the axes, of pivot or rotation which ensure deflection of the rear-view mirror in the direction of impact concerned, passes through at least part of the surface to which the device is attached. 5.5 In the case of those parts of interior rear-view mirrors which are made of a material with a Shore A hardness of less than 50 and which are mounted on a rigid support and also the part of exterior rear-view mirrors which are made of a material with a Shore A hardness not exceeding 60, the requirements of 5.2 and 5.3 shall only apply to the support. 5.6 All rear-view mirrors shall be examined visually for harmful defects. 6. DIMENSIONS 6.1 Interior rear-view mirrors (Class I). The dimensions of the reflecting surface shall be such that it is possible to inscribe thereon a rectangle, one side of which is 4 cm and the other side ‘a’ cm in length, where a = 15 cm x 1 1 + 1000 r (r as defined in clause 4.6) 6.2 Main exterior rear-view mirrors (Classes II and III). AIS 001 / 2001 6.2.1 The dimensions of the reflecting surface shall be such that it is possible to inscribe therein: - a rectangle 4 cm high, the base length of which, measured in centimeters, has the value ‘a’, - a segment which is parallel to the height of the rectangle, and the length of which, expressed in centimeters, has the value ‘b’. 6.2.2 The minimum values of ‘a’ and ‘b’ are given in the table below: Class of Rear-view mirrors', 'which, measured in centimeters, has the value ‘a’, - a segment which is parallel to the height of the rectangle, and the length of which, expressed in centimeters, has the value ‘b’. 6.2.2 The minimum values of ‘a’ and ‘b’ are given in the table below: Class of Rear-view mirrors a b II 17 / [ 1+ 1000/r ] III 13 / [ 1+ 1000/r ] 6.3 Wide-angle exterior rear-view mirrors (Class IV) The contours of the reflecting surface shall be of simple geometric form and its dimensions such that it provides, if necessary in conjunction with a Class II exterior rear-view mirror, the required field of vision. 6.4 Close-proximity exterior rear-view mirrors (Class V) The contours of the reflecting surface shall be of simple geometric form and its dimensions such that the mirror provides the required field of vision. 6.5 ‘Main’ exterior mirrors (Class VI). 6.5.1 The minimum dimensions of the reflecting surface shall be such that: 6.5.1.1 Its area shall not be less than 6900 mm² ; 6.5.1.2 The diameter of circular mirrors shall not be less than 94 mm; 6.5.1.3 Where rear-view mirrors are not circular, their dimensions shall enable a circle of diameter 78 mm to be inscribed on their reflecting surface. 6.5.2 The maximum dimensions of the reflecting surfaces shall be such that: 6.5.2.1 The diameter of any circular rear-view mirror shall not be greater than 150 mm, 6.5.2.2 The reflecting surface of any non-circular rear-view mirror shall lie within a rectangle measuring 120 mm x 200 mm. AIS 001 / 2001 REFLECTING SURFACE AND COEFFICIENTS OF REFLECTION 7.1 The reflecting surface of a rear-view mirror shall be either flat or spherically convex. 7.1.1 There shall be no cracks, cloudiness, spots, etc, on the mirror surface. 7.1.2 Differences between the radii of curvature for spherically convex mirrors. 7.1.2.1 The difference between r or r’i and rp at each reference point shall not exceed 0,15 r. 7.1.2.2 The difference between any of the radii of curvature (rp1 , rp2 and rp3) and r shall not exceed 0,15 r. 7.1.2.3 When ‘r’ is not less than 3000 mm, the value of 0.15 r quoted in items 7.1.2.1 and 7.1.2.2 is replaced by 0.25 r. 7.1.3 The value of ‘r’ for spherically convex mirrors shall not be less than; 7.1.3.1 1200 mm for interior rear-view mirrors (Class I) and Class III main exterior rear-view mirrors; 7.1.3.2 1800 mm for Class II main exterior rear-view mirrors; 7.1.3.3 400 mm for wide-angle exterior rear-view mirrors (Class IV) and close-proximity exterior rear-view mirrors (Class V). 7.1.3.4 1000 mm in the case of Class VI rear-view mirrors. 7.1.4 The value of the normal coefficient of reflection, as determined according to the method described in 10, shall not be less than 40%. If the reflecting surface has two positions (`day’ and `night’) the day position shall allow the colours of the signals used for road traffic to be recognized. The value of the normal coefficient of reflection in the night position shall not', 'not a part of the fitment by the vehicle manufacturer, the sizes of mirror shall be as follows: Category vehicles Mirror Size M2 , N2 130 mm W X 240 mm H M3, N3 Upper size 183 mm W X 315 mm H Lower Size 183 mm W X 122 mm H The lower mirror would have a wider angle vision than the upper mirror 3 Wheelers Equivalent to circle of 110 mm diameter. 5.2.2 In such cases, verification would not have been carried out at the time of type approval, as the fitment of mirror would be fitted only at the time of bodybuilding. This shall be indicated in the certificate and is to be verified by the registering authority. AIS – 002/2001 6. POSITION 6.1 Rear view mirrors shall be so placed that the driver, when sitting on the driving seat, in a normal driving position, has a clear view of the road to the rear and side(s) of the vehicle. 6.2 Exterior rear-view mirrors shall be visible through side windows or through the portion of the windscreen that is swept by the windscreen wiper, nevertheless, for design reasons visibility through wiped area shall not apply to exterior rear-view mirrors fitted on left side of vehicles of categories M2 and M3 and visible 6.3 In the case of any vehicle which is in chassis/cab form when the field of vision is measured, the minimum and maximum body widths shall be stated by the manufacturer and, if necessary, simulated by dummy headboards. All vehicles and mirror configurations taken into consideration during the tests shall be shown on the test report. 6.4 The prescribed exterior rear-view mirror on the driver’s side of the vehicles shall be so located that an angle of not more than 55° is formed between the vertical longitudinal median plane of the vehicle and the vertical plane passing through the center of rear-view mirror and through the center of the straight line 65mm long which joins the driver’s two ocular points (See figure a). This condition shall deemed to have met if the vehicle manufacturer certifies so. External Rear View mirror Driver’s ocular points < 550 65mm Figure a 6.5 Rear-view mirrors shall not project beyond the exterior bodywork of the vehicle substantially more than necessary to comply with the field of vision requirements. 6.6 Where the lower edge of an exterior rear-view mirror is less than 2 m above the ground when the vehicle is loaded to its maximum permissible weight (GVW), this rear-view mirror shall not project more than 0.20 m beyond the overall width of the vehicles measured without rear-view mirrors. AIS – 002/2001 6.7 In case of vehicle satisfying field of view requirement of F6 or F7, rear view mirrors shall be mounted on vehicles in such a way that, regardless of their position after adjustment, no part of these mirrors or their holders is less than 2 m from the ground when the vehicle is under a load corresponding to its']","['2', '6', '4', '5', '3']",['13'],"['document6.pdf', 'document3.pdf', 'document3.pdf', 'document3.pdf', 'document7.pdf']",easy,factual,0.85,0.85
What tests are carried out on Rear-View mirrors for verification of Conformity of Production?,"[Dimensions of mirror, Dimensions of mounting, Marking on mirror, General requirements]","The tests for verifying the conformity of production for Rear-View mirrors, as per the provided documents, include:

1. Field of Vision (AIS-002, Part 1, Rev.2:2023, Annex P)
   - Affected field of vision requirements to be verified for optional equipment which may affect the rearward field of vision.
   - The applicable field of vision should be verified if the location of the mirror or the sensing device is changed.

2. Radius of Curvature (AIS-002, Part 1, Rev.2:2023)
   - If there is an increase in radius of curvature, the field of vision should be checked.

3. Size of Mirror (AIS – 002/2001)
   - For certain categories of vehicles, the sizes of mirrors are specified and need to be verified.

4. Position (AIS – 002/2001)
   - Rear view mirrors should be placed in such a way that the driver has a clear view of the road to the rear and side(s) of the vehicle.
   - The prescribed exterior rear-view mirror on the driver’s side of the vehicles shall meet certain angle conditions with the vertical longitudinal median plane of the vehicle.

5. Projection (AIS – 002/2001)
   - Rear-view mirrors should not project beyond the exterior bodywork of the vehicle substantially more than necessary to comply with the field of vision requirements.
   - In case of certain vehicles, the lower edge of an exterior rear-view mirror should not project more than 0.20 m beyond the overall width of the vehicles measured without rear-view mirrors.","['kept in position as shown in Figure 2. 8.3.2. The test load shall be 25 kg applied for one minute. AIS-001 (Part 2) (Rev.1): 2011 6/14 Figure 2 Example of bending test apparatus for rear view mirror holder 8.4. Results of the tests 8.4.1. Results of the test prescribed in 8.2 shall be as specified in 6.1.3.3.1, 6.1.3.3.3, 6.1.3.3.3.1 and 6.1.3.3.3.2 of Part 1 of this standard. 8.4.2 Results of the test prescribed in 8.3 shall be as specified in 6.1.3.3.3, 6.1.3.3.3.1 and 6.1.3.3.3.2 of Part 1 of this standard. 9. CONFORMITY OF PRODUCTION 9.1 Any rear-view mirror approved pursuant to this standard shall be so manufactured as to conform to the type approved by meeting the requirements set out in 6, 7 and 8 this standard. 9.2 The manufacturer shall ensure that for each type of rear-view mirror at least the tests prescribed in Annex G to this standard are carried out. 9.3 Verification of the Conformity of Production procedure by the testing agencies shall be as per AIS-037. 9.4 The normal frequency of these verifications shall be once every two years. 9.5 During the verification of Conformity of productions, the following tests may be conducted by the testing Agency 9.5.1 Reflecting surface requirements as per 7.2.2 9.5.2 Impact test pursuant to the requirements of 8.2. AIS-001 (Part 2) (Rev.1): 2011 7/14 10. PENALTIES FOR NON-CONFORMITY OF PRODUCTION Shall be as prescribed in AIS-037. EXTENSION OF TYPE APPROVAL. Procedure shall be as described in 7.0 of Part 1 of this standard. 12. to 21 Reserved 22. 22.1 TRANSITIONAL PROVISION At the request of the applicant, type approval for rear view mirror for compliance to AIS-001 (Part 2) (Rev.1):2011, shall be granted by testing agencies from 22nd February 2011 (date of adoption in CMVR-TSC). Such type approvals shall be deemed to be compliance to Class VI rear view mirrors of AIS-001:2001. 22.2 At the request of applicant, type approval of Class VI rear view mirrors compliance to AIS-001:2001 shall be granted up to the notified date of implementation of AIS-001 (Part 2) (Rev.1):2011. 22.3 Type approvals issued for compliance to Class VI rear view mirrors other than flat mirrors of AIS-001 : 2001 shall be extended to approval of AIS-001 (Part 2) (Rev.1):2011 subject to satisfactory compliance of the following: 22.3.1 Marking as per 4.0 22.3.2 In case of “E/e” approved devices, requirements specified in 23. Note: Additional verification for the above need not be carried out, if compliance to the above requirements has already been established during the type approval as per of AIS-001:2001 22.4 Extension of Approvals for engineering and administrative changes: 22.4.1 In the case of 22.1, extensions shall be granted subject to the conditions of AIS-001 (Part 2) (Rev.1):2011. Such extensions shall be deemed to be compliance to AIS-001:2001. 22.4.2 In the case of 22.2, extensions shall be granted subject to conditions of AIS-001:2001 till the notified date of implementation of AIS-001 (Part 2) (Rev.1):2011. 22.5 Type approvals for compliance to AIS-037, already been granted, shall', 'for Type Approval. This is also applicable to : • Extension of Type Approval for changes in Technical Specifications of an already Type Approved Mirror. • Establishing compliance of new mirrors /variants based on an already Type Approved mirror. In general, when changes in Technical Specifications of a mirror do not affect the performance adversely, and are still within the stipulated limits, the Type Approval can be extended without further checking/testing. If the changes affect some of the performance parameters, tests shall be carried out only for those parameters. Where some parts comments / assemblies, used on an already Type Approved mirror are used in another mode / variant, no additional tests will be needed to establish compliance of these parts, components / assemblies to the respective performance requirements. In the case of following changes, tests shown against each, are necessary to be carried out for establishing compliance. SR. NO. PARAMETER AND CHANGE TEST TO BE CONDUCTED 1. Dimensions of reflecting surfaces. If maximum and minimum dimensions are type approved and changed dimensions are within these values, no test is required, other wise dimensional check to be conducted. 2. Reduction in cross-section of material and hardness of stem. Bending and impact tests are to be conducted. 3. Change in Radius of curvature of reflecting surface. Radius of curvature, reflectivity test and distortion factor test to be conducted. 4. Change in reflective coating. Reflectivity test, Reflective surface adhesion test, Salt spray test, Temperature resistance test, to be conducted. 5. Changes in mounting dimensions adversely affecting, the performance against impact / bending test. Bending test and Impact test to be conducted. 6. Changes adversely affecting the performance against Moisture, Temperature and Weather resistance Moisture resistance test, Temperature resistance test and Weather resistance test to be conducted Changes other than those listed above are considered to be having no adverse effect on Rear-View Mirror. AIS 001 / 2001 ANNEX 3 PROCEDURE FOR THE DETERMINATION OF THE RADIUS OF CURVATURE ‘r’ OF THE REFLECTING SURFACE OF THE REAR - VIEW MIRROR 1. MEASUREMENTS 1.1 Apparatus The piece of apparatus known as ‘Spherometer’ described in Figure 5 shall be used. 1.2 Measuring Point 1.2.1 The principal radii of curvature shall be measured at three points as close as possible to one-third, one-half and two-thirds of the length of the major arc of the reflecting surface passing through the center of that surface, in a vertical plane, or of the major arc passing through the center of that surface, in a horizontal plane, if the latter part is the longer. 1.2.2 However, if the dimensions of the reflecting surface make it impossible to obtain the measurements defined in Item 7, the inspecting bodies responsible for the tests may proceed with measurement at this point in two perpendicular directions which shall be as close to as possible to those required above. 1.3 Calculation of Radius of Curvature `r’ `r’, expressed in millimeters, is calculated via the formula: rp1 + rp2 + rp3 r = Where, rp1 =', 'If maximum and minimum dimensions are type approved and changed dimensions are within these values, no test is required, other wise dimensional check to be conducted. 8.5 Change in Radius of curvature of reflecting surface. Radius of curvature to be verified. 8.6 Change in reflective coating. Reflectivity test to be verified. 8.7 Increase in cross-section of material and hardness of stem. Bending and impact tests are to be conducted. 8.8 Changes in mounting dimensions adversely affecting, the performance against impact / bending test. If height is reduced and/or horizontal distance between centre of the mirror to the base is reduced, bending test and Impact test to be conducted. 8.9 Overall shape of Housing Bending and impact tests are to be conducted. Note :Bending test is applicable only for rear mirrors described in Part 2 of this standard Devices for indirect vision other than mirrors: As agreed between test agency and device manufacturer/ applicant. AIS-001 (Part 1) (Rev.1) : 2011 33/35 ANNEX M (See introduction) COMPOSITION OF AISC PANEL ON REAR VIEW MIRRORS* Convener Mr. T. M. Balaraman Hero Honda Motors Ltd., (SIAM) Members Representing Mr. A. S. Bhale The Automotive Research Association of India (ARAI) Mr. B. V. Shamsundara The Automotive Research Association of India (ARAI) Mr. D. P. Saste Central Institute of Road Transport (CIRT) Mr. V. D. Chavan Central Institute of Road Transport (CIRT) Dr. Madhusudan Joshi International Centre for Automotive Technology (ICAT) Mr. G.R.M. Rao Vehicle Research & Dev. Estt. (VRDE) Dr. N. Karuppaiah National Automotive Testing and R&D Infrastructure Project (NATRIP) Mr. K. K. Gandhi Society of Indian Automobile Manufacturers (SIAM) Mr. G. K. Binani Society of Indian Automobile Manufacturers (SIAM) (Tata Motors Ltd) Mr. P. K. Banerjee Society of Indian Automobile Manufacturers (SIAM) (Tata Motors Ltd) Mr. R. M. Kanitkar Society of Indian Automobile Manufacturers (SIAM) (Force Motors Ltd.) Mr. Z. A. Mujawar Society of Indian Automobile Manufacturers (SIAM) (Mahindra and Mahindra Ltd) Mr. Nagendra H. V. Society of Indian Automobile Manufacturers (SIAM) (Toyota Kirloskar Motor Pvt. Ltd) Mr. Prakash Vemali Society of Indian Automobile Manufacturers (SIAM) (Mercedes Benz India Ltd. ) Mr. Jitendra Malhotra Society of Indian Automobile Manufacturers (SIAM) (Maruti Suzuki India Ltd) Mr. Sumit Sharma Society of Indian Automobile Manufacturers (SIAM) (Volkswagen India Private Ltd.) Mr. Harjeet Singh Society of Indian Automobile Manufacturers (SIAM) (Hero Honda Motors Ltd) Mr. Harsh Agrawal Society of Indian Automobile Manufacturers (SIAM) (Hero Honda Motors Ltd) Mr. S Ramiah Society of Indian Automobile Manufacturers (SIAM) (TVS Motor Company Limited) AIS-001 (Part 1) (Rev.1) : 2011 34/35 Mr. T.C. Gopalan, Tractor Manufacturers Association (TMA) Mr. K. N. D. Nambudiripad Automotive Component Manufacturers Association (ACMA) Mr. G. V. George FIEM Industries Ltd. (ACMA) Mr. Rajagopalan FIEM Industries Ltd. (ACMA) Mr. Virendra Sachdev Lumax Industries Ltd. (ACMA) Mr. Sagar Kulkarni Rinder India Pvt. Ltd. (ACMA) Mr. T. V. Singh Bureau of Indian Standards (BIS) Mr. Rajiv Agarwal All India Auto & Miniature Bulbs & Component Mfrs. Association Mr. C. K. Choudhari All India Auto & Miniature Bulbs & Component Mfrs.', 'Category of vehicle If it affects the number of compulsory or prohibited mirrors as per 15.2.1.1.1 compliance to this clause and related fields of vision to be checked. However, if the mirrors fitted optionally on the approved type has become mandatory for new type, field of vision need not be re-verified, if they have been verified already during type approval. Driving cab (forward control or bonneted) (only for N2 >7.5t and N3) If changed to forward control, fitment and field of vision for class VI mirrors to be verified. If changed to bonneted type, no verification required. AIS-002 (Part 1) (Rev.2):2023 62/65 7. Range of vehicle dimensions (overall): See Sr. No. 8. Maximum bodywork width Field of vision requirements to be verified if there is an increase in width. If decrease, no additional verification required. Type of device (mirror to other devices or vice versa) Affected vision requirements to be verified Fitment of additional optional classes of mirrors Applicable vision requirements of additional mirror to be verified. Name of manufacturer of rear view mirrors used If the location of mirror wrt. R point is not changed and/or, the dimensions of reflecting surface have not reduced, no verification required. Otherwise the applicable field of vision should be verified. Change of position of mirror with respect to R point All field of vision requirements to be verified. Description of the electronic components (if any) of the adjustment device No additional verification needed. Optional equipment which may affect the rearward field of vision: Affected field of vision requirements to be verified. Devices for indirect vision other than mirrors: 15.1 Name of manufacturer of devices used If the location of the sensing device is not changed, no verification required. Otherwise the applicable field of vision should be verified. 16. Radius of curvature If increase, field of vision to be checked. AIS-002 (Part 1) (Rev.2):2023 63/65 ANNEX P (See introduction) COMPOSITION OF AISC PANEL ON REAR VIEW MIRRORS* Panel Convener Mr. P. S. Gowrishankar SIAM (Tata Motors Ltd.) Members Representing Dr. B. V. Shamsundara The Automotive Research Association of India Ms. Sonali Tambolkar The Automotive Research Association of India Mr. Vishal P. Rawal The Automotive Research Association of India Mr. Ankit Sinha The Automotive Research Association of India Ms. Shubhangi Dalvi Central Institute of Road Transport Ms. Vijayanta Ahuja International Centre for Automotive Technology Mr. Rohit Yadav International Centre for Automotive Technology Mr. Ravi M Global Automotive Research Centre Mr. S. Nagarajan Global Automotive Research Centre Mr. Karthikeyan. K Global Automotive Research Centre Mr. Ved Prakash Gautam SIAM (Ashok Leyland Ltd.) Mr. V. Faustino SIAM (Ashok Leyland Ltd.) Mr. D. Karthikeyan, SIAM (Daimler India Com. Veh. Pvt., Ltd.) Mr. Manikandan Rama SIAM (Daimler India Com. Veh. Pvt., Ltd.) Mr. Navneet Kaushik SIAM (Honda 2 Wheeler) Mr. Sudhir Sathe SIAM (Mahindra & Mahindra Ltd.) Ms. Pushpanjali Pathak SIAM (Mahindra & Mahindra) Mr. Shailesh Kulkarni SIAM (Mahindra & Mahindra Ltd.) Mr. Karuppasamy Thangaraj SIAM (Mahindra & Mahindra Ltd.) Mr. Tangri Devinder SIAM (Mahindra & Mahindra Ltd.) Mr.', 'not a part of the fitment by the vehicle manufacturer, the sizes of mirror shall be as follows: Category vehicles Mirror Size M2 , N2 130 mm W X 240 mm H M3, N3 Upper size 183 mm W X 315 mm H Lower Size 183 mm W X 122 mm H The lower mirror would have a wider angle vision than the upper mirror 3 Wheelers Equivalent to circle of 110 mm diameter. 5.2.2 In such cases, verification would not have been carried out at the time of type approval, as the fitment of mirror would be fitted only at the time of bodybuilding. This shall be indicated in the certificate and is to be verified by the registering authority. AIS – 002/2001 6. POSITION 6.1 Rear view mirrors shall be so placed that the driver, when sitting on the driving seat, in a normal driving position, has a clear view of the road to the rear and side(s) of the vehicle. 6.2 Exterior rear-view mirrors shall be visible through side windows or through the portion of the windscreen that is swept by the windscreen wiper, nevertheless, for design reasons visibility through wiped area shall not apply to exterior rear-view mirrors fitted on left side of vehicles of categories M2 and M3 and visible 6.3 In the case of any vehicle which is in chassis/cab form when the field of vision is measured, the minimum and maximum body widths shall be stated by the manufacturer and, if necessary, simulated by dummy headboards. All vehicles and mirror configurations taken into consideration during the tests shall be shown on the test report. 6.4 The prescribed exterior rear-view mirror on the driver’s side of the vehicles shall be so located that an angle of not more than 55° is formed between the vertical longitudinal median plane of the vehicle and the vertical plane passing through the center of rear-view mirror and through the center of the straight line 65mm long which joins the driver’s two ocular points (See figure a). This condition shall deemed to have met if the vehicle manufacturer certifies so. External Rear View mirror Driver’s ocular points < 550 65mm Figure a 6.5 Rear-view mirrors shall not project beyond the exterior bodywork of the vehicle substantially more than necessary to comply with the field of vision requirements. 6.6 Where the lower edge of an exterior rear-view mirror is less than 2 m above the ground when the vehicle is loaded to its maximum permissible weight (GVW), this rear-view mirror shall not project more than 0.20 m beyond the overall width of the vehicles measured without rear-view mirrors. AIS – 002/2001 6.7 In case of vehicle satisfying field of view requirement of F6 or F7, rear view mirrors shall be mounted on vehicles in such a way that, regardless of their position after adjustment, no part of these mirrors or their holders is less than 2 m from the ground when the vehicle is under a load corresponding to its']","['5', '14', '20', '39', '3']",['13'],"['document6.pdf', 'document3.pdf', 'document4.pdf', 'document9.pdf', 'document7.pdf']",easy,factual,0.35,0.95
What is the preferred angle of the incident beam from the perpendicular to the test surface according to AIS-001 (Part 1) (Rev.2):2023?,0.44 ± 0.09 rad (25 ± 5°),"According to the provided documents, there is no specific information about the preferred angle of the incident beam from the perpendicular to the test surface in AIS-001 (Part 1) (Rev.2):2023. The documents provided focus more on the requirements for rear-view mirrors, marking, approval, general and special specifications, but not on the angle of incident beam from the perpendicular to the test surface.","[""1/2 AMENDMENT NO. 1 (05/2024) To AIS-002 (Part 1) (Rev.2):2023 Automotive Vehicles - Approval of Devices for Indirect Vision intended for use on L category with bodywork vehicles, M and N category - Installation Requirements 1. Page 4/65, clause 15.2.1.1.3 Substitute following text for the existing text in Table Main rear-view Classes III or VII: Second Para of footnote 1 in table shall be corrected as below. Where a single class III or VII rear-view mirror is fitted this shall be located on the right-hand side of the vehicle. 2. Page 9/65, clause 15.2.2.4 Substitute following text for the existing text: “15.2.2.4 The prescribed Classes II, III, IV and VII mirror or monitor on the driver’s side of the vehicle shall be so located that an angle of not more than 55° is formed between the vertical longitudinal median plane of the vehicle and the vertical plane passing through the centre of the mirror or monitor and through the centre of the straight line 65 mm long which joins the driver's two ocular points. This condition shall be met if the manufacturer certifies so for the vehicles which are already approved as per AIS-002(Part 1) (Rev. 1) and there is no change in any parameter affecting the above-mentioned requirement. For new installation requirement, verification may be carried out based on agreement between the testing agency and manufacturer/applicant. 3. Page 25/65, clause 22.4 Substitute following text for the existing text: 22.4 Extension of Approvals for engineering and administrative changes: 22.4.1 In the case of 22.1, extensions shall be granted subject to the conditions of AIS-002 (Part 1) (Rev. 2): 2023. Such extensions shall be deemed to be compliance to AIS-002 (Part 1) (Rev.1):2011. 22.4.2 In the case of 22.2, extensions shall be granted subject to conditions of AIS- 002 (Part 1) (Rev.1):2011 till the notified date of implementation of AIS-002 (Part 1) (Rev.2): 2023. 2/2 PRINTED BY THE AUTOMOTIVE RESEARCH ASSOCIATION OF INDIA P. B. NO. 832, PUNE 411 004 ON BEHALF OF AUTOMOTIVE INDUSTRY STANDARDS COMMITTEE UNDER CENTRAL MOTOR VEHICLES RULES - TECHNICAL STANDING COMMITTEE SET-UP BY MINISTRY OF ROAD TRANSPORT & HIGHWAYS (DEPARTMENT OF ROAD TRANSPORT & HIGHWAYS) GOVERNMENT OF INDIA 29th May 2024 AIS-002 (Part 1) (Rev.2):2023 I AUTOMOTIVE INDUSTRY STANDARD Automotive Vehicles – Approval of Devices for Indirect Vision intended for use on L category with bodywork vehicles, M and N category - Installation requirements (Revision 2) PRINTED BY THE AUTOMOTIVE RESEARCH ASSOCIATION OF INDIA P.B. NO. 832, PUNE 411 004 ON BEHALF OF AUTOMOTIVE INDUSTRY STANDARDS COMMITTEE UNDER CENTRAL MOTOR VEHICLE RULES – TECHNICAL STANDING COMMITTEE SET-UP BY MINISTRY OF ROAD TRANSPORT & HIGHWAYS (DEPARTMENT OF ROAD TRANSPORT & HIGHWAYS) GOVERNMENT OF INDIA May 2023 AIS-002 (Part 1) (Rev.2):2023 II INTRODUCTION 0.0 The Government of India felt the need for a permanent agency to expedite the publication of standards and development of test facilities in parallel when the work on the preparation of the standards is going on, as the development of improved safety critical parts"", 'radius of curvature ""c"" on its perimeter shall be not less than 2.5 mm at all points and in all directions. In cases, where the edge of the reflecting AIS-001 (Part 1) (Rev.2):2023 7/46 surface projects beyond the protective housing, this requirement shall apply to the edge of the projecting part. 6.1.1.3. When the mirror is mounted on a plane surface, all parts, irrespective of the adjustment position of the device, including those parts remaining attached to the support after the test provided for in clause 6.3.2 below, which are in potential static contact with a sphere either 165 mm in diameter in the case of an Class I mirror or 100 mm in diameter in the case of an Class II to VII mirror, shall have a radius of curvature \'c\' of not less than 2.5 mm. 6.1.1.4. The requirements in clause 6.1.1.2. and 6.1.1.3. above shall not apply to parts of the external surface which protrude less than 5 mm, but the outward facing angles of such parts shall be blunted, save where such parts protrude less than 1.5 mm. For determining the dimension of the projection, the following method shall apply: 6.1.1.4.1. The dimension of the projection of a component which is mounted on a convex surface may be determined either directly or by reference to a drawing of an appropriate section of this component in its installed condition. 6.1.1.4.2. If the dimension of the projection of a component which is mounted on a surface other than convex cannot be determined by simple measurement, it shall be determined by the maximum variation of the distance of the center of a 100 mm diameter sphere from the nominal line of the panel when the sphere is moved over and is in constant contact with that component. Figure 1 shows an example of the use of this procedure. Figure 1 Example for the measurement by maximum variation 6.1.1.5 Edges of fixing holes or recesses of which the diameter or longest diagonal is less than 12 mm are exempt from the radius requirements of clause 6.1.1.3. above provided that they are blunted. 6.1.1.6 The device for the attachment of mirrors to the vehicle shall be so designed that a cylinder with a 70 mm radius, (50 mm in the case of an L-category vehicle), having at its axis, or one of the axes, of pivot or rotation which ensures deflection of the mirror in the direction of AIS-001 (Part 1) (Rev.2):2023 8/46 impact concerned, passes through at least part of the surface to which the device is attached. 6.1.1.7 The parts of Classes II to VII mirrors referred to in clause 6.1.1.2. and 6.1.1.3. which are made of a material with a Shore A hardness not exceeding 60 are exempt from the relevant provisions. 6.1.1.8 In the case of those parts of Class I mirrors which are made of a material with a Shore A hardness of less than 50 and which are mounted on a rigid support, the requirements', 'least 20° with the vertical. The accuracy of measurement of the angle shall be within ± 1°. 9.1.1 This requirement is not applicable to rear-view mirror stuck to the windscreen, in respect of which the requirement stipulated in item 9.2 shall apply after the test. 9.1.2 The required pendulum angle of return to the vertical is reduced from 20° to 10° for all Class II, Class III & Class VI rear-view mirrors which are fitted on the mounting normally used with Class IV rear- view mirrors. AIS 001 / 2001 9.2 Should the mounting of the rear-view mirror break during the tests described in item 8.2 for rear-view mirrors stuck to the windscreen, the part remaining shall not project beyond the base by more than 1 cm and the configuration after the test shall satisfy the conditions laid down in 5.3. 9.3 The reflecting surface shall not break during the tests described in 8.2 and 8.3. However, breakage of the reflecting surface will be allowed if one of the following conditions is fulfilled. 9.3.1 The fragments of glass still adhere to the back housing or to a surface firmly attached to the housing; partial separation of the glass from its backing is permitted provided this does not exceed 2.5 mm on either side of the cracks. It is permissible for small splinters to become detached from the surface of the glass at the point of impact. 9.3.2 The reflecting surface, if made of glass, shall be made of float glass. 10. TEST METHOD FOR DETERMINING REFLECTIVITY 10.1 DEFINITIONS 10.1.1 CIE standard illuminate A(1) - Colorimetric illuminant, representing the full radiator at T68 = 2855.8 K. 10.1.2 CIE standard source A(1) - Gas-filled tungsten filament lamp operating at a correlated colour temperature of T68 = 2855.8 K. 10.1.3 CIE 1931 standard calorimetric observer(1) - Receptor of radiation whose calorimetric characteristics correspond to the spectral tristimulus values. x(λ), y(λ), z(λ) (see table 1). 10.1.4 CIE spectral tristimulus values (1) - Tristimulus values of the spectral components of an equi-energy spectrum in the CIE (XYZ) system. 10.1.5 Photopic vision(1) - Vision by the normal eye when it is adapted to levels of luminance of at least several candela per square meter. 10.2 APPARATUS 10.2.1 General The apparatus shall consist of a light source, a holder for the test sample, a receiver unit with a photo-detector and an indicating meter (see Figure 3), and means of eliminating the effects of extraneous light. AIS 001 / 2001 The receiver may incorporate a light-integrating sphere to facilitate measuring the reflectance of non-flat (convex) mirrors (see Figure 4). 10.2.2 Spectral characteristics of light source and receiver The light source shall consist of a CIE standard source A(1) and associated optics to provide a near-collimated light beam. A voltage stabilizer is recommended in order to maintain a fixed lamp voltage during instrument operation. The receiver shall have a photo detector with a spectral response proportional to the photopic luminosity function of the CIE (1931) standard calorimetric observer(1) (see', 'of Part 1 of this standard, measured on the arc of the reflecting surface contained in a plane parallel to the greatest dimension of the mirror and passing through its centre and on the arc perpendicular to it; 2.6 ""Radius of curvature at one point on the reflecting surface (rp)"" is as defined in 2.1.1.7 of Part 1 of this standard. 2.7 ""Centre of the mirror"" is “centre of reflecting surface” as defined in 2.1.1.11 of Part 1 of this standard. 2.8 Radius of curvature of the constituent parts of the rear-view mirror"" is as defined in 2.1.1.12 of Part 1 of this standard. AIS-001 (Part 2) (Rev.1): 2011 2/14 3. APPLICATION FOR APPROVAL 3.1 Reserved 3.2 Information to be submitted at the time of applying for type approval of the mirror shall be as given in Annex A of Part 1 of this standard. Note :Sl. No.9 and its sub-paragraphs of Annex A to Part 1 are not applicable for this standard. 3.3 For each type of rear-view mirror, the application shall be accompanied by, four samples of the type of rear view mirror. Additional samples may be called for at the request of the testing agency. 3.4 Reserved. 4. MARKING 4.1. The marking shall be as specified in 4. of Part 1 of this standard. 4.2. Every rear-view mirror shall possess on its holder a space large enough to accommodate the approval mark, which must be legible when the rear-view mirror has been mounted on the vehicle; this space shall be shown on the drawings referred to Annex A of Part 1 of this standard. 5. APPROVAL 5.1. If the samples submitted for approval meet the requirements of paragraph 6 to 8 of this standard, approval of the pertinent type of rear-view mirror, shall be granted. 5.2. Approval number shall be as per AIS-037 5.3 Reserved 5.4 Reserved 5.4.1 Reserved 5.4.2 Approval number granted as per AIS-037. 5.4.3 In addition to the approval mark (5.2), An an additional symbol in the form of the letter ""L"". The additional symbol shall be placed at any convenient position. 5.5 The approval mark and the additional symbol shall be clearly legible and be indelible. 5.6 Reserved 6. GENERAL REQUIREMENTS 6.1 Provisions of 6.1.1.1 of Part 1 of this standard shall apply. 6.2. Provisions of 6.1.1.2 of Part 1 of this standard shall apply. AIS-001 (Part 2) (Rev.1): 2011 3/14 6.3. When the rear-view mirror is mounted on a plane surface, all its parts, irrespective of the adjustment position of the device, including those parts remaining attached to the holder after the test set out in 8.2., which are in potential static contact with a sphere 100 mm in diameter shall have a radius of curvature ""c"" of not less than 2.5 mm. 6.3.1. Provisions of 6.1.1.4 of Part 1 of this standard shall apply. 6.4. Provisions of 6.1.1.6 of Part 1 of this standard shall apply. 7. SPECIAL SPECIFICATIONS 7.1. Dimensions 7.1.1. The minimum dimensions of the reflecting surface shall be', 'if this arc is the longer. G-1.2.2. Where, owing to the size of the reflecting surface, it is impossible to obtain measurements in the directions defined in 2.1.1.6. of this standard, testing agency may take measurements at the said point in two perpendicular directions as close as possible to those prescribed above. G-2. CALCULATION OF THE RADIUS OF CURVATURE ""r"" ""r"" expressed in mm is calculated from the formula p p p r r r r + + = where: rp1 = the radius of curvature at the first measuring point, rp2 = the radius of curvature at the second measuring point, rp3 = the radius of curvature at the third measuring point, AIS-001 (Part 1) (Rev.1) : 2011 29/35 Figure G-1 Spherometer (see G-1.1.) AIS-001 (Part 1) (Rev.1) : 2011 30/35 ANNEX H Reserved ANNEX J Reserved ANNEX K Reserved AIS-001 (Part 1) (Rev.1) : 2011 31/35 ANNEX L (See 7.5) CRITERIA FOR EXTENSION OF APPROVAL L-1 The verification/tests to be carried out for extending the approval to changes in the parameters are listed in the Table L-1 below: L-2 Changes other than those listed above are considered to be having no adverse effect on Rear View Mirror. Table L-1 1. Make (trade name of manufacturer): If different manufacturer complete type approval to be carried out. In case of changes in the name of manufacturerer’s or trademark for commercial reasons, type approval shall be extended without any testing. 2. Type and general commercial description(s): In the case of type change, subject to other provisions of this table, all verification shall be carried out. In case of change in commercial description, type approval shall be extended without any testing, unless additional tests are called for, because of changes in technical parameters. 3. Means of identification of the type, if indicated on the device: Type approval shall be extended without any testing. 4. Category of vehicle for which the device is intended: No extension of approval is required 5. Name and address of manufacturer: Same as for sl. No. 1 6. Location and method of affixing of the approval mark: Type approval shall be extended without any testing. 7. Address(es) of assembly plant(s): Verification of compliance to following requirements in AIS-037 need be carried out: - 5.0 Initial documentary appraisal - 6.0 Pre-test inspection Subject to compliance of the above type approval shall be extended without any further testing of samples. AIS-001 (Part 1) (Rev.1) : 2011 32/35 8. Mirrors (state for each mirror): 8.1. Variant Based on the change in parameters listed in this table 8.2. Sketch for the identification of the mirror: No verification required. 8.3. Details of the method of attachment: See 8.8 8.4 Dimensions of reflecting surfaces. If maximum and minimum dimensions are type approved and changed dimensions are within these values, no test is required, other wise dimensional check to be conducted. 8.5 Change in Radius of curvature of reflecting surface. Radius of curvature to be verified. 8.6 Change in reflective coating. Reflectivity test to be']","['0', '7', '9', '2', '19']",['23'],"['document9.pdf', 'document5.pdf', 'document3.pdf', 'document6.pdf', 'document4.pdf']",easy,factual,0.0,0.0
What is the minimum diameter of an integrating sphere used in the receiver section according to AIS-001 (Part 1) (Rev.2):2023?,127 mm (5 in.),"The minimum diameter of an integrating sphere used in the receiver section is not explicitly stated in the provided context. However, it can be inferred that the diameter should be sufficient to allow calibration at the 100% point by swinging the receiver to a position directly on the axis of the light source (see Figure F-1). Since no specific diameter is mentioned in the figure, it is not possible to determine an exact minimum value based solely on the provided context.","['radius of curvature ""c"" on its perimeter shall be not less than 2.5 mm at all points and in all directions. In cases, where the edge of the reflecting AIS-001 (Part 1) (Rev.2):2023 7/46 surface projects beyond the protective housing, this requirement shall apply to the edge of the projecting part. 6.1.1.3. When the mirror is mounted on a plane surface, all parts, irrespective of the adjustment position of the device, including those parts remaining attached to the support after the test provided for in clause 6.3.2 below, which are in potential static contact with a sphere either 165 mm in diameter in the case of an Class I mirror or 100 mm in diameter in the case of an Class II to VII mirror, shall have a radius of curvature \'c\' of not less than 2.5 mm. 6.1.1.4. The requirements in clause 6.1.1.2. and 6.1.1.3. above shall not apply to parts of the external surface which protrude less than 5 mm, but the outward facing angles of such parts shall be blunted, save where such parts protrude less than 1.5 mm. For determining the dimension of the projection, the following method shall apply: 6.1.1.4.1. The dimension of the projection of a component which is mounted on a convex surface may be determined either directly or by reference to a drawing of an appropriate section of this component in its installed condition. 6.1.1.4.2. If the dimension of the projection of a component which is mounted on a surface other than convex cannot be determined by simple measurement, it shall be determined by the maximum variation of the distance of the center of a 100 mm diameter sphere from the nominal line of the panel when the sphere is moved over and is in constant contact with that component. Figure 1 shows an example of the use of this procedure. Figure 1 Example for the measurement by maximum variation 6.1.1.5 Edges of fixing holes or recesses of which the diameter or longest diagonal is less than 12 mm are exempt from the radius requirements of clause 6.1.1.3. above provided that they are blunted. 6.1.1.6 The device for the attachment of mirrors to the vehicle shall be so designed that a cylinder with a 70 mm radius, (50 mm in the case of an L-category vehicle), having at its axis, or one of the axes, of pivot or rotation which ensures deflection of the mirror in the direction of AIS-001 (Part 1) (Rev.2):2023 8/46 impact concerned, passes through at least part of the surface to which the device is attached. 6.1.1.7 The parts of Classes II to VII mirrors referred to in clause 6.1.1.2. and 6.1.1.3. which are made of a material with a Shore A hardness not exceeding 60 are exempt from the relevant provisions. 6.1.1.8 In the case of those parts of Class I mirrors which are made of a material with a Shore A hardness of less than 50 and which are mounted on a rigid support, the requirements', 'time to time. 6.2.2. Camera-monitor systems The requirements of paragraph 6.2.2.1. shall be considered to be satisfied in the case of monitors of a vehicle that fulfills the provisions of IS 15223: 2002. 6.2.2.1. General requirements 6.2.2.1.1. When the devices of the camera-monitor system are mounted in the position recommended by the manufacturer for normal driving, all parts, irrespective of the adjustment position of the device which are in potential, static contact with a sphere either 165 mm in diameter in the case of a CMS or parts of CMS installed inside the vehicle or 100 mm in diameter in the case of a CMS or parts of CMS installed outside the vehicle, shall have a radius of curvature ""c"" of not less than 2.5 mm. 6.2.2.1.2. Edges of fixing holes or recesses of which the diameter or longest diagonal is less than 12 mm are exempt from the radius requirements of clause 6.2.2.1.1. above provided that they are blunted. 6.2.2.1.3. For parts of the camera and the monitor which are made of a material with a Shore A hardness of less than 60 and which are mounted on a rigid support, the requirements of clause 6.2.2.1.1. above shall only apply to the support. 6.2.2.2. Functional requirements for camera-monitor devices of Classes V and VI. 6.2.2.2.1. The camera shall function well in conditions in which low sunlight falls on the camera. The saturated area, defined as the area in which the luminance contrast ratio (C=Lw/Lb) of a high contrast pattern falls below 2.0, shall not cover more than 15 percent of the displayed image under the conditions of clauses 6.2.2.2.1.1. to 6.2.2.2.1.4. below. In the case the camera system shows dynamical changes in the blooming area during the test the maximum blooming area shall fulfill the requirements. 6.2.2.2.1.1 A black and white test pattern, having a minimum contrast ratio of 20 shall be positioned in front of the camera. The test pattern shall be evenly illuminated at an illumination of 3,000 ± 300 lx. The test pattern shall be medium gray on average and cover the complete area viewed by the camera; the camera shall view no other objects than the test pattern. AIS-001 (Part 1) (Rev.2):2023 12/46 6.2.2.2.1.2 The camera shall be hit by a (simulated sun) light of 40 klx, spanning an angle between 0.6 and 0.9° with an elevation angle of 10°(directly or indirectly via a mirror) removed from the optical axis of the sensor. The light source shall: (a) Have a spectrum D65 with a tolerance of ±1,500 K; (b) Be homogeneous in space and time within a tolerance of 2 klx. The emission of the light source in infrared shall be negligible. 6.2.2.2.1.3. There shall be no ambient illumination of the monitor during the test. 6.2.2.2.1.4. An example of the set-up is given in the Figure A below. Figure A – Diagram of the blooming measurement set-up 6.2.2.2.2 The monitor shall render a minimum contrast under various light conditions as specified by ISO 15008:2003. 6.2.2.2.3.', 'CIE (1931) standard colorimetric observer (see table). Any other combination of illuminate-filter-receptor giving the overall equivalent of CIE standard illuminant A and photopic vision may be used. When an integrating sphere is used in the receiver, the interior surface of the sphere shall be coated with a matt (diffusive) spectrally non-selective white coating. AIS-001 (Part 1) (Rev.2):2023 34/46 F-2.3 Geometrical conditions The angle of the incident beam ( θ) should preferably be 0.44 ± 0.09 rad (25 ± 5°) from the perpendicular to the test surface and shall not exceed the upper limit of the tolerance (i.e. 0.53 rad or 30°). The axis of the receptor shall make an angle ( θ ) with this perpendicular equal to that of the incident beam (see Figure F-1). The incident beam upon arrival at the test surface shall have a diameter of not less than 13 mm (0.5 in.). The reflected beam shall not be wider than the sensitive area of the photodetector, shall not cover less than 50 per cent of such area, and as nearly as possible shall cover the same area segment as used during instrument calibration. When an integrating sphere is used in the receiver section, the sphere shall have a minimum diameter of 127 mm (5 in.). The sample and incident beam apertures in the sphere wall shall be of such a size as to admit the entire incident and reflected light beams. The photodetector shall be so located as not to receive direct light from either the incident or the reflected beam. F-2.4 Electrical characteristics of the photodetector-indicator unit The photo detector output as read on the indicating meter shall be a linear function of the light intensity of the photosensitive area. Means (electrical and/or optical) shall be provided to facilitate zeroing and calibration adjustments. Such means shall not affect the linearity or the spectral characteristics of the instrument. The accuracy of the receptor indicator unit shall be within ± 2 per cent of full scale, or ± 10 per cent of the magnitude of the reading, whichever is the smaller F-2.5. Sample holder The mechanism shall be capable of locating the test sample so that the axes of the source arm and receptor intersect at the reflecting surface. The reflecting surface may lie within or at either face of the mirror sample, depending on whether it is a first surface, second surface or prismatic ""flip"" type mirror. F-3. PROCEDURE F-3.1. Direct calibration method In the direct calibration method, air is used as the reference standard. This method is applicable for those instruments, which are so constructed as to permit calibration at the 100 per cent point by swinging the receiver to a position directly on the axis of the light source (see Figure F-1). It may be desired in some cases (such as when measuring low-reflectivity surfaces) to use an intermediate calibration point (between 0 and 100 per cent on the scale) with this method. In these cases, a neutral density filter of known transmittance', 'field of vision. 6.1.2.2.2 Differences between the radii of curvature of mirrors 6.1.2.2.2.1 The difference between ri or r\'i, and rp at each reference point shall not exceed 0.15 r 6.1.2.2.2.2 The difference between any of the radii of curvature (rp1, rp2, and rp3) and r shall not exceed 0.15 r. 6.1.2.2.2.3 When r is not less than 3,000 mm, the value of 0.15 r quoted in clause 6.1.2.2.2.1. and 6.1.2.2.2.2. is replaced by 0.25 r. AIS-001 (Part 1) (Rev.2):2023 10/46 6.1.2.2.3 Requirements for aspherical parts of mirrors 6.1.2.2.3.1 Aspherical mirrors shall be of sufficient size and shape to provide useful information to the driver. This normally means a minimum width of 30 mm at some point. 6.1.2.2.3.2 The radius of curvature ri of the aspherical part shall not be less than 150 mm. 6.1.2.2.4 Value of \'r\' for spherical mirrors shall not be less than: 6.1.2.2.4.1 1200 mm for rear-view mirrors (Class I); 6.1.2.2.4.2 1200 mm for Class II and III main rear-view mirrors; 6.1.2.2.4.3 300 mm for ""wide-angle"" mirrors (Class IV) and ""close-proximity"" mirrors (Class V); 6.1.2.2.4.4 200 mm for front mirrors (Class VI). 6.1.2.2.4.5 1000 mm or more than 1500 mm in the case of Class VII main rear-view mirrors 6.1.2.2.5 The value of the normal coefficient of reflection, as determined according to the method described in Annex F, shall be not less than 40 per cent. In the case of reflecting surfaces with a changeable degree of reflection, the ""day"" position shall allow the colours of the signals used for road traffic to be recognized. The value of the normal coefficient of reflection in the ""night"" position shall be not less than 4 per cent. 6.1.2.2.6 The reflecting surface shall retain the characteristics laid down in 6.1.2.2.5. in spite of prolonged exposure to adverse weather conditions in normal use. Note : 6.1.2.2.6 is general clause and no specific tests are required for verifying compliance to this clause. 6.2 Devices for Indirect Vision other than Mirrors 6.2.1. General requirements 6.2.1.1. If adjustment by the user is needed, the device for indirect vision shall be adjustable without the use of tools. 6.2.1.2. If a device for indirect vision can only render the total prescribed field of vision by scanning the field of vision, the total process of scanning, rendering and reset to its initial position together shall not take more than 200 milliseconds at room temperature of 22 °C ± 5 °C AIS-001 (Part 1) (Rev.2):2023 11/46 6.2.1.3. The effectiveness of the CMS of Classes I to IV shall not be adversely affected by magnetic or electrical fields. This shall be demonstrated by compliance with the technical requirements and transitional provisions of AIS-004 (Part 3), as amended from time to time. 6.2.2. Camera-monitor systems The requirements of paragraph 6.2.2.1. shall be considered to be satisfied in the case of monitors of a vehicle that fulfills the provisions of IS 15223: 2002. 6.2.2.1. General requirements 6.2.2.1.1. When the devices of the camera-monitor system are mounted in the position recommended', 'if this arc is the longer. G-1.2.2. Where, owing to the size of the reflecting surface, it is impossible to obtain measurements in the directions defined in 2.1.1.6. of this standard, testing agency may take measurements at the said point in two perpendicular directions as close as possible to those prescribed above. G-2. CALCULATION OF THE RADIUS OF CURVATURE ""r"" ""r"" expressed in mm is calculated from the formula p p p r r r r + + = where: rp1 = the radius of curvature at the first measuring point, rp2 = the radius of curvature at the second measuring point, rp3 = the radius of curvature at the third measuring point, AIS-001 (Part 1) (Rev.1) : 2011 29/35 Figure G-1 Spherometer (see G-1.1.) AIS-001 (Part 1) (Rev.1) : 2011 30/35 ANNEX H Reserved ANNEX J Reserved ANNEX K Reserved AIS-001 (Part 1) (Rev.1) : 2011 31/35 ANNEX L (See 7.5) CRITERIA FOR EXTENSION OF APPROVAL L-1 The verification/tests to be carried out for extending the approval to changes in the parameters are listed in the Table L-1 below: L-2 Changes other than those listed above are considered to be having no adverse effect on Rear View Mirror. Table L-1 1. Make (trade name of manufacturer): If different manufacturer complete type approval to be carried out. In case of changes in the name of manufacturerer’s or trademark for commercial reasons, type approval shall be extended without any testing. 2. Type and general commercial description(s): In the case of type change, subject to other provisions of this table, all verification shall be carried out. In case of change in commercial description, type approval shall be extended without any testing, unless additional tests are called for, because of changes in technical parameters. 3. Means of identification of the type, if indicated on the device: Type approval shall be extended without any testing. 4. Category of vehicle for which the device is intended: No extension of approval is required 5. Name and address of manufacturer: Same as for sl. No. 1 6. Location and method of affixing of the approval mark: Type approval shall be extended without any testing. 7. Address(es) of assembly plant(s): Verification of compliance to following requirements in AIS-037 need be carried out: - 5.0 Initial documentary appraisal - 6.0 Pre-test inspection Subject to compliance of the above type approval shall be extended without any further testing of samples. AIS-001 (Part 1) (Rev.1) : 2011 32/35 8. Mirrors (state for each mirror): 8.1. Variant Based on the change in parameters listed in this table 8.2. Sketch for the identification of the mirror: No verification required. 8.3. Details of the method of attachment: See 8.8 8.4 Dimensions of reflecting surfaces. If maximum and minimum dimensions are type approved and changed dimensions are within these values, no test is required, other wise dimensional check to be conducted. 8.5 Change in Radius of curvature of reflecting surface. Radius of curvature to be verified. 8.6 Change in reflective coating. Reflectivity test to be']","['7', '10', '23', '9', '19']",['23'],"['document5.pdf', 'document5.pdf', 'document5.pdf', 'document5.pdf', 'document4.pdf']",easy,factual,0.3,0.75
What condition should the reflected beam meet regarding the sensitive area of the photodetector according to AIS-001 (Part 1) (Rev.2):2023?,"The reflected beam shall not be wider than the sensitive area of the photodetector, shall not cover less than 50 per cent of such area, and as nearly as possible shall cover the same area segment as used during instrument calibration.","According to AIS-001 (Part 1) (Rev.2):2023, the reflected beam should not be wider than the sensitive area of the photodetector, should cover at least 50% of such area, and ideally should cover the same area segment as used during instrument calibration. (Source: F-2.3 Geometrical conditions)","['CIE (1931) standard colorimetric observer (see table). Any other combination of illuminate-filter-receptor giving the overall equivalent of CIE standard illuminant A and photopic vision may be used. When an integrating sphere is used in the receiver, the interior surface of the sphere shall be coated with a matt (diffusive) spectrally non-selective white coating. AIS-001 (Part 1) (Rev.2):2023 34/46 F-2.3 Geometrical conditions The angle of the incident beam ( θ) should preferably be 0.44 ± 0.09 rad (25 ± 5°) from the perpendicular to the test surface and shall not exceed the upper limit of the tolerance (i.e. 0.53 rad or 30°). The axis of the receptor shall make an angle ( θ ) with this perpendicular equal to that of the incident beam (see Figure F-1). The incident beam upon arrival at the test surface shall have a diameter of not less than 13 mm (0.5 in.). The reflected beam shall not be wider than the sensitive area of the photodetector, shall not cover less than 50 per cent of such area, and as nearly as possible shall cover the same area segment as used during instrument calibration. When an integrating sphere is used in the receiver section, the sphere shall have a minimum diameter of 127 mm (5 in.). The sample and incident beam apertures in the sphere wall shall be of such a size as to admit the entire incident and reflected light beams. The photodetector shall be so located as not to receive direct light from either the incident or the reflected beam. F-2.4 Electrical characteristics of the photodetector-indicator unit The photo detector output as read on the indicating meter shall be a linear function of the light intensity of the photosensitive area. Means (electrical and/or optical) shall be provided to facilitate zeroing and calibration adjustments. Such means shall not affect the linearity or the spectral characteristics of the instrument. The accuracy of the receptor indicator unit shall be within ± 2 per cent of full scale, or ± 10 per cent of the magnitude of the reading, whichever is the smaller F-2.5. Sample holder The mechanism shall be capable of locating the test sample so that the axes of the source arm and receptor intersect at the reflecting surface. The reflecting surface may lie within or at either face of the mirror sample, depending on whether it is a first surface, second surface or prismatic ""flip"" type mirror. F-3. PROCEDURE F-3.1. Direct calibration method In the direct calibration method, air is used as the reference standard. This method is applicable for those instruments, which are so constructed as to permit calibration at the 100 per cent point by swinging the receiver to a position directly on the axis of the light source (see Figure F-1). It may be desired in some cases (such as when measuring low-reflectivity surfaces) to use an intermediate calibration point (between 0 and 100 per cent on the scale) with this method. In these cases, a neutral density filter of known transmittance', 'in Annex F, shall be not less than 40 per cent. In the case of reflecting surfaces with a changeable degree of reflection, the ""day"" position shall allow the colours of the signals used for road traffic to be recognized. The value of the normal coefficient of reflection in the ""night"" position shall be not less than 4 per cent. 6.1.2.2.6. The reflecting surface shall retain the characteristics laid down in 6.1.2.2.5. in spite of prolonged exposure to adverse weather conditions in normal use. Note : 6.1.2.2.6 is general clause and no specific tests are required for verifying compliance to this clause. AIS-001 (Part 1) (Rev.1) : 2011 9/35 6.1.3. Test 6.1.3.1. Mirrors in Classes I to VI and Class VII (having fitments identical to Class III) shall be subjected to the tests described in 6.1.3.2.1 and 6.1.3.2.2. Class VII mirrors with a stem, shall be subjected to the tests described in 6.1.3.2.3. 6.1.3.1.1. The test provided for in 6.1.3.2. shall not be required in the case of any exterior mirror of which no part is less than 2 m from the ground, regardless of the adjustment position, when the vehicle is under a load corresponding to its maximum technically permissible mass. This derogation also applies to the attachments of mirrors (attachment plates, arms, swivel joints, etc.) which are situated less than 2 m from the ground and which do not project beyond the overall width of the vehicle, measured in the transverse plane passing through the lowest mirror attachments or any other point forward of this plane if this configuration produces a greater overall width. In such cases, a description specifying that the mirror shall be mounted so as to conform to the above-mentioned conditions for the positioning of its attachments on the vehicle must be provided. Where advantage is taken of this derogation, the arm shall be indelibly marked with the symbol 2m ∆ and the type-approval report shall be endorsed to this effect. 6.1.3.2. Impact test The test according to this paragraph is not to be carried out for devices integrated in the bodywork of the vehicle and providing a frontal deflecting area of an angle not more than 45° measured in relation to the longitudinal median plane of the vehicle, or devices not protruding more than 100 mm measured beyond the circumscribing bodywork of the vehicle according to IS: 13942. Note: If this test is not carried out, it shall be mentioned in the test report. 6.1.3.2.1. Description of the test rig 6.1.3.2.1.1. The test rig consists of a pendulum capable of swinging about two horizontal axes at right angles to each other, one of which is perpendicular to the plane containing the ""release"" trajectory of the pendulum. The end of the pendulum comprises a hammer formed by a rigid sphere with a diameter of 165 ± 1 mm having a 5 mm thick rubber covering of Shore A hardness 50. A device is provided which permits determination of the maximum angle assumed by the arm', '6.1.2.1.3. ""Wide-angle"" exterior mirrors (Class IV) The contours of the reflecting surface shall be of simple geometric form and its dimensions such that it provides, if necessary in conjunction with a Class II exterior mirror, the field of vision specified in 15.2.4.4. of AIS-002 (Part 1) (Rev. 1). 6.1.2.1.4. ""Close-proximity"" exterior mirrors (Class V) The contours of the reflecting surface shall be of simple geometric form and its dimensions such that the mirror provides the field of vision specified in 15.2.4.5. of AIS-002 (Part 1) (Rev. 1). 6.1.2.1.5. Front mirrors (Class VI) The contours of the reflecting surface shall be of simple geometric form and its dimensions such that the mirror provides the field of vision specified in 15.2.4.6. of AIS-002 (Part 1) (Rev. 1). Note : Conditions given in 6.1.2.1.3, 6.1.2.1.4 and 6.1.2.1.5 are for general guidelines and need not be verified at the time of type approval of the mirror 6.1.2.1.6. Mirrors for Category L vehicles with bodywork (Class VII) 6.1.2.1.6.1 \'Main\' exterior mirrors (Class VII) The minimum dimensions of the reflecting surface shall be as per 7.1 of Part 2 of this standard. AIS-001 (Part 1) (Rev.1) : 2011 8/35 6.1.2.2 Reflecting surface and coefficients of reflection 6.1.2.2.1 The reflecting surface of a mirror shall be either flat or spherically convex. Exterior mirrors may be equipped with an additional aspherical part provided that the main mirror fulfils the requirements of the indirect field of vision. 6.1.2.2.2 Differences between the radii of curvature of mirrors 6.1.2.2.2.1 The difference between ri or r\'i, and rp at each reference point shall not exceed 0.15 r 6.1.2.2.2.2 The difference between any of the radii of curvature (rp1, rp2, and rp3) and r shall not exceed 0.15 r. 6.1.2.2.2.3 When r is not less than 3,000 mm, the value of 0.15 r quoted in 6.1.2.2.2.1. and 6.1.2.2.2.2. is replaced by 0.25 r. 6.1.2.2.3 Requirements for aspherical parts of mirrors 6.1.2.2.3.1 Aspherical mirrors shall be of sufficient size and shape to provide useful information to the driver. This normally means a minimum width of 30 mm at some point. 6.1.2.2.3.2 The radius of curvature ri of the aspherical part shall not be less than 150 mm. 6.1.2.2.4 Value of \'r\' for spherical mirrors shall not be less than: 6.1.2.2.4.1 1,200 mm for interior rear-view mirrors (Class I); 6.1.2.2.4.2 1,200 mm for Class II and III main exterior rear-view mirrors; 6.1.2.2.4.3 300 mm for ""wide-angle"" exterior mirrors (Class IV) and ""close-proximity"" exterior mirrors (Class V); 6.1.2.2.4.4 200 mm for front mirrors (Class VI). 6.1.2.2.4.5 1000 mm or more than 1500 mm in the case of Class VII mirrors 6.1.2.2.5 The value of the normal coefficient of reflection, as determined according to the method described in Annex F, shall be not less than 40 per cent. In the case of reflecting surfaces with a changeable degree of reflection, the ""day"" position shall allow the colours of the signals used for road traffic to be recognized. The value of the normal coefficient of reflection in the', 'CIE standard source A and associated optics to provide a near-collimated light beam. A voltage stabiliser is recommended in order to maintain a fixed lamp voltage during instrument operation. AIS-001 (Part 1) (Rev.1) : 2011 22/35 The receiver shall have a photodetector with a spectral response proportional to the photopic luminosity function of the CIE (1931) standard colorimetric observer (see table). Any other combination of illuminate-filter-receptor giving the overall equivalent of CIE standard illuminant A and photopic vision may be used. When an integrating sphere is used in the receiver, the interior surface of the sphere shall be coated with a matt (diffusive) spectrally non-selective white coating. F-2.3. Geometrical conditions The angle of the incident beam ( θ) should preferably be 0.44 ± 0.09 rad (25 ± 5°) from the perpendicular to the test surface and shall not exceed the upper limit of the tolerance (i.e. 0.53 rad or 30°). The axis of the receptor shall make an angle ( θ) with this perpendicular equal to that of the incident beam (see Figure F-1). The incident beam upon arrival at the test surface shall have a diameter of not less than 13 mm (0.5 in.). The reflected beam shall not be wider than the sensitive area of the photodetector, shall not cover less than 50 per cent of such area, and as nearly as possible shall cover the same area segment as used during instrument calibration. When an integrating sphere is used in the receiver section, the sphere shall have a minimum diameter of 127 mm (5 in.). The sample and incident beam apertures in the sphere wall shall be of such a size as to admit the entire incident and reflected light beams. The photodetector shall be so located as not to receive direct light from either the incident or the reflected beam. F-2.4. Electrical characteristics of the photodetector-indicator unit The photo detector output as read on the indicating meter shall be a linear function of the light intensity of the photosensitive area. Means (electrical and/or optical) shall be provided to facilitate zeroing and calibration adjustments. Such means shall not affect the linearity or the spectral characteristics of the instrument. The accuracy of the receptor indicator unit shall be within ± 2 per cent of full scale, or ± 10 per cent of the magnitude of the reading, whichever is the smaller. F-2.5. Sample holder The mechanism shall be capable of locating the test sample so that the axes of the source arm and receptor intersect at the reflecting surface. The reflecting surface may lie within or at either face of the mirror sample, depending on whether it is a first surface, second surface or prismatic ""flip"" type mirror. AIS-001 (Part 1) (Rev.1) : 2011 23/35 F-3. PROCEDURE F-3.1. Direct calibration method In the direct calibration method, air is used as the reference standard. This method is applicable for those instruments, which are so constructed as to permit calibration at the 100 per cent point by swinging the receiver', 'and associated optics to provide a near-collimated light beam. A voltage stabilizer is recommended in order to maintain a fixed lamp voltage during instrument operation. The receiver shall have a photo detector with a spectral response proportional to the photopic luminosity function of the CIE (1931) standard calorimetric observer(1) (see table 1). Any other combination of illuminant-filter-receptor giving the overall equivalent of CIE standard illuminant A(1) and photopic vision may be used. When an integrating sphere is used in the receiver, the interior surface of the sphere shall be coated with a mart (diffusive) spectrally non-selective white coating. 10.2.3 Geometrical conditions The angle of the incident beam (θ) should preferably be 0.44 ± 0 .09 rad (25 ± 5°) from the perpendicular to the test surface and shall not exceed the upper limit of the tolerance (i.e. 0,53 rad or 30°). The axis of the receptor shall make an angle (θ) with this perpendicular equal to that of the incident beam (see Figure 3). The incident beam upon the arrival at the test surface shall have a diameter of not less than 19 mm (0.75 in.). The reflected beam shall not be wider than the sensitive area of the photo-detector, shall not cover less than 50% of such area, and as nearly as possible shall cover the same area segment as used during instrument calibration. When an integrating sphere is used in the receiver section, the sphere shall have a minimum diameter of 127 mm (5 in.). The sample and incident beam apertures in the sphere wall shall be of such a size as to admit the entire incident and reflected light beams. The photo detector shall be so located as not to receive direct light from either the incident or the reflected beam. 10.2.4 Electrical characteristics of the photo detector-indicator unit The photo detector output as read on the indicating meter shall be a linear function of the light intensity on the photosensitive area. Means (electrical and/or optical) shall be provided to facilitate zeroing and calibration adjustments. Such means shall not affect the linearing or the spectral characteristics of the instrument. The accuracy of the receptor-indicator unit shall be within ± 2% of full scale, or ± 10% of the magnitude of the reading, whichever is the smaller. 10.2.5 Sample holder The mechanism shall be capable of locating the test sample so that the axes of the source arm and receptor intersect at the reflecting surface. The reflecting surface may lie within or at either face of the mirror sample, depending on whether it is a first-surface, second-surface or prismatic `flip’-type mirror. (1) Definitions taken from CIE publication 50(45), International Electronical Vocabulary,Group 45: Lighting. AIS 001 / 2001 10.3 Procedure 10.3.1 Direct Calibration method In the direct calibration method, air is used as the reference standard. This method is applicable for those instruments which are so constructed as to permit calibration at the 100% point by swinging the receiver to a position directly on the axis of the light']","['23', '8', '7', '16', '10']",['23'],"['document5.pdf', 'document4.pdf', 'document4.pdf', 'document4.pdf', 'document3.pdf']",easy,factual,1.0,0.95
What is the date when AIS-002 (Part 2) (Rev.1):2011 was adopted?,22nd February 2011,"Based on the provided documents, there is no specific mention of the date when AIS-002 (Part 2) (Rev.1):2011 was adopted. The documents only provide information about revisions and extensions for this standard, but not its initial adoption date.","['established during the type approval as per AIS-001:2001. 21.4 Extension of Approvals for engineering and administrative changes: 21.4.1 In the case of 21.1, extensions shall be granted subject to the conditions of AIS-001 (Part 1) (Rev.1):2011. Such extensions shall be deemed to be compliance to AIS-001:2001. 21.4.2 In the case of 21.2, extensions shall be granted subject to conditions of AIS-001:2001 till the notified date of implementation AIS-001 (Part 1) (Rev.1):2011. 21.5 Type approvals for compliance to AIS-037, already been granted, shall continue to be valid for AIS-001 (Rev.1) (Part 1):2011. Note: Necessary corrections to the reference of verification reports as per this standard shall be incorporated while issuing the next COP certificate. In the meantime for issuing of vehicle certificate, test/verification report as per this standard shall deemed to be the proof of compliance of AIS-037. ESTABLISHING COMPLIANCE OF “E”/“e” APPROVED DEVICES TO THIS STANDARDS 22.1 As an exception to 7.4 of AIS-037, (or related administrative decisions) for certifying compliance of “E”/”e” approved rear-view mirrors devices to this standard, the test for the following shall be carried out by testing agency 22.1.1 Requirements of dimension as per 6.1.2.1 22.1.2 Requirements of reflecting surfaces as per 6.1.2.2 AIS-001 (Part 1) (Rev.1) : 2011 17/35 AMENDMENTS TO ECE REGULATIONS AFTER THE LEVEL DESCRIBED IN 0.3 OF INTRODUCTION 23.1 Supplements In case of changes in ECE regulation, which are issued as supplements (Supplements do not affect the earlier type approvals) at the request of applicant, approval of compliance to this standard shall be issued taking into account the changes arising out of such supplement(s) to ECE regulation with approval from Chairman AISC. This shall be incorporated in the test report. Note: Such changes will be considered for inclusion in this standard at the time of its next amendment /revision. 23.2 Series of amendments Changes in ECE regulation, which are issued as series of amendments (series of amendments may affect the earlier type approvals) will not be considered for issuing approval to this standard. However, Chairman, AISC may, on a case to case basis, permit to accept latest series of amendments. This shall be incorporated in the test report. Note: Such changes will be considered for inclusion in this standard at the time of its next revision. AIS-001 (Part 1) (Rev.1) : 2011 18/35 ANNEX A (See 3.1) INFORMATION TO BE SUBMITTED AT THE TIME OF APPLYING FOR TYPE APPROVAL A1 The information given in Table A1, if applicable, shall be supplied and shall include a list of contents. A2 Any sketches shall be supplied in appropriate scale and in sufficient detail. A3 Photographs, if any, shall show sufficient detail. Table A1 (See A1) 1. Make (trade name of manufacturer): 2. Type and general commercial description(s): 3. Means of identification of the type, if indicated on the device: 4. Category of vehicle for which the device is intended: 5. Name and address of manufacturer: 6. Location and method of affixing of the approval mark: 7. Address(es) of assembly plant(s): 8. Mirrors (state for', '(Part 2) (Rev.1):2011. Such extensions shall be deemed to be compliance to AIS-001:2001. 22.4.2 In the case of 22.2, extensions shall be granted subject to conditions of AIS-001:2001 till the notified date of implementation of AIS-001 (Part 2) (Rev.1):2011. 22.5 Type approvals for compliance to AIS-037, already been granted, shall continue to be valid for AIS-001 (Part 2) (Rev.1):2011. Note : Necessary corrections to the reference of verification reports as per this standard shall be incorporated while issuing the next COP certificate. In the meantime for issuing of vehicle certificate, test/verification report as per this standard shall deemed to be the proof of compliance of AIS-037. AIS-001 (Part 2) (Rev.1): 2011 8/14 ESTABLISHING COMPLIANCE OF “E”/“e” MARKED APPROVED REAR-VIEW MIRRORS DEVICES TO THIS STANDARDS 23.1 As an exception to 7.4 of AIS-037, (or related administrative decisions) for certifying compliance of “E”/”e” marked approved rear-view mirrors to this standard, the test for the following shall be carried out by testing agency 23.1.1 Requirements of dimension as per 7.1 23.1.2 Requirements of reflecting surfaces as per 7.2 AMENDMENTS TO ECE REGULATIONS AFTER THE LEVEL DESCRIBED IN 0.3 OF INTRODUCTION 24.1 Supplements In case of changes in ECE regulation, which are issued as supplements (Supplements do not affect the earlier type approvals) at the request of applicant, approval of compliance to this standard shall be issued taking into account the changes arising out of such supplement(s) to ECE regulation with approval from Chairman AISC. This shall be incorporated in the test report. Note : Such changes will be considered for inclusion in this standard at the time of its next amendment /revision. 24.2 Series of amendments Changes in ECE regulation, which are issued as series of amendments (series of amendments may affect the earlier type approvals) will not be considered for issuing approval to this standard. However, Chairman, AISC may, on a case to case basis, permit to accept latest series of amendments. This shall be incorporated in the test report. Note : Such changes will be considered for inclusion in this standard at the time of its next revision. AIS-001 (Part 2) (Rev.1): 2011 9/14 Annex A (Reserved) Annex B (Reserved) Annex C (Reserved) Annex D (Reserved) Annex E (Reserved) Annex F (Reserved) AIS-001 (Part 2) (Rev.1): 2011 10/14 ANNEX G (See 9.2) CONTROL OF THE CONFORMITY OF PRODUCTION FOR REAR VIEW MIRRORS (Periodic tests to be carried out by the manufacturer) G 1. DEFINITIONS For the purpose of this Annex, ""Type of deflection system"" means a given combination of axes, swivel points and other articulating mechanisms, which ensures deflection of the rear-view mirror in the direction of impact concerned. G 2. TESTS Rear-view mirrors shall be subjected to the following tests: G-2.1. Reflecting surface G-2.1.1. Verification of the nominal radius of curvature, pursuant to the requirements of G-2 of Annex G of Part 1 of this standard. G-2.1.2. Measurement of the differences between radii of curvature pursuant to the requirements of 7.2.2. G-2.2. Deflection system Impact test pursuant to the requirements', 'AIS-000 I AUTOMOTIVE INDUSTRY STANDARD Administrative Procedure to deal with Corrigendum, Amendments or Revisions to AIS, TAP 115/116, CMVR Notifications, IS and ISO standards, which are notified under CMVR PRINTED BY THE AUTOMOTIVE RESEARCH ASSOCIATION OF INDIA P.B. NO. 832, PUNE 411 004 ON BEHALF OF AUTOMOTIVE INDUSTRY STANDARDS COMMITTEE UNDER CENTRAL MOTOR VEHICLE RULES – TECHNICAL STANDING COMMITTEE SET-UP BY MINISTRY OF ROAD TRANSPORT & HIGHWAYS (DEPARTMENT OF ROAD TRANSPORT & HIGHWAYS) GOVERNMENT OF INDIA October 2013 AIS-000 II Status chart of the standard to be used by the purchaser for updating the record Sr. No. Corrigenda. Amendment Revision Date Remark Misc. General remarks : AIS-000 III Administrative Procedure to deal with Corrigendum, Amendments or Revisions to AIS, TAP 115 / 116, CMVR Notifications, IS and ISO standards, which are notified under CMVR Para. No. Contents Page No. 1. Introduction 1/21 Scope 2/21 Definitions 2/21 General guidelines for approval of changes in published AIS 7/21 General guidelines for transitional provisions in AIS / TAP 115/116 9/21 Provisions regarding IS 11/21 General guidelines for approval of changes in published TAP 115/116 14/21 General guidelines for approval of changes in published CMVR Notifications including CMV Rule 115 16/21 Provisions regarding changes in ISO standards related to vehicle/ component approval notified under CMVR 16/21 Acceptance of changes in the UN/ GTR regulation, the base standard for AIS/ TAP 115/116 17/21 Annexures Annexure I Mapping of terms for equivalence 18/21 Annexure II Abbreviations used 19/21 Annexure III Composition of AISC panel on Administrative Procedure to deal with Corrigendum, Amendments or Revisions to AIS, TAP 115 / 116, CMVR Notifications, IS and ISO standards, which are notified under CMVR 20/21 Annexure IV Committee composition of AISC 21/21 AIS-000 1/21 Administrative Procedure to deal with Corrigendum, Amendments or Revisions to AIS, TAP 115 / 116, CMVR Notifications, IS and ISO standards, which are notified under CMVR 1.0 INTRODUCTION 1.1 Automotive Industry Standards Committee (AISC) is constituted by Ministry of Road Transport & Highways to formulate safety standards for automotive components, systems and vehicle level testing and type approval. Automotive Industry Standard (AIS), which are published on behalf of AISC, are technically based on equivalent UN Regulations/ EC Directives/ Global Technical Regulations (GTRs). AIS are notified as mandatory requirements under Central Motor Vehicles Rules (CMVR). On account of technological advancements and revisions in corresponding base regulations or any other technical/administrative reasons, AIS will be undergoing modifications from time to time. Transitional provisions related to implementation of such modified standards, granting approvals as per modified standards and extending the previous type approvals are therefore necessary. 1.2 Apart from these AIS, several Indian Standards (IS) are also notified under CMVR. As per the directive from government, existing AIS will be subsequently converted to IS by Bureau of Indian Standards (BIS). While modifications of IS is the primary responsibility of BIS, however transitional provisions related to implementation of such modified IS through CMVR are not addressed by BIS. Hence this document also addresses this aspect. 1.3 On the similar', 'be deemed to be compliance to AIS-002 (Part 1) (Rev.1):2011. 22.2 At the request of applicant, type approval to the compliance to AIS-002 (Part 1) (Rev.1):2011 shall be granted up to the notified date of implementation of AIS-002 (Part 1) (Rev. 2): 2023. 22.3 Type approvals issued for compliance to AIS-002 (Part 1) (Rev.1):2011 shall: 22.3.1 be extended for L category vehicles without any further verification, for compliance to AIS-002 (Part 1) (Rev. 2): 2023. 22.3.2 not be extended for M and N category vehicles for compliance to AIS-002 (Part 1) (Rev. 2): 2023. Note: Additional verification for the above need not be carried out, if compliance to the above requirements has already been established during the type approval as per AIS-002 (Part 1) (Rev.1):2011. 22.4 Extension of Approvals for engineering and administrative changes: 22.4.2 In the case of 21.1, extensions shall be granted subject to the conditions of AIS-002 (Part 1) (Rev. 2): 2023. Such extensions shall be deemed to be compliance to AIS-002 (Part 1) (Rev.1):2011. 22.4.2 In the case of 21.2, extensions shall be granted subject to conditions of AIS-002 (Part 1) (Rev.1):2011 till the notified date of implementation of AIS-002 (Part 1) (Rev.2): 2023. AIS-002 (Part 1) (Rev.2):2023 26/65 AMENDMENTS TO UN REGULATIONS AFTER THE LEVEL DESCRIBED IN 0.3 OF INTRODUCTION 23.1 Supplements In case of changes in UN regulation, which are issued as supplements (Supplements do not affect the earlier type approvals) at the request of applicant, approval of compliance to this standard shall be issued taking into account the changes arising out of such supplement(s) to UN regulation with approval from Chairman AISC. This shall be incorporated in the test report. Note: Such changes will be considered for inclusion in this standard at the time of its next amendment /revision. 23.2 Series of amendments Changes in UN regulation, which are issued as series of amendments (series of amendments may affect the earlier type approvals) will not be considered for issuing approval to this standard. However, Chairman, AISC may, on a case to case basis, permit to accept latest series of amendments. This shall be incorporated in the test report. Note: Such changes will be considered for inclusion in this standard at the time of its next revision. AIS-002 (Part 1) (Rev.2):2023 27/65 ANNEX A (Reserved) AIS-002 (Part 1) (Rev.2):2023 28/65 ANNEX B (See 13.1) INFORMATION TO BE SUBMITTED AT THE TIME OF TYPE APPROVAL B-1 The specification submitted by manufacturer (applicant) at the time of applying for the type approval of the vehicle to this standard shall contain at least the information set out in the following entries of AIS-007 (Revision 5): Table 1A 0.1 to 0.9, 1.2 and 9 of detailed specifications (For L category vehicles only) Table 2 A1.1, A1.7.1, A.2.1, A.2.1.1, A.2.1.2, A2.2, A2.1.5 (For M and N category vehicles) Table 3 B1.2, B27.1 to B27.8 (For M and N category vehicles) Following additional information shall also be provided along with the type approval application. 1. In case of L-category vehicles', 'in ECE regulation, which are issued as series of amendments (series of amendments may affect the earlier type approvals) will not be considered for issuing approval to this standard. However, Chairman, AISC may, on a case to case basis, permit to accept latest series of amendments. This shall be incorporated in the test report. Note : Such changes will be considered for inclusion in this standard at the time of its next revision. AIS-002 (Part 1)(Rev.1):2011 21/42 ANNEX A (Reserved) AIS-002 (Part 1)(Rev.1):2011 22/42 ANNEX B (See 13.1) INFORMATION TO BE SUBMITTED AT THE TIME OF TYPE APPROVAL B-1 The specification submitted by manufacturer (applicant) at the time of applying for the type approval of the vehicle to this standard shall contain at least the information set out in the following entries of AIS-007(Revision 3): Table 1 1.1, 1.7.1, 2.1, 2.2, 6.2, 52.1.2, 52.2.2, 52.4 (For L category vehicles only) Table 2 A1.1, A1.7.1, A.2.1, A.2.1.1, A.2.1.2, A2.2, A2.1.5 (For M and N category vehicles) Table 3 B1.2, B27.1.3, B27.2.3, B27.1.7, B27.2.6, B27.2.7, B27.3.7.(For M and N category vehicles) Following additional information shall also be provided along with the type approval application. 1. In case of L-category vehicles – with bodywork / without bodywork. 2. Photograph(s) and/or drawing(s) of a representative vehicle: 3. Optional equipment which may affect the rearward field of vision: 4. A brief description of the electronic components (if any) of the adjustment device: 5. Sketch(es) showing R point, seat back angle and the position of the mirror relative to the vehicle structure, including methods of attachment and relevant dimensions as applicable 6. Devices for indirect vision other than mirrors: 7. Sufficiently detailed drawings of devices for indirect vision other than mirrors, with the installation instructions: B-2 If the above information is submitted as per AIS-007 for approval of the complete vehicle it is not necessary to submit information in the above format. In addition, the information required in sketch form may be combined with information needed for other standards. AIS-002 (Part 1)(Rev.1):2011 23/42 ANNEX C (Reserved) ANNEX D (Reserved) ANNEX E (Reserved) ANNEX F (Reserved) ANNEX G (Reserved) AIS-002 (Part 1)(Rev.1):2011 24/42 ANNEX H (See 12.1.) PROCEDURE FOR DETERMINING THE ""H"" POINT AND THE ACTUAL TORSO ANGLE FOR SEATING POSITIONS IN MOTOR VEHICLES H-1. PURPOSE The procedure described in this Annex is used to establish the ""H"" point location and the actual torso angle for one or several seating positions in a motor vehicle and to verify the relationship of measured data to design specifications given by the vehicle manufacturer. Note: In any seating position other than front seats where the ""H"" point cannot be determined using the ""Three-dimensional \'H\' point machine"" or procedures, the ""R"" point indicated by the manufacturer may be taken as a reference at the discretion of the testing agency. H-2. DEFINITIONS For the purposes of this Annex: H-2.1. ""Reference data"" means one or several of the following characteristics of a seating position: H-2.1.1. the ""H"" point and the ""R"" point and']","['14', '6', '0', '20', '14']",['3'],"['document4.pdf', 'document6.pdf', 'document2.pdf', 'document9.pdf', 'document8.pdf']",easy,factual,0.2,0.5
What is the type of mirrors that are not permitted as per AIS-001 (Part 2) (Rev. 1)?,Flat mirrors,"According to the provided documents, there is no specific mention in AIS-001 (Part 2) (Rev. 1) about any type of mirrors that are not permitted. However, it's important to note that the document primarily focuses on rear-view mirrors and their specifications for approval. Other types of mirrors might be subject to different standards or regulations.","['AIS-002 (Part 2) (Rev.1):2011 shall be granted by test agencies from 22nd February 2011 (date of adoption in CMVR-TSC). Such type approvals shall be deemed to be compliance to AIS-002: 2001. 22.2 At the request of applicant, type approval to the compliance to AIS-002:2001 shall be granted up to the notified date of implementation of AIS-002 (Part 2) (Rev.1):2011. 22.3 Type approvals issued for compliance to AIS-002 : 2001, for vehicles fitted with convex mirrors shall be extended to approval of AIS-002 (Part 2) (Rev.1):2011 subject to satisfactory compliance of the following: 22.3.1 For the following L2 category vehicles, verification as per 16. 22.3.1.1 Vehicles having engine capacity not exceeding 70cc and having maximum design speed more than 50 km/h. Note 1: As per AIS-001 (Part 2) (Rev. 1), flat mirrors are not permitted. Note 2: Additional verification for the above need not be carried out, if compliance to the above requirements has already been established during the type approval as per AIS-002:2001. AIS-002 (Part 2) (Rev. 1):2011 4/11 22.4 Extension of Approvals for engineering and administrative changes: 22.4.1 In the case of 22.1, extensions shall be granted subject to the conditions of AIS-002 (Part 2) (Rev.1):2011. Such extensions shall be deemed to be compliance to AIS-002:2001. 22.4.2 In the case of 22.2, extensions shall be granted subject to conditions of AIS-002:2001 till the notified date of implementation of AIS-002 (Part 2) (Rev.1):2011. 23. AMENDMENTS TO ECE REGULATIONS AFTER THE LEVEL DESCRIBED IN 0.3 OF INTRODUCTION 23.1 Supplements In case of changes in ECE regulation, which are issued as supplements (Supplements do not affect the earlier type approvals) at the request of applicant, approval of compliance to this standard shall be issued taking into account the changes arising out of such supplement(s) to ECE regulation with approval from Chairman AISC. This shall be incorporated in the test report. Note : Such changes will be considered for inclusion in this standard at the time of its next amendment /revision. 23.2 Series of amendments Changes in ECE regulation, which are issued as series of amendments (series of amendments may affect the earlier type approvals) will not be considered for issuing approval to this standard. However, Chairman, AISC may, on a case to case basis, permit to accept latest series of amendments. This shall be incorporated in the test report. Note : Such changes will be considered for inclusion in this standard at the time of its next revision. AIS-002 (Part 2) (Rev. 1):2011 5/11 ANNEX A (Reserved) AIS-002 (Part 2) (Rev. 1):2011 6/11 ANNEX B (See 14.1.) INFORMATION TO BE SUBMITTED AT THE TIME OF TYPE APPROVAL B-1 The specification submitted by manufacturer (applicant) at the time of applying for the type approval of the vehicle to this standard shall contain at least the information set out in the following entries of Table 1 of AIS-007, Revision 4. 0.2, 0.2.1, 0.5, 0.5.1, 4.6 and 10.0 to 10.4 B-2 If the above information is submitted as per AIS-007 for approval of the complete', ""combination of direct view and indirect vision devices (of Classes IV, V, VI). Note: “Passenger’s” side means the side opposite to where the driver seat is provided. AIS-002 (Part 1) (Rev.2):2023 9/65 15.2.1.1.4 Optional rear-view mirrors for L-category vehicles with body work The fitting of a Class III or VII rear-view mirror on the side of the vehicle opposite to that of the mandatory rear-view mirror referred to in clause 15.2.1.1.3. above, is permissible. The rear-view mirror shall meet the requirements of this standard 15.2.1.2. The provisions of this standard do not apply to the surveillance mirrors defined in clause 2.1.1.3 of AIS-001 (Part 1) (Rev. 2). Nevertheless, the exterior surveillance mirrors shall be mounted at least 2 m above the ground when the vehicle is under a load corresponding to its maximum technical permissible mass or shall be fully integrated in a housing including Class II or III mirror(s) which is (are) type approved to this standard. 15.2.2. Position 15.2.2.1. Devices for indirect vision shall be so placed that the driver, when sitting on the driving seat in a normal driving position, has a clear view of the road to the rear, side(s) or front of the vehicle. 15.2.2.2. Classes II to VII mirrors shall be visible through the side windows or through the portion of the windscreen that is swept by the windscreen wiper. Nevertheless, for design reasons, this last provision (i.e. the provisions relating the cleaned part of the windscreen) shall not apply to: (a) Classes II to VII mirrors on the passenger side and optional exterior mirrors on the driver side of vehicles of categories M2 and M3; (b) Class VI front-view mirrors 15.2.2.3. In the case of any vehicle, which is in chassis/cab form when the field of vision is measured, the minimum and maximum body widths shall be stated by the manufacturer and, if necessary, simulated by dummy headboards. All vehicles and devices for indirect vision configurations taken into consideration during the tests shall be shown in the test report for a vehicle with regard to the installation of devices for indirect vision. 15.2.2.4 The prescribed Classes II, III, IV and VII mirror or monitor on the driver’s side of the vehicle shall be so located that an angle of not more than 55° is formed between the vertical longitudinal median plane of the vehicle and the vertical plane passing through the centre of the mirror or monitor and through the centre of the straight line 65 mm long which joins the driver's two ocular points. 15.2.2.5 Devices for indirect vision shall not project beyond the external bodywork of the vehicle substantially more than is necessary to comply with the requirements concerning fields of vision laid down in clause 15.2.4. below. 15.2.2.6 Where the lower edge of a Classes II to VII mirror is less than 2 m above the ground when the vehicle is loaded to its technically permissible maximum laden mass, this mirror shall not project more than 250 mm beyond the"", '2003. 0.2 With technological developments in automotive vehicles rear view mirrors, AIS-001 was taken up for revision and prepared in two parts. This part covers the requirements for approval of devices for indirect vision for use on A, M, N, category and L category vehicles with bodywork vehicles specification. 0.3 This part is based on the following UN Regulation UN R 46 Revision 6, Amendment 7, Supplement 9 to the 04 series of amendments Date of entry into force: 30 September 2021 Uniform Provisions Concerning the Approval of Devices for Indirect Vision and of Motor Vehicles with regard to the Installation of these Devices 0.4 While preparing this standard attempt has been made to align with the above UN regulation. However, certain changes were necessary in Indian context. 0.5 The following standards contain provisions, which through reference in this text constitute provisions of the standard AIS-002 (Part 1) (Rev.2):2023 Automotive Vehicles – Devices for indirect Vision intended for use on L category with bodywork vehicles, M and N category - Installation requirements AIS-037 Procedure for Type Approval and Establishing Conformity of Production for Safety Critical Components AIS-001 (Part 1) (Rev.2):2023 III IS 14272:2011 Automotive Vehicles – Types – Terminology IS 13942:1994 Automotive vehicles - External projections - Performance requirements ISO 15008:2003 Road vehicles - Ergonomic aspects of transport Information and control systems - Specifications and compliance procedures for in-vehicle visual presentation CIE publication 50 (45) International Electronical Vocabulary, Group 45, Lighting EN 12368: 8.4 Traffic Control Equipment – Signal heads 0.6 The composition of AISC panel and AIS Committee responsible for preparation of this standard is given in Annex P and Annex R respectively. AIS-001 (Part 1) (Rev.2):2023 IV Automotive Vehicles –Approval of Devices for Indirect Vision Intended for use on A, M, N Category and L Category with Bodywork Vehicles – Specification Clause No. Contents Page No. 1. Scope 1/46 2. Definitions 1/46 3. Application for approval 5/46 4. Markings 5/46 5. Approval 6/46 6. Requirements 6/46 7. Extension of type approval 26/46 8. Conformity of production 26/46 9. Penalties for non-conformity of production 27/46 10. to 20. Reserved 27/46 21. Transitional provisions 27/46 22. Establishing compliance of “E”/“e” approved devices to this standard 28/46 23. Amendments to UN regulations after the level described in 0.3 of introduction 28/46 List of Annexes Annex A Information to be submitted at the time of applying for type approval 30/46 Annex B to E Reserved 32/46 Annex F Test method for determining reflectivity 33/46 Annex G Procedure for determining the Radius of Curvature ""r"" of the reflecting surface of a mirror 39/46 Annex H to M Reserved 41/46 Annex N Criteria for extension of approval 42/46 Annex P Composition of AISC panel on rear view mirrors 44/46 Annex R Committee composition Automotive Industry Standards Committee 46/46 AIS-001 (Part 1) (Rev.2):2023 1/46 Automotive Vehicles – Approval of Devices for Indirect Vision Intended for use on A, M, N Category and L Category with Bodywork Vehicles – Specification 1. SCOPE 1.1 This standard applies', 'of Part 1 of this standard, measured on the arc of the reflecting surface contained in a plane parallel to the greatest dimension of the mirror and passing through its centre and on the arc perpendicular to it; 2.6 ""Radius of curvature at one point on the reflecting surface (rp)"" is as defined in 2.1.1.7 of Part 1 of this standard. 2.7 ""Centre of the mirror"" is “centre of reflecting surface” as defined in 2.1.1.11 of Part 1 of this standard. 2.8 Radius of curvature of the constituent parts of the rear-view mirror"" is as defined in 2.1.1.12 of Part 1 of this standard. AIS-001 (Part 2) (Rev.1): 2011 2/14 3. APPLICATION FOR APPROVAL 3.1 Reserved 3.2 Information to be submitted at the time of applying for type approval of the mirror shall be as given in Annex A of Part 1 of this standard. Note :Sl. No.9 and its sub-paragraphs of Annex A to Part 1 are not applicable for this standard. 3.3 For each type of rear-view mirror, the application shall be accompanied by, four samples of the type of rear view mirror. Additional samples may be called for at the request of the testing agency. 3.4 Reserved. 4. MARKING 4.1. The marking shall be as specified in 4. of Part 1 of this standard. 4.2. Every rear-view mirror shall possess on its holder a space large enough to accommodate the approval mark, which must be legible when the rear-view mirror has been mounted on the vehicle; this space shall be shown on the drawings referred to Annex A of Part 1 of this standard. 5. APPROVAL 5.1. If the samples submitted for approval meet the requirements of paragraph 6 to 8 of this standard, approval of the pertinent type of rear-view mirror, shall be granted. 5.2. Approval number shall be as per AIS-037 5.3 Reserved 5.4 Reserved 5.4.1 Reserved 5.4.2 Approval number granted as per AIS-037. 5.4.3 In addition to the approval mark (5.2), An an additional symbol in the form of the letter ""L"". The additional symbol shall be placed at any convenient position. 5.5 The approval mark and the additional symbol shall be clearly legible and be indelible. 5.6 Reserved 6. GENERAL REQUIREMENTS 6.1 Provisions of 6.1.1.1 of Part 1 of this standard shall apply. 6.2. Provisions of 6.1.1.2 of Part 1 of this standard shall apply. AIS-001 (Part 2) (Rev.1): 2011 3/14 6.3. When the rear-view mirror is mounted on a plane surface, all its parts, irrespective of the adjustment position of the device, including those parts remaining attached to the holder after the test set out in 8.2., which are in potential static contact with a sphere 100 mm in diameter shall have a radius of curvature ""c"" of not less than 2.5 mm. 6.3.1. Provisions of 6.1.1.4 of Part 1 of this standard shall apply. 6.4. Provisions of 6.1.1.6 of Part 1 of this standard shall apply. 7. SPECIAL SPECIFICATIONS 7.1. Dimensions 7.1.1. The minimum dimensions of the reflecting surface shall be', ':2023. 21.5 Type approvals for compliance to AIS-037, already been granted, shall continue to be valid for AIS-001 (Part 1) (Rev.2) :2023. Note: Necessary corrections to the reference of verification reports as per this standard shall be incorporated while issuing the next COP certificate. In the meantime for issuing of vehicle certificate, test/verification report as per this standard shall deemed to be the proof of compliance of AIS-037. 22. ESTABLISHING COMPLIANCE OF “E”/“e” APPROVED DEVICES TO THIS STANDARDS 22.1 As an exception to clause 7.4 of AIS-037, (or related administrative decisions) for certifying compliance of “E”/”e” approved rear-view mirrors devices to this standard, the test for the following shall be carried out by testing agency. 22.1.1 Requirements of dimension as per clause 6.1.2.1 22.1.2 Requirements of reflecting surfaces as per clause 6.1.2.2 23. AMENDMENTS TO UN REGULATIONS AFTER THE LEVEL DESCRIBED IN 0.3 OF INTRODUCTION 23.1 Supplements In case of changes in UN regulation, which are issued as supplements (Supplements do not affect the earlier type approvals) at the request of applicant, approval of compliance to this standard shall be issued taking into account the changes arising out of such supplement(s) to UN regulation with approval from Chairman AISC. This shall be incorporated in the test report. Note: Such changes will be considered for inclusion in this standard at the time of its next amendment /revision. AIS-001 (Part 1) (Rev.2):2023 29/46 23.2 Series of amendments Changes in UN regulation, which are issued as series of amendments (series of amendments may affect the earlier type approvals) will not be considered for issuing approval to this standard. However, Chairman, AISC may, on a case to case basis, permit to accept latest series of amendments. This shall be incorporated in the test report. Note: Such changes will be considered for inclusion in this standard at the time of its next revision. AIS-001 (Part 1) (Rev.2):2023 30/46 ANNEX A (See 3.1) INFORMATION TO BE SUBMITTED AT THE TIME OF APPLYING FOR TYPE APPROVAL A1 The information given in Table A1, if applicable, shall be supplied and shall include a list of contents A2 Any sketches shall be supplied in appropriate scale and in sufficient detail. A3 Photographs, if any, shall show sufficient detail. Table A1 (See A1) 1. Make (trade name of manufacturer): 2. Type and general commercial description(s): 3. Means of identification of the type, if indicated on the device: 4. Category of vehicle for which the device is intended: 5. Name and address of manufacturer: 6. Location and method of affixing of the approval mark: 6.1 Other mean of identification link to the approval mark: 7. Address(es) of assembly plant(s): 8. Mirrors (state for each mirror): 8.1 Variant 8.2 Sketch(s) for the identification of the mirror: 8.3 A technical description of Rear view mirror, including ounting instructions. Details of the method of attachment 8.4 Dimensions of reflecting surfaces 8.5 Radius of curvature of reflecting surface. 8.6 Type of reflective coating. 8.7 Overall shape of the housing 9. Devices for indirect vision other']","['3', '8', '1', '2', '21']",['3'],"['document10.pdf', 'document9.pdf', 'document5.pdf', 'document6.pdf', 'document5.pdf']",easy,factual,0.5,0.85
"For vehicles having engine capacity not exceeding 70cc and having maximum design speed more than 50 km/h, what additional verification is needed for compliance to AIS-002 (Part 2) (Rev.1):2011?",Verification as per 16,"For vehicles having engine capacity not exceeding 70cc and having maximum design speed more than 50 km/h, additional verification as per AIS-002 (Part 2) (Rev.1), specifically for L2 category vehicles, is required as per point 22.3.1 in Chunk 3 of the provided documents. No explicit details are given about what this verification entails, but it is noted that additional verification may not be necessary if compliance to the above requirements has already been established during the type approval as per AIS-002:2001 (see Note 2 in Chunk 3).","['be deemed to be compliance to AIS-002 (Part 1) (Rev.1):2011. 22.2 At the request of applicant, type approval to the compliance to AIS-002 (Part 1) (Rev.1):2011 shall be granted up to the notified date of implementation of AIS-002 (Part 1) (Rev. 2): 2023. 22.3 Type approvals issued for compliance to AIS-002 (Part 1) (Rev.1):2011 shall: 22.3.1 be extended for L category vehicles without any further verification, for compliance to AIS-002 (Part 1) (Rev. 2): 2023. 22.3.2 not be extended for M and N category vehicles for compliance to AIS-002 (Part 1) (Rev. 2): 2023. Note: Additional verification for the above need not be carried out, if compliance to the above requirements has already been established during the type approval as per AIS-002 (Part 1) (Rev.1):2011. 22.4 Extension of Approvals for engineering and administrative changes: 22.4.2 In the case of 21.1, extensions shall be granted subject to the conditions of AIS-002 (Part 1) (Rev. 2): 2023. Such extensions shall be deemed to be compliance to AIS-002 (Part 1) (Rev.1):2011. 22.4.2 In the case of 21.2, extensions shall be granted subject to conditions of AIS-002 (Part 1) (Rev.1):2011 till the notified date of implementation of AIS-002 (Part 1) (Rev.2): 2023. AIS-002 (Part 1) (Rev.2):2023 26/65 AMENDMENTS TO UN REGULATIONS AFTER THE LEVEL DESCRIBED IN 0.3 OF INTRODUCTION 23.1 Supplements In case of changes in UN regulation, which are issued as supplements (Supplements do not affect the earlier type approvals) at the request of applicant, approval of compliance to this standard shall be issued taking into account the changes arising out of such supplement(s) to UN regulation with approval from Chairman AISC. This shall be incorporated in the test report. Note: Such changes will be considered for inclusion in this standard at the time of its next amendment /revision. 23.2 Series of amendments Changes in UN regulation, which are issued as series of amendments (series of amendments may affect the earlier type approvals) will not be considered for issuing approval to this standard. However, Chairman, AISC may, on a case to case basis, permit to accept latest series of amendments. This shall be incorporated in the test report. Note: Such changes will be considered for inclusion in this standard at the time of its next revision. AIS-002 (Part 1) (Rev.2):2023 27/65 ANNEX A (Reserved) AIS-002 (Part 1) (Rev.2):2023 28/65 ANNEX B (See 13.1) INFORMATION TO BE SUBMITTED AT THE TIME OF TYPE APPROVAL B-1 The specification submitted by manufacturer (applicant) at the time of applying for the type approval of the vehicle to this standard shall contain at least the information set out in the following entries of AIS-007 (Revision 5): Table 1A 0.1 to 0.9, 1.2 and 9 of detailed specifications (For L category vehicles only) Table 2 A1.1, A1.7.1, A.2.1, A.2.1.1, A.2.1.2, A2.2, A2.1.5 (For M and N category vehicles) Table 3 B1.2, B27.1 to B27.8 (For M and N category vehicles) Following additional information shall also be provided along with the type approval application. 1. In case of L-category vehicles', 'established during the type approval as per AIS-001:2001. 21.4 Extension of Approvals for engineering and administrative changes: 21.4.1 In the case of 21.1, extensions shall be granted subject to the conditions of AIS-001 (Part 1) (Rev.1):2011. Such extensions shall be deemed to be compliance to AIS-001:2001. 21.4.2 In the case of 21.2, extensions shall be granted subject to conditions of AIS-001:2001 till the notified date of implementation AIS-001 (Part 1) (Rev.1):2011. 21.5 Type approvals for compliance to AIS-037, already been granted, shall continue to be valid for AIS-001 (Rev.1) (Part 1):2011. Note: Necessary corrections to the reference of verification reports as per this standard shall be incorporated while issuing the next COP certificate. In the meantime for issuing of vehicle certificate, test/verification report as per this standard shall deemed to be the proof of compliance of AIS-037. ESTABLISHING COMPLIANCE OF “E”/“e” APPROVED DEVICES TO THIS STANDARDS 22.1 As an exception to 7.4 of AIS-037, (or related administrative decisions) for certifying compliance of “E”/”e” approved rear-view mirrors devices to this standard, the test for the following shall be carried out by testing agency 22.1.1 Requirements of dimension as per 6.1.2.1 22.1.2 Requirements of reflecting surfaces as per 6.1.2.2 AIS-001 (Part 1) (Rev.1) : 2011 17/35 AMENDMENTS TO ECE REGULATIONS AFTER THE LEVEL DESCRIBED IN 0.3 OF INTRODUCTION 23.1 Supplements In case of changes in ECE regulation, which are issued as supplements (Supplements do not affect the earlier type approvals) at the request of applicant, approval of compliance to this standard shall be issued taking into account the changes arising out of such supplement(s) to ECE regulation with approval from Chairman AISC. This shall be incorporated in the test report. Note: Such changes will be considered for inclusion in this standard at the time of its next amendment /revision. 23.2 Series of amendments Changes in ECE regulation, which are issued as series of amendments (series of amendments may affect the earlier type approvals) will not be considered for issuing approval to this standard. However, Chairman, AISC may, on a case to case basis, permit to accept latest series of amendments. This shall be incorporated in the test report. Note: Such changes will be considered for inclusion in this standard at the time of its next revision. AIS-001 (Part 1) (Rev.1) : 2011 18/35 ANNEX A (See 3.1) INFORMATION TO BE SUBMITTED AT THE TIME OF APPLYING FOR TYPE APPROVAL A1 The information given in Table A1, if applicable, shall be supplied and shall include a list of contents. A2 Any sketches shall be supplied in appropriate scale and in sufficient detail. A3 Photographs, if any, shall show sufficient detail. Table A1 (See A1) 1. Make (trade name of manufacturer): 2. Type and general commercial description(s): 3. Means of identification of the type, if indicated on the device: 4. Category of vehicle for which the device is intended: 5. Name and address of manufacturer: 6. Location and method of affixing of the approval mark: 7. Address(es) of assembly plant(s): 8. Mirrors (state for', '(Part 2) (Rev.1):2011. Such extensions shall be deemed to be compliance to AIS-001:2001. 22.4.2 In the case of 22.2, extensions shall be granted subject to conditions of AIS-001:2001 till the notified date of implementation of AIS-001 (Part 2) (Rev.1):2011. 22.5 Type approvals for compliance to AIS-037, already been granted, shall continue to be valid for AIS-001 (Part 2) (Rev.1):2011. Note : Necessary corrections to the reference of verification reports as per this standard shall be incorporated while issuing the next COP certificate. In the meantime for issuing of vehicle certificate, test/verification report as per this standard shall deemed to be the proof of compliance of AIS-037. AIS-001 (Part 2) (Rev.1): 2011 8/14 ESTABLISHING COMPLIANCE OF “E”/“e” MARKED APPROVED REAR-VIEW MIRRORS DEVICES TO THIS STANDARDS 23.1 As an exception to 7.4 of AIS-037, (or related administrative decisions) for certifying compliance of “E”/”e” marked approved rear-view mirrors to this standard, the test for the following shall be carried out by testing agency 23.1.1 Requirements of dimension as per 7.1 23.1.2 Requirements of reflecting surfaces as per 7.2 AMENDMENTS TO ECE REGULATIONS AFTER THE LEVEL DESCRIBED IN 0.3 OF INTRODUCTION 24.1 Supplements In case of changes in ECE regulation, which are issued as supplements (Supplements do not affect the earlier type approvals) at the request of applicant, approval of compliance to this standard shall be issued taking into account the changes arising out of such supplement(s) to ECE regulation with approval from Chairman AISC. This shall be incorporated in the test report. Note : Such changes will be considered for inclusion in this standard at the time of its next amendment /revision. 24.2 Series of amendments Changes in ECE regulation, which are issued as series of amendments (series of amendments may affect the earlier type approvals) will not be considered for issuing approval to this standard. However, Chairman, AISC may, on a case to case basis, permit to accept latest series of amendments. This shall be incorporated in the test report. Note : Such changes will be considered for inclusion in this standard at the time of its next revision. AIS-001 (Part 2) (Rev.1): 2011 9/14 Annex A (Reserved) Annex B (Reserved) Annex C (Reserved) Annex D (Reserved) Annex E (Reserved) Annex F (Reserved) AIS-001 (Part 2) (Rev.1): 2011 10/14 ANNEX G (See 9.2) CONTROL OF THE CONFORMITY OF PRODUCTION FOR REAR VIEW MIRRORS (Periodic tests to be carried out by the manufacturer) G 1. DEFINITIONS For the purpose of this Annex, ""Type of deflection system"" means a given combination of axes, swivel points and other articulating mechanisms, which ensures deflection of the rear-view mirror in the direction of impact concerned. G 2. TESTS Rear-view mirrors shall be subjected to the following tests: G-2.1. Reflecting surface G-2.1.1. Verification of the nominal radius of curvature, pursuant to the requirements of G-2 of Annex G of Part 1 of this standard. G-2.1.2. Measurement of the differences between radii of curvature pursuant to the requirements of 7.2.2. G-2.2. Deflection system Impact test pursuant to the requirements', '16.2 For considering whether testing is required or not, guidelines given in Annex M shall be followed. 16.3 In case of 16.1.2., checks for those parameters which are affected by the modifications only need to be carried out. 16.4 In the event of 16.1.1. or in the case of 16.1.2 after successful compliance to requirements, the certificate of compliance shall be validated for the modified version. 17. CONFORMITY OF PRODUCTION Every vehicle approved under this standard shall be so manufactured as to conform to the type approved by meeting the requirements set out in 15 or 21 as applicable Note : Verification of conformity of production will be applicable when the Whole Vehicle COP procedure is implemented. 18. Reserved 19. Reserved 20. Reserved AIS-002 (Part 1)(Rev.1):2011 19/42 21. TRANSITIONAL PROVISIONS 21.1 At the request of the applicant, type approvals for compliance to AIS-002 (Part 1) (Rev.1): 2011, shall be granted by testing agencies from 28th June 2011 (date of adoption of this standard in CMVR-TSC). Such type approvals shall be deemed to be compliance to AIS-002:2001. 21.2 At the request of applicant, type approval to the compliance to AIS-002:2001 shall be granted up to the notified date of implementation of AIS-002 (Part 1) (Rev.1): 2011. 21.3 Type approvals issued for compliance to AIS-002 : 2001 shall: 21.3.1 be extended for L category vehicles without any further verification, for compliance to AIS-002 (Part 1) (Rev.1) : 2011. 21.3.2 not be extended for M and N category vehicles for compliance to AIS-002 (Part 1) (Rev.1) : 2011 Note: Additional verification for the above need not be carried out, if compliance to the above requirements has already been established during the type approval as per AIS-002:2001. 21.4 Extension of Approvals for engineering and administrative changes: 21.4.1 In the case of 21.1, extensions shall be granted subject to the conditions of AIS-002 (Part 1) (Rev.1):2011. Such extensions shall be deemed to be compliance to AIS-002:2001. 21.4.2 In the case of 21.2, extensions shall be granted subject to conditions of AIS-002:2001 till the notified date of implementation of AIS-002 (Part 1) (Rev.1):2011. 22. AMENDMENTS TO ECE REGULATIONS AFTER THE LEVEL DESCRIBED IN 0.3 OF INTRODUCTION 22.1 Supplements In case of changes in ECE regulation, which are issued as supplements (Supplements do not affect the earlier type approvals) at the request of applicant, approval of compliance to this standard shall be issued taking into account the changes arising out of such supplement(s) to ECE regulation with approval from Chairman AISC. This shall be incorporated in the test report. Note: Such changes will be considered for inclusion in this standard at the time of its next amendment /revision. AIS-002 (Part 1)(Rev.1):2011 20/42 22.2 Series of amendments Changes in ECE regulation, which are issued as series of amendments (series of amendments may affect the earlier type approvals) will not be considered for issuing approval to this standard. However, Chairman, AISC may, on a case to case basis, permit to accept latest series of amendments. This shall be incorporated', 'AIS-002 (Part 2) (Rev.1):2011 shall be granted by test agencies from 22nd February 2011 (date of adoption in CMVR-TSC). Such type approvals shall be deemed to be compliance to AIS-002: 2001. 22.2 At the request of applicant, type approval to the compliance to AIS-002:2001 shall be granted up to the notified date of implementation of AIS-002 (Part 2) (Rev.1):2011. 22.3 Type approvals issued for compliance to AIS-002 : 2001, for vehicles fitted with convex mirrors shall be extended to approval of AIS-002 (Part 2) (Rev.1):2011 subject to satisfactory compliance of the following: 22.3.1 For the following L2 category vehicles, verification as per 16. 22.3.1.1 Vehicles having engine capacity not exceeding 70cc and having maximum design speed more than 50 km/h. Note 1: As per AIS-001 (Part 2) (Rev. 1), flat mirrors are not permitted. Note 2: Additional verification for the above need not be carried out, if compliance to the above requirements has already been established during the type approval as per AIS-002:2001. AIS-002 (Part 2) (Rev. 1):2011 4/11 22.4 Extension of Approvals for engineering and administrative changes: 22.4.1 In the case of 22.1, extensions shall be granted subject to the conditions of AIS-002 (Part 2) (Rev.1):2011. Such extensions shall be deemed to be compliance to AIS-002:2001. 22.4.2 In the case of 22.2, extensions shall be granted subject to conditions of AIS-002:2001 till the notified date of implementation of AIS-002 (Part 2) (Rev.1):2011. 23. AMENDMENTS TO ECE REGULATIONS AFTER THE LEVEL DESCRIBED IN 0.3 OF INTRODUCTION 23.1 Supplements In case of changes in ECE regulation, which are issued as supplements (Supplements do not affect the earlier type approvals) at the request of applicant, approval of compliance to this standard shall be issued taking into account the changes arising out of such supplement(s) to ECE regulation with approval from Chairman AISC. This shall be incorporated in the test report. Note : Such changes will be considered for inclusion in this standard at the time of its next amendment /revision. 23.2 Series of amendments Changes in ECE regulation, which are issued as series of amendments (series of amendments may affect the earlier type approvals) will not be considered for issuing approval to this standard. However, Chairman, AISC may, on a case to case basis, permit to accept latest series of amendments. This shall be incorporated in the test report. Note : Such changes will be considered for inclusion in this standard at the time of its next revision. AIS-002 (Part 2) (Rev. 1):2011 5/11 ANNEX A (Reserved) AIS-002 (Part 2) (Rev. 1):2011 6/11 ANNEX B (See 14.1.) INFORMATION TO BE SUBMITTED AT THE TIME OF TYPE APPROVAL B-1 The specification submitted by manufacturer (applicant) at the time of applying for the type approval of the vehicle to this standard shall contain at least the information set out in the following entries of Table 1 of AIS-007, Revision 4. 0.2, 0.2.1, 0.5, 0.5.1, 4.6 and 10.0 to 10.4 B-2 If the above information is submitted as per AIS-007 for approval of the complete']","['20', '14', '6', '13', '3']",['3'],"['document9.pdf', 'document4.pdf', 'document6.pdf', 'document8.pdf', 'document10.pdf']",easy,factual,0.95,0.95
What is the test method for measuring radiated broadband electromagnetic emissions from vehicles according to AIS-004 (Part 3) Annex 2?,"The test method described in this Annex shall only be applied to vehicles. If not otherwise stated in this annex, the test shall be performed according to CISPR 12 (Amendment 1 fifth edition 2005).","The test method for measuring radiated broadband electromagnetic emissions from vehicles according to AIS-004 (Part 3) Annex 2 is as follows:

1. The electromagnetic radiation generated by the vehicle representative of its type shall be measured using the method described in Annex 2.
2. The method of measurement shall be defined by the vehicle manufacturer in accordance with the Test Agency.
3. If measurements are made using this method with a vehicle-to-antenna spacing of 10.0 ± 0.2 m, the limits for broadband type approval are 32 dB microvolts/m in the 30 to 75 MHz frequency band and 32 to 43 dB microvolts/m in the 75 to 400 MHz frequency band, with the limit increasing logarithmically with frequencies above 75 MHz. In the 400 to 1,000 MHz frequency band, the limit remains constant at 43 dB microvolts/m.
4. If measurements are made using this method with a vehicle-to-antenna spacing of 3.0 ± 0.05 m, the limits for broadband type approval are 42 dB microvolts/m in the 30 to 75 MHz frequency band and 42 to 53 dB microvolts/m in the 75 to 400 MHz frequency band, with the limit increasing logarithmically with frequencies above 75 MHz. In the 400 to 1,000 MHz frequency band, the limit remains constant at 53 dB microvolts/m.

Sources:
- AIS-004 (Part 3) Annex 2, pages 18-20","[""units and associated wiring harness predominantly towards the middle of the vehicle, a reference point may be established based on either the right side surface or the left side surface of the vehicle. This reference point shall be at the midpoint of the vehicle's length or at one point along the side of the vehicle chosen by the manufacturer in conjunction with the Test Agency after considering the distribution of electronic systems and the layout of any wiring harness. Such testing may only take place if the physical construction of the chamber permits. The antenna location must be noted in the test report. 38/60 AIS-004 (Part 3) ANNEX 4 – APPENDIX 1 Figure 1 39/60 AIS-004 (Part 3) Figure 2 40/60 AIS-004 (Part 3) Figure 3 41/60 AIS-004 (Part 3) ANNEX 5 (See 5.5.1) METHOD OF MEASUREMENT OF RADIATED BROADBAND ELECTROMAGNETIC EMISSIONS FROM ELECTRICAL/ELECTRONIC SUB-ASSEMBLIES 1. GENERAL 1.1. The test method described in this annex may be applied to ESAs which may be subsequently fitted to vehicles, which comply with Annex 2. 1.2. Test method This test is intended to measure broadband electromagnetic emissions from ESAs (e.g. ignition systems, electric motor, etc.). If not otherwise stated in this annex the test shall be performed according CISPR 25 (second edition 2002). 2. ESA STATE DURING TESTS 2.1. The ESA under test shall be in normal operation mode, preferably in maximum load. 3. TEST ARRANGEMENTS 3.1. The test shall be performed according to CISPR 25 (second edition 2002) clause 6.4. - ALSE method. 3.2. Alternative measuring location As an alternative to an absorber lined shielded enclosure (ALSE) an open area test site (OATS), which complies with the requirements of CISPR 16-1 (second edition 2002) may be used (see Appendix 1 of this annex). 3.3. Ambient To ensure that there is no extraneous noise or signal of a magnitude sufficient to affect materially the measurement, measurements shall be taken before or after the main test. In this measurement, the extraneous noise or signal shall be at least 6 dB below the limits of interference given in paragraph 5.5.2.1 of this standard, except for intentional narrowband ambient transmissions. 4. TEST REQUIREMENTS 4.1. The limits apply throughout the frequency range 30 to 1,000 MHz for measurements performed in a semi anechoic chamber or an outdoor test site. 42/60 AIS-004 (Part 3) 4.2. Measurements can be performed with either quasi-peak or peak detectors. The limits given in paragraphs 5.2 and 5.5 of this standard are for quasi-peak detectors. If peak detectors are used a correction factor of 20 dB as defined in CISPR 12 (fifth edition 2001) shall be applied. 4.3. Measurements The Test Agency shall perform the test at the intervals specified in the CISPR 25 (second edition 2002) standard throughout the frequency range 30 to 1,000 MHz. Alternatively, if the manufacturer provides measurement data for the whole frequency band from a test laboratory accredited to the applicable parts of ISO 17025 (first edition 1999) and recognized by the Test Agency, the Test Agency may"", 'ground. Appendix 1: Description of the ESA chosen to represent the type (electronic block diagram and list of main component constituting the ESA (e.g. make and type of microprocessor, crystal, etc.). Appendix 2: Relevant test report(s) supplied by the manufacturer from a test laboratory accredited to ISO 17025 and recognized by the Test Agency for the purpose of drawing up the type approval certificate."" 27/60 AIS-004 (Part 3) ANNEX 2 (See 5.2.1) METHOD OF MEASUREMENT OF RADIATED BROADBAND ELECTROMAGNETIC EMISSIONS FROM VEHICLES 1. GENERAL 1.1. The test method described in this Annex shall only be applied to vehicles. 1.2 Test Method This test is intended to measure the broadband emissions generated by electrical or electronic systems fitted to the vehicle (e.g. ignition system or electric motors). If not otherwise stated in this annex the test shall be performed according to CISPR 12 (Amendment 1 fifth edition 2005). 2. VEHICLE STATE DURING TESTS 2.1. For vehicles equipped with an internal combustion engine, the engine shall be in operation according to CISPR 12 (amendment 1, fifth edition 2005) clause 5.3.2. Typically for single cylinder engines, the engine speed shall be 2500 + 10% rpm and for multi-cylinder (>1 cylinder) engines, the engine speed shall be 1500 + 10% rpm. For vehicles equipped with an electric propulsion motor, the vehicle shall be driven on a dynamometer without a load, or on non-conductive axle stands, with a constant speed of 40 km/h, or the maximum speed, if this is less than 40 km/h. 2.2. Other vehicle systems All equipment capable of generating broadband emissions which can be switched on permanently by the driver or passenger should be in operation in maximum load, e.g. wiper motors or fans. The horn and electric window motors are excluded because they are not used continuously. 3. MEASURING LOCATION 3.1 As an alternative to the requirements of CISPR 12 (amendment 1, fifth edition 2005) for vehicles of category L the test surface may be any location that fulfils the conditions shown in the figure 1 in the appendix to this annex. In this case the measuring equipment must lie outside the part shown in the figures 1 and 2 of Appendix 1 to this annex. 3.2 Enclosed test facilities may be used if correlation can be shown between the results obtained in the enclosed test facility and those obtained at an outdoor site. Enclosed test facilities do not need to meet the dimensional requirements of the outdoor site other than the distance from the antenna to the vehicle and the height of the antenna. 28/60 AIS-004 (Part 3) 4. TEST REQUIREMENTS 4.1. The limits apply throughout the frequency range 30 to 1,000 MHz for measurements performed in a semi anechoic chamber or an outdoor test site. 4.2. Measurements can be performed with either quasi-peak or peak detectors. The limits given in paragraphs 5.2 and 5.5 of this standard are for quasi-peak detectors. If peak detectors are used a correction factor of 20 dB as defined in CISPR 12 (amendment', 'a test laboratory accredited to the applicable parts of ISO 17025 and recognized by the Test Agency, the Test Agency may divide the frequency range in 14 frequency bands 30 – 34, 34 – 45, 45 – 60, 60 – 80, 80 – 100, 100 – 130, 130 – 170, 170 – 225, 225 – 300, 300– 400, 400 – 525, 525 – 700, 700 – 850, 850 – 1,000 MHz and perform tests at the 14 frequencies giving the highest emission levels within each band to confirm that the vehicle meets the requirements of this annex. AIS-004 (Part 3) (Rev.1) 64/149 In the event that the limit is exceeded during the test, investigations shall be made to ensure that this is due to the vehicle and not due to background radiation including broadband radiation from any ESA. 3.5 Readings The maximum of the readings relative to the limit (horizontal and vertical polarization and antenna location on the left and right-hand sides of the vehicle) in each of the 14 frequency bands shall be taken as the characteristic reading at the frequency at which the measurements were made. AIS-004 (Part 3) (Rev.1) 65/149 ANNEX 4 METHOD OF TESTING FOR IMMUNITY OF VEHICLES TO ELECTROMAGNETIC RADIATION (See 5.4.1 and 6.7) 1.0 GENERAL 1.1 The test method described in this annex shall only be applied to vehicles. This method concerns both configurations of vehicle: (a) Other than ""REESS charging mode coupled to the power grid"". (b) ""REESS charging mode coupled to the power grid"". 1.2 Test Method This test is intended to demonstrate the immunity of the vehicle electronic systems. The vehicle shall be subjected to electromagnetic fields as described in this annex. The vehicle shall be monitored during the tests. If not otherwise stated in this annex the test shall be performed according to ISO 11451-2, third edition 2005. 1.3 Alternative test methods The test may be alternatively performed in an outdoor test site for all vehicles. The test facility shall comply with (national) legal requirements regarding the emission of electromagnetic fields. If a vehicle is longer than 12 m and/or wider than 2.60 m and/or higher than 4.00 m, BCI (bulk current injection) method according to ISO 11451-4 (first edition 1995) can be used in the frequency range 20 to 2,000 MHz with levels defined in paragraph 5.7.2.1 of this standard. 2.0 VEHICLE STATE DURING TESTS 2.1 Vehicle in configuration other than ""REESS charging mode coupled to the power grid 2.1.1 The vehicle shall be in an unladen condition except for necessary test equipment. 2.1.1.1 The engine shall normally turn the driving wheels at a steady speed of 50 km/h if there is no technical reason due to the vehicle to define a different condition. For vehicles of categories L1, L5 and L7 the steady speed shall normally be turned at 25 km/h. The vehicle shall be on an appropriately loaded dynamometer or alternatively supported on insulated axle stands with minimum ground clearance if no dynamometer is available. Where appropriate,', 'and if applicable paragraph 6 of this standard, type approval shall be granted. 5.0 SPECIFICATION IN CONFIGURATIONS OTHER THAN REESS CHARGING MODE COUPLED TO THE POWER GRID 5.1 General Specifications 5.1.1 A vehicle and its electrical / electronic system(s) or ESA(s) shall be so designed, constructed and fitted as to enable the vehicle, in normal conditions of use, to comply with the requirements of this standard. 5.1.1.1 A vehicle shall be tested for radiated emissions and for immunity to radiated disturbances. No tests for conducted emissions or immunity to conducted disturbances are required for vehicle type approval. 5.1.1.2 ESA(s) shall be tested for radiated and conducted emissions, for immunity to radiated and conducted disturbances. 5.1.2 Before testing the Test Agency has to prepare a test plan in conjunction with the manufacturer, which contains at least mode of operation, stimulated function(s), monitored function(s), pass / fail criterion (criteria) and intended emissions. 5.2 Specifications Concerning Broadband Electromagnetic Radiation from Vehicles 5.2.1 Method of Measurement The electromagnetic radiation generated by the vehicle representative of its type shall be measured using the method described in Annex 2. The method of measurement shall be defined by the vehicle manufacturer in accordance with the Test Agency. 5.2.2 Vehicle broadband type approval limits 5.2.2.1 If measurements are made using the method described in Annex 2 using a vehicle-to-antenna spacing of 10.0 ± 0.2 m, the limits shall be 32 dB microvolts/m in the 30 to 75 MHz frequency band and 32 to 43 dB microvolts/m in the 75 to 400 MHz frequency band, this limit increasing logarithmically with frequencies above 75 MHz as shown in Appendix 2. In the 400 to 1,000 MHz frequency band the limit remains constant at 43 dB microvolts/m AIS-004 (Part 3) (Rev.1) 9/149 5.2.2.2 If measurements are made using the method described in Annex 2 using a vehicle-to-antenna spacing of 3.0 ± 0.05 m, the limits shall be 42 dB microvolts/m in the 30 to 75 MHz frequency band and 42 to 53 dB microvolts/m in the 75 to 400 MHz frequency band, this limit increasing logarithmically with frequencies above 75 MHz as shown in Appendix 3. In the 400 to 1,000 MHz frequency band the limit remains constant at 53 dB microvolts/m. 5.2.2.3 On the vehicle representative of its type, the measured values, expressed in dB microvolts/m shall be below the type approval limits 5.3 Specifications Concerning Narrowband Electromagnetic Radiation from Vehicles 5.3.1 Method of Measurement The electromagnetic radiation generated by the vehicle representative of its type shall be measured using the method described in Annex 3. These shall be defined by the vehicle manufacturer in accordance with the Test Agency. 5.3.2 Vehicle narrowband type approval limits 5.3.2.1 If measurements are made using the method described in Annex 3 using a vehicle-to-antenna spacing of 10.0 ± 0.2 m, the limits shall be 22 dB microvolts/m in the 30 to 75 MHz frequency band and 22 to 33 dB microvolts/m in the 75 to 400 MHz frequency band, this limit increasing logarithmically', 'tests are made using the method described in Annex 4, the field strength shall be 30 volts/m rms (root mean squared) in over 90 per cent of the 20 to 2,000 MHz frequency band and a minimum of 25 volts/m rms over the whole 20 to 2,000 MHz frequency band. 5.4.2.2 The vehicle representative of its type shall be considered as complying with immunity requirements if, during the tests performed in accordance with Annex 4 , there shall be no degradation of performance of ""immunity related functions 8/60 AIS-004 (Part 3) 5.5 Specifications Concerning Broadband Electromagnetic Interference Generated by ESAs. 5.5.1 Method of Measurement The electromagnetic radiation generated by the ESA representative of its type shall be measured by the method described in Annex 5. 5.5.2 ESA Broadband Type Approval limits 5.5.2.1 If measurements are made using the method described in Annex 5, the limits shall be 62 to 52 dB microvolts/m in the 30 to 75 MHz frequency band, this limit decreasing logarithmically with frequencies above 30 MHz, and 52 to 63 dB microvolts/m in the 75 to 400 MHz band, this limit increasing logarithmically with frequencies above 75 MHz as shown in Appendix 6. In the 400 to 1,000 MHz frequency band the limit remains constant at 63 dB microvolts/m. 5.5.2.2 On the ESA representative of its type, the measured values, expressed in dB microvolts/m, shall be below the type approval limits. 5.6 Specifications Concerning Narrowband Electromagnetic Interference Generated by ESAs. 5.6.1 Method of Measurement The electromagnetic radiation generated by the ESA representative of its type shall be measured by the method described in Annex 6. 5.6.2 ESA narrowband type approval limits 5.6.2.1 If measurements are made using the method described in Annex 6, the limits shall be 52 to 42 dB microvolts/m in the 30 to 75 MHz frequency band, this limit decreasing logarithmically with frequencies above 30 MHz, and 42 to 53 dB microvolts/m in the 75 to 400 MHz band, this limit increasing logarithmically with frequencies above 75 MHz as shown in Appendix 7. In the 400 to 1,000 MHz frequency band the limit remains constant at 53 dB microvolts/m. 5.6.2.2 On the ESA representative of its type, the measured values, expressed in dB microvolts/m, shall be below the type approval limits. 9/60 AIS-004 (Part 3) 5.7 Specifications Concerning Immunity of ESAs to Electromagnetic Radiation. 5.7.1 Method(s) of Testing The immunity to electromagnetic radiation of the ESA representative of its type shall be tested by the method(s) chosen from those described in Annex 7. 5.7.2 ESA immunity type approval limits 5.7.2.1 If tests are made using the methods described in Annex 7, the immunity test levels shall be 60 volts/m for the 150 mm stripline testing method, 15 volts/m for the 800 mm stripline testing method, 75 volts/m for the Transverse Electromagnetic Mode (TEM) cell testing method, 60 mA for the bulk current injection (BCI) testing method and 30 volts/m for the free field testing method in over 90 per cent of the 20 to']","['23', '17', '34', '8', '9']",['17'],"['document14.pdf', 'document14.pdf', 'document15.pdf', 'document15.pdf', 'document14.pdf']",easy,factual,1.0,1.0
What should be the engine speed for single cylinder engines during tests as per AIS-004 (Part 3) Annex 2?,"For single cylinder engines, the engine speed shall be 2500 + 10% rpm.","Based on the provided documents, there is no specific mention of the engine speed for single cylinder engines during tests as per AIS-004 (Part 3) Annex 2 in the given context. The documents provided pertain to immunity requirements and testing methods for vehicles and electronic sub-assemblies, but they do not specify an engine speed for single cylinder engines during these tests.","['to define a different condition. For vehicles of categories L1, L5 and L7 the steady speed shall normally be turned at 25 km/h. The vehicle shall be on an appropriately loaded dynamometer or alternatively supported on insulated axle stands with minimum ground clearance if no dynamometer is available. Where appropriate, transmission shafts, belts or chains may be disconnected (e.g. trucks, two- and three wheel vehicles). AIS-004 (Part 3) (Rev.1) 66/149 2.1.1.2 Basic vehicle conditions The paragraph defines minimum test conditions (as far as applicable) and failures criteria for vehicle immunity tests. Other vehicle systems, which can affect immunity related functions must be tested in a way to be agreed between manufacturer and Test Agency. ""50 km/h cycle"" vehicle test conditions Failure criteria Vehicle speed 50 km/h (respectively 25 km/h for L1, L5 and L7 vehicles) \uf0b1 20 per cent (vehicle driving the rollers). If the vehicle is equipped with a cruise control system, it shall be operational. Speed variation greater than \uf0b1 10 per cent of the nominal speed. In case of automatic gearbox: change of gear ratio inducing a speed variation greater than \uf0b1 10 per cent of the nominal speed. Dipped beams ON (manual mode) Lighting OFF Front wiper ON (manual mode) maximum speed Complete stop of front wiper Direction indicator on driver\'s side ON Frequency change (lower than 0.75 Hz or greater than 2.25 Hz). Duty cycle change (lower than 25 per cent or greater than 75 per cent). Adjustable suspension in normal position Unexpected significant variation Driver\'s seat and steering wheel in medium position Unexpected variation greater than 10 per cent of total range Alarm unset Unexpected activation of alarm Horn OFF Unexpected activation of horn Airbag and safety restraint systems operational with inhibited passenger airbag if this function exists Unexpected activation Automatic doors closed Unexpected opening Adjustable endurance brake lever in normal position Unexpected activation ""Brake cycle"" vehicle test conditions Failure criteria To be defined in brake cycle test plan. This must include operation of the brake pedal (unless there are technical reasons not to do so) but not necessarily an anti-lock brake system action. Stop lights inactivated during cycle Brake warning light ON with loss of function. Unexpected activation AIS-004 (Part 3) (Rev.1) 67/149 2.1.1.3. All equipment which can be switched on permanently by the driver or passenger should be in normal operation. 2.1.1.4. All other systems which affect the driver\'s control of the vehicle shall be (on) as in normal operation of the vehicle. 2.1.2 If there are vehicle electrical/electronic systems which form an integral part of the direct control of the vehicle, which will not operate under the conditions described in paragraph 2.1., it will be permissible for the manufacturer to provide a report or additional evidence to the Test Agency that the vehicle electrical/electronic system meets the requirements of this standard. Such evidence shall be retained in the type approval documentation. 2.1.3 Only non-perturbing equipment shall be used while monitoring the vehicle. The vehicle exterior and the passenger compartment shall be', 'AIS-001 (Part 2) (Rev.1): 2011 I AUTOMOTIVE INDUSTRY STANDARD Automotive Vehicles – Approval of Rear View Mirrors Intended for use on L Category Vehicles without Bodywork Partly or Wholly Encloses the Driver - Specification (Revision 1) PRINTED BY THE AUTOMOTIVE RESEARCH ASSOCIATION OF INDIA P.B. NO. 832, PUNE 411 004 ON BEHALF OF AUTOMOTIVE INDUSTRY STANDARDS COMMITTEE UNDER CENTRAL MOTOR VEHICLE RULES – TECHNICAL STANDING COMMITTEE SET-UP BY MINISTRY OF ROAD TRANSPORT & HIGHWAYS (DEPARTMENT OF ROAD TRANSPORT & HIGHWAYS) GOVERNMENT OF INDIA May 2011 AIS-001 (Part 2) (Rev.1): 2011 II INTRODUCTION 0. The Government of India felt the need for a permanent agency to expedite the publication of standards and development of test facilities in parallel when the work on the preparation of the standards is going on, as the development of improved safety critical parts can be undertaken only after the publication of the standard and commissioning of test facilities. To this end, the erstwhile Ministry of Surface Transport (MOST) has constituted a permanent Automotive Industry Standards Committee (AISC) vide order No.RT-11028/11/97-MVL dated September 15, 1997. The standards prepared by AISC will be approved by the permanent CMVR Technical Standing Committee (CTSC). After approval, the Automotive Research Association of India, (ARAI), Pune, being the Secretariat of the AIS Committee, has published this standard. For better dissemination of this information ARAI may publish this document on their Web site. 0.1 Accordingly AIS-001 covering mandatory requirements regarding performance requirements of rear view mirrors has been published in 2001 and implemented thereafter in 2003. 0.2 With technological developments in rear view mirrors, AIS-001 was taken up for revision and now is prepared in two parts. This part covers the requirements of rear view mirrors intended for use on L category vehicles without body work partly or wholly encloses the driver. 0.3 This part is based on the following ECE Regulation: ECE R amendment (Supplement 2 to the 00 series of amendments - date of entry into force: 18 June 2007) Uniform Provisions Concerning the Approval of Seats of Rear-view Mirrors of two-wheeled Power-driven Vehicles with or without Side Car, with regard to the Mounting of Rear-view Mirrors on Handlebars 0.4 While preparing this standard attempts have been made to align with the above ECE regulation. However, certain changes were necessary in the Indian context. 0.5 The following standard contain provisions, which through reference in this text constitute provision of the standard. AIS-001 (Part 1) (Rev.1):2011 Automotive Vehicles - Approval of devices for indirect vision intended for use on M, N category and L category with bodywork vehicles – specification AIS-002 (Part 2) (Rev.1): 2011 Automotive Vehicles – Approval of Rear View Mirrors intended for use on L category vehicles without bodywork partly or wholly encloses the driver – Installation requirements AIS-001 (Part 2) (Rev.1): 2011 III AIS-037 Procedure for Type Approval and Establishing Conformity of Production for Safety Critical Components. AIS-053 Automotive Vehicles – Types – Terminology 0.6 The composition of AIS panel and AIS Committee responsible for preparation of this', 'AIS-006 AUTOMOTIVE INDUSTRY STANDARD Automotive Vehicles – Bumper fitment on M1 Category of Vehicles – Test Methods PRINTED BY THE AUTOMOTIVE RESEARCH ASSOCIATION OF INDIA P. B. NO. 832. PUNE 411 004 ON BEHALF OF AUTOMOTIVE INDUSTRY STANDARDS COMMITTEE UNDER CENTRAL MOTOR VEHICLE RULES - TECHNICAL STANDING COMMITTEE SET-UP BY MINISTRY OF SHIPPING, ROAD TRANSPORT & HIGHWAYS (DEPARTMENT OF ROAD TRANSPORT & HIGHWAYS) GOVERNMENT OF INDIA December 2005 I AIS-006 Status chart of the Standard to be used by the purchaser for updating the record Sr. No. Corr- igenda. Amend- ment Revision Date Remark Misc. General Remarks: II AIS-006 INTRODUCTION The Government of India felt the need for a permanent agency to expedite the publication of standards and development of test facilities in parallel when the work on the preparation of the standards is going on, as the development of improved safety critical parts can be undertaken only after the publication of the standard and commissioning of test facilities. To this end, the erstwhile Ministry of Surface Transport (MOST) has constituted a permanent Automotive Industry Standard Committee (AISC) vide order No. RT-11028/11/97-MVL dated September 15, 1997. The standards prepared by AISC will be approved by the permanent CMVR Technical Standing Committee (CTSC). After approval, the Automotive Research Association of India, (ARAI), Pune, being the secretariat of the AIS Committee, has published this standard. For better dissemination of this information ARAI may publish this document on their Web site. The purpose of this standard is to assure exterior protection of elements located at front and rear ends of the vehicle against small shocks and low energy impacts. The elements include lighting & signaling, engine cooling, fuel lines, bonnet / boot lids, doors, engine/vehicle exhausts, propulsion, steering, braking, suspension including tyres. With this objective to ensure suitable anchorages of bumpers, this standard has been formulated by offering three equivalent optional methods. These methods have been arrived at after suitable debate in the expert forums and also after relevant test work by member agencies. These methods are also founded on ECE R 42 “Uniform Provisions Concerning the Approval of Vehicles with regard to their Front and Rear Protective Devices (Bumpers etc.) and JIS D1601-1995 “Vibration Testing Methods for Automotive Parts”. The Automotive Industry Standards Committee responsible for preparation of this standard is given in Annexure IV. III AIS-006 Automotive Vehicles – Bumper fitment on M1 Category of Vehicles – Test methods 1.0 SCOPE This standard establishes requirements for approval of vehicles of category M1 with regard to integrity of anchorages of front and rear bumpers to the vehicle. 2.0 DEFINITIONS For the purpose of this standard: 2.1 “Approval of vehicle” means the approval of a vehicle type with regard to the anchoring of front and rear bumpers. 2.2 “Vehicle type” means M1 category of vehicles which do not differ in such essential respects as: 2.2.1 The size, material and mass of the bumpers, 2.2.2 The type of mounting and mounting fasteners for the bumpers. 3.0 APPLICATION FOR APPROVAL 3.1 The vehicle manufacturer shall', 'AIS-001 (Part 1) (Rev.1) : 2011 I AUTOMOTIVE INDUSTRY STANDARD Automotive Vehicles – Approval of Devices for Indirect Vision Intended for use on M, N Category and L Category with Bodywork Vehicles – Specification (Revision 1) PRINTED BY THE AUTOMOTIVE RESEARCH ASSOCIATION OF INDIA P.B. NO. 832, PUNE 411 004 ON BEHALF OF AUTOMOTIVE INDUSTRY STANDARDS COMMITTEE UNDER CENTRAL MOTOR VEHICLE RULES – TECHNICAL STANDING COMMITTEE SET-UP BY MINISTRY OF ROAD TRANSPORT & HIGHWAYS (DEPARTMENT OF ROAD TRANSPORT & HIGHWAYS) GOVERNMENT OF INDIA May 2011 AIS-001 (Part 1) (Rev.1) : 2011 II Status chart of the standard to be used by the purchaser for updating the record Sr. No. Corrigenda. Amendment Revision Date Remark Misc. General remarks : AIS-001 (Part 1) (Rev.1) : 2011 III INTRODUCTION 0.0 The Government of India felt the need for a permanent agency to expedite the publication of standards and development of test facilities in parallel when the work on the preparation of the standards is going on, as the development of improved safety critical parts can be undertaken only after the publication of the standard and commissioning of test facilities. To this end, the erstwhile Ministry of Surface Transport (MOST) has constituted a permanent Automotive Industry Standards Committee (AISC) vide order No. RT-11028/11/97-MVL dated September 15, 1997. The standards prepared by AISC will be approved by the permanent CMVR Technical Standing Committee (CTSC). After approval, the Automotive Research Association of India, (ARAI), Pune, being the Secretariat of the AIS Committee, has published this standard. For better dissemination of this information ARAI may publish this document on their web site. 0.1 Accordingly AIS-001 covering mandatory requirements regarding performance of rear view mirrors devices has been published in 2001 and has been implemented thereafter in 2003. 0.2 With technological developments in automotive vehicles rear view mirrors, AIS-001 was taken up for revision and now is prepared in two parts. This part covers the requirements for approval of devices for indirect vision for use on M, N, category and L category vehicles with bodywork vehicles- specification. 0.3 This part is based on the following ECE Regulation ECE R 46, Rev. 3, Supplement 4 to the 02 series of amendment (Date of entry into force 22 July 2009). Uniform Provisions Concerning the Approval of Devices for Indirect Vision and of Motor Vehicles with regard to the Installation of these Devices 0.4 While preparing this standard attempts have been made to align with the above ECE regulation. However, certain changes were necessary in the Indian context. 0.5 The following standards contain provisions, which through reference in this text constitute provisions of the standard. AIS-002 (Part 1) (Rev.1):2011 Automotive Vehicles – Devices for indirect Vision intended for use on L category with bodywork vehicles, M and N category -Installation requirements AIS-037 Procedure for Type Approval and Establishing Conformity of Production for Safety Critical Components. AIS-053 Automotive Vehicles – Types – Terminology AIS-001 (Part 1) (Rev.1) : 2011 IV IS 13942:1994 Automotive vehicles - External projections - Performance requirements ISO 15008:2003', 'shall be monitored during the test. If tests are made using the method described in Annex.1, the field strength reference limit shall be 24V/m r.m.s. in over 90% of the 20 MHz to 1000 MHz frequency band and 20V/m r.m.s. over the whole 20 MHz to 1000 MHz frequency band. The test vehicle shall be considered as conforming to immunity requirements if during the test performed in accordance with Annex.1 and subjected to a field strength expressed in V/m of 25% above the reference level, no abnormal change in the speed of the driving wheels of the vehicle, no degradation of performance which would cause confusion to other road users and no degradation in the driver’s direct control of the vehicle can be observed by the driver or other road users. The driver’s direct control of the vehicle is exercised by means of, for example, steering, braking or engine speed control. 3/48 AIS-004 (Part 2) 6.2 For Electronic Sub-Assemblies (ESA) The ESA shall be tested for the requirements of immunity as per Annex.2. If tests are made using the methods described in Annex.2, the immunity test reference levels shall be 48 V/m for 150 mm stripline testing method, 12 V/m for 800 mm stripline testing method, 60 V/m for the TEM cell testing method, 48 mA for the bulb current injection (BCI test method) and 24 V/m for the free-field test method. The ESA shall be considered as conforming to immunity requirements if during the tests performed in accordance with Annex.2 and subjected to field strength or current, expressed in appropriate linear units, 25% above the reference limit, the ESA shall not exhibit any mal-function which would cause any degradation of performance which would cause confusion to other road users or any degradation in the driver’s direct control of a vehicle fitted with the system. 6.3 Exceptions 6.3.1 Vehicles which do not have electrical/electronic system with “immunity related functions ” need not be tested for immunity and shall be deemed to conform to paragraph 6.1 above and Annex 1. 6.3.2 ESAs with no “immunity related functions” of the vehicle need not be tested for immunity and shall be deemed to conform to paragraph 6.2 above and Annex 2. 7.0 Application for Approval The application for approval shall be submitted by vehicle/ESA manufacturer or by his duly accredited representative. Information to be submitted by vehicle / ESA manufacturer at the time of applying for type approval shall be as given in Annex 4A and 4B respectively. 8.0 Changes in Technical Specifications 8.1 Every modification pertaining to the information, even if the changes are not technical in nature declared in accordance with 7.0, shall be intimated by the manufacturer to the certifying agency. If the changes are in parameters not related to the provisions, no further action will be taken. If the changes are in parameters related to the provisions, the testing agency which has issued the certificate of compliance shall then consider whether 4/48 AIS-004 (Part 2) 8.1.1 The model with']","['35', '0', '0', '0', '3']",['17'],"['document15.pdf', 'document6.pdf', 'document17.pdf', 'document4.pdf', 'document13.pdf']",easy,factual,0.25,0.25
